B1: FELLOWS SURVEY ON UNIT USE: FOUR AREAS
C3: ALBUQUERQUE (n=34) | F3: HOUSTON (n=49) | I3: PITTSBURGH (n=57) | L3: UCI-SA (n=45) | O3: ALL (n=185)
A4: 1 | B4: Teaching grades of the last three years (multiple choice) | C4: FRQ | D4: % T2 | E4: % T1 | F4: FRQ | G4: % T2 | H4: % T1 | I4: FRQ | J4: % T2 | K4: % T1 | L4: FRQ | M4: % T2 | N4: % T1 | O4: FRQ | P4: % T2 | Q4: % T1
B5: Kindergarten | C5: 1 | D5: =(C5/105)*100 -> 0.95238095238095244 | E5: =(C5/34)*100 -> 2.9411764705882351 | F5: 3 | G5: =(F5/146)*100 -> 2.054794520547945 | H5: =(F5/49)*100 -> 6.1224489795918364 | I5: 4 | J5: =(I5/158)*100 -> 2.5316455696202533 | K5: =(I5/57)*100 -> 7.0175438596491224 | L5: 3 | M5: =(L5/117)*100 -> 2.5641025641025639 | N5: =(L5/45)*100 -> 6.666666666666667 | O5: =(C5+F5+L5+I5) -> 11 | P5: =(O5/526)*100 -> 2.0912547528517109 | Q5: =(O5/185)*100 -> 5.9459459459459465
B6: 1st grade | C6: 0 | D6: =(C6/105)*100 -> 0.0 | E6: =(C6/34)*100 -> 0.0 | F6: 4 | G6: =(F6/146)*100 -> 2.7397260273972601 | H6: =(F6/49)*100 -> 8.1632653061224492 | I6: 4 | J6: =(I6/158)*100 -> 2.5316455696202533 | K6: =(I6/57)*100 -> 7.0175438596491224 | L6: 2 | M6: =(L6/117)*100 -> 1.7094017094017095 | N6: =(L6/45)*100 -> 4.4444444444444446 | O6: =(C6+F6+L6+I6) -> 10 | P6: =(O6/526)*100 -> 1.9011406844106464 | Q6: =(O6/185)*100 -> 5.4054054054054053
B7: 2nd grade | C7: 1 | D7: =(C7/105)*100 -> 0.95238095238095244 | E7: =(C7/34)*100 -> 2.9411764705882351 | F7: 3 | G7: =(F7/146)*100 -> 2.054794520547945 | H7: =(F7/49)*100 -> 6.1224489795918364 | I7: 2 | J7: =(I7/158)*100 -> 1.2658227848101267 | K7: =(I7/57)*100 -> 3.5087719298245612 | L7: 4 | M7: =(L7/117)*100 -> 3.4188034188034191 | N7: =(L7/45)*100 -> 8.8888888888888893 | O7: =(C7+F7+L7+I7) -> 10 | P7: =(O7/526)*100 -> 1.9011406844106464 | Q7: =(O7/185)*100 -> 5.4054054054054053
B8: 3rd grade | C8: 1 | D8: =(C8/105)*100 -> 0.95238095238095244 | E8: =(C8/34)*100 -> 2.9411764705882351 | F8: 3 | G8: =(F8/146)*100 -> 2.054794520547945 | H8: =(F8/49)*100 -> 6.1224489795918364 | I8: 2 | J8: =(I8/158)*100 -> 1.2658227848101267 | K8: =(I8/57)*100 -> 3.5087719298245612 | L8: 1 | M8: =(L8/117)*100 -> 0.85470085470085477 | N8: =(L8/45)*100 -> 2.2222222222222223 | O8: =(C8+F8+L8+I8) -> 7 | P8: =(O8/526)*100 -> 1.3307984790874523 | Q8: =(O8/185)*100 -> 3.7837837837837842
B9: 4th grade | C9: 1 | D9: =(C9/105)*100 -> 0.95238095238095244 | E9: =(C9/34)*100 -> 2.9411764705882351 | F9: 4 | G9: =(F9/146)*100 -> 2.7397260273972601 | H9: =(F9/49)*100 -> 8.1632653061224492 | I9: 2 | J9: =(I9/158)*100 -> 1.2658227848101267 | K9: =(I9/57)*100 -> 3.5087719298245612 | L9: 1 | M9: =(L9/117)*100 -> 0.85470085470085477 | N9: =(L9/45)*100 -> 2.2222222222222223 | O9: =(C9+F9+L9+I9) -> 8 | P9: =(O9/526)*100 -> 1.520912547528517 | Q9: =(O9/185)*100 -> 4.3243243243243246
B10: 5th grade | C10: 1 | D10: =(C10/105)*100 -> 0.95238095238095244 | E10: =(C10/34)*100 -> 2.9411764705882351 | F10: 5 | G10: =(F10/146)*100 -> 3.4246575342465753 | H10: =(F10/49)*100 -> 10.204081632653061 | I10: 5 | J10: =(I10/158)*100 -> 3.1645569620253164 | K10: =(I10/57)*100 -> 8.7719298245614024 | L10: 2 | M10: =(L10/117)*100 -> 1.7094017094017095 | N10: =(L10/45)*100 -> 4.4444444444444446 | O10: =(C10+F10+L10+I10) -> 13 | P10: =(O10/526)*100 -> 2.4714828897338403 | Q10: =(O10/185)*100 -> 7.0270270270270272
B11: 6th grade | C11: 12 | D11: =(C11/105)*100 -> 11.428571428571429 | E11: =(C11/34)*100 -> 35.294117647058826 | F11: 9 | G11: =(F11/146)*100 -> 6.1643835616438354 | H11: =(F11/49)*100 -> 18.367346938775512 | I11: 8 | J11: =(I11/158)*100 -> 5.0632911392405067 | K11: =(I11/57)*100 -> 14.035087719298245 | L11: 9 | M11: =(L11/117)*100 -> 7.6923076923076925 | N11: =(L11/45)*100 -> 20.0 | O11: =(C11+F11+L11+I11) -> 38 | P11: =(O11/526)*100 -> 7.2243346007604554 | Q11: =(O11/185)*100 -> 20.54054054054054
B12: 7th grade | C12: 12 | D12: =(C12/105)*100 -> 11.428571428571429 | E12: =(C12/34)*100 -> 35.294117647058826 | F12: 9 | G12: =(F12/146)*100 -> 6.1643835616438354 | H12: =(F12/49)*100 -> 18.367346938775512 | I12: 14 | J12: =(I12/158)*100 -> 8.8607594936708853 | K12: =(I12/57)*100 -> 24.561403508771928 | L12: 11 | M12: =(L12/117)*100 -> 9.4017094017094021 | N12: =(L12/45)*100 -> 24.444444444444443 | O12: =(C12+F12+L12+I12) -> 46 | P12: =(O12/526)*100 -> 8.7452471482889731 | Q12: =(O12/185)*100 -> 24.864864864864867
B13: 8th grade | C13: 16 | D13: =(C13/105)*100 -> 15.238095238095239 | E13: =(C13/34)*100 -> 47.058823529411761 | F13: 11 | G13: =(F13/146)*100 -> 7.5342465753424657 | H13: =(F13/49)*100 -> 22.448979591836736 | I13: 14 | J13: =(I13/158)*100 -> 8.8607594936708853 | K13: =(I13/57)*100 -> 24.561403508771928 | L13: 9 | M13: =(L13/117)*100 -> 7.6923076923076925 | N13: =(L13/45)*100 -> 20.0 | O13: =(C13+F13+L13+I13) -> 50 | P13: =(O13/526)*100 -> 9.5057034220532319 | Q13: =(O13/185)*100 -> 27.027027027027028
B14: 9th grade | C14: 16 | D14: =(C14/105)*100 -> 15.238095238095239 | E14: =(C14/34)*100 -> 47.058823529411761 | F14: 22 | G14: =(F14/146)*100 -> 15.068493150684931 | H14: =(F14/49)*100 -> 44.897959183673471 | I14: 23 | J14: =(I14/158)*100 -> 14.556962025316455 | K14: =(I14/57)*100 -> 40.350877192982452 | L14: 21 | M14: =(L14/117)*100 -> 17.948717948717949 | N14: =(L14/45)*100 -> 46.666666666666664 | O14: =(C14+F14+L14+I14) -> 82 | P14: =(O14/526)*100 -> 15.589353612167301 | Q14: =(O14/185)*100 -> 44.32432432432433
B15: 10th grade | C15: 14 | D15: =(C15/105)*100 -> 13.333333333333334 | E15: =(C15/34)*100 -> 41.17647058823529 | F15: 26 | G15: =(F15/146)*100 -> 17.80821917808219 | H15: =(F15/49)*100 -> 53.061224489795919 | I15: 27 | J15: =(I15/158)*100 -> 17.088607594936708 | K15: =(I15/57)*100 -> 47.368421052631575 | L15: 18 | M15: =(L15/117)*100 -> 15.384615384615385 | N15: =(L15/45)*100 -> 40.0 | O15: =(C15+F15+L15+I15) -> 85 | P15: =(O15/526)*100 -> 16.159695817490494 | Q15: =(O15/185)*100 -> 45.945945945945951
B16: 11th grade | C16: 16 | D16: =(C16/105)*100 -> 15.238095238095239 | E16: =(C16/34)*100 -> 47.058823529411761 | F16: 25 | G16: =(F16/146)*100 -> 17.123287671232877 | H16: =(F16/49)*100 -> 51.020408163265309 | I16: 28 | J16: =(I16/158)*100 -> 17.721518987341771 | K16: =(I16/57)*100 -> 49.122807017543856 | L16: 18 | M16: =(L16/117)*100 -> 15.384615384615385 | N16: =(L16/45)*100 -> 40.0 | O16: =(C16+F16+L16+I16) -> 87 | P16: =(O16/526)*100 -> 16.539923954372622 | Q16: =(O16/185)*100 -> 47.027027027027032
B17: 12th grade | C17: 14 | D17: =(C17/105)*100 -> 13.333333333333334 | E17: =(C17/34)*100 -> 41.17647058823529 | F17: 22 | G17: =(F17/146)*100 -> 15.068493150684931 | H17: =(F17/49)*100 -> 44.897959183673471 | I17: 25 | J17: =(I17/158)*100 -> 15.822784810126583 | K17: =(I17/57)*100 -> 43.859649122807014 | L17: 18 | M17: =(L17/117)*100 -> 15.384615384615385 | N17: =(L17/45)*100 -> 40.0 | O17: =(C17+F17+L17+I17) -> 79 | P17: =(O17/526)*100 -> 15.019011406844108 | Q17: =(O17/185)*100 -> 42.702702702702702
B18: Total | C18: =SUM(C5:C17) -> 105 | D18: =SUM(D5:D17) -> 100.0 | E18: =(C18/34)*100 -> 308.8235294117647 | F18: =SUM(F5:F17) -> 146 | G18: =SUM(G5:G17) -> 100.0 | H18: =(F18/49)*100 -> 297.9591836734694 | I18: =SUM(I5:I17) -> 158 | J18: =(I18/158)*100 -> 100.0 | K18: =(I18/57)*100 -> 277.19298245614038 | L18: =SUM(L5:L17) -> 117 | M18: =(L18/117)*100 -> 100.0 | N18: =(L18/45)*100 -> 260.0 | O18: =SUM(O5:O17) -> 526 | P18: =(O18/526)*100 -> 100.0 | Q18: =(O18/185)*100 -> 284.32432432432432
A20: 2A | B20: Subjects taught during the last three years (multiple choice) | C20: FRQ | D20: % T2 | E20: % T1 | F20: FRQ | G20: % T2 | H20: % T1 | I20: FRQ | J20: % T2 | K20: % T1 | L20: FRQ | M20: % T2 | N20: % T1 | O20: FRQ | P20: % T2 | Q20: % T1
B21: Art | C21: 2 | D21: =(C21/82)*100 -> 2.4390243902439024 | E21: =(C21/34)*100 -> 5.8823529411764701 | F21: 2 | G21: =(F21/90)*100 -> 2.2222222222222223 | H21: =(F21/49)*100 -> 4.0816326530612246 | I21: 3 | J21: =(I21/84)*100 -> 3.5714285714285712 | K21: =(I21/57)*100 -> 5.2631578947368416 | L21: 4 | M21: =(L21/82)*100 -> 4.8780487804878048 | N21: =(L21/45)*100 -> 8.8888888888888893 | O21: =(C21+F21+L21+I21) -> 11 | P21: =(O21/338)*100 -> 3.2544378698224854 | Q21: =(O21/185)*100 -> 5.9459459459459465
B22: Bilingual | C22: 0 | D22: =(C22/82)*100 -> 0.0 | E22: =(C22/34)*100 -> 0.0 | F22: 4 | G22: =(F22/90)*100 -> 4.4444444444444446 | H22: =(F22/49)*100 -> 8.1632653061224492 | I22: 0 | J22: =(I22/84)*100 -> 0.0 | K22: =(I22/57)*100 -> 0.0 | L22: 4 | M22: =(L22/82)*100 -> 4.8780487804878048 | N22: =(L22/45)*100 -> 8.8888888888888893 | O22: =(C22+F22+L22+I22) -> 8 | P22: =(O22/338)*100 -> 2.3668639053254439 | Q22: =(O22/185)*100 -> 4.3243243243243246
B23: Bio | C23: 6 | D23: =(C23/82)*100 -> 7.3170731707317067 | E23: =(C23/34)*100 -> 17.647058823529413 | F23: 2 | G23: =(F23/90)*100 -> 2.2222222222222223 | H23: =(F23/49)*100 -> 4.0816326530612246 | I23: 2 | J23: =(I23/84)*100 -> 2.3809523809523809 | K23: =(I23/57)*100 -> 3.5087719298245612 | L23: 5 | M23: =(L23/82)*100 -> 6.0975609756097562 | N23: =(L23/45)*100 -> 11.111111111111111 | O23: =(C23+F23+L23+I23) -> 15 | P23: =(O23/338)*100 -> 4.4378698224852071 | Q23: =(O23/185)*100 -> 8.1081081081081088
B24: Chemistry | C24: 3 | D24: =(C24/82)*100 -> 3.6585365853658534 | E24: =(C24/34)*100 -> 8.8235294117647065 | F24: 2 | G24: =(F24/90)*100 -> 2.2222222222222223 | H24: =(F24/49)*100 -> 4.0816326530612246 | I24: 5 | J24: =(I24/84)*100 -> 5.9523809523809517 | K24: =(I24/57)*100 -> 8.7719298245614024 | L24: 1 | M24: =(L24/82)*100 -> 1.2195121951219512 | N24: =(L24/45)*100 -> 2.2222222222222223 | O24: =(C24+F24+L24+I24) -> 11 | P24: =(O24/338)*100 -> 3.2544378698224854 | Q24: =(O24/185)*100 -> 5.9459459459459465
B25: Earth Science | C25: 6 | D25: =(C25/82)*100 -> 7.3170731707317067 | E25: =(C25/34)*100 -> 17.647058823529413 | F25: 2 | G25: =(F25/90)*100 -> 2.2222222222222223 | H25: =(F25/49)*100 -> 4.0816326530612246 | I25: 2 | J25: =(I25/84)*100 -> 2.3809523809523809 | K25: =(I25/57)*100 -> 3.5087719298245612 | L25: 3 | M25: =(L25/82)*100 -> 3.6585365853658534 | N25: =(L25/45)*100 -> 6.666666666666667 | O25: =(C25+F25+L25+I25) -> 13 | P25: =(O25/338)*100 -> 3.8461538461538463 | Q25: =(O25/185)*100 -> 7.0270270270270272
B26: English | C26: 18 | D26: =(C26/82)*100 -> 21.951219512195124 | E26: =(C26/34)*100 -> 52.941176470588239 | F26: 23 | G26: =(F26/90)*100 -> 25.555555555555554 | H26: =(F26/49)*100 -> 46.938775510204081 | I26: 13 | J26: =(I26/84)*100 -> 15.476190476190476 | K26: =(I26/57)*100 -> 22.807017543859647 | L26: 14 | M26: =(L26/82)*100 -> 17.073170731707318 | N26: =(L26/45)*100 -> 31.111111111111111 | O26: =(C26+F26+L26+I26) -> 68 | P26: =(O26/338)*100 -> 20.118343195266274 | Q26: =(O26/185)*100 -> 36.756756756756758
B27: Foreign Language(s) | C27: 0 | D27: =(C27/82)*100 -> 0.0 | E27: =(C27/34)*100 -> 0.0 | F27: 5 | G27: =(F27/90)*100 -> 5.5555555555555554 | H27: =(F27/49)*100 -> 10.204081632653061 | I27: 4 | J27: =(I27/84)*100 -> 4.7619047619047619 | K27: =(I27/57)*100 -> 7.0175438596491224 | L27: 4 | M27: =(L27/82)*100 -> 4.8780487804878048 | N27: =(L27/45)*100 -> 8.8888888888888893 | O27: =(C27+F27+L27+I27) -> 13 | P27: =(O27/338)*100 -> 3.8461538461538463 | Q27: =(O27/185)*100 -> 7.0270270270270272
B28: General Science | C28: 3 | D28: =(C28/82)*100 -> 3.6585365853658534 | E28: =(C28/34)*100 -> 8.8235294117647065 | F28: 2 | G28: =(F28/90)*100 -> 2.2222222222222223 | H28: =(F28/49)*100 -> 4.0816326530612246 | I28: 5 | J28: =(I28/84)*100 -> 5.9523809523809517 | K28: =(I28/57)*100 -> 8.7719298245614024 | L28: 2 | M28: =(L28/82)*100 -> 2.4390243902439024 | N28: =(L28/45)*100 -> 4.4444444444444446 | O28: =(C28+F28+L28+I28) -> 12 | P28: =(O28/338)*100 -> 3.5502958579881656 | Q28: =(O28/185)*100 -> 6.4864864864864868
B29: History | C29: 4 | D29: =(C29/82)*100 -> 4.8780487804878048 | E29: =(C29/34)*100 -> 11.76470588235294 | F29: 10 | G29: =(F29/90)*100 -> 11.111111111111111 | H29: =(F29/49)*100 -> 20.408163265306122 | I29: 4 | J29: =(I29/84)*100 -> 4.7619047619047619 | K29: =(I29/57)*100 -> 7.0175438596491224 | L29: 5 | M29: =(L29/82)*100 -> 6.0975609756097562 | N29: =(L29/45)*100 -> 11.111111111111111 | O29: =(C29+F29+L29+I29) -> 23 | P29: =(O29/338)*100 -> 6.8047337278106506 | Q29: =(O29/185)*100 -> 12.432432432432433
B30: K-8 | C30: 1 | D30: =(C30/82)*100 -> 1.2195121951219512 | E30: =(C30/34)*100 -> 2.9411764705882351 | F30: 1 | G30: =(F30/90)*100 -> 1.1111111111111112 | H30: =(F30/49)*100 -> 2.0408163265306123 | I30: 2 | J30: =(I30/84)*100 -> 2.3809523809523809 | K30: =(I30/57)*100 -> 3.5087719298245612 | L30: 7 | M30: =(L30/82)*100 -> 8.536585365853659 | N30: =(L30/45)*100 -> 15.555555555555555 | O30: =(C30+F30+L30+I30) -> 11 | P30: =(O30/338)*100 -> 3.2544378698224854 | Q30: =(O30/185)*100 -> 5.9459459459459465
B31: Math | C31: 5 | D31: =(C31/82)*100 -> 6.0975609756097562 | E31: =(C31/34)*100 -> 14.705882352941178 | F31: 5 | G31: =(F31/90)*100 -> 5.5555555555555554 | H31: =(F31/49)*100 -> 10.204081632653061 | I31: 6 | J31: =(I31/84)*100 -> 7.1428571428571423 | K31: =(I31/57)*100 -> 10.526315789473683 | L31: 4 | M31: =(L31/82)*100 -> 4.8780487804878048 | N31: =(L31/45)*100 -> 8.8888888888888893 | O31: =(C31+F31+L31+I31) -> 20 | P31: =(O31/338)*100 -> 5.9171597633136095 | Q31: =(O31/185)*100 -> 10.810810810810811
B32: Physics | C32: 2 | D32: =(C32/82)*100 -> 2.4390243902439024 | E32: =(C32/34)*100 -> 5.8823529411764701 | F32: 2 | G32: =(F32/90)*100 -> 2.2222222222222223 | H32: =(F32/49)*100 -> 4.0816326530612246 | I32: 5 | J32: =(I32/84)*100 -> 5.9523809523809517 | K32: =(I32/57)*100 -> 8.7719298245614024 | L32: 1 | M32: =(L32/82)*100 -> 1.2195121951219512 | N32: =(L32/45)*100 -> 2.2222222222222223 | O32: =(C32+F32+L32+I32) -> 10 | P32: =(O32/338)*100 -> 2.9585798816568047 | Q32: =(O32/185)*100 -> 5.4054054054054053
B33: Social Studies | C33: 8 | D33: =(C33/82)*100 -> 9.7560975609756095 | E33: =(C33/34)*100 -> 23.52941176470588 | F33: 11 | G33: =(F33/90)*100 -> 12.222222222222221 | H33: =(F33/49)*100 -> 22.448979591836736 | I33: 13 | J33: =(I33/84)*100 -> 15.476190476190476 | K33: =(I33/57)*100 -> 22.807017543859647 | L33: 8 | M33: =(L33/82)*100 -> 9.7560975609756095 | N33: =(L33/45)*100 -> 17.777777777777779 | O33: =(C33+F33+L33+I33) -> 40 | P33: =(O33/338)*100 -> 11.834319526627219 | Q33: =(O33/185)*100 -> 21.621621621621621
B34: Special Ed | C34: 12 | D34: =(C34/82)*100 -> 14.634146341463413 | E34: =(C34/34)*100 -> 35.294117647058826 | F34: 5 | G34: =(F34/90)*100 -> 5.5555555555555554 | H34: =(F34/49)*100 -> 10.204081632653061 | I34: 4 | J34: =(I34/84)*100 -> 4.7619047619047619 | K34: =(I34/57)*100 -> 7.0175438596491224 | L34: 5 | M34: =(L34/82)*100 -> 6.0975609756097562 | N34: =(L34/45)*100 -> 11.111111111111111 | O34: =(C34+F34+L34+I34) -> 26 | P34: =(O34/338)*100 -> 7.6923076923076925 | Q34: =(O34/185)*100 -> 14.054054054054054
B35: Other | C35: 12 | D35: =(C35/82)*100 -> 14.634146341463413 | E35: =(C35/34)*100 -> 35.294117647058826 | F35: 14 | G35: =(F35/90)*100 -> 15.555555555555555 | H35: =(F35/49)*100 -> 28.571428571428569 | I35: 16 | J35: =(I35/84)*100 -> 19.047619047619047 | K35: =(I35/57)*100 -> 28.07017543859649 | L35: 15 | M35: =(L35/82)*100 -> 18.292682926829269 | N35: =(L35/45)*100 -> 33.333333333333329 | O35: =(C35+F35+L35+I35) -> 57 | P35: =(O35/338)*100 -> 16.863905325443788 | Q35: =(O35/185)*100 -> 30.810810810810814
B36: Total | C36: =SUM(C21:C35) -> 82 | D36: =SUM(D21:D35) -> 100.0 | E36: =(C36/34)*100 -> 241.17647058823528 | F36: =SUM(F21:F35) -> 90 | G36: =SUM(G21:G35) -> 100.0 | H36: =(F36/49)*100 -> 183.67346938775512 | I36: =SUM(I21:I35) -> 84 | J36: =SUM(J21:J35) -> 100.0 | K36: =(I36/57)*100 -> 147.36842105263156 | L36: =SUM(L21:L35) -> 82 | M36: =SUM(M21:M35) -> 100.0 | N36: =(L36/45)*100 -> 182.22222222222223 | O36: =(C36+F36+L36+I36) -> 338 | P36: =SUM(P21:P35) -> 100.0 | Q36: =(O36/185)*100 -> 182.70270270270271
A38: 2B | B38: Subject expected to teach next year (multiple choice) | C38: FRQ | D38: % T2 | E38: % T1 | F38: FRQ | G38: % T2 | H38: % T1 | I38: FRQ | J38: % T2 | K38: % T1 | L38: FRQ | M38: % T2 | N38: % T1 | O38: FRQ | P38: % T2 | Q38: % T1
B39: Art | C39: 1 | D39: =(C39/55)*100 -> 1.8181818181818181 | E39: =(C39/34)*100 -> 2.9411764705882351 | F39: 2 | G39: =(F39/69)*100 -> 2.8985507246376812 | H39: =(F39/49)*100 -> 4.0816326530612246 | I39: 3 | J39: =(I39/70)*100 -> 4.2857142857142856 | K39: =(I39/57)*100 -> 5.2631578947368416 | L39: 4 | M39: =(L39/64)*100 -> 6.25 | N39: =(L39/45)*100 -> 8.8888888888888893 | O39: =(C39+F39+L39+I39) -> 10 | P39: =(O39/258)*100 -> 3.8759689922480618 | Q39: =(O39/185)*100 -> 5.4054054054054053
B40: Bilingual | C40: 1 | D40: =(C40/55)*100 -> 1.8181818181818181 | E40: =(C40/34)*100 -> 2.9411764705882351 | F40: 3 | G40: =(F40/69)*100 -> 4.3478260869565215 | H40: =(F40/49)*100 -> 6.1224489795918364 | I40: 1 | J40: =(I40/70)*100 -> 1.4285714285714286 | K40: =(I40/57)*100 -> 1.7543859649122806 | L40: 3 | M40: =(L40/64)*100 -> 4.6875 | N40: =(L40/45)*100 -> 6.666666666666667 | O40: =(C40+F40+L40+I40) -> 8 | P40: =(O40/258)*100 -> 3.1007751937984498 | Q40: =(O40/185)*100 -> 4.3243243243243246
B41: Bio | C41: 1 | D41: =(C41/55)*100 -> 1.8181818181818181 | E41: =(C41/34)*100 -> 2.9411764705882351 | F41: 1 | G41: =(F41/69)*100 -> 1.4492753623188406 | H41: =(F41/49)*100 -> 2.0408163265306123 | I41: 2 | J41: =(I41/70)*100 -> 2.8571428571428572 | K41: =(I41/57)*100 -> 3.5087719298245612 | L41: 3 | M41: =(L41/64)*100 -> 4.6875 | N41: =(L41/45)*100 -> 6.666666666666667 | O41: =(C41+F41+L41+I41) -> 7 | P41: =(O41/258)*100 -> 2.7131782945736433 | Q41: =(O41/185)*100 -> 3.7837837837837842
B42: Chemistry | C42: 1 | D42: =(C42/55)*100 -> 1.8181818181818181 | E42: =(C42/34)*100 -> 2.9411764705882351 | F42: 1 | G42: =(F42/69)*100 -> 1.4492753623188406 | H42: =(F42/49)*100 -> 2.0408163265306123 | I42: 4 | J42: =(I42/70)*100 -> 5.7142857142857144 | K42: =(I42/57)*100 -> 7.0175438596491224 | L42: 1 | M42: =(L42/64)*100 -> 1.5625 | N42: =(L42/45)*100 -> 2.2222222222222223 | O42: =(C42+F42+L42+I42) -> 7 | P42: =(O42/258)*100 -> 2.7131782945736433 | Q42: =(O42/185)*100 -> 3.7837837837837842
B43: Earth Science | C43: 2 | D43: =(C43/55)*100 -> 3.6363636363636362 | E43: =(C43/34)*100 -> 5.8823529411764701 | F43: 1 | G43: =(F43/69)*100 -> 1.4492753623188406 | H43: =(F43/49)*100 -> 2.0408163265306123 | I43: 2 | J43: =(I43/70)*100 -> 2.8571428571428572 | K43: =(I43/57)*100 -> 3.5087719298245612 | L43: 1 | M43: =(L43/64)*100 -> 1.5625 | N43: =(L43/45)*100 -> 2.2222222222222223 | O43: =(C43+F43+L43+I43) -> 6 | P43: =(O43/258)*100 -> 2.3255813953488373 | Q43: =(O43/185)*100 -> 3.2432432432432434
B44: English | C44: 15 | D44: =(C44/55)*100 -> 27.27272727272727 | E44: =(C44/34)*100 -> 44.117647058823529 | F44: 18 | G44: =(F44/69)*100 -> 26.086956521739129 | H44: =(F44/49)*100 -> 36.734693877551024 | I44: 10 | J44: =(I44/70)*100 -> 14.285714285714285 | K44: =(I44/57)*100 -> 17.543859649122805 | L44: 13 | M44: =(L44/64)*100 -> 20.3125 | N44: =(L44/45)*100 -> 28.888888888888886 | O44: =(C44+F44+L44+I44) -> 56 | P44: =(O44/258)*100 -> 21.705426356589147 | Q44: =(O44/185)*100 -> 30.270270270270274
B45: Foreign Language(s) | C45: 0 | D45: =(C45/55)*100 -> 0.0 | E45: =(C45/34)*100 -> 0.0 | F45: 4 | G45: =(F45/69)*100 -> 5.7971014492753623 | H45: =(F45/49)*100 -> 8.1632653061224492 | I45: 2 | J45: =(I45/70)*100 -> 2.8571428571428572 | K45: =(I45/57)*100 -> 3.5087719298245612 | L45: 4 | M45: =(L45/64)*100 -> 6.25 | N45: =(L45/45)*100 -> 8.8888888888888893 | O45: =(C45+F45+L45+I45) -> 10 | P45: =(O45/258)*100 -> 3.8759689922480618 | Q45: =(O45/185)*100 -> 5.4054054054054053
B46: General Science | C46: 0 | D46: =(C46/55)*100 -> 0.0 | E46: =(C46/34)*100 -> 0.0 | F46: 1 | G46: =(F46/69)*100 -> 1.4492753623188406 | H46: =(F46/49)*100 -> 2.0408163265306123 | I46: 4 | J46: =(I46/70)*100 -> 5.7142857142857144 | K46: =(I46/57)*100 -> 7.0175438596491224 | L46: 2 | M46: =(L46/64)*100 -> 3.125 | N46: =(L46/45)*100 -> 4.4444444444444446 | O46: =(C46+F46+L46+I46) -> 7 | P46: =(O46/258)*100 -> 2.7131782945736433 | Q46: =(O46/185)*100 -> 3.7837837837837842
B47: History | C47: 3 | D47: =(C47/55)*100 -> 5.4545454545454541 | E47: =(C47/34)*100 -> 8.8235294117647065 | F47: 8 | G47: =(F47/69)*100 -> 11.594202898550725 | H47: =(F47/49)*100 -> 16.326530612244898 | I47: 4 | J47: =(I47/70)*100 -> 5.7142857142857144 | K47: =(I47/57)*100 -> 7.0175438596491224 | L47: 4 | M47: =(L47/64)*100 -> 6.25 | N47: =(L47/45)*100 -> 8.8888888888888893 | O47: =(C47+F47+L47+I47) -> 19 | P47: =(O47/258)*100 -> 7.3643410852713185 | Q47: =(O47/185)*100 -> 10.27027027027027
B48: K-8 | C48: 1 | D48: =(C48/55)*100 -> 1.8181818181818181 | E48: =(C48/34)*100 -> 2.9411764705882351 | F48: 1 | G48: =(F48/69)*100 -> 1.4492753623188406 | H48: =(F48/49)*100 -> 2.0408163265306123 | I48: 2 | J48: =(I48/70)*100 -> 2.8571428571428572 | K48: =(I48/57)*100 -> 3.5087719298245612 | L48: 6 | M48: =(L48/64)*100 -> 9.375 | N48: =(L48/45)*100 -> 13.333333333333334 | O48: =(C48+F48+L48+I48) -> 10 | P48: =(O48/258)*100 -> 3.8759689922480618 | Q48: =(O48/185)*100 -> 5.4054054054054053
B49: Math | C49: 3 | D49: =(C49/55)*100 -> 5.4545454545454541 | E49: =(C49/34)*100 -> 8.8235294117647065 | F49: 5 | G49: =(F49/69)*100 -> 7.2463768115942031 | H49: =(F49/49)*100 -> 10.204081632653061 | I49: 3 | J49: =(I49/70)*100 -> 4.2857142857142856 | K49: =(I49/57)*100 -> 5.2631578947368416 | L49: 2 | M49: =(L49/64)*100 -> 3.125 | N49: =(L49/45)*100 -> 4.4444444444444446 | O49: =(C49+F49+L49+I49) -> 13 | P49: =(O49/258)*100 -> 5.0387596899224807 | Q49: =(O49/185)*100 -> 7.0270270270270272
B50: Physics | C50: 0 | D50: =(C50/55)*100 -> 0.0 | E50: =(C50/34)*100 -> 0.0 | F50: 1 | G50: =(F50/69)*100 -> 1.4492753623188406 | H50: =(F50/49)*100 -> 2.0408163265306123 | I50: 4 | J50: =(I50/70)*100 -> 5.7142857142857144 | K50: =(I50/57)*100 -> 7.0175438596491224 | L50: 1 | M50: =(L50/64)*100 -> 1.5625 | N50: =(L50/45)*100 -> 2.2222222222222223 | O50: =(C50+F50+L50+I50) -> 6 | P50: =(O50/258)*100 -> 2.3255813953488373 | Q50: =(O50/185)*100 -> 3.2432432432432434
B51: Social Studies | C51: 6 | D51: =(C51/55)*100 -> 10.909090909090908 | E51: =(C51/34)*100 -> 17.647058823529413 | F51: 9 | G51: =(F51/69)*100 -> 13.043478260869565 | H51: =(F51/49)*100 -> 18.367346938775512 | I51: 13 | J51: =(I51/70)*100 -> 18.571428571428573 | K51: =(I51/57)*100 -> 22.807017543859647 | L51: 6 | M51: =(L51/64)*100 -> 9.375 | N51: =(L51/45)*100 -> 13.333333333333334 | O51: =(C51+F51+L51+I51) -> 34 | P51: =(O51/258)*100 -> 13.178294573643413 | Q51: =(O51/185)*100 -> 18.378378378378379
B52: Special Ed | C52: 9 | D52: =(C52/55)*100 -> 16.363636363636363 | E52: =(C52/34)*100 -> 26.47058823529412 | F52: 4 | G52: =(F52/69)*100 -> 5.7971014492753623 | H52: =(F52/49)*100 -> 8.1632653061224492 | I52: 3 | J52: =(I52/70)*100 -> 4.2857142857142856 | K52: =(I52/57)*100 -> 5.2631578947368416 | L52: 4 | M52: =(L52/64)*100 -> 6.25 | N52: =(L52/45)*100 -> 8.8888888888888893 | O52: =(C52+F52+L52+I52) -> 20 | P52: =(O52/258)*100 -> 7.7519379844961236 | Q52: =(O52/185)*100 -> 10.810810810810811
B53: Other | C53: 12 | D53: =(C53/55)*100 -> 21.818181818181817 | E53: =(C53/34)*100 -> 35.294117647058826 | F53: 10 | G53: =(F53/69)*100 -> 14.492753623188406 | H53: =(F53/49)*100 -> 20.408163265306122 | I53: 13 | J53: =(I53/70)*100 -> 18.571428571428573 | K53: =(I53/57)*100 -> 22.807017543859647 | L53: 10 | M53: =(L53/64)*100 -> 15.625 | N53: =(L53/45)*100 -> 22.222222222222221 | O53: =(C53+F53+L53+I53) -> 45 | P53: =(O53/258)*100 -> 17.441860465116278 | Q53: =(O53/185)*100 -> 24.324324324324326
B54: Total | C54: =SUM(C39:C53) -> 55 | D54: =SUM(D39:D53) -> 100.0 | E54: =(C54/34)*100 -> 161.76470588235296 | F54: =SUM(F39:F53) -> 69 | G54: =SUM(G39:G53) -> 100.0 | H54: =(F54/49)*100 -> 140.81632653061226 | I54: =SUM(I39:I53) -> 70 | J54: =SUM(J39:J53) -> 100.0 | K54: =(I54/57)*100 -> 122.80701754385966 | L54: =SUM(L39:L53) -> 64 | M54: =SUM(M39:M53) -> 100.0 | N54: =(L54/45)*100 -> 142.22222222222223 | O54: =(C54+F54+L54+I54) -> 258 | P54: =SUM(P39:P53) -> 100.0 | Q54: =(O54/185)*100 -> 139.45945945945945
A56: 3 | B56: Number of enrolled students in class | C56: FRQ | D56: AVG | E56: STD | F56: FRQ | G56: AVG | H56: STD | I56: FRQ | J56: AVG | K56: STD | L56: FRQ | M56: AVG | N56: STD | O56: FRQ | P56: AVG | Q56: STD
C57: 31 | D57: 88.225806500000004 | E57: 65.0905573 | F57: 40 | G57: 137.25 | H57: 76.646959600000002 | I57: 50 | J57: 117.9019608 | K57: 76.722423000000006 | L57: 42 | M57: 219.07142859999999 | N57: 572.68526210000005 | O57: =(C57+F57+L57+I57) -> 163 | P57: 143.09815950000001 | Q57: 298.82383049999999
D58: RNG | E58: 0-290 | G58: RNG | H58: 10-460 | J58: RNG | K58: 0-355 | M58: RNG | N58: 19-3800 | P58: RNG | Q58: 0-3800
C59: 29 | D59: 94.310344799999996 | E59: 62.8098624 | F59: 40 | G59: 137.25 | H59: 76.646959600000002 | I59: 50 | J59: 120.26 | K59: 75.611469299999996 | L59: 42 | M59: 219.07142859999999 | N59: 572.68526210000005 | O59: =(C59+F59+L59+I59) -> 161 | P59: 145.58385089999999 | Q59: 300.04500830000001
D60: RNG | E60: 8-290 | G60: RNG | H60: 10-460 | J60: RNG | K60: 14-355 | M60: RNG | N60: 19-3800 | P60: RNG | Q60: 8-3800
A62: 4 | B62: Total years of teaching each subject | C62: FRQ | D62: AVG | E62: STD | F62: FRQ | G62: AVG | H62: STD | I62: FRQ | J62: AVG | K62: STD | L62: FRQ | M62: AVG | N62: STD | O62: FRQ | P62: AVG | Q62: STD
B63: Art | C63: 3 | D63: 2.00 | E63: 1.00 | F63: 3 | G63: 3.6666666999999999 | H63: 2.5166114999999998 | I63: 4 | J63: 20.75 | K63: 12.4465524 | L63: 4 | M63: 11.00 | N63: 16.0623784 | O63: =(C63+F63+L63+I63) -> 14 | P63: 10.2857143 | Q63: 12.498791199999999
B64: Bilingual | C64: 1 | D64: 1.00 | E64: . | F64: 5 | G64: 5.80 | H64: 3.4928498000000001 | I64: 0 | J64: . | K64: . | L64: 4 | M64: 9.00 | N64: 6.9761498 | O64: =(C64+F64+L64+I64) -> 10 | P64: 6.60 | Q64: 5.2957006
B65: Bio | C65: 8 | D65: 4.1875 | E65: 3.2943403999999998 | F65: 3 | G65: 16.3333333 | H65: 19.087517699999999 | I65: 6 | J65: 4.9166667000000004 | K65: 3.2313567999999999 | L65: 6 | M65: 6.8333332999999996 | N65: 8.7044049999999995 | O65: =(C65+F65+L65+I65) -> 23 | P65: 6.6521739000000002 | Q65: 8.4845243999999997
B66: Chemistry | C66: 4 | D66: 2.75 | E66: 4.1733279999999997 | F66: 2 | G66: 11.00 | H66: 12.727922100000001 | I66: 4 | J66: 17.00 | K66: 9.9666108999999992 | L66: 1 | M66: 12.00 | N66: . | O66: =(C66+F66+L66+I66) -> 11 | P66: 10.2727273 | Q66: 9.6108367000000001
B67: Earth Science | C67: 5 | D67: 9.40 | E67: 4.3931765 | F67: 2 | G67: 11.00 | H67: 12.727922100000001 | I67: 5 | J67: 5.60 | K67: 4.9295030000000004 | L67: 6 | M67: 4.1666667000000004 | N67: 4.9966656 | O67: =(C67+F67+L67+I67) -> 18 | P67: 6.7777778 | Q67: 5.8365536999999996
B68: English | C68: 20 | D68: 8.9749999999999996 | E68: 7.3564775999999998 | F68: 24 | G68: 10.5833333 | H68: 8.5461238000000002 | I68: 13 | J68: 13.192307700000001 | K68: 8.9943001999999996 | L68: 18 | M68: 10.3333333 | N68: 7.9038338000000001 | O68: =(C68+F68+L68+I68) -> 75 | P68: 10.546666699999999 | Q68: 8.1224468999999999
B69: Foreign Language(s) | C69: 0 | D69: . | E69: . | F69: 6 | G69: 13.8333333 | H69: 9.3041210000000003 | I69: 4 | J69: 13.25 | K69: 9.6393292000000006 | L69: 5 | M69: 6.60 | N69: 3.3615472999999998 | O69: =(C69+F69+L69+I69) -> 15 | P69: 11.2666667 | Q69: 8.1105458000000006
B70: General Science | C70: 7 | D70: 5.00 | E70: 3.6055513000000001 | F70: 3 | G70: 11.3333333 | H70: 16.1658075 | I70: 7 | J70: 6.5714286 | K70: 9.3960477999999998 | L70: 5 | M70: 7.80 | N70: 8.1670067999999993 | O70: =(C70+F70+L70+I70) -> 22 | P70: 7.00 | Q70: 8.4120095999999993
B71: History | C71: 7 | D71: 5.4285714 | E71: 5.5933634000000003 | F71: 9 | G71: 11.3333333 | H71: 9.5916630000000005 | I71: 4 | J71: 12.50 | K71: 14.3874946 | L71: 7 | M71: 5.4285714 | N71: 7.9761549 | O71: =(C71+F71+L71+I71) -> 27 | P71: 8.4444444000000001 | Q71: 9.1875055000000003
B72: K-8 | C72: 5 | D72: 5.60 | E72: 5.3197744 | F72: 1 | G72: 6.00 | H72: . | I72: 3 | J72: 13.6666667 | K72: 6.4291004999999997 | L72: 11 | M72: 6.6363636000000001 | N72: 3.8281255999999999 | O72: =(C72+F72+L72+I72) -> 20 | P72: 7.40 | Q72: 5.0513155999999997
B73: Math | C73: 7 | D73: 7.7142856999999996 | E73: 4.3094580000000002 | F73: 6 | G73: 5.8333332999999996 | H73: 6.3691966999999998 | I73: 5 | J73: 10.20 | K73: 12.9884564 | L73: 7 | M73: 2.4285714 | N73: 2.0701966999999999 | O73: =(C73+F73+L73+I73) -> 25 | P73: 6.28 | Q73: 7.1035202999999996
B74: Physics | C74: 4 | D74: 6.50 | E74: 5.4467115000000002 | F74: 2 | G74: 11.00 | H74: 12.727922100000001 | I74: 5 | J74: 11.00 | K74: 12.629330899999999 | L74: 1 | M74: 12.00 | N74: . | O74: =(C74+F74+L74+I74) -> 12 | P74: 9.5833332999999996 | Q74: 9.2781103999999992
B75: Social Studies | C75: 10 | D75: 4.80 | E75: 4.2373995999999998 | F75: 9 | G75: 15.6666667 | H75: 14.603081899999999 | I75: 12 | J75: 15.1666667 | K75: 12.9462759 | L75: 8 | M75: 7.625 | N75: 7.5581082000000004 | O75: =(C75+F75+L75+I75) -> 39 | P75: 11.0769231 | Q75: 11.4601934
B76: Special Ed | C76: 12 | D76: 9.6666667000000004 | E76: 5.7101717000000001 | F76: 6 | G76: 14.1666667 | H76: 11.4789663 | I76: 5 | J76: 11.40 | K76: 7.8294316999999998 | L76: 7 | M76: 7.8571429000000004 | N76: 6.3620900999999996 | O76: =(C76+F76+L76+I76) -> 30 | P76: 10.433333299999999 | Q76: 7.5369586999999996
B77: Other | C77: 10 | D77: 6.90 | E77: 6.0452000999999997 | F77: 14 | G77: 7.8571429000000004 | H77: 7.0367949999999997 | I77: 12 | J77: 17.5833333 | K77: 9.0096749000000003 | L77: 12 | M77: 6.8333332999999996 | N77: 6.4361667000000002 | O77: =(C77+F77+L77+I77) -> 48 | P77: 9.8333332999999996 | Q77: 8.3674479000000002
A79: 5 | B79: FULL-TIME TEACHING experience | C79: FRQ | D79: AVG | E79: STD | F79: FRQ | G79: AVG | H79: STD | I79: FRQ | J79: AVG | K79: STD | L79: FRQ | M79: AVG | N79: STD | O79: FRQ | P79: AVG | Q79: STD
B80: a. Total teaching years | C80: 33 | D80: 11.969697 | E80: 7.7801223000000004 | F80: 48 | G80: 15.625 | H80: 11.324282 | I80: 56 | J80: 17.885964900000001 | K80: 9.9579552000000007 | L80: 39 | M80: 13.4358974 | N80: 8.6291881000000004 | O80: =(C80+F80+L80+I80) -> 176 | P80: 15.167613599999999 | Q80: 9.9190453000000005
D81: RNG | E81: 2-33 | G81: RNG | H81: 2-42 | J81: RNG | K81: 2.5-36 | M81: RNG | N81: 2-35 | P81: RNG | Q81: 2-42
B82: b. Present position years | C82: 28 | D82: 3.0357143 | E82: 2.5456156000000001 | F82: 42 | G82: 9.6190476 | H82: 8.7796949000000009 | I82: 52 | J82: 8.4811321 | K82: 7.5612640999999998 | L82: 38 | M82: 9.00 | N82: 6.6819644 | O82: =(C82+F82+L82+I82) -> 160 | P82: 7.8843750000000004 | Q82: 7.3918239999999997
D83: RNG | E83: 1-10 | G83: RNG | H83: 0.5-33 | J83: RNG | K83: 0.5-30.5 | M83: RNG | N83: 1-27 | P83: RNG | Q83: 0.5-33
A85: 6 | B85: Number of Institute curriculum units written | C85: FRQ | D85: % T2 | E85: % T1 | F85: FRQ | G85: % T2 | H85: % T1 | I85: FRQ | J85: % T2 | K85: % T1 | L85: FRQ | M85: % T2 | N85: % T1 | O85: FRQ | P85: % T2 | Q85: % T1
B86: 1 | C86: 19 | D86: =(C86/34)*100 -> 55.882352941176471 | E86: =(C86/34)*100 -> 55.882352941176471 | F86: 40 | G86: =(F86/49)*100 -> 81.632653061224488 | H86: =(F86/49)*100 -> 81.632653061224488 | I86: 33 | J86: =(I86/52)*100 -> 63.46153846153846 | K86: =(I86/53)*100 -> 62.264150943396224 | L86: 26 | M86: =(L86/43)*100 -> 60.465116279069761 | N86: =(L86/45)*100 -> 57.777777777777771 | O86: =(C86+F86+L86+I86) -> 118 | P86: =(O86/178)*100 -> 66.292134831460672 | Q86: =(O86/185)*100 -> 63.78378378378379
B87: 2 | C87: 9 | D87: =(C87/34)*100 -> 26.47058823529412 | E87: =(C87/34)*100 -> 26.47058823529412 | F87: 6 | G87: =(F87/49)*100 -> 12.244897959183673 | H87: =(F87/49)*100 -> 12.244897959183673 | I87: 13 | J87: =(I87/52)*100 -> 25.0 | K87: =(I87/53)*100 -> 24.528301886792452 | L87: 11 | M87: =(L87/43)*100 -> 25.581395348837212 | N87: =(L87/45)*100 -> 24.444444444444443 | O87: =(C87+F87+L87+I87) -> 39 | P87: =(O87/178)*100 -> 21.910112359550563 | Q87: =(O87/185)*100 -> 21.081081081081081
B88: 3 | C88: 6 | D88: =(C88/34)*100 -> 17.647058823529413 | E88: =(C88/34)*100 -> 17.647058823529413 | F88: 3 | G88: =(F88/49)*100 -> 6.1224489795918364 | H88: =(F88/49)*100 -> 6.1224489795918364 | I88: 6 | J88: =(I88/52)*100 -> 11.538461538461538 | K88: =(I88/53)*100 -> 11.320754716981133 | L88: 6 | M88: =(L88/43)*100 -> 13.953488372093023 | N88: =(L88/45)*100 -> 13.333333333333334 | O88: =(C88+F88+L88+I88) -> 21 | P88: =(O88/178)*100 -> 11.797752808988763 | Q88: =(O88/185)*100 -> 11.351351351351353
B89: Total | C89: =SUM(C86:C88) -> 34 | D89: =SUM(D86:D88) -> 100.0 | E89: =(C89/34)*100 -> 100.0 | F89: =SUM(F86:F88) -> 49 | G89: =SUM(G86:G88) -> 100.0 | H89: =(F89/49)*100 -> 100.0 | I89: =SUM(I86:I88) -> 52 | J89: =(I89/52)*100 -> 100.0 | K89: =(I89/53)*100 -> 98.113207547169807 | L89: =SUM(L86:L88) -> 43 | M89: =SUM(M86:M88) -> 100.0 | N89: =(L89/45)*100 -> 95.555555555555557 | O89: =(C89+F89+L89+I89) -> 178 | P89: =(O89/178)*100 -> 100.0 | Q89: =(O89/185)*100 -> 96.216216216216225
A91: 7 | B91: Primary source of idea for most recent unit | C91: FRQ | D91: % T2 | E91: % T1 | F91: FRQ | G91: % T2 | H91: % T1 | I91: FRQ | J91: % T2 | K91: % T1 | L91: FRQ | M91: % T2 | N91: % T1 | O91: FRQ | P91: % T2 | Q91: % T1
B92: Students' interest | C92: 2 | D92: =(C92/35)*100 -> 5.7142857142857144 | E92: =(C92/34)*100 -> 5.8823529411764701 | F92: 5 | G92: =(F92/53)*100 -> 9.433962264150944 | H92: =(F92/49)*100 -> 10.204081632653061 | I92: 4 | J92: =(I92/53)*100 -> 7.5471698113207548 | K92: =(I92/57)*100 -> 7.0175438596491224 | L92: 3 | M92: =(L92/42)*100 -> 7.1428571428571423 | N92: =(L92/45)*100 -> 6.666666666666667 | O92: =(C92+F92+L92+I92) -> 14 | P92: =(O92/183)*100 -> 7.6502732240437163 | Q92: =(O92/185)*100 -> 7.5675675675675684
B93: Self interest | C93: 9 | D93: =(C93/35)*100 -> 25.714285714285712 | E93: =(C93/34)*100 -> 26.47058823529412 | F93: 12 | G93: =(F93/53)*100 -> 22.641509433962266 | H93: =(F93/49)*100 -> 24.489795918367346 | I93: 20 | J93: =(I93/53)*100 -> 37.735849056603776 | K93: =(I93/57)*100 -> 35.087719298245609 | L93: 11 | M93: =(L93/42)*100 -> 26.190476190476193 | N93: =(L93/45)*100 -> 24.444444444444443 | O93: =(C93+F93+L93+I93) -> 52 | P93: =(O93/183)*100 -> 28.415300546448087 | Q93: =(O93/185)*100 -> 28.108108108108109
B94: Department requirement | C94: 0 | D94: =(C94/35)*100 -> 0.0 | E94: =(C94/34)*100 -> 0.0 | F94: 2 | G94: =(F94/53)*100 -> 3.7735849056603774 | H94: =(F94/49)*100 -> 4.0816326530612246 | I94: 4 | J94: =(I94/53)*100 -> 7.5471698113207548 | K94: =(I94/57)*100 -> 7.0175438596491224 | L94: 1 | M94: =(L94/42)*100 -> 2.3809523809523809 | N94: =(L94/45)*100 -> 2.2222222222222223 | O94: =(C94+F94+L94+I94) -> 7 | P94: =(O94/183)*100 -> 3.8251366120218582 | Q94: =(O94/185)*100 -> 3.7837837837837842
B95: Importance of topic | C95: 9 | D95: =(C95/35)*100 -> 25.714285714285712 | E95: =(C95/34)*100 -> 26.47058823529412 | F95: 19 | G95: =(F95/53)*100 -> 35.849056603773583 | H95: =(F95/49)*100 -> 38.775510204081634 | I95: 6 | J95: =(I95/53)*100 -> 11.320754716981133 | K95: =(I95/57)*100 -> 10.526315789473683 | L95: 15 | M95: =(L95/42)*100 -> 35.714285714285715 | N95: =(L95/45)*100 -> 33.333333333333329 | O95: =(C95+F95+L95+I95) -> 49 | P95: =(O95/183)*100 -> 26.775956284153008 | Q95: =(O95/185)*100 -> 26.486486486486488
B96: Need further work | C96: 6 | D96: =(C96/35)*100 -> 17.142857142857142 | E96: =(C96/34)*100 -> 17.647058823529413 | F96: 6 | G96: =(F96/53)*100 -> 11.320754716981133 | H96: =(F96/49)*100 -> 12.244897959183673 | I96: 11 | J96: =(I96/53)*100 -> 20.754716981132077 | K96: =(I96/57)*100 -> 19.298245614035086 | L96: 5 | M96: =(L96/42)*100 -> 11.904761904761903 | N96: =(L96/45)*100 -> 11.111111111111111 | O96: =(C96+F96+L96+I96) -> 28 | P96: =(O96/183)*100 -> 15.300546448087433 | Q96: =(O96/185)*100 -> 15.135135135135137
B97: Seminar description | C97: 3 | D97: =(C97/35)*100 -> 8.5714285714285712 | E97: =(C97/34)*100 -> 8.8235294117647065 | F97: 4 | G97: =(F97/53)*100 -> 7.5471698113207548 | H97: =(F97/49)*100 -> 8.1632653061224492 | I97: 1 | J97: =(I97/53)*100 -> 1.8867924528301887 | K97: =(I97/57)*100 -> 1.7543859649122806 | L97: 0 | M97: =(L97/42)*100 -> 0.0 | N97: =(L97/45)*100 -> 0.0 | O97: =(C97+F97+L97+I97) -> 8 | P97: =(O97/183)*100 -> 4.3715846994535523 | Q97: =(O97/185)*100 -> 4.3243243243243246
B98: Reading for seminar | C98: 1 | D98: =(C98/35)*100 -> 2.8571428571428572 | E98: =(C98/34)*100 -> 2.9411764705882351 | F98: 1 | G98: =(F98/53)*100 -> 1.8867924528301887 | H98: =(F98/49)*100 -> 2.0408163265306123 | I98: 3 | J98: =(I98/53)*100 -> 5.6603773584905666 | K98: =(I98/57)*100 -> 5.2631578947368416 | L98: 2 | M98: =(L98/42)*100 -> 4.7619047619047619 | N98: =(L98/45)*100 -> 4.4444444444444446 | O98: =(C98+F98+L98+I98) -> 7 | P98: =(O98/183)*100 -> 3.8251366120218582 | Q98: =(O98/185)*100 -> 3.7837837837837842
B99: Discussion in seminar | C99: 4 | D99: =(C99/35)*100 -> 11.428571428571429 | E99: =(C99/34)*100 -> 11.76470588235294 | F99: 4 | G99: =(F99/53)*100 -> 7.5471698113207548 | H99: =(F99/49)*100 -> 8.1632653061224492 | I99: 1 | J99: =(I99/53)*100 -> 1.8867924528301887 | K99: =(I99/57)*100 -> 1.7543859649122806 | L99: 4 | M99: =(L99/42)*100 -> 9.5238095238095237 | N99: =(L99/45)*100 -> 8.8888888888888893 | O99: =(C99+F99+L99+I99) -> 13 | P99: =(O99/183)*100 -> 7.1038251366120218 | Q99: =(O99/185)*100 -> 7.0270270270270272
B100: Previous Institute seminar | C100: 1 | D100: =(C100/35)*100 -> 2.8571428571428572 | E100: =(C100/34)*100 -> 2.9411764705882351 | F100: 0 | G100: =(F100/53)*100 -> 0.0 | H100: =(F100/49)*100 -> 0.0 | I100: 3 | J100: =(I100/53)*100 -> 5.6603773584905666 | K100: =(I100/57)*100 -> 5.2631578947368416 | L100: 1 | M100: =(L100/42)*100 -> 2.3809523809523809 | N100: =(L100/45)*100 -> 2.2222222222222223 | O100: =(C100+F100+L100+I100) -> 5 | P100: =(O100/183)*100 -> 2.7322404371584699 | Q100: =(O100/185)*100 -> 2.7027027027027026
B101: Previous institute talk | C101: 0 | D101: =(C101/35)*100 -> 0.0 | E101: =(C101/34)*100 -> 0.0 | F101: 0 | G101: =(F101/53)*100 -> 0.0 | H101: =(F101/49)*100 -> 0.0 | I101: 0 | J101: =(I101/53)*100 -> 0.0 | K101: =(I101/57)*100 -> 0.0 | L101: 0 | M101: =(L101/42)*100 -> 0.0 | N101: =(L101/45)*100 -> 0.0 | O101: =(C101+F101+L101+I101) -> 0 | P101: =(O101/183)*100 -> 0.0 | Q101: =(O101/185)*100 -> 0.0
B102: Other | C102: 0 | D102: =(C102/35)*100 -> 0.0 | E102: =(C102/34)*100 -> 0.0 | F102: 0 | G102: =(F102/53)*100 -> 0.0 | H102: =(F102/49)*100 -> 0.0 | I102: 0 | J102: =(I102/53)*100 -> 0.0 | K102: =(I102/57)*100 -> 0.0 | L102: 0 | M102: =(L102/42)*100 -> 0.0 | N102: =(L102/45)*100 -> 0.0 | O102: =(C102+F102+L102+I102) -> 0 | P102: =(O102/183)*100 -> 0.0 | Q102: =(O102/185)*100 -> 0.0
B103: Total | C103: =SUM(C92:C102) -> 35 | D103: =(C103/35)*100 -> 100.0 | E103: =(C103/34)*100 -> 102.94117647058823 | F103: =SUM(F92:F102) -> 53 | G103: =(F103/53)*100 -> 100.0 | H103: =(F103/49)*100 -> 108.16326530612245 | I103: =SUM(I92:I102) -> 53 | J103: =SUM(J92:J102) -> 100.0 | K103: =(I103/57)*100 -> 92.982456140350877 | L103: =SUM(L92:L102) -> 42 | M103: =(L103/42)*100 -> 100.0 | N103: =(L103/45)*100 -> 93.333333333333329 | O103: =(C103+F103+L103+I103) -> 183 | P103: =(O103/183)*100 -> 100.0 | Q103: =(O103/185)*100 -> 98.918918918918919
A105: 8 | B105: Trial of SUBJECT MATTER of the unit in classroom | C105: FRQ | D105: % T2 | E105: % T1 | F105: FRQ | G105: % T2 | H105: % T1 | I105: FRQ | J105: % T2 | K105: % T1 | L105: FRQ | M105: % T2 | N105: % T1 | O105: FRQ | P105: % T2 | Q105: % T1
B106: No | C106: 17 | D106: =(C106/34)*100 -> 50.0 | E106: =(C106/34)*100 -> 50.0 | F106: 10 | G106: =(F106/48)*100 -> 20.833333333333336 | H106: =(F106/49)*100 -> 20.408163265306122 | I106: 13 | J106: =(I106/53)*100 -> 24.528301886792452 | K106: =(I106/57)*100 -> 22.807017543859647 | L106: 5 | M106: =(L106/42)*100 -> 11.904761904761903 | N106: =(L106/45)*100 -> 11.111111111111111 | O106: =(C106+F106+L106+I106) -> 45 | P106: =(O106/177)*100 -> 25.423728813559322 | Q106: =(O106/185)*100 -> 24.324324324324326
B107: Yes | C107: 17 | D107: =(C107/34)*100 -> 50.0 | E107: =(C107/34)*100 -> 50.0 | F107: 38 | G107: =(F107/48)*100 -> 79.166666666666657 | H107: =(F107/49)*100 -> 77.551020408163268 | I107: 40 | J107: =(I107/53)*100 -> 75.471698113207552 | K107: =(I107/57)*100 -> 70.175438596491219 | L107: 37 | M107: =(L107/42)*100 -> 88.095238095238088 | N107: =(L107/45)*100 -> 82.222222222222214 | O107: =(C107+F107+L107+I107) -> 132 | P107: =(O107/177)*100 -> 74.576271186440678 | Q107: =(O107/185)*100 -> 71.351351351351354
B108: Total | C108: =SUM(C106:C107) -> 34 | D108: =SUM(D106:D107) -> 100.0 | E108: =(C108/34)*100 -> 100.0 | F108: =SUM(F106:F107) -> 48 | G108: =SUM(G106:G107) -> 100.0 | H108: =(F108/49)*100 -> 97.959183673469383 | I108: =SUM(I106:I107) -> 53 | J108: =(I108/53)*100 -> 100.0 | K108: =(I108/57)*100 -> 92.982456140350877 | L108: =SUM(L106:L107) -> 42 | M108: =SUM(M106:M107) -> 100.0 | N108: =(L108/45)*100 -> 93.333333333333329 | O108: =(C108+F108+L108+I108) -> 177 | P108: =(O108/177)*100 -> 100.0 | Q108: =(O108/185)*100 -> 95.675675675675677
A110: 9 | B110: Trial of STRATEGIES of the unit in classroom | C110: FRQ | D110: % T2 | E110: % T1 | F110: FRQ | G110: % T2 | H110: % T1 | I110: FRQ | J110: % T2 | K110: % T1 | L110: FRQ | M110: % T2 | N110: % T1 | O110: FRQ | P110: % T2 | Q110: % T1
B111: No | C111: 20 | D111: =(C111/34)*100 -> 58.82352941176471 | E111: =(C111/34)*100 -> 58.82352941176471 | F111: 5 | G111: =(F111/48)*100 -> 10.416666666666668 | H111: =(F111/49)*100 -> 10.204081632653061 | I111: 15 | J111: =(I111/52)*100 -> 28.846153846153843 | K111: =(I111/57)*100 -> 26.315789473684209 | L111: 8 | M111: =(L111/44)*100 -> 18.181818181818183 | N111: =(L111/45)*100 -> 17.777777777777779 | O111: =(C111+F111+L111+I111) -> 48 | P111: =(O111/178)*100 -> 26.966292134831459 | Q111: =(O111/185)*100 -> 25.945945945945947
B112: Yes | C112: 14 | D112: =(C112/34)*100 -> 41.17647058823529 | E112: =(C112/34)*100 -> 41.17647058823529 | F112: 43 | G112: =(F112/48)*100 -> 89.583333333333343 | H112: =(F112/49)*100 -> 87.755102040816325 | I112: 37 | J112: =(I112/52)*100 -> 71.15384615384616 | K112: =(I112/57)*100 -> 64.912280701754383 | L112: 36 | M112: =(L112/44)*100 -> 81.818181818181827 | N112: =(L112/45)*100 -> 80.0 | O112: =(C112+F112+L112+I112) -> 130 | P112: =(O112/178)*100 -> 73.033707865168537 | Q112: =(O112/185)*100 -> 70.270270270270274
B113: Total | C113: =SUM(C111:C112) -> 34 | D113: =SUM(D111:D112) -> 100.0 | E113: =(C113/34)*100 -> 100.0 | F113: =SUM(F111:F112) -> 48 | G113: =SUM(G111:G112) -> 100.0 | H113: =(F113/49)*100 -> 97.959183673469383 | I113: =SUM(I111:I112) -> 52 | J113: =SUM(J111:J112) -> 100.0 | K113: =(I113/57)*100 -> 91.228070175438589 | L113: =SUM(L111:L112) -> 44 | M113: =SUM(M111:M112) -> 100.0 | N113: =(L113/45)*100 -> 97.777777777777771 | O113: =(C113+F113+L113+I113) -> 178 | P113: =SUM(P111:P112) -> 100.0 | Q113: =(O113/185)*100 -> 96.216216216216225
A115: 10 | B115: Influence of subject matter and strategies of the unit | C115: FRQ | D115: % T2 | E115: % T1 | F115: FRQ | G115: % T2 | H115: % T1 | I115: FRQ | J115: % T2 | K115: % T1 | L115: FRQ | M115: % T2 | N115: % T1 | O115: FRQ | P115: % T2 | Q115: % T1
B116: No | C116: 1 | D116: =(C116/34)*100 -> 2.9411764705882351 | E116: =(C116/34)*100 -> 2.9411764705882351 | F116: 7 | G116: =(F116/46)*100 -> 15.217391304347828 | H116: =(F116/49)*100 -> 14.285714285714285 | I116: 6 | J116: =(I116/53)*100 -> 11.320754716981133 | K116: =(I116/57)*100 -> 10.526315789473683 | L116: 3 | M116: =(L116/41)*100 -> 7.3170731707317067 | N116: =(L116/45)*100 -> 6.666666666666667 | O116: =(C116+F116+L116+I116) -> 17 | P116: =(O116/174)*100 -> 9.7701149425287355 | Q116: =(O116/185)*100 -> 9.1891891891891895
B117: Yes | C117: 14 | D117: =(C117/34)*100 -> 41.17647058823529 | E117: =(C117/34)*100 -> 41.17647058823529 | F117: 35 | G117: =(F117/46)*100 -> 76.08695652173914 | H117: =(F117/49)*100 -> 71.428571428571431 | I117: 40 | J117: =(I117/53)*100 -> 75.471698113207552 | K117: =(I117/57)*100 -> 70.175438596491219 | L117: 36 | M117: =(L117/41)*100 -> 87.804878048780495 | N117: =(L117/45)*100 -> 80.0 | O117: =(C117+F117+L117+I117) -> 125 | P117: =(O117/174)*100 -> 71.839080459770116 | Q117: =(O117/185)*100 -> 67.567567567567565
B118: No trial | C118: 19 | D118: =(C118/34)*100 -> 55.882352941176471 | E118: =(C118/34)*100 -> 55.882352941176471 | F118: 4 | G118: =(F118/46)*100 -> 8.695652173913043 | H118: =(F118/49)*100 -> 8.1632653061224492 | I118: 7 | J118: =(I118/53)*100 -> 13.20754716981132 | K118: =(I118/57)*100 -> 12.280701754385964 | L118: 2 | M118: =(L118/41)*100 -> 4.8780487804878048 | N118: =(L118/45)*100 -> 4.4444444444444446 | O118: =(C118+F118+L118+I118) -> 32 | P118: =(O118/174)*100 -> 18.390804597701148 | Q118: =(O118/185)*100 -> 17.297297297297298
B119: Total | C119: =SUM(C116:C118) -> 34 | D119: =SUM(D116:D118) -> 100.0 | E119: =(C119/34)*100 -> 100.0 | F119: =SUM(F116:F118) -> 46 | G119: =(F119/46)*100 -> 100.0 | H119: =(F119/49)*100 -> 93.877551020408163 | I119: =SUM(I116:I118) -> 53 | J119: =(I119/53)*100 -> 100.0 | K119: =(I119/57)*100 -> 92.982456140350877 | L119: =SUM(L116:L118) -> 41 | M119: =(L119/41)*100 -> 100.0 | N119: =(L119/45)*100 -> 91.111111111111114 | O119: =(C119+F119+L119+I119) -> 174 | P119: =(O119/174)*100 -> 100.0 | Q119: =(O119/185)*100 -> 94.054054054054063
A121: 11 | B121: Further work on the unit before and while teaching | C121: FRQ | D121: % T2 | E121: % T1 | F121: FRQ | G121: % T2 | H121: % T1 | I121: FRQ | J121: % T2 | K121: % T1 | L121: FRQ | M121: % T2 | N121: % T1 | O121: FRQ | P121: % T2 | Q121: % T1
B122: No | C122: 9 | D122: =(C122/32)*100 -> 28.125 | E122: =(C122/34)*100 -> 26.47058823529412 | F122: 15 | G122: =(F122/46)*100 -> 32.608695652173914 | H122: =(F122/49)*100 -> 30.612244897959183 | I122: 17 | J122: =(I122/50)*100 -> 34.0 | K122: =(I122/57)*100 -> 29.82456140350877 | L122: 8 | M122: =(L122/42)*100 -> 19.047619047619047 | N122: =(L122/45)*100 -> 17.777777777777779 | O122: =(C122+F122+L122+I122) -> 49 | P122: =(O122/170)*100 -> 28.823529411764703 | Q122: =(O122/185)*100 -> 26.486486486486488
B123: Yes | C123: 23 | D123: =(C123/32)*100 -> 71.875 | E123: =(C123/34)*100 -> 67.64705882352942 | F123: 31 | G123: =(F123/46)*100 -> 67.391304347826093 | H123: =(F123/49)*100 -> 63.265306122448983 | I123: 33 | J123: =(I123/50)*100 -> 66.0 | K123: =(I123/57)*100 -> 57.894736842105267 | L123: 34 | M123: =(L123/42)*100 -> 80.952380952380949 | N123: =(L123/45)*100 -> 75.555555555555557 | O123: =(C123+F123+L123+I123) -> 121 | P123: =(O123/170)*100 -> 71.17647058823529 | Q123: =(O123/185)*100 -> 65.405405405405403
B124: Total | C124: =SUM(C122:C123) -> 32 | D124: =(C124/32)*100 -> 100 | E124: =(C124/34)*100 -> 94.117647058823522 | F124: =SUM(F122:F123) -> 46 | G124: =(F124/46)*100 -> 100.0 | H124: =(F124/49)*100 -> 93.877551020408163 | I124: =SUM(I122:I123) -> 50 | J124: =(I124/50)*100 -> 100.0 | K124: =(I124/57)*100 -> 87.719298245614027 | L124: =SUM(L122:L123) -> 42 | M124: =(L124/42)*100 -> 100.0 | N124: =(L124/45)*100 -> 93.333333333333329 | O124: =(C124+F124+L124+I124) -> 170 | P124: =(O124/170)*100 -> 100.0 | Q124: =(O124/185)*100 -> 91.891891891891902
A126: 12 | B126: Content and extent of further work on the unit | C126: FRQ | D126: % T2 | E126: % T1 | F126: FRQ | G126: % T2 | H126: % T1 | I126: FRQ | J126: % T2 | K126: % T1 | L126: FRQ | M126: % T2 | N126: % T1 | O126: FRQ | P126: % T2 | Q126: % T1
B127: a. Additional research on the unit topic
B128: A lot | C128: 5 | D128: =(C128/23)*100 -> 21.739130434782609 | E128: =(C128/34)*100 -> 14.705882352941178 | F128: 5 | G128: =(F128/27)*100 -> 18.518518518518519 | H128: =(F128/49)*100 -> 10.204081632653061 | I128: 10 | J128: =(I128/37)*100 -> 27.027027027027028 | K128: =(I128/57)*100 -> 17.543859649122805 | L128: 7 | M128: =(L128/31)*100 -> 22.58064516129032 | N128: =(L128/45)*100 -> 15.555555555555555 | O128: =(C128+F128+L128+I128) -> 27 | P128: =(O128/118)*100 -> 22.881355932203391 | Q128: =(O128/185)*100 -> 14.594594594594595
B129: Some | C129: 10 | D129: =(C129/23)*100 -> 43.478260869565219 | E129: =(C129/34)*100 -> 29.411764705882355 | F129: 16 | G129: =(F129/27)*100 -> 59.259259259259252 | H129: =(F129/49)*100 -> 32.653061224489797 | I129: 16 | J129: =(I129/37)*100 -> 43.243243243243242 | K129: =(I129/57)*100 -> 28.07017543859649 | L129: 15 | M129: =(L129/31)*100 -> 48.387096774193552 | N129: =(L129/45)*100 -> 33.333333333333329 | O129: =(C129+F129+L129+I129) -> 57 | P129: =(O129/118)*100 -> 48.305084745762713 | Q129: =(O129/185)*100 -> 30.810810810810814
B130: A little | C130: 6 | D130: =(C130/23)*100 -> 26.086956521739129 | E130: =(C130/34)*100 -> 17.647058823529413 | F130: 1 | G130: =(F130/27)*100 -> 3.7037037037037033 | H130: =(F130/49)*100 -> 2.0408163265306123 | I130: 5 | J130: =(I130/37)*100 -> 13.513513513513514 | K130: =(I130/57)*100 -> 8.7719298245614024 | L130: 6 | M130: =(L130/31)*100 -> 19.35483870967742 | N130: =(L130/45)*100 -> 13.333333333333334 | O130: =(C130+F130+L130+I130) -> 18 | P130: =(O130/118)*100 -> 15.254237288135593 | Q130: =(O130/185)*100 -> 9.7297297297297298
B131: None | C131: 2 | D131: =(C131/23)*100 -> 8.695652173913043 | E131: =(C131/34)*100 -> 5.8823529411764701 | F131: 5 | G131: =(F131/27)*100 -> 18.518518518518519 | H131: =(F131/49)*100 -> 10.204081632653061 | I131: 6 | J131: =(I131/37)*100 -> 16.216216216216218 | K131: =(I131/57)*100 -> 10.526315789473683 | L131: 3 | M131: =(L131/31)*100 -> 9.67741935483871 | N131: =(L131/45)*100 -> 6.666666666666667 | O131: =(C131+F131+L131+I131) -> 16 | P131: =(O131/118)*100 -> 13.559322033898304 | Q131: =(O131/185)*100 -> 8.6486486486486491
B132: Total | C132: =SUM(C128:C131) -> 23 | D132: =(C132/23)*100 -> 100.0 | E132: =(C132/34)*100 -> 67.64705882352942 | F132: =SUM(F128:F131) -> 27 | G132: =(F132/27)*100 -> 100.0 | H132: =(F132/49)*100 -> 55.102040816326522 | I132: =SUM(I128:I131) -> 37 | J132: =(I132/37)*100 -> 100.0 | K132: =(I132/57)*100 -> 64.912280701754383 | L132: =SUM(L128:L131) -> 31 | M132: =(L132/31)*100 -> 100.0 | N132: =(L132/45)*100 -> 68.888888888888886 | O132: =(C132+F132+L132+I132) -> 118 | P132: =(O132/118)*100 -> 100.0 | Q132: =(O132/185)*100 -> 63.78378378378379
B133: b. Additional teaching strategies
B134: A lot | C134: 4 | D134: =(C134/23)*100 -> 17.391304347826086 | E134: =(C134/34)*100 -> 11.76470588235294 | F134: 3 | G134: =(F134/30)*100 -> 10.0 | H134: =(F134/49)*100 -> 6.1224489795918364 | I134: 4 | J134: =(I134/37)*100 -> 10.810810810810811 | K134: =(I134/57)*100 -> 7.0175438596491224 | L134: 3 | M134: =(L134/30)*100 -> 10.0 | N134: =(L134/45)*100 -> 6.666666666666667 | O134: =(C134+F134+L134+I134) -> 14 | P134: =(O134/120)*100 -> 11.666666666666666 | Q134: =(O134/185)*100 -> 7.5675675675675684
B135: Some | C135: 13 | D135: =(C135/23)*100 -> 56.521739130434781 | E135: =(C135/34)*100 -> 38.235294117647058 | F135: 16 | G135: =(F135/30)*100 -> 53.333333333333336 | H135: =(F135/49)*100 -> 32.653061224489797 | I135: 11 | J135: =(I135/37)*100 -> 29.72972972972973 | K135: =(I135/57)*100 -> 19.298245614035086 | L135: 17 | M135: =(L135/30)*100 -> 56.666666666666664 | N135: =(L135/45)*100 -> 37.777777777777779 | O135: =(C135+F135+L135+I135) -> 57 | P135: =(O135/120)*100 -> 47.5 | Q135: =(O135/185)*100 -> 30.810810810810814
B136: A little | C136: 6 | D136: =(C136/23)*100 -> 26.086956521739129 | E136: =(C136/34)*100 -> 17.647058823529413 | F136: 10 | G136: =(F136/30)*100 -> 33.333333333333329 | H136: =(F136/49)*100 -> 20.408163265306122 | I136: 15 | J136: =(I136/37)*100 -> 40.54054054054054 | K136: =(I136/57)*100 -> 26.315789473684209 | L136: 7 | M136: =(L136/30)*100 -> 23.333333333333332 | N136: =(L136/45)*100 -> 15.555555555555555 | O136: =(C136+F136+L136+I136) -> 38 | P136: =(O136/120)*100 -> 31.666666666666664 | Q136: =(O136/185)*100 -> 20.54054054054054
B137: None | C137: 0 | D137: =(C137/23)*100 -> 0.0 | E137: =(C137/34)*100 -> 0.0 | F137: 1 | G137: =(F137/30)*100 -> 3.3333333333333335 | H137: =(F137/49)*100 -> 2.0408163265306123 | I137: 7 | J137: =(I137/37)*100 -> 18.918918918918919 | K137: =(I137/57)*100 -> 12.280701754385964 | L137: 3 | M137: =(L137/30)*100 -> 10.0 | N137: =(L137/45)*100 -> 6.666666666666667 | O137: =(C137+F137+L137+I137) -> 11 | P137: =(O137/120)*100 -> 9.1666666666666661 | Q137: =(O137/185)*100 -> 5.9459459459459465
B138: Total | C138: =SUM(C134:C137) -> 23 | D138: =(C138/23)*100 -> 100.0 | E138: =(C138/34)*100 -> 67.64705882352942 | F138: =SUM(F134:F137) -> 30 | G138: =(F138/30)*100 -> 100.0 | H138: =(F138/49)*100 -> 61.224489795918366 | I138: =SUM(I134:I137) -> 37 | J138: =(I138/37)*100 -> 100.0 | K138: =(I138/57)*100 -> 64.912280701754383 | L138: =SUM(L134:L137) -> 30 | M138: =(L138/30)*100 -> 100.0 | N138: =(L138/45)*100 -> 66.666666666666657 | O138: =(C138+F138+L138+I138) -> 120 | P138: =(O138/120)*100 -> 100.0 | Q138: =(O138/185)*100 -> 64.86486486486487
B139: c. Additional lesson plans and classroom activities
B140: A lot | C140: 6 | D140: =(C140/21)*100 -> 28.571428571428569 | E140: =(C140/34)*100 -> 17.647058823529413 | F140: 6 | G140: =(F140/28)*100 -> 21.428571428571427 | H140: =(F140/49)*100 -> 12.244897959183673 | I140: 8 | J140: =(I140/36)*100 -> 22.222222222222221 | K140: =(I140/57)*100 -> 14.035087719298245 | L140: 7 | M140: =(L140/28)*100 -> 25.0 | N140: =(L140/45)*100 -> 15.555555555555555 | O140: =(C140+F140+L140+I140) -> 27 | P140: =(O140/113)*100 -> 23.893805309734514 | Q140: =(O140/185)*100 -> 14.594594594594595
B141: Some | C141: 10 | D141: =(C141/21)*100 -> 47.619047619047613 | E141: =(C141/34)*100 -> 29.411764705882355 | F141: 15 | G141: =(F141/28)*100 -> 53.571428571428569 | H141: =(F141/49)*100 -> 30.612244897959183 | I141: 15 | J141: =(I141/36)*100 -> 41.666666666666671 | K141: =(I141/57)*100 -> 26.315789473684209 | L141: 11 | M141: =(L141/28)*100 -> 39.285714285714285 | N141: =(L141/45)*100 -> 24.444444444444443 | O141: =(C141+F141+L141+I141) -> 51 | P141: =(O141/113)*100 -> 45.132743362831853 | Q141: =(O141/185)*100 -> 27.567567567567568
B142: A little | C142: 5 | D142: =(C142/21)*100 -> 23.809523809523807 | E142: =(C142/34)*100 -> 14.705882352941178 | F142: 5 | G142: =(F142/28)*100 -> 17.857142857142858 | H142: =(F142/49)*100 -> 10.204081632653061 | I142: 8 | J142: =(I142/36)*100 -> 22.222222222222221 | K142: =(I142/57)*100 -> 14.035087719298245 | L142: 9 | M142: =(L142/28)*100 -> 32.142857142857146 | N142: =(L142/45)*100 -> 20.0 | O142: =(C142+F142+L142+I142) -> 27 | P142: =(O142/113)*100 -> 23.893805309734514 | Q142: =(O142/185)*100 -> 14.594594594594595
B143: None | C143: 0 | D143: =(C143/21)*100 -> 0.0 | E143: =(C143/34)*100 -> 0.0 | F143: 2 | G143: =(F143/28)*100 -> 7.1428571428571423 | H143: =(F143/49)*100 -> 4.0816326530612246 | I143: 5 | J143: =(I143/36)*100 -> 13.888888888888889 | K143: =(I143/57)*100 -> 8.7719298245614024 | L143: 1 | M143: =(L143/28)*100 -> 3.5714285714285712 | N143: =(L143/45)*100 -> 2.2222222222222223 | O143: =(C143+F143+L143+I143) -> 8 | P143: =(O143/113)*100 -> 7.0796460176991154 | Q143: =(O143/185)*100 -> 4.3243243243243246
B144: Total | C144: =SUM(C140:C143) -> 21 | D144: =(C144/21)*100 -> 100.0 | E144: =(C144/34)*100 -> 61.764705882352942 | F144: =SUM(F140:F143) -> 28 | G144: =(F144/28)*100 -> 100.0 | H144: =(F144/49)*100 -> 57.142857142857139 | I144: =SUM(I140:I143) -> 36 | J144: =(I144/36)*100 -> 100.0 | K144: =(I144/57)*100 -> 63.157894736842103 | L144: =SUM(L140:L143) -> 28 | M144: =(L144/28)*100 -> 100.0 | N144: =(L144/45)*100 -> 62.222222222222221 | O144: =(C144+F144+L144+I144) -> 113 | P144: =(O144/113)*100 -> 100.0 | Q144: =(O144/185)*100 -> 61.081081081081081
B145: d. Additional classroom materials
B146: A lot | C146: 8 | D146: =(C146/22)*100 -> 36.363636363636367 | E146: =(C146/34)*100 -> 23.52941176470588 | F146: 7 | G146: =(F146/32)*100 -> 21.875 | H146: =(F146/49)*100 -> 14.285714285714285 | I146: 4 | J146: =(I146/37)*100 -> 10.810810810810811 | K146: =(I146/57)*100 -> 7.0175438596491224 | L146: 4 | M146: =(L146/30)*100 -> 13.333333333333334 | N146: =(L146/45)*100 -> 8.8888888888888893 | O146: =(C146+F146+L146+I146) -> 23 | P146: =(O146/121)*100 -> 19.008264462809919 | Q146: =(O146/185)*100 -> 12.432432432432433
B147: Some | C147: 9 | D147: =(C147/22)*100 -> 40.909090909090914 | E147: =(C147/34)*100 -> 26.47058823529412 | F147: 15 | G147: =(F147/32)*100 -> 46.875 | H147: =(F147/49)*100 -> 30.612244897959183 | I147: 18 | J147: =(I147/37)*100 -> 48.648648648648653 | K147: =(I147/57)*100 -> 31.578947368421051 | L147: 17 | M147: =(L147/30)*100 -> 56.666666666666664 | N147: =(L147/45)*100 -> 37.777777777777779 | O147: =(C147+F147+L147+I147) -> 59 | P147: =(O147/121)*100 -> 48.760330578512395 | Q147: =(O147/185)*100 -> 31.891891891891895
B148: A little | C148: 3 | D148: =(C148/22)*100 -> 13.636363636363635 | E148: =(C148/34)*100 -> 8.8235294117647065 | F148: 7 | G148: =(F148/32)*100 -> 21.875 | H148: =(F148/49)*100 -> 14.285714285714285 | I148: 6 | J148: =(I148/37)*100 -> 16.216216216216218 | K148: =(I148/57)*100 -> 10.526315789473683 | L148: 6 | M148: =(L148/30)*100 -> 20.0 | N148: =(L148/45)*100 -> 13.333333333333334 | O148: =(C148+F148+L148+I148) -> 22 | P148: =(O148/121)*100 -> 18.181818181818183 | Q148: =(O148/185)*100 -> 11.891891891891893
B149: None | C149: 2 | D149: =(C149/22)*100 -> 9.0909090909090917 | E149: =(C149/34)*100 -> 5.8823529411764701 | F149: 3 | G149: =(F149/32)*100 -> 9.375 | H149: =(F149/49)*100 -> 6.1224489795918364 | I149: 9 | J149: =(I149/37)*100 -> 24.324324324324326 | K149: =(I149/57)*100 -> 15.789473684210526 | L149: 3 | M149: =(L149/30)*100 -> 10.0 | N149: =(L149/45)*100 -> 6.666666666666667 | O149: =(C149+F149+L149+I149) -> 17 | P149: =(O149/121)*100 -> 14.049586776859504 | Q149: =(O149/185)*100 -> 9.1891891891891895
B150: Total | C150: =SUM(C146:C149) -> 22 | D150: =(C150/22)*100 -> 100.0 | E150: =(C150/34)*100 -> 64.705882352941174 | F150: =SUM(F146:F149) -> 32 | G150: =(F150/32)*100 -> 100.0 | H150: =(F150/49)*100 -> 65.306122448979593 | I150: =SUM(I146:I149) -> 37 | J150: =(I150/37)*100 -> 100.0 | K150: =(I150/57)*100 -> 64.912280701754383 | L150: =SUM(L146:L149) -> 30 | M150: =(L150/30)*100 -> 100.0 | N150: =(L150/45)*100 -> 66.666666666666657 | O150: =(C150+F150+L150+I150) -> 121 | P150: =(O150/121)*100 -> 100.0 | Q150: =(O150/185)*100 -> 65.405405405405403
B151: e. Other
B152: A lot | C152: 0 | D152: =(C152/1)*100 -> 0.0 | E152: =(C152/34)*100 -> 0.0 | F152: 3 | G152: =(F152/4)*100 -> 75.0 | H152: =(F152/49)*100 -> 6.1224489795918364 | I152: 0 | J152: =(I152/2)*100 -> 0.0 | K152: =(I152/57)*100 -> 0.0 | L152: 2 | M152: =(L152/5)*100 -> 40.0 | N152: =(L152/45)*100 -> 4.4444444444444446 | O152: =(C152+F152+L152+I152) -> 5 | P152: =(O152/12)*100 -> 41.666666666666671 | Q152: =(O152/185)*100 -> 2.7027027027027026
B153: Some | C153: 0 | D153: =(C153/1)*100 -> 0.0 | E153: =(C153/34)*100 -> 0.0 | F153: 1 | G153: =(F153/4)*100 -> 25.0 | H153: =(F153/49)*100 -> 2.0408163265306123 | I153: 1 | J153: =(I153/2)*100 -> 50.0 | K153: =(I153/57)*100 -> 1.7543859649122806 | L153: 1 | M153: =(L153/5)*100 -> 20.0 | N153: =(L153/45)*100 -> 2.2222222222222223 | O153: =(C153+F153+L153+I153) -> 3 | P153: =(O153/12)*100 -> 25.0 | Q153: =(O153/185)*100 -> 1.6216216216216217
B154: A little | C154: 1 | D154: =(C154/1)*100 -> 100.0 | E154: =(C154/34)*100 -> 2.9411764705882351 | F154: 0 | G154: =(F154/4)*100 -> 0.0 | H154: =(F154/49)*100 -> 0.0 | I154: 1 | J154: =(I154/2)*100 -> 50.0 | K154: =(I154/57)*100 -> 1.7543859649122806 | L154: 2 | M154: =(L154/5)*100 -> 40.0 | N154: =(L154/45)*100 -> 4.4444444444444446 | O154: =(C154+F154+L154+I154) -> 4 | P154: =(O154/12)*100 -> 33.333333333333329 | Q154: =(O154/185)*100 -> 2.1621621621621623
B155: None | C155: 0 | D155: =(C155/1)*100 -> 0.0 | E155: =(C155/34)*100 -> 0.0 | F155: 0 | G155: =(F155/4)*100 -> 0.0 | H155: =(F155/49)*100 -> 0.0 | I155: 0 | J155: =(I155/2)*100 -> 0.0 | K155: =(I155/57)*100 -> 0.0 | L155: 0 | M155: =(L155/5)*100 -> 0.0 | N155: =(L155/45)*100 -> 0.0 | O155: =(C155+F155+L155+I155) -> 0 | P155: =(O155/12)*100 -> 0.0 | Q155: =(O155/185)*100 -> 0.0
B156: Total | C156: =SUM(C152:C155) -> 1 | D156: =(C156/1)*100 -> 100.0 | E156: =(C156/34)*100 -> 2.9411764705882351 | F156: =SUM(F152:F155) -> 4 | G156: =(F156/4)*100 -> 100.0 | H156: =(F156/49)*100 -> 8.1632653061224492 | I156: =SUM(I152:I155) -> 2 | J156: =(I156/2)*100 -> 100.0 | K156: =(I156/57)*100 -> 3.5087719298245612 | L156: =SUM(L152:L155) -> 5 | M156: =(L156/5)*100 -> 100.0 | N156: =(L156/45)*100 -> 11.111111111111111 | O156: =(C156+F156+L156+I156) -> 12 | P156: =(O156/12)*100 -> 100.0 | Q156: =(O156/185)*100 -> 6.4864864864864868
A158: 13 | B158: Way of deliverance of the unit to individuals | C158: FRQ | D158: % T2 | E158: % T1 | F158: FRQ | G158: % T2 | H158: % T1 | I158: FRQ | J158: % T2 | K158: % T1 | L158: FRQ | M158: % T2 | N158: % T1 | O158: FRQ | P158: % T2 | Q158: % T1
B159: a. To other teachers
B160: In dept meetings | C160: 4 | D160: =(C160/33)*100 -> 12.121212121212121 | E160: =(C160/34)*100 -> 11.76470588235294 | F160: 5 | G160: =(F160/45)*100 -> 11.111111111111111 | H160: =(F160/49)*100 -> 10.204081632653061 | I160: 8 | J160: =(I160/51)*100 -> 15.686274509803921 | K160: =(I160/57)*100 -> 14.035087719298245 | L160: 7 | M160: =(L160/39)*100 -> 17.948717948717949 | N160: =(L160/45)*100 -> 15.555555555555555 | O160: =(C160+F160+L160+I160) -> 24 | P160: =(O160/168)*100 -> 14.285714285714285 | Q160: =(O160/185)*100 -> 12.972972972972974
B161: Individually | C161: 28 | D161: =(C161/33)*100 -> 84.848484848484844 | E161: =(C161/34)*100 -> 82.35294117647058 | F161: 36 | G161: =(F161/45)*100 -> 80.0 | H161: =(F161/49)*100 -> 73.469387755102048 | I161: 40 | J161: =(I161/51)*100 -> 78.431372549019613 | K161: =(I161/57)*100 -> 70.175438596491219 | L161: 28 | M161: =(L161/39)*100 -> 71.794871794871796 | N161: =(L161/45)*100 -> 62.222222222222221 | O161: =(C161+F161+L161+I161) -> 132 | P161: =(O161/168)*100 -> 78.571428571428569 | Q161: =(O161/185)*100 -> 71.351351351351354
B162: Thru in-service wkshops | C162: 1 | D162: =(C162/33)*100 -> 3.0303030303030303 | E162: =(C162/34)*100 -> 2.9411764705882351 | F162: 3 | G162: =(F162/45)*100 -> 6.666666666666667 | H162: =(F162/49)*100 -> 6.1224489795918364 | I162: 2 | J162: =(I162/51)*100 -> 3.9215686274509802 | K162: =(I162/57)*100 -> 3.5087719298245612 | L162: 2 | M162: =(L162/39)*100 -> 5.1282051282051277 | N162: =(L162/45)*100 -> 4.4444444444444446 | O162: =(C162+F162+L162+I162) -> 8 | P162: =(O162/168)*100 -> 4.7619047619047619 | Q162: =(O162/185)*100 -> 4.3243243243243246
B163: Thru after-school presents | C163: 0 | D163: =(C163/33)*100 -> 0.0 | E163: =(C163/34)*100 -> 0.0 | F163: 0 | G163: =(F163/45)*100 -> 0.0 | H163: =(F163/49)*100 -> 0.0 | I163: 0 | J163: =(I163/51)*100 -> 0.0 | K163: =(I163/57)*100 -> 0.0 | L163: 0 | M163: =(L163/39)*100 -> 0.0 | N163: =(L163/45)*100 -> 0.0 | O163: =(C163+F163+L163+I163) -> 0 | P163: =(O163/168)*100 -> 0.0 | Q163: =(O163/185)*100 -> 0.0
B164: N/A | C164: 0 | D164: =(C164/33)*100 -> 0.0 | E164: =(C164/34)*100 -> 0.0 | F164: 1 | G164: =(F164/45)*100 -> 2.2222222222222223 | H164: =(F164/49)*100 -> 2.0408163265306123 | I164: 1 | J164: =(I164/51)*100 -> 1.9607843137254901 | K164: =(I164/57)*100 -> 1.7543859649122806 | L164: 2 | M164: =(L164/39)*100 -> 5.1282051282051277 | N164: =(L164/45)*100 -> 4.4444444444444446 | O164: =(C164+F164+L164+I164) -> 4 | P164: =(O164/168)*100 -> 2.3809523809523809 | Q164: =(O164/185)*100 -> 2.1621621621621623
B165: Total | C165: =SUM(C160:C164) -> 33 | D165: =(C165/33)*100 -> 100.0 | E165: =(C165/34)*100 -> 97.058823529411768 | F165: =SUM(F160:F164) -> 45 | G165: =(F165/45)*100 -> 100.0 | H165: =(F165/49)*100 -> 91.83673469387756 | I165: =SUM(I160:I164) -> 51 | J165: =(I165/51)*100 -> 100.0 | K165: =(I165/57)*100 -> 89.473684210526315 | L165: =SUM(L160:L164) -> 39 | M165: =(L165/39)*100 -> 100.0 | N165: =(L165/45)*100 -> 86.666666666666671 | O165: =(C165+F165+L165+I165) -> 168 | P165: =(O165/168)*100 -> 100.0 | Q165: =(O165/185)*100 -> 90.810810810810821
B166: b. To department chairmen | N166: =(L166/45)*100 -> 0.0
B167: In dept meetings | C167: 4 | D167: =(C167/22)*100 -> 18.181818181818183 | E167: =(C167/34)*100 -> 11.76470588235294 | F167: 8 | G167: =(F167/37)*100 -> 21.621621621621621 | H167: =(F167/49)*100 -> 16.326530612244898 | I167: 2 | J167: =(I167/36)*100 -> 5.5555555555555554 | K167: =(I167/57)*100 -> 3.5087719298245612 | L167: 7 | M167: =(L167/33)*100 -> 21.212121212121211 | N167: =(L167/45)*100 -> 15.555555555555555 | O167: =(C167+F167+L167+I167) -> 21 | P167: =(O167/128)*100 -> 16.40625 | Q167: =(O167/185)*100 -> 11.351351351351353
B168: Individually | C168: 15 | D168: =(C168/22)*100 -> 68.181818181818173 | E168: =(C168/34)*100 -> 44.117647058823529 | F168: 17 | G168: =(F168/37)*100 -> 45.945945945945951 | H168: =(F168/49)*100 -> 34.693877551020407 | I168: 22 | J168: =(I168/36)*100 -> 61.111111111111114 | K168: =(I168/57)*100 -> 38.596491228070171 | L168: 11 | M168: =(L168/33)*100 -> 33.333333333333329 | N168: =(L168/45)*100 -> 24.444444444444443 | O168: =(C168+F168+L168+I168) -> 65 | P168: =(O168/128)*100 -> 50.78125 | Q168: =(O168/185)*100 -> 35.135135135135137
B169: Thru in-service wkshops | C169: 0 | D169: =(C169/22)*100 -> 0.0 | E169: =(C169/34)*100 -> 0.0 | F169: 1 | G169: =(F169/37)*100 -> 2.7027027027027026 | H169: =(F169/49)*100 -> 2.0408163265306123 | I169: 1 | J169: =(I169/36)*100 -> 2.7777777777777777 | K169: =(I169/57)*100 -> 1.7543859649122806 | L169: 0 | M169: =(L169/33)*100 -> 0.0 | N169: =(L169/45)*100 -> 0.0 | O169: =(C169+F169+L169+I169) -> 2 | P169: =(O169/128)*100 -> 1.5625 | Q169: =(O169/185)*100 -> 1.0810810810810811
B170: Thru after-school presents | C170: 0 | D170: =(C170/22)*100 -> 0.0 | E170: =(C170/34)*100 -> 0.0 | F170: 0 | G170: =(F170/37)*100 -> 0.0 | H170: =(F170/49)*100 -> 0.0 | I170: 0 | J170: =(I170/36)*100 -> 0.0 | K170: =(I170/57)*100 -> 0.0 | L170: 0 | M170: =(L170/33)*100 -> 0.0 | N170: =(L170/45)*100 -> 0.0 | O170: =(C170+F170+L170+I170) -> 0 | P170: =(O170/128)*100 -> 0.0 | Q170: =(O170/185)*100 -> 0.0
B171: N/A | C171: 3 | D171: =(C171/22)*100 -> 13.636363636363635 | E171: =(C171/34)*100 -> 8.8235294117647065 | F171: 11 | G171: =(F171/37)*100 -> 29.72972972972973 | H171: =(F171/49)*100 -> 22.448979591836736 | I171: 11 | J171: =(I171/36)*100 -> 30.555555555555557 | K171: =(I171/57)*100 -> 19.298245614035086 | L171: 15 | M171: =(L171/33)*100 -> 45.454545454545453 | N171: =(L171/45)*100 -> 33.333333333333329 | O171: =(C171+F171+L171+I171) -> 40 | P171: =(O171/128)*100 -> 31.25 | Q171: =(O171/185)*100 -> 21.621621621621621
B172: Total | C172: =SUM(C167:C171) -> 22 | D172: =(C172/22)*100 -> 100.0 | E172: =(C172/34)*100 -> 64.705882352941174 | F172: =SUM(F167:F171) -> 37 | G172: =(F172/37)*100 -> 100.0 | H172: =(F172/49)*100 -> 75.510204081632651 | I172: =SUM(I167:I171) -> 36 | J172: =(I172/36)*100 -> 100.0 | K172: =(I172/57)*100 -> 63.157894736842103 | L172: =SUM(L167:L171) -> 33 | M172: =(L172/33)*100 -> 100.0 | N172: =(L172/45)*100 -> 73.333333333333329 | O172: =(C172+F172+L172+I172) -> 128 | P172: =(O172/128)*100 -> 100.0 | Q172: =(O172/185)*100 -> 69.189189189189193
B173: c. To supervisors
B174: In dept meetings | C174: 2 | D174: =(C174/23)*100 -> 8.695652173913043 | E174: =(C174/34)*100 -> 5.8823529411764701 | F174: 2 | G174: =(F174/37)*100 -> 5.4054054054054053 | H174: =(F174/49)*100 -> 4.0816326530612246 | I174: 1 | J174: =(I174/32)*100 -> 3.125 | K174: =(I174/57)*100 -> 1.7543859649122806 | L174: 1 | M174: =(L174/31)*100 -> 3.225806451612903 | N174: =(L174/45)*100 -> 2.2222222222222223 | O174: =(C174+F174+L174+I174) -> 6 | P174: =(O174/123)*100 -> 4.8780487804878048 | Q174: =(O174/185)*100 -> 3.2432432432432434
B175: Individually | C175: 14 | D175: =(C175/23)*100 -> 60.869565217391312 | E175: =(C175/34)*100 -> 41.17647058823529 | F175: 23 | G175: =(F175/37)*100 -> 62.162162162162161 | H175: =(F175/49)*100 -> 46.938775510204081 | I175: 15 | J175: =(I175/32)*100 -> 46.875 | K175: =(I175/57)*100 -> 26.315789473684209 | L175: 13 | M175: =(L175/31)*100 -> 41.935483870967744 | N175: =(L175/45)*100 -> 28.888888888888886 | O175: =(C175+F175+L175+I175) -> 65 | P175: =(O175/123)*100 -> 52.845528455284551 | Q175: =(O175/185)*100 -> 35.135135135135137
B176: Thru in-service wkshops | C176: 0 | D176: =(C176/23)*100 -> 0.0 | E176: =(C176/34)*100 -> 0.0 | F176: 1 | G176: =(F176/37)*100 -> 2.7027027027027026 | H176: =(F176/49)*100 -> 2.0408163265306123 | I176: 0 | J176: =(I176/32)*100 -> 0.0 | K176: =(I176/57)*100 -> 0.0 | L176: 0 | M176: =(L176/31)*100 -> 0.0 | N176: =(L176/45)*100 -> 0.0 | O176: =(C176+F176+L176+I176) -> 1 | P176: =(O176/123)*100 -> 0.81300813008130091 | Q176: =(O176/185)*100 -> 0.54054054054054057
B177: Thru after-school presents | C177: 0 | D177: =(C177/23)*100 -> 0.0 | E177: =(C177/34)*100 -> 0.0 | F177: 1 | G177: =(F177/37)*100 -> 2.7027027027027026 | H177: =(F177/49)*100 -> 2.0408163265306123 | I177: 0 | J177: =(I177/32)*100 -> 0.0 | K177: =(I177/57)*100 -> 0.0 | L177: 0 | M177: =(L177/31)*100 -> 0.0 | N177: =(L177/45)*100 -> 0.0 | O177: =(C177+F177+L177+I177) -> 1 | P177: =(O177/123)*100 -> 0.81300813008130091 | Q177: =(O177/185)*100 -> 0.54054054054054057
B178: N/A | C178: 7 | D178: =(C178/23)*100 -> 30.434782608695656 | E178: =(C178/34)*100 -> 20.588235294117645 | F178: 10 | G178: =(F178/37)*100 -> 27.027027027027028 | H178: =(F178/49)*100 -> 20.408163265306122 | I178: 16 | J178: =(I178/32)*100 -> 50.0 | K178: =(I178/57)*100 -> 28.07017543859649 | L178: 17 | M178: =(L178/31)*100 -> 54.838709677419352 | N178: =(L178/45)*100 -> 37.777777777777779 | O178: =(C178+F178+L178+I178) -> 50 | P178: =(O178/123)*100 -> 40.650406504065039 | Q178: =(O178/185)*100 -> 27.027027027027028
B179: Total | C179: =SUM(C174:C178) -> 23 | D179: =(C179/23)*100 -> 100.0 | E179: =(C179/34)*100 -> 67.64705882352942 | F179: =SUM(F174:F178) -> 37 | G179: =(F179/37)*100 -> 100.0 | H179: =(F179/49)*100 -> 75.510204081632651 | I179: =SUM(I174:I178) -> 32 | J179: =(I179/32)*100 -> 100.0 | K179: =(I179/57)*100 -> 56.140350877192979 | L179: =SUM(L174:L178) -> 31 | M179: =(L179/31)*100 -> 100.0 | N179: =(L179/45)*100 -> 68.888888888888886 | O179: =(C179+F179+L179+I179) -> 123 | P179: =(O179/123)*100 -> 100.0 | Q179: =(O179/185)*100 -> 66.486486486486484
B180: d. To principals
B181: In dept meetings | C181: 2 | D181: =(C181/27)*100 -> 7.4074074074074066 | E181: =(C181/34)*100 -> 5.8823529411764701 | F181: 3 | G181: =(F181/37)*100 -> 8.1081081081081088 | H181: =(F181/49)*100 -> 6.1224489795918364 | I181: 2 | J181: =(I181/41)*100 -> 4.8780487804878048 | K181: =(I181/57)*100 -> 3.5087719298245612 | L181: 1 | M181: =(L181/32)*100 -> 3.125 | N181: =(L181/45)*100 -> 2.2222222222222223 | O181: =(C181+F181+L181+I181) -> 8 | P181: =(O181/137)*100 -> 5.8394160583941606 | Q181: =(O181/185)*100 -> 4.3243243243243246
B182: Individually | C182: 16 | D182: =(C182/27)*100 -> 59.259259259259252 | E182: =(C182/34)*100 -> 47.058823529411761 | F182: 25 | G182: =(F182/37)*100 -> 67.567567567567565 | H182: =(F182/49)*100 -> 51.020408163265309 | I182: 27 | J182: =(I182/41)*100 -> 65.853658536585371 | K182: =(I182/57)*100 -> 47.368421052631575 | L182: 18 | M182: =(L182/32)*100 -> 56.25 | N182: =(L182/45)*100 -> 40.0 | O182: =(C182+F182+L182+I182) -> 86 | P182: =(O182/137)*100 -> 62.773722627737229 | Q182: =(O182/185)*100 -> 46.486486486486491
B183: Thru in-service wkshops | C183: 0 | D183: =(C183/27)*100 -> 0.0 | E183: =(C183/34)*100 -> 0.0 | F183: 0 | G183: =(F183/37)*100 -> 0.0 | H183: =(F183/49)*100 -> 0.0 | I183: 0 | J183: =(I183/41)*100 -> 0.0 | K183: =(I183/57)*100 -> 0.0 | L183: 0 | M183: =(L183/32)*100 -> 0.0 | N183: =(L183/45)*100 -> 0.0 | O183: =(C183+F183+L183+I183) -> 0 | P183: =(O183/137)*100 -> 0.0 | Q183: =(O183/185)*100 -> 0.0
B184: Thru after-school presents | C184: 0 | D184: =(C184/27)*100 -> 0.0 | E184: =(C184/34)*100 -> 0.0 | F184: 1 | G184: =(F184/37)*100 -> 2.7027027027027026 | H184: =(F184/49)*100 -> 2.0408163265306123 | I184: 0 | J184: =(I184/41)*100 -> 0.0 | K184: =(I184/57)*100 -> 0.0 | L184: 0 | M184: =(L184/32)*100 -> 0.0 | N184: =(L184/45)*100 -> 0.0 | O184: =(C184+F184+L184+I184) -> 1 | P184: =(O184/137)*100 -> 0.72992700729927007 | Q184: =(O184/185)*100 -> 0.54054054054054057
B185: N/A | C185: 9 | D185: =(C185/27)*100 -> 33.333333333333329 | E185: =(C185/34)*100 -> 26.47058823529412 | F185: 8 | G185: =(F185/37)*100 -> 21.621621621621621 | H185: =(F185/49)*100 -> 16.326530612244898 | I185: 12 | J185: =(I185/41)*100 -> 29.268292682926827 | K185: =(I185/57)*100 -> 21.052631578947366 | L185: 13 | M185: =(L185/32)*100 -> 40.625 | N185: =(L185/45)*100 -> 28.888888888888886 | O185: =(C185+F185+L185+I185) -> 42 | P185: =(O185/137)*100 -> 30.656934306569344 | Q185: =(O185/185)*100 -> 22.702702702702705
B186: Total | C186: =SUM(C181:C185) -> 27 | D186: =(C186/27)*100 -> 100.0 | E186: =(C186/34)*100 -> 79.411764705882348 | F186: =SUM(F181:F185) -> 37 | G186: =(F186/37)*100 -> 100.0 | H186: =(F186/49)*100 -> 75.510204081632651 | I186: =SUM(I181:I185) -> 41 | J186: =(I186/41)*100 -> 100.0 | K186: =(I186/57)*100 -> 71.929824561403507 | L186: =SUM(L181:L185) -> 32 | M186: =(L186/32)*100 -> 100.0 | N186: =(L186/45)*100 -> 71.111111111111114 | O186: =(C186+F186+L186+I186) -> 137 | P186: =(O186/137)*100 -> 100.0 | Q186: =(O186/185)*100 -> 74.054054054054049
B187: e. To other
B188: In dept meetings | C188: 0 | D188: =(C188/3)*100 -> 0.0 | E188: =(C188/34)*100 -> 0.0 | F188: 0 | G188: =(F188/3)*100 -> 0.0 | H188: =(F188/49)*100 -> 0.0 | I188: 2 | J188: =(I188/3)*100 -> 66.666666666666657 | K188: =(I188/57)*100 -> 3.5087719298245612 | L188: 1 | M188: =(L188/6)*100 -> 16.666666666666664 | N188: =(L188/45)*100 -> 2.2222222222222223 | O188: =(C188+F188+L188+I188) -> 3 | P188: =(O188/15)*100 -> 20.0 | Q188: =(O188/185)*100 -> 1.6216216216216217
B189: Individually | C189: 3 | D189: =(C189/3)*100 -> 100.0 | E189: =(C189/34)*100 -> 8.8235294117647065 | F189: 3 | G189: =(F189/3)*100 -> 100.0 | H189: =(F189/49)*100 -> 6.1224489795918364 | I189: 1 | J189: =(I189/3)*100 -> 33.333333333333329 | K189: =(I189/57)*100 -> 1.7543859649122806 | L189: 4 | M189: =(L189/6)*100 -> 66.666666666666657 | N189: =(L189/45)*100 -> 8.8888888888888893 | O189: =(C189+F189+L189+I189) -> 11 | P189: =(O189/15)*100 -> 73.333333333333329 | Q189: =(O189/185)*100 -> 5.9459459459459465
B190: Thru in-service wkshops | C190: 0 | D190: =(C190/3)*100 -> 0.0 | E190: =(C190/34)*100 -> 0.0 | F190: 0 | G190: =(F190/3)*100 -> 0.0 | H190: =(F190/49)*100 -> 0.0 | I190: 0 | J190: =(I190/3)*100 -> 0.0 | K190: =(I190/57)*100 -> 0.0 | L190: 1 | M190: =(L190/6)*100 -> 16.666666666666664 | N190: =(L190/45)*100 -> 2.2222222222222223 | O190: =(C190+F190+L190+I190) -> 1 | P190: =(O190/15)*100 -> 6.666666666666667 | Q190: =(O190/185)*100 -> 0.54054054054054057
B191: Thru after-school presents | C191: 0 | D191: =(C191/3)*100 -> 0.0 | E191: =(C191/34)*100 -> 0.0 | F191: 0 | G191: =(F191/3)*100 -> 0.0 | H191: =(F191/49)*100 -> 0.0 | I191: 0 | J191: =(I191/3)*100 -> 0.0 | K191: =(I191/57)*100 -> 0.0 | L191: 0 | M191: =(L191/6)*100 -> 0.0 | N191: =(L191/45)*100 -> 0.0 | O191: =(C191+F191+L191+I191) -> 0 | P191: =(O191/15)*100 -> 0.0 | Q191: =(O191/185)*100 -> 0.0
B192: N/A | C192: 0 | D192: =(C192/3)*100 -> 0.0 | E192: =(C192/34)*100 -> 0.0 | F192: 0 | G192: =(F192/3)*100 -> 0.0 | H192: =(F192/49)*100 -> 0.0 | I192: 0 | J192: =(I192/3)*100 -> 0.0 | K192: =(I192/57)*100 -> 0.0 | L192: 0 | M192: =(L192/6)*100 -> 0.0 | N192: =(L192/45)*100 -> 0.0 | O192: =(C192+F192+L192+I192) -> 0 | P192: =(O192/15)*100 -> 0.0 | Q192: =(O192/185)*100 -> 0.0
B193: Total | C193: =SUM(C188:C192) -> 3 | D193: =(C193/3)*100 -> 100.0 | E193: =(C193/34)*100 -> 8.8235294117647065 | F193: 3 | G193: =(F193/3)*100 -> 100.0 | H193: =(F193/49)*100 -> 6.1224489795918364 | I193: =SUM(I188:I192) -> 3 | J193: =(I193/3)*100 -> 100.0 | K193: =(I193/57)*100 -> 5.2631578947368416 | L193: =SUM(L188:L192) -> 6 | M193: =(L193/6)*100 -> 100.0 | N193: =(L193/45)*100 -> 13.333333333333334 | O193: =(C193+F193+L193+I193) -> 15 | P193: =(O193/15)*100 -> 100.0 | Q193: =(O193/185)*100 -> 8.1081081081081088
A195: 14 | B195: Rateness of most recent unit of the following respects | C195: FRQ | D195: % T2 | E195: % T1 | F195: FRQ | G195: % T2 | H195: % T1 | I195: FRQ | J195: % T2 | K195: % T1 | L195: FRQ | M195: % T2 | N195: % T1 | O195: FRQ | P195: % T2 | Q195: % T1
B196: a. Interest
B197: High | C197: 21 | D197: =(C197/33)*100 -> 63.636363636363633 | E197: =(C197/34)*100 -> 61.764705882352942 | F197: 28 | G197: =(F197/48)*100 -> 58.333333333333336 | H197: =(F197/49)*100 -> 57.142857142857139 | I197: 31 | J197: =(I197/52)*100 -> 59.615384615384613 | K197: =(I197/57)*100 -> 54.385964912280706 | L197: 25 | M197: =(L197/43)*100 -> 58.139534883720934 | N197: =(L197/45)*100 -> 55.555555555555557 | O197: =(C197+F197+L197+I197) -> 105 | P197: =(O197/176)*100 -> 59.659090909090907 | Q197: =(O197/185)*100 -> 56.756756756756758
B198: Moderate | C198: 10 | D198: =(C198/33)*100 -> 30.303030303030305 | E198: =(C198/34)*100 -> 29.411764705882355 | F198: 18 | G198: =(F198/48)*100 -> 37.5 | H198: =(F198/49)*100 -> 36.734693877551024 | I198: 19 | J198: =(I198/52)*100 -> 36.538461538461533 | K198: =(I198/57)*100 -> 33.333333333333329 | L198: 17 | M198: =(L198/43)*100 -> 39.534883720930232 | N198: =(L198/45)*100 -> 37.777777777777779 | O198: =(C198+F198+L198+I198) -> 64 | P198: =(O198/176)*100 -> 36.363636363636367 | Q198: =(O198/185)*100 -> 34.594594594594597
B199: Minimal | C199: 2 | D199: =(C199/33)*100 -> 6.0606060606060606 | E199: =(C199/34)*100 -> 5.8823529411764701 | F199: 2 | G199: =(F199/48)*100 -> 4.1666666666666661 | H199: =(F199/49)*100 -> 4.0816326530612246 | I199: 2 | J199: =(I199/52)*100 -> 3.8461538461538463 | K199: =(I199/57)*100 -> 3.5087719298245612 | L199: 1 | M199: =(L199/43)*100 -> 2.3255813953488373 | N199: =(L199/45)*100 -> 2.2222222222222223 | O199: =(C199+F199+L199+I199) -> 7 | P199: =(O199/176)*100 -> 3.9772727272727271 | Q199: =(O199/185)*100 -> 3.7837837837837842
B200: Total | C200: =SUM(C197:C199) -> 33 | D200: =(C200/33)*100 -> 100.0 | E200: =(C200/34)*100 -> 97.058823529411768 | F200: =SUM(F197:F199) -> 48 | G200: =(F200/48)*100 -> 100.0 | H200: =(F200/49)*100 -> 97.959183673469383 | I200: =SUM(I197:I199) -> 52 | J200: =(I200/52)*100 -> 100.0 | K200: =(I200/57)*100 -> 91.228070175438589 | L200: =SUM(L197:L199) -> 43 | M200: =(L200/43)*100 -> 100.0 | N200: =(L200/45)*100 -> 95.555555555555557 | O200: =(C200+F200+L200+I200) -> 176 | P200: =(O200/176)*100 -> 100.0 | Q200: =(O200/185)*100 -> 95.135135135135144
B201: b. Challenge
B202: High | C202: 18 | D202: =(C202/33)*100 -> 54.54545454545454 | E202: =(C202/34)*100 -> 52.941176470588239 | F202: 27 | G202: =(F202/45)*100 -> 60.0 | H202: =(F202/49)*100 -> 55.102040816326522 | I202: 27 | J202: =(I202/52)*100 -> 51.923076923076927 | K202: =(I202/57)*100 -> 47.368421052631575 | L202: 24 | M202: =(L202/42)*100 -> 57.142857142857139 | N202: =(L202/45)*100 -> 53.333333333333336 | O202: =(C202+F202+L202+I202) -> 96 | P202: =(O202/172)*100 -> 55.813953488372093 | Q202: =(O202/185)*100 -> 51.891891891891895
B203: Moderate | C203: 14 | D203: =(C203/33)*100 -> 42.424242424242422 | E203: =(C203/34)*100 -> 41.17647058823529 | F203: 18 | G203: =(F203/45)*100 -> 40.0 | H203: =(F203/49)*100 -> 36.734693877551024 | I203: 25 | J203: =(I203/52)*100 -> 48.07692307692308 | K203: =(I203/57)*100 -> 43.859649122807014 | L203: 16 | M203: =(L203/42)*100 -> 38.095238095238095 | N203: =(L203/45)*100 -> 35.555555555555557 | O203: =(C203+F203+L203+I203) -> 73 | P203: =(O203/172)*100 -> 42.441860465116278 | Q203: =(O203/185)*100 -> 39.45945945945946
B204: Minimal | C204: 1 | D204: =(C204/33)*100 -> 3.0303030303030303 | E204: =(C204/34)*100 -> 2.9411764705882351 | F204: 0 | G204: =(F204/45)*100 -> 0.0 | H204: =(F204/49)*100 -> 0.0 | I204: 0 | J204: =(I204/52)*100 -> 0.0 | K204: =(I204/57)*100 -> 0.0 | L204: 2 | M204: =(L204/42)*100 -> 4.7619047619047619 | N204: =(L204/45)*100 -> 4.4444444444444446 | O204: =(C204+F204+L204+I204) -> 3 | P204: =(O204/172)*100 -> 1.7441860465116279 | Q204: =(O204/185)*100 -> 1.6216216216216217
B205: Total | C205: =SUM(C202:C204) -> 33 | D205: =(C205/33)*100 -> 100.0 | E205: =(C205/34)*100 -> 97.058823529411768 | F205: =SUM(F202:F204) -> 45 | G205: =(F205/45)*100 -> 100.0 | H205: =(F205/49)*100 -> 91.83673469387756 | I205: =SUM(I202:I204) -> 52 | J205: =(I205/52)*100 -> 100.0 | K205: =(I205/57)*100 -> 91.228070175438589 | L205: =SUM(L202:L204) -> 42 | M205: =(L205/42)*100 -> 100.0 | N205: =(L205/45)*100 -> 93.333333333333329 | O205: =(C205+F205+L205+I205) -> 172 | P205: =(O205/172)*100 -> 100.0 | Q205: =(O205/185)*100 -> 92.972972972972983
A207: 15 | B207: Use of the unit for the following purposes | C207: FRQ | D207: % T2 | E207: % T1 | F207: FRQ | G207: % T2 | H207: % T1 | I207: FRQ | J207: % T2 | K207: % T1 | L207: FRQ | M207: % T2 | N207: % T1 | O207: FRQ | P207: % T2 | Q207: % T1
B208: a. Conveying general knowledge
B209: To a great extent | C209: 17 | D209: =(C209/31)*100 -> 54.838709677419352 | E209: =(C209/34)*100 -> 50.0 | F209: 22 | G209: =(F209/46)*100 -> 47.826086956521742 | H209: =(F209/49)*100 -> 44.897959183673471 | I209: 22 | J209: =(I209/50)*100 -> 44.0 | K209: =(I209/57)*100 -> 38.596491228070171 | L209: 16 | M209: =(L209/44)*100 -> 36.363636363636367 | N209: =(L209/45)*100 -> 35.555555555555557 | O209: =(C209+F209+L209+I209) -> 77 | P209: =(O209/171)*100 -> 45.029239766081872 | Q209: =(O209/185)*100 -> 41.621621621621621
B210: To a moderate extent | C210: 8 | D210: =(C210/31)*100 -> 25.806451612903224 | E210: =(C210/34)*100 -> 23.52941176470588 | F210: 15 | G210: =(F210/46)*100 -> 32.608695652173914 | H210: =(F210/49)*100 -> 30.612244897959183 | I210: 16 | J210: =(I210/50)*100 -> 32.0 | K210: =(I210/57)*100 -> 28.07017543859649 | L210: 22 | M210: =(L210/44)*100 -> 50.0 | N210: =(L210/45)*100 -> 48.888888888888886 | O210: =(C210+F210+L210+I210) -> 61 | P210: =(O210/171)*100 -> 35.672514619883039 | Q210: =(O210/185)*100 -> 32.972972972972975
B211: To a small extent | C211: 4 | D211: =(C211/31)*100 -> 12.903225806451612 | E211: =(C211/34)*100 -> 11.76470588235294 | F211: 5 | G211: =(F211/46)*100 -> 10.869565217391305 | H211: =(F211/49)*100 -> 10.204081632653061 | I211: 9 | J211: =(I211/50)*100 -> 18.0 | K211: =(I211/57)*100 -> 15.789473684210526 | L211: 6 | M211: =(L211/44)*100 -> 13.636363636363635 | N211: =(L211/45)*100 -> 13.333333333333334 | O211: =(C211+F211+L211+I211) -> 24 | P211: =(O211/171)*100 -> 14.035087719298245 | Q211: =(O211/185)*100 -> 12.972972972972974
B212: Not at all | C212: 2 | D212: =(C212/31)*100 -> 6.4516129032258061 | E212: =(C212/34)*100 -> 5.8823529411764701 | F212: 4 | G212: =(F212/46)*100 -> 8.695652173913043 | H212: =(F212/49)*100 -> 8.1632653061224492 | I212: 3 | J212: =(I212/50)*100 -> 6.0 | K212: =(I212/57)*100 -> 5.2631578947368416 | L212: 0 | M212: =(L212/44)*100 -> 0.0 | N212: =(L212/45)*100 -> 0.0 | O212: =(C212+F212+L212+I212) -> 9 | P212: =(O212/171)*100 -> 5.2631578947368416 | Q212: =(O212/185)*100 -> 4.8648648648648649
B213: Total | C213: =SUM(C209:C212) -> 31 | D213: =(C213/31)*100 -> 100.0 | E213: =(C213/34)*100 -> 91.17647058823529 | F213: =SUM(F209:F212) -> 46 | G213: =(F213/46)*100 -> 100.0 | H213: =(F213/49)*100 -> 93.877551020408163 | I213: =SUM(I209:I212) -> 50 | J213: =(I213/50)*100 -> 100.0 | K213: =(I213/57)*100 -> 87.719298245614027 | L213: =SUM(L209:L212) -> 44 | M213: =(L213/44)*100 -> 100.0 | N213: =(L213/45)*100 -> 97.777777777777771 | O213: =(C213+F213+L213+I213) -> 171 | P213: =(O213/171)*100 -> 100.0 | Q213: =(O213/185)*100 -> 92.432432432432435
B214: b. Developing learning skills
B215: To a great extent | C215: 13 | D215: =(C215/31)*100 -> 41.935483870967744 | E215: =(C215/34)*100 -> 38.235294117647058 | F215: 28 | G215: =(F215/47)*100 -> 59.574468085106382 | H215: =(F215/49)*100 -> 57.142857142857139 | I215: 15 | J215: =(I215/49)*100 -> 30.612244897959183 | K215: =(I215/57)*100 -> 26.315789473684209 | L215: 17 | M215: =(L215/44)*100 -> 38.636363636363633 | N215: =(L215/45)*100 -> 37.777777777777779 | O215: =(C215+F215+L215+I215) -> 73 | P215: =(O215/171)*100 -> 42.690058479532162 | Q215: =(O215/185)*100 -> 39.45945945945946
B216: To a moderate extent | C216: 11 | D216: =(C216/31)*100 -> 35.483870967741936 | E216: =(C216/34)*100 -> 32.352941176470587 | F216: 14 | G216: =(F216/47)*100 -> 29.787234042553191 | H216: =(F216/49)*100 -> 28.571428571428569 | I216: 20 | J216: =(I216/49)*100 -> 40.816326530612244 | K216: =(I216/57)*100 -> 35.087719298245609 | L216: 21 | M216: =(L216/44)*100 -> 47.727272727272727 | N216: =(L216/45)*100 -> 46.666666666666664 | O216: =(C216+F216+L216+I216) -> 66 | P216: =(O216/171)*100 -> 38.596491228070171 | Q216: =(O216/185)*100 -> 35.675675675675677
B217: To a small extent | C217: 5 | D217: =(C217/31)*100 -> 16.129032258064516 | E217: =(C217/34)*100 -> 14.705882352941178 | F217: 2 | G217: =(F217/47)*100 -> 4.2553191489361701 | H217: =(F217/49)*100 -> 4.0816326530612246 | I217: 8 | J217: =(I217/49)*100 -> 16.326530612244898 | K217: =(I217/57)*100 -> 14.035087719298245 | L217: 5 | M217: =(L217/44)*100 -> 11.363636363636363 | N217: =(L217/45)*100 -> 11.111111111111111 | O217: =(C217+F217+L217+I217) -> 20 | P217: =(O217/171)*100 -> 11.695906432748536 | Q217: =(O217/185)*100 -> 10.810810810810811
B218: Not at all | C218: 2 | D218: =(C218/31)*100 -> 6.4516129032258061 | E218: =(C218/34)*100 -> 5.8823529411764701 | F218: 3 | G218: =(F218/47)*100 -> 6.3829787234042552 | H218: =(F218/49)*100 -> 6.1224489795918364 | I218: 6 | J218: =(I218/49)*100 -> 12.244897959183673 | K218: =(I218/57)*100 -> 10.526315789473683 | L218: 1 | M218: =(L218/44)*100 -> 2.2727272727272729 | N218: =(L218/45)*100 -> 2.2222222222222223 | O218: =(C218+F218+L218+I218) -> 12 | P218: =(O218/171)*100 -> 7.0175438596491224 | Q218: =(O218/185)*100 -> 6.4864864864864868
B219: Total | C219: 31 | D219: =(C219/31)*100 -> 100.0 | E219: =(C219/34)*100 -> 91.17647058823529 | F219: 47 | G219: =(F219/47)*100 -> 100.0 | H219: =(F219/49)*100 -> 95.918367346938766 | I219: 49 | J219: =(I219/49)*100 -> 100.0 | K219: =(I219/57)*100 -> 85.964912280701753 | L219: 44 | M219: =(L219/44)*100 -> 100.0 | N219: =(L219/45)*100 -> 97.777777777777771 | O219: =(C219+F219+L219+I219) -> 171 | P219: =(O219/171)*100 -> 100.0 | Q219: =(O219/185)*100 -> 92.432432432432435
B220: c. Conveying an understanding of ideas and values | N220: =(L220/45)*100 -> 0.0
B221: To a great extent | C221: 21 | D221: =(C221/31)*100 -> 67.741935483870961 | E221: =(C221/34)*100 -> 61.764705882352942 | F221: 30 | G221: =(F221/46)*100 -> 65.217391304347828 | H221: =(F221/49)*100 -> 61.224489795918366 | I221: 21 | J221: =(I221/49)*100 -> 42.857142857142854 | K221: =(I221/57)*100 -> 36.84210526315789 | L221: 24 | M221: =(L221/45)*100 -> 53.333333333333336 | N221: =(L221/45)*100 -> 53.333333333333336 | O221: =(C221+F221+L221+I221) -> 96 | P221: =(O221/171)*100 -> 56.140350877192979 | Q221: =(O221/185)*100 -> 51.891891891891895
B222: To a moderate extent | C222: 6 | D222: =(C222/31)*100 -> 19.35483870967742 | E222: =(C222/34)*100 -> 17.647058823529413 | F222: 10 | G222: =(F222/46)*100 -> 21.739130434782609 | H222: =(F222/49)*100 -> 20.408163265306122 | I222: 20 | J222: =(I222/49)*100 -> 40.816326530612244 | K222: =(I222/57)*100 -> 35.087719298245609 | L222: 20 | M222: =(L222/45)*100 -> 44.444444444444443 | N222: =(L222/45)*100 -> 44.444444444444443 | O222: =(C222+F222+L222+I222) -> 56 | P222: =(O222/171)*100 -> 32.748538011695906 | Q222: =(O222/185)*100 -> 30.270270270270274
B223: To a small extent | C223: 1 | D223: =(C223/31)*100 -> 3.225806451612903 | E223: =(C223/34)*100 -> 2.9411764705882351 | F223: 3 | G223: =(F223/46)*100 -> 6.5217391304347823 | H223: =(F223/49)*100 -> 6.1224489795918364 | I223: 5 | J223: =(I223/49)*100 -> 10.204081632653061 | K223: =(I223/57)*100 -> 8.7719298245614024 | L223: 1 | M223: =(L223/45)*100 -> 2.2222222222222223 | N223: =(L223/45)*100 -> 2.2222222222222223 | O223: =(C223+F223+L223+I223) -> 10 | P223: =(O223/171)*100 -> 5.8479532163742682 | Q223: =(O223/185)*100 -> 5.4054054054054053
B224: Not at all | C224: 3 | D224: =(C224/31)*100 -> 9.67741935483871 | E224: =(C224/34)*100 -> 8.8235294117647065 | F224: 3 | G224: =(F224/46)*100 -> 6.5217391304347823 | H224: =(F224/49)*100 -> 6.1224489795918364 | I224: 3 | J224: =(I224/49)*100 -> 6.1224489795918364 | K224: =(I224/57)*100 -> 5.2631578947368416 | L224: 0 | M224: =(L224/45)*100 -> 0.0 | N224: =(L224/45)*100 -> 0.0 | O224: =(C224+F224+L224+I224) -> 9 | P224: =(O224/171)*100 -> 5.2631578947368416 | Q224: =(O224/185)*100 -> 4.8648648648648649
B225: Total | C225: =SUM(C221:C224) -> 31 | D225: =(C225/31)*100 -> 100.0 | E225: =(C225/34)*100 -> 91.17647058823529 | F225: =SUM(F221:F224) -> 46 | G225: =(F225/46)*100 -> 100.0 | H225: =(F225/49)*100 -> 93.877551020408163 | I225: =SUM(I221:I224) -> 49 | J225: =(I225/49)*100 -> 100.0 | K225: =(I225/57)*100 -> 85.964912280701753 | L225: =SUM(L221:L224) -> 45 | M225: =(L225/45)*100 -> 100.0 | N225: =(L225/45)*100 -> 100.0 | O225: =(C225+F225+L225+I225) -> 171 | P225: =(O225/171)*100 -> 100.0 | Q225: =(O225/185)*100 -> 92.432432432432435
A227: 16 | B227: Extent of the unit proposing the following approaches | C227: FRQ | D227: % T2 | E227: % T1 | F227: FRQ | G227: % T2 | H227: % T1 | I227: FRQ | J227: % T2 | K227: % T1 | L227: FRQ | M227: % T2 | N227: % T1 | O227: FRQ | P227: % T2 | Q227: % T1
B228: a. Lecturing
B229: To a great extent | C229: 0 | D229: =(C229/33)*100 -> 0.0 | E229: =(C229/34)*100 -> 0.0 | F229: 3 | G229: =(F229/44)*100 -> 6.8181818181818175 | H229: =(F229/49)*100 -> 6.1224489795918364 | I229: 2 | J229: =(I229/49)*100 -> 4.0816326530612246 | K229: =(I229/57)*100 -> 3.5087719298245612 | L229: 1 | M229: =(L229/45)*100 -> 2.2222222222222223 | N229: =(L229/45)*100 -> 2.2222222222222223 | O229: =(C229+F229+L229+I229) -> 6 | P229: =(O229/171)*100 -> 3.5087719298245612 | Q229: =(O229/185)*100 -> 3.2432432432432434
B230: To a moderate extent | C230: 15 | D230: =(C230/33)*100 -> 45.454545454545453 | E230: =(C230/34)*100 -> 44.117647058823529 | F230: 14 | G230: =(F230/44)*100 -> 31.818181818181817 | H230: =(F230/49)*100 -> 28.571428571428569 | I230: 13 | J230: =(I230/49)*100 -> 26.530612244897959 | K230: =(I230/57)*100 -> 22.807017543859647 | L230: 12 | M230: =(L230/45)*100 -> 26.666666666666668 | N230: =(L230/45)*100 -> 26.666666666666668 | O230: =(C230+F230+L230+I230) -> 54 | P230: =(O230/171)*100 -> 31.578947368421051 | Q230: =(O230/185)*100 -> 29.189189189189189
B231: To a small extent | C231: 16 | D231: =(C231/33)*100 -> 48.484848484848484 | E231: =(C231/34)*100 -> 47.058823529411761 | F231: 25 | G231: =(F231/44)*100 -> 56.81818181818182 | H231: =(F231/49)*100 -> 51.020408163265309 | I231: 26 | J231: =(I231/49)*100 -> 53.061224489795919 | K231: =(I231/57)*100 -> 45.614035087719294 | L231: 27 | M231: =(L231/45)*100 -> 60.0 | N231: =(L231/45)*100 -> 60.0 | O231: =(C231+F231+L231+I231) -> 94 | P231: =(O231/171)*100 -> 54.970760233918128 | Q231: =(O231/185)*100 -> 50.810810810810814
B232: Not at all | C232: 2 | D232: =(C232/33)*100 -> 6.0606060606060606 | E232: =(C232/34)*100 -> 5.8823529411764701 | F232: 2 | G232: =(F232/44)*100 -> 4.5454545454545459 | H232: =(F232/49)*100 -> 4.0816326530612246 | I232: 8 | J232: =(I232/49)*100 -> 16.326530612244898 | K232: =(I232/57)*100 -> 14.035087719298245 | L232: 5 | M232: =(L232/45)*100 -> 11.111111111111111 | N232: =(L232/45)*100 -> 11.111111111111111 | O232: =(C232+F232+L232+I232) -> 17 | P232: =(O232/171)*100 -> 9.9415204678362574 | Q232: =(O232/185)*100 -> 9.1891891891891895
B233: Total | C233: =SUM(C229:C232) -> 33 | D233: =(C233/33)*100 -> 100.0 | E233: =(C233/34)*100 -> 97.058823529411768 | F233: =SUM(F229:F232) -> 44 | G233: =(F233/44)*100 -> 100.0 | H233: =(F233/49)*100 -> 89.795918367346943 | I233: =SUM(I229:I232) -> 49 | J233: =(I233/49)*100 -> 100.0 | K233: =(I233/57)*100 -> 85.964912280701753 | L233: =SUM(L229:L232) -> 45 | M233: =(L233/45)*100 -> 100.0 | N233: =(L233/45)*100 -> 100.0 | O233: =(C233+F233+L233+I233) -> 171 | P233: =(O233/171)*100 -> 100.0 | Q233: =(O233/185)*100 -> 92.432432432432435
B234: b. Leading discussion
B235: To a great extent | C235: 11 | D235: =(C235/34)*100 -> 32.352941176470587 | E235: =(C235/34)*100 -> 32.352941176470587 | F235: 21 | G235: =(F235/45)*100 -> 46.666666666666664 | H235: =(F235/49)*100 -> 42.857142857142854 | I235: 13 | J235: =(I235/50)*100 -> 26.0 | K235: =(I235/57)*100 -> 22.807017543859647 | L235: 11 | M235: =(L235/45)*100 -> 24.444444444444443 | N235: =(L235/45)*100 -> 24.444444444444443 | O235: =(C235+F235+L235+I235) -> 56 | P235: =(O235/174)*100 -> 32.183908045977013 | Q235: =(O235/185)*100 -> 30.270270270270274
B236: To a moderate extent | C236: 16 | D236: =(C236/34)*100 -> 47.058823529411761 | E236: =(C236/34)*100 -> 47.058823529411761 | F236: 20 | G236: =(F236/45)*100 -> 44.444444444444443 | H236: =(F236/49)*100 -> 40.816326530612244 | I236: 26 | J236: =(I236/50)*100 -> 52.0 | K236: =(I236/57)*100 -> 45.614035087719294 | L236: 28 | M236: =(L236/45)*100 -> 62.222222222222221 | N236: =(L236/45)*100 -> 62.222222222222221 | O236: =(C236+F236+L236+I236) -> 90 | P236: =(O236/174)*100 -> 51.724137931034484 | Q236: =(O236/185)*100 -> 48.648648648648653
B237: To a small extent | C237: 5 | D237: =(C237/34)*100 -> 14.705882352941178 | E237: =(C237/34)*100 -> 14.705882352941178 | F237: 3 | G237: =(F237/45)*100 -> 6.666666666666667 | H237: =(F237/49)*100 -> 6.1224489795918364 | I237: 8 | J237: =(I237/50)*100 -> 16.0 | K237: =(I237/57)*100 -> 14.035087719298245 | L237: 6 | M237: =(L237/45)*100 -> 13.333333333333334 | N237: =(L237/45)*100 -> 13.333333333333334 | O237: =(C237+F237+L237+I237) -> 22 | P237: =(O237/174)*100 -> 12.643678160919542 | Q237: =(O237/185)*100 -> 11.891891891891893
B238: Not at all | C238: 2 | D238: =(C238/34)*100 -> 5.8823529411764701 | E238: =(C238/34)*100 -> 5.8823529411764701 | F238: 1 | G238: =(F238/45)*100 -> 2.2222222222222223 | H238: =(F238/49)*100 -> 2.0408163265306123 | I238: 3 | J238: =(I238/50)*100 -> 6.0 | K238: =(I238/57)*100 -> 5.2631578947368416 | L238: 0 | M238: =(L238/45)*100 -> 0.0 | N238: =(L238/45)*100 -> 0.0 | O238: =(C238+F238+L238+I238) -> 6 | P238: =(O238/174)*100 -> 3.4482758620689653 | Q238: =(O238/185)*100 -> 3.2432432432432434
B239: Total | C239: =SUM(C235:C238) -> 34 | D239: =(C239/34)*100 -> 100.0 | E239: =(C239/34)*100 -> 100.0 | F239: =SUM(F235:F238) -> 45 | G239: =(F239/45)*100 -> 100.0 | H239: =(F239/49)*100 -> 91.83673469387756 | I239: =SUM(I235:I238) -> 50 | J239: =(I239/50)*100 -> 100.0 | K239: =(I239/57)*100 -> 87.719298245614027 | L239: =SUM(L235:L238) -> 45 | M239: =(L239/45)*100 -> 100.0 | N239: =(L239/45)*100 -> 100.0 | O239: =(C239+F239+L239+I239) -> 174 | P239: =(O239/174)*100 -> 100.0 | Q239: =(O239/185)*100 -> 94.054054054054063
B240: c. Group demonstration
B241: To a great extent | C241: 7 | D241: =(C241/33)*100 -> 21.212121212121211 | E241: =(C241/34)*100 -> 20.588235294117645 | F241: 23 | G241: =(F241/46)*100 -> 50.0 | H241: =(F241/49)*100 -> 46.938775510204081 | I241: 16 | J241: =(I241/48)*100 -> 33.333333333333329 | K241: =(I241/57)*100 -> 28.07017543859649 | L241: 17 | M241: =(L241/45)*100 -> 37.777777777777779 | N241: =(L241/45)*100 -> 37.777777777777779 | O241: =(C241+F241+L241+I241) -> 63 | P241: =(O241/172)*100 -> 36.627906976744185 | Q241: =(O241/185)*100 -> 34.054054054054056
B242: To a moderate extent | C242: 16 | D242: =(C242/33)*100 -> 48.484848484848484 | E242: =(C242/34)*100 -> 47.058823529411761 | F242: 14 | G242: =(F242/46)*100 -> 30.434782608695656 | H242: =(F242/49)*100 -> 28.571428571428569 | I242: 21 | J242: =(I242/48)*100 -> 43.75 | K242: =(I242/57)*100 -> 36.84210526315789 | L242: 14 | M242: =(L242/45)*100 -> 31.111111111111111 | N242: =(L242/45)*100 -> 31.111111111111111 | O242: =(C242+F242+L242+I242) -> 65 | P242: =(O242/172)*100 -> 37.790697674418603 | Q242: =(O242/185)*100 -> 35.135135135135137
B243: To a small extent | C243: 6 | D243: =(C243/33)*100 -> 18.181818181818183 | E243: =(C243/34)*100 -> 17.647058823529413 | F243: 7 | G243: =(F243/46)*100 -> 15.217391304347828 | H243: =(F243/49)*100 -> 14.285714285714285 | I243: 8 | J243: =(I243/48)*100 -> 16.666666666666664 | K243: =(I243/57)*100 -> 14.035087719298245 | L243: 9 | M243: =(L243/45)*100 -> 20.0 | N243: =(L243/45)*100 -> 20.0 | O243: =(C243+F243+L243+I243) -> 30 | P243: =(O243/172)*100 -> 17.441860465116278 | Q243: =(O243/185)*100 -> 16.216216216216218
B244: Not at all | C244: 4 | D244: =(C244/33)*100 -> 12.121212121212121 | E244: =(C244/34)*100 -> 11.76470588235294 | F244: 2 | G244: =(F244/46)*100 -> 4.3478260869565215 | H244: =(F244/49)*100 -> 4.0816326530612246 | I244: 3 | J244: =(I244/48)*100 -> 6.25 | K244: =(I244/57)*100 -> 5.2631578947368416 | L244: 5 | M244: =(L244/45)*100 -> 11.111111111111111 | N244: =(L244/45)*100 -> 11.111111111111111 | O244: =(C244+F244+L244+I244) -> 14 | P244: =(O244/172)*100 -> 8.1395348837209305 | Q244: =(O244/185)*100 -> 7.5675675675675684
B245: Total | C245: =SUM(C241:C244) -> 33 | D245: =(C245/33)*100 -> 100.0 | E245: =(C245/34)*100 -> 97.058823529411768 | F245: =SUM(F241:F244) -> 46 | G245: =(F245/46)*100 -> 100.0 | H245: =(F245/49)*100 -> 93.877551020408163 | I245: =SUM(I241:I244) -> 48 | J245: =(I245/48)*100 -> 100.0 | K245: =(I245/57)*100 -> 84.210526315789465 | L245: 45 | M245: =(L245/45)*100 -> 100.0 | N245: =(L245/45)*100 -> 100.0 | O245: =(C245+F245+L245+I245) -> 172 | P245: =(O245/172)*100 -> 100.0 | Q245: =(O245/185)*100 -> 92.972972972972983
B246: d. Administering tests
B247: To a great extent | C247: 0 | D247: =(C247/34)*100 -> 0.0 | E247: =(C247/34)*100 -> 0.0 | F247: 0 | G247: =(F247/44)*100 -> 0.0 | H247: =(F247/49)*100 -> 0.0 | I247: 0 | J247: =(I247/49)*100 -> 0.0 | K247: =(I247/57)*100 -> 0.0 | L247: 1 | M247: =(L247/44)*100 -> 2.2727272727272729 | N247: =(L247/45)*100 -> 2.2222222222222223 | O247: =(C247+F247+L247+I247) -> 1 | P247: =(O247/171)*100 -> 0.58479532163742687 | Q247: =(O247/185)*100 -> 0.54054054054054057
B248: To a moderate extent | C248: 1 | D248: =(C248/34)*100 -> 2.9411764705882351 | E248: =(C248/34)*100 -> 2.9411764705882351 | F248: 8 | G248: =(F248/44)*100 -> 18.181818181818183 | H248: =(F248/49)*100 -> 16.326530612244898 | I248: 5 | J248: =(I248/49)*100 -> 10.204081632653061 | K248: =(I248/57)*100 -> 8.7719298245614024 | L248: 3 | M248: =(L248/44)*100 -> 6.8181818181818175 | N248: =(L248/45)*100 -> 6.666666666666667 | O248: =(C248+F248+L248+I248) -> 17 | P248: =(O248/171)*100 -> 9.9415204678362574 | Q248: =(O248/185)*100 -> 9.1891891891891895
B249: To a small extent | C249: 22 | D249: =(C249/34)*100 -> 64.705882352941174 | E249: =(C249/34)*100 -> 64.705882352941174 | F249: 22 | G249: =(F249/44)*100 -> 50.0 | H249: =(F249/49)*100 -> 44.897959183673471 | I249: 16 | J249: =(I249/49)*100 -> 32.653061224489797 | K249: =(I249/57)*100 -> 28.07017543859649 | L249: 16 | M249: =(L249/44)*100 -> 36.363636363636367 | N249: =(L249/45)*100 -> 35.555555555555557 | O249: =(C249+F249+L249+I249) -> 76 | P249: =(O249/171)*100 -> 44.444444444444443 | Q249: =(O249/185)*100 -> 41.081081081081081
B250: Not at all | C250: 11 | D250: =(C250/34)*100 -> 32.352941176470587 | E250: =(C250/34)*100 -> 32.352941176470587 | F250: 14 | G250: =(F250/44)*100 -> 31.818181818181817 | H250: =(F250/49)*100 -> 28.571428571428569 | I250: 28 | J250: =(I250/49)*100 -> 57.142857142857139 | K250: =(I250/57)*100 -> 49.122807017543856 | L250: 24 | M250: =(L250/44)*100 -> 54.54545454545454 | N250: =(L250/45)*100 -> 53.333333333333336 | O250: =(C250+F250+L250+I250) -> 77 | P250: =(O250/171)*100 -> 45.029239766081872 | Q250: =(O250/185)*100 -> 41.621621621621621
B251: Total | C251: =SUM(C247:C250) -> 34 | D251: =(C251/34)*100 -> 100.0 | E251: =(C251/34)*100 -> 100.0 | F251: =SUM(F247:F250) -> 44 | G251: =(F251/44)*100 -> 100.0 | H251: =(F251/49)*100 -> 89.795918367346943 | I251: =SUM(I247:I250) -> 49 | J251: =(I251/49)*100 -> 100.0 | K251: =(I251/57)*100 -> 85.964912280701753 | L251: =SUM(L247:L250) -> 44 | M251: =(L251/44)*100 -> 100.0 | N251: =(L251/45)*100 -> 97.777777777777771 | O251: =(C251+F251+L251+I251) -> 171 | P251: =(O251/171)*100 -> 100.0 | Q251: =(O251/185)*100 -> 92.432432432432435
B252: e. Develop students' skills
B253: To a great extent | C253: 10 | D253: =(C253/33)*100 -> 30.303030303030305 | E253: =(C253/34)*100 -> 29.411764705882355 | F253: 25 | G253: =(F253/46)*100 -> 54.347826086956516 | H253: =(F253/49)*100 -> 51.020408163265309 | I253: 17 | J253: =(I253/48)*100 -> 35.416666666666671 | K253: =(I253/57)*100 -> 29.82456140350877 | L253: 23 | M253: =(L253/45)*100 -> 51.111111111111107 | N253: =(L253/45)*100 -> 51.111111111111107 | O253: =(C253+F253+L253+I253) -> 75 | P253: =(O253/172)*100 -> 43.604651162790695 | Q253: =(O253/185)*100 -> 40.54054054054054
B254: To a moderate extent | C254: 17 | D254: =(C254/33)*100 -> 51.515151515151516 | E254: =(C254/34)*100 -> 50.0 | F254: 15 | G254: =(F254/46)*100 -> 32.608695652173914 | H254: =(F254/49)*100 -> 30.612244897959183 | I254: 20 | J254: =(I254/48)*100 -> 41.666666666666671 | K254: =(I254/57)*100 -> 35.087719298245609 | L254: 11 | M254: =(L254/45)*100 -> 24.444444444444443 | N254: =(L254/45)*100 -> 24.444444444444443 | O254: =(C254+F254+L254+I254) -> 63 | P254: =(O254/172)*100 -> 36.627906976744185 | Q254: =(O254/185)*100 -> 34.054054054054056
B255: To a small extent | C255: 5 | D255: =(C255/33)*100 -> 15.151515151515152 | E255: =(C255/34)*100 -> 14.705882352941178 | F255: 5 | G255: =(F255/46)*100 -> 10.869565217391305 | H255: =(F255/49)*100 -> 10.204081632653061 | I255: 8 | J255: =(I255/48)*100 -> 16.666666666666664 | K255: =(I255/57)*100 -> 14.035087719298245 | L255: 10 | M255: =(L255/45)*100 -> 22.222222222222221 | N255: =(L255/45)*100 -> 22.222222222222221 | O255: =(C255+F255+L255+I255) -> 28 | P255: =(O255/172)*100 -> 16.279069767441861 | Q255: =(O255/185)*100 -> 15.135135135135137
B256: Not at all | C256: 1 | D256: =(C256/33)*100 -> 3.0303030303030303 | E256: =(C256/34)*100 -> 2.9411764705882351 | F256: 1 | G256: =(F256/46)*100 -> 2.1739130434782608 | H256: =(F256/49)*100 -> 2.0408163265306123 | I256: 3 | J256: =(I256/48)*100 -> 6.25 | K256: =(I256/57)*100 -> 5.2631578947368416 | L256: 1 | M256: =(L256/45)*100 -> 2.2222222222222223 | N256: =(L256/45)*100 -> 2.2222222222222223 | O256: =(C256+F256+L256+I256) -> 6 | P256: =(O256/172)*100 -> 3.4883720930232558 | Q256: =(O256/185)*100 -> 3.2432432432432434
B257: Total | C257: =SUM(C253:C256) -> 33 | D257: =(C257/33)*100 -> 100.0 | E257: =(C257/34)*100 -> 97.058823529411768 | F257: =SUM(F253:F256) -> 46 | G257: =(F257/46)*100 -> 100.0 | H257: =(F257/49)*100 -> 93.877551020408163 | I257: =SUM(I253:I256) -> 48 | J257: =(I257/48)*100 -> 100.0 | K257: =(I257/57)*100 -> 84.210526315789465 | L257: =SUM(L253:L256) -> 45 | M257: =(L257/45)*100 -> 100.0 | N257: =(L257/45)*100 -> 100.0 | O257: =(C257+F257+L257+I257) -> 172 | P257: =(O257/172)*100 -> 100.0 | Q257: =(O257/185)*100 -> 92.972972972972983
B258: f. Socratical questioning
B259: To a great extent | C259: 18 | D259: =(C259/31)*100 -> 58.064516129032263 | E259: =(C259/34)*100 -> 52.941176470588239 | F259: 23 | G259: =(F259/45)*100 -> 51.111111111111107 | H259: =(F259/49)*100 -> 46.938775510204081 | I259: 14 | J259: =(I259/50)*100 -> 28.0 | K259: =(I259/57)*100 -> 24.561403508771928 | L259: 22 | M259: =(L259/44)*100 -> 50.0 | N259: =(L259/45)*100 -> 48.888888888888886 | O259: =(C259+F259+L259+I259) -> 77 | P259: =(O259/170)*100 -> 45.294117647058826 | Q259: =(O259/185)*100 -> 41.621621621621621
B260: To a moderate extent | C260: 6 | D260: =(C260/31)*100 -> 19.35483870967742 | E260: =(C260/34)*100 -> 17.647058823529413 | F260: 18 | G260: =(F260/45)*100 -> 40.0 | H260: =(F260/49)*100 -> 36.734693877551024 | I260: 19 | J260: =(I260/50)*100 -> 38.0 | K260: =(I260/57)*100 -> 33.333333333333329 | L260: 13 | M260: =(L260/44)*100 -> 29.545454545454547 | N260: =(L260/45)*100 -> 28.888888888888886 | O260: =(C260+F260+L260+I260) -> 56 | P260: =(O260/170)*100 -> 32.941176470588232 | Q260: =(O260/185)*100 -> 30.270270270270274
B261: To a small extent | C261: 6 | D261: =(C261/31)*100 -> 19.35483870967742 | E261: =(C261/34)*100 -> 17.647058823529413 | F261: 2 | G261: =(F261/45)*100 -> 4.4444444444444446 | H261: =(F261/49)*100 -> 4.0816326530612246 | I261: 10 | J261: =(I261/50)*100 -> 20.0 | K261: =(I261/57)*100 -> 17.543859649122805 | L261: 7 | M261: =(L261/44)*100 -> 15.909090909090908 | N261: =(L261/45)*100 -> 15.555555555555555 | O261: =(C261+F261+L261+I261) -> 25 | P261: =(O261/170)*100 -> 14.705882352941178 | Q261: =(O261/185)*100 -> 13.513513513513514
B262: Not at all | C262: 1 | D262: =(C262/31)*100 -> 3.225806451612903 | E262: =(C262/34)*100 -> 2.9411764705882351 | F262: 2 | G262: =(F262/45)*100 -> 4.4444444444444446 | H262: =(F262/49)*100 -> 4.0816326530612246 | I262: 7 | J262: =(I262/50)*100 -> 14.0 | K262: =(I262/57)*100 -> 12.280701754385964 | L262: 2 | M262: =(L262/44)*100 -> 4.5454545454545459 | N262: =(L262/45)*100 -> 4.4444444444444446 | O262: =(C262+F262+L262+I262) -> 12 | P262: =(O262/170)*100 -> 7.0588235294117645 | Q262: =(O262/185)*100 -> 6.4864864864864868
B263: Total | C263: =SUM(C259:C262) -> 31 | D263: =(C263/31)*100 -> 100.0 | E263: =(C263/34)*100 -> 91.17647058823529 | F263: =SUM(F259:F262) -> 45 | G263: =(F263/45)*100 -> 100.0 | H263: =(F263/49)*100 -> 91.83673469387756 | I263: =SUM(I259:I262) -> 50 | J263: =(I263/50)*100 -> 100.0 | K263: =(I263/57)*100 -> 87.719298245614027 | L263: =SUM(L259:L262) -> 44 | M263: =(L263/44)*100 -> 100.0 | N263: =(L263/45)*100 -> 97.777777777777771 | O263: =(C263+F263+L263+I263) -> 170 | P263: =(O263/170)*100 -> 100.0 | Q263: =(O263/185)*100 -> 91.891891891891902
B264: g. Other
B265: To a great extent | C265: 7 | D265: =(C265/7)*100 -> 100.0 | E265: =(C265/34)*100 -> 20.588235294117645 | F265: 4 | G265: =(F265/6)*100 -> 66.666666666666657 | H265: =(F265/49)*100 -> 8.1632653061224492 | I265: 7 | J265: =(I265/7)*100 -> 100.0 | K265: =(I265/57)*100 -> 12.280701754385964 | L265: 8 | M265: =(L265/9)*100 -> 88.888888888888886 | N265: =(L265/45)*100 -> 17.777777777777779 | O265: =(C265+F265+L265+I265) -> 26 | P265: =(O265/29)*100 -> 89.65517241379311 | Q265: =(O265/185)*100 -> 14.054054054054054
B266: To a moderate extent | C266: 0 | D266: =(C266/7)*100 -> 0.0 | E266: =(C266/34)*100 -> 0.0 | F266: 2 | G266: =(F266/6)*100 -> 33.333333333333329 | H266: =(F266/49)*100 -> 4.0816326530612246 | I266: 0 | J266: =(I266/7)*100 -> 0.0 | K266: =(I266/57)*100 -> 0.0 | L266: 1 | M266: =(L266/9)*100 -> 11.111111111111111 | N266: =(L266/45)*100 -> 2.2222222222222223 | O266: =(C266+F266+L266+I266) -> 3 | P266: =(O266/29)*100 -> 10.344827586206897 | Q266: =(O266/185)*100 -> 1.6216216216216217
B267: To a small extent | C267: 0 | D267: =(C267/7)*100 -> 0.0 | E267: =(C267/34)*100 -> 0.0 | F267: 0 | G267: =(F267/6)*100 -> 0.0 | H267: =(F267/49)*100 -> 0.0 | I267: 0 | J267: =(I267/7)*100 -> 0.0 | K267: =(I267/57)*100 -> 0.0 | L267: 0 | M267: =(L267/9)*100 -> 0.0 | N267: =(L267/45)*100 -> 0.0 | O267: =(C267+F267+L267+I267) -> 0 | P267: =(O267/29)*100 -> 0.0 | Q267: =(O267/185)*100 -> 0.0
B268: Not at all | C268: 0 | D268: =(C268/7)*100 -> 0.0 | E268: =(C268/34)*100 -> 0.0 | F268: 0 | G268: =(F268/6)*100 -> 0.0 | H268: =(F268/49)*100 -> 0.0 | I268: 0 | J268: =(I268/7)*100 -> 0.0 | K268: =(I268/57)*100 -> 0.0 | L268: 0 | M268: =(L268/9)*100 -> 0.0 | N268: =(L268/45)*100 -> 0.0 | O268: =(C268+F268+L268+I268) -> 0 | P268: =(O268/29)*100 -> 0.0 | Q268: =(O268/185)*100 -> 0.0
B269: Total | C269: =SUM(C265:C268) -> 7 | D269: =(C269/7)*100 -> 100.0 | E269: =(C269/34)*100 -> 20.588235294117645 | F269: =SUM(F265:F268) -> 6 | G269: =(F269/6)*100 -> 100.0 | H269: =(F269/49)*100 -> 12.244897959183673 | I269: =SUM(I265:I268) -> 7 | J269: =(I269/7)*100 -> 100.0 | K269: =(I269/57)*100 -> 12.280701754385964 | L269: =SUM(L265:L268) -> 9 | M269: =(L269/9)*100 -> 100.0 | N269: =(L269/45)*100 -> 20.0 | O269: =(C269+F269+L269+I269) -> 29 | P269: =(O269/29)*100 -> 100.0 | Q269: =(O269/185)*100 -> 15.675675675675677
A271: 17 | B271: Extent of the unit proposing students' activities | C271: FRQ | D271: % T2 | E271: % T1 | F271: FRQ | G271: % T2 | H271: % T1 | I271: FRQ | J271: % T2 | K271: % T1 | L271: FRQ | M271: % T2 | N271: % T1 | O271: FRQ | P271: % T2 | Q271: % T1
B272: a. Creative writing
B273: To a great extent | C273: 7 | D273: =(C273/34)*100 -> 20.588235294117645 | E273: =(C273/34)*100 -> 20.588235294117645 | F273: 22 | G273: =(F273/42)*100 -> 52.380952380952387 | H273: =(F273/49)*100 -> 44.897959183673471 | I273: 16 | J273: =(I273/50)*100 -> 32.0 | K273: =(I273/57)*100 -> 28.07017543859649 | L273: 14 | M273: =(L273/44)*100 -> 31.818181818181817 | N273: =(L273/45)*100 -> 31.111111111111111 | O273: =(C273+F273+L273+I273) -> 59 | P273: =(O273/170)*100 -> 34.705882352941174 | Q273: =(O273/185)*100 -> 31.891891891891895
B274: To a moderate extent | C274: 10 | D274: =(C274/34)*100 -> 29.411764705882355 | E274: =(C274/34)*100 -> 29.411764705882355 | F274: 10 | G274: =(F274/42)*100 -> 23.809523809523807 | H274: =(F274/49)*100 -> 20.408163265306122 | I274: 19 | J274: =(I274/50)*100 -> 38.0 | K274: =(I274/57)*100 -> 33.333333333333329 | L274: 15 | M274: =(L274/44)*100 -> 34.090909090909086 | N274: =(L274/45)*100 -> 33.333333333333329 | O274: =(C274+F274+L274+I274) -> 54 | P274: =(O274/170)*100 -> 31.764705882352938 | Q274: =(O274/185)*100 -> 29.189189189189189
B275: To a small extent | C275: 10 | D275: =(C275/34)*100 -> 29.411764705882355 | E275: =(C275/34)*100 -> 29.411764705882355 | F275: 5 | G275: =(F275/42)*100 -> 11.904761904761903 | H275: =(F275/49)*100 -> 10.204081632653061 | I275: 7 | J275: =(I275/50)*100 -> 14.0 | K275: =(I275/57)*100 -> 12.280701754385964 | L275: 9 | M275: =(L275/44)*100 -> 20.454545454545457 | N275: =(L275/45)*100 -> 20.0 | O275: =(C275+F275+L275+I275) -> 31 | P275: =(O275/170)*100 -> 18.235294117647058 | Q275: =(O275/185)*100 -> 16.756756756756758
B276: Not at all | C276: 7 | D276: =(C276/34)*100 -> 20.588235294117645 | E276: =(C276/34)*100 -> 20.588235294117645 | F276: 5 | G276: =(F276/42)*100 -> 11.904761904761903 | H276: =(F276/49)*100 -> 10.204081632653061 | I276: 8 | J276: =(I276/50)*100 -> 16.0 | K276: =(I276/57)*100 -> 14.035087719298245 | L276: 6 | M276: =(L276/44)*100 -> 13.636363636363635 | N276: =(L276/45)*100 -> 13.333333333333334 | O276: =(C276+F276+L276+I276) -> 26 | P276: =(O276/170)*100 -> 15.294117647058824 | Q276: =(O276/185)*100 -> 14.054054054054054
B277: Total | C277: =SUM(C273:C276) -> 34 | D277: =(C277/34)*100 -> 100.0 | E277: =(C277/34)*100 -> 100.0 | F277: =SUM(F273:F276) -> 42 | G277: =(F277/42)*100 -> 100.0 | H277: =(F277/49)*100 -> 85.714285714285708 | I277: =SUM(I273:I276) -> 50 | J277: =(I277/50)*100 -> 100.0 | K277: =(I277/57)*100 -> 87.719298245614027 | L277: =SUM(L273:L276) -> 44 | M277: =(L277/44)*100 -> 100.0 | N277: =(L277/45)*100 -> 97.777777777777771 | O277: =(C277+F277+L277+I277) -> 170 | P277: =(O277/170)*100 -> 100.0 | Q277: =(O277/185)*100 -> 91.891891891891902
B278: b. Research writing
B279: To a great extent | C279: 5 | D279: =(C279/34)*100 -> 14.705882352941178 | E279: =(C279/34)*100 -> 14.705882352941178 | F279: 11 | G279: =(F279/42)*100 -> 26.190476190476193 | H279: =(F279/49)*100 -> 22.448979591836736 | I279: 20 | J279: =(I279/51)*100 -> 39.215686274509807 | K279: =(I279/57)*100 -> 35.087719298245609 | L279: 13 | M279: =(L279/44)*100 -> 29.545454545454547 | N279: =(L279/45)*100 -> 28.888888888888886 | O279: =(C279+F279+L279+I279) -> 49 | P279: =(O279/171)*100 -> 28.654970760233915 | Q279: =(O279/185)*100 -> 26.486486486486488
B280: To a moderate extent | C280: 15 | D280: =(C280/34)*100 -> 44.117647058823529 | E280: =(C280/34)*100 -> 44.117647058823529 | F280: 18 | G280: =(F280/42)*100 -> 42.857142857142854 | H280: =(F280/49)*100 -> 36.734693877551024 | I280: 20 | J280: =(I280/51)*100 -> 39.215686274509807 | K280: =(I280/57)*100 -> 35.087719298245609 | L280: 15 | M280: =(L280/44)*100 -> 34.090909090909086 | N280: =(L280/45)*100 -> 33.333333333333329 | O280: =(C280+F280+L280+I280) -> 68 | P280: =(O280/171)*100 -> 39.76608187134503 | Q280: =(O280/185)*100 -> 36.756756756756758
B281: To a small extent | C281: 8 | D281: =(C281/34)*100 -> 23.52941176470588 | E281: =(C281/34)*100 -> 23.52941176470588 | F281: 8 | G281: =(F281/42)*100 -> 19.047619047619047 | H281: =(F281/49)*100 -> 16.326530612244898 | I281: 4 | J281: =(I281/51)*100 -> 7.8431372549019605 | K281: =(I281/57)*100 -> 7.0175438596491224 | L281: 7 | M281: =(L281/44)*100 -> 15.909090909090908 | N281: =(L281/45)*100 -> 15.555555555555555 | O281: =(C281+F281+L281+I281) -> 27 | P281: =(O281/171)*100 -> 15.789473684210526 | Q281: =(O281/185)*100 -> 14.594594594594595
B282: Not at all | C282: 6 | D282: =(C282/34)*100 -> 17.647058823529413 | E282: =(C282/34)*100 -> 17.647058823529413 | F282: 5 | G282: =(F282/42)*100 -> 11.904761904761903 | H282: =(F282/49)*100 -> 10.204081632653061 | I282: 7 | J282: =(I282/51)*100 -> 13.725490196078432 | K282: =(I282/57)*100 -> 12.280701754385964 | L282: 9 | M282: =(L282/44)*100 -> 20.454545454545457 | N282: =(L282/45)*100 -> 20.0 | O282: =(C282+F282+L282+I282) -> 27 | P282: =(O282/171)*100 -> 15.789473684210526 | Q282: =(O282/185)*100 -> 14.594594594594595
B283: Total | C283: =SUM(C279:C282) -> 34 | D283: =(C283/34)*100 -> 100.0 | E283: =(C283/34)*100 -> 100.0 | F283: =SUM(F279:F282) -> 42 | G283: =(F283/42)*100 -> 100.0 | H283: =(F283/49)*100 -> 85.714285714285708 | I283: =SUM(I279:I282) -> 51 | J283: =(I283/51)*100 -> 100.0 | K283: =(I283/57)*100 -> 89.473684210526315 | L283: =SUM(L279:L282) -> 44 | M283: =(L283/44)*100 -> 100.0 | N283: =(L283/45)*100 -> 97.777777777777771 | O283: =(C283+F283+L283+I283) -> 171 | P283: =(O283/171)*100 -> 100.0 | Q283: =(O283/185)*100 -> 92.432432432432435
B284: c. Dramatic performance
B285: To a great extent | C285: 2 | D285: =(C285/34)*100 -> 5.8823529411764701 | E285: =(C285/34)*100 -> 5.8823529411764701 | F285: 10 | G285: =(F285/40)*100 -> 25.0 | H285: =(F285/49)*100 -> 20.408163265306122 | I285: 5 | J285: =(I285/51)*100 -> 9.8039215686274517 | K285: =(I285/57)*100 -> 8.7719298245614024 | L285: 7 | M285: =(L285/43)*100 -> 16.279069767441861 | N285: =(L285/45)*100 -> 15.555555555555555 | O285: =(C285+F285+L285+I285) -> 24 | P285: =(O285/168)*100 -> 14.285714285714285 | Q285: =(O285/185)*100 -> 12.972972972972974
B286: To a moderate extent | C286: 7 | D286: =(C286/34)*100 -> 20.588235294117645 | E286: =(C286/34)*100 -> 20.588235294117645 | F286: 5 | G286: =(F286/40)*100 -> 12.5 | H286: =(F286/49)*100 -> 10.204081632653061 | I286: 15 | J286: =(I286/51)*100 -> 29.411764705882355 | K286: =(I286/57)*100 -> 26.315789473684209 | L286: 7 | M286: =(L286/43)*100 -> 16.279069767441861 | N286: =(L286/45)*100 -> 15.555555555555555 | O286: =(C286+F286+L286+I286) -> 34 | P286: =(O286/168)*100 -> 20.238095238095237 | Q286: =(O286/185)*100 -> 18.378378378378379
B287: To a small extent | C287: 11 | D287: =(C287/34)*100 -> 32.352941176470587 | E287: =(C287/34)*100 -> 32.352941176470587 | F287: 9 | G287: =(F287/40)*100 -> 22.5 | H287: =(F287/49)*100 -> 18.367346938775512 | I287: 10 | J287: =(I287/51)*100 -> 19.607843137254903 | K287: =(I287/57)*100 -> 17.543859649122805 | L287: 10 | M287: =(L287/43)*100 -> 23.255813953488371 | N287: =(L287/45)*100 -> 22.222222222222221 | O287: =(C287+F287+L287+I287) -> 40 | P287: =(O287/168)*100 -> 23.809523809523807 | Q287: =(O287/185)*100 -> 21.621621621621621
B288: Not at all | C288: 14 | D288: =(C288/34)*100 -> 41.17647058823529 | E288: =(C288/34)*100 -> 41.17647058823529 | F288: 16 | G288: =(F288/40)*100 -> 40.0 | H288: =(F288/49)*100 -> 32.653061224489797 | I288: 21 | J288: =(I288/51)*100 -> 41.17647058823529 | K288: =(I288/57)*100 -> 36.84210526315789 | L288: 19 | M288: =(L288/43)*100 -> 44.186046511627907 | N288: =(L288/45)*100 -> 42.222222222222221 | O288: =(C288+F288+L288+I288) -> 70 | P288: =(O288/168)*100 -> 41.666666666666671 | Q288: =(O288/185)*100 -> 37.837837837837839
B289: Total | C289: =SUM(C285:C288) -> 34 | D289: =(C289/34)*100 -> 100.0 | E289: =(C289/34)*100 -> 100.0 | F289: =SUM(F285:F288) -> 40 | G289: =(F289/40)*100 -> 100.0 | H289: =(F289/49)*100 -> 81.632653061224488 | I289: =SUM(I285:I288) -> 51 | J289: =(I289/51)*100 -> 100.0 | K289: =(I289/57)*100 -> 89.473684210526315 | L289: =SUM(L285:L288) -> 43 | M289: =(L289/43)*100 -> 100.0 | N289: =(L289/45)*100 -> 95.555555555555557 | O289: =(C289+F289+L289+I289) -> 168 | P289: =(O289/168)*100 -> 100.0 | Q289: =(O289/185)*100 -> 90.810810810810821
B290: d. Analyzing a writing
B291: To a great extent | C291: 10 | D291: =(C291/33)*100 -> 30.303030303030305 | E291: =(C291/34)*100 -> 29.411764705882355 | F291: 18 | G291: =(F291/40)*100 -> 45.0 | H291: =(F291/49)*100 -> 36.734693877551024 | I291: 18 | J291: =(I291/51)*100 -> 35.294117647058826 | K291: =(I291/57)*100 -> 31.578947368421051 | L291: 15 | M291: =(L291/44)*100 -> 34.090909090909086 | N291: =(L291/45)*100 -> 33.333333333333329 | O291: =(C291+F291+L291+I291) -> 61 | P291: =(O291/168)*100 -> 36.30952380952381 | Q291: =(O291/185)*100 -> 32.972972972972975
B292: To a moderate extent | C292: 8 | D292: =(C292/33)*100 -> 24.242424242424242 | E292: =(C292/34)*100 -> 23.52941176470588 | F292: 9 | G292: =(F292/40)*100 -> 22.5 | H292: =(F292/49)*100 -> 18.367346938775512 | I292: 17 | J292: =(I292/51)*100 -> 33.333333333333329 | K292: =(I292/57)*100 -> 29.82456140350877 | L292: 10 | M292: =(L292/44)*100 -> 22.727272727272727 | N292: =(L292/45)*100 -> 22.222222222222221 | O292: =(C292+F292+L292+I292) -> 44 | P292: =(O292/168)*100 -> 26.190476190476193 | Q292: =(O292/185)*100 -> 23.783783783783786
B293: To a small extent | C293: 9 | D293: =(C293/33)*100 -> 27.27272727272727 | E293: =(C293/34)*100 -> 26.47058823529412 | F293: 8 | G293: =(F293/40)*100 -> 20.0 | H293: =(F293/49)*100 -> 16.326530612244898 | I293: 5 | J293: =(I293/51)*100 -> 9.8039215686274517 | K293: =(I293/57)*100 -> 8.7719298245614024 | L293: 7 | M293: =(L293/44)*100 -> 15.909090909090908 | N293: =(L293/45)*100 -> 15.555555555555555 | O293: =(C293+F293+L293+I293) -> 29 | P293: =(O293/168)*100 -> 17.261904761904763 | Q293: =(O293/185)*100 -> 15.675675675675677
B294: Not at all | C294: 6 | D294: =(C294/33)*100 -> 18.181818181818183 | E294: =(C294/34)*100 -> 17.647058823529413 | F294: 5 | G294: =(F294/40)*100 -> 12.5 | H294: =(F294/49)*100 -> 10.204081632653061 | I294: 11 | J294: =(I294/51)*100 -> 21.568627450980394 | K294: =(I294/57)*100 -> 19.298245614035086 | L294: 12 | M294: =(L294/44)*100 -> 27.27272727272727 | N294: =(L294/45)*100 -> 26.666666666666668 | O294: =(C294+F294+L294+I294) -> 34 | P294: =(O294/168)*100 -> 20.238095238095237 | Q294: =(O294/185)*100 -> 18.378378378378379
B295: Total | C295: =SUM(C291:C294) -> 33 | D295: =(C295/33)*100 -> 100.0 | E295: =(C295/34)*100 -> 97.058823529411768 | F295: =SUM(F291:F294) -> 40 | G295: =(F295/40)*100 -> 100.0 | H295: =(F295/49)*100 -> 81.632653061224488 | I295: =SUM(I291:I294) -> 51 | J295: =(I295/51)*100 -> 100.0 | K295: =(I295/57)*100 -> 89.473684210526315 | L295: =SUM(L291:L294) -> 44 | M295: =(L295/44)*100 -> 100.0 | N295: =(L295/45)*100 -> 97.777777777777771 | O295: =(C295+F295+L295+I295) -> 168 | P295: =(O295/168)*100 -> 100.0 | Q295: =(O295/185)*100 -> 90.810810810810821
B296: e. Reading
B297: To a great extent | C297: 16 | D297: =(C297/34)*100 -> 47.058823529411761 | E297: =(C297/34)*100 -> 47.058823529411761 | F297: 37 | G297: =(F297/44)*100 -> 84.090909090909093 | H297: =(F297/49)*100 -> 75.510204081632651 | I297: 31 | J297: =(I297/52)*100 -> 59.615384615384613 | K297: =(I297/57)*100 -> 54.385964912280706 | L297: 26 | M297: =(L297/45)*100 -> 57.777777777777771 | N297: =(L297/45)*100 -> 57.777777777777771 | O297: =(C297+F297+L297+I297) -> 110 | P297: =(O297/175)*100 -> 62.857142857142854 | Q297: =(O297/185)*100 -> 59.45945945945946
B298: To a moderate extent | C298: 12 | D298: =(C298/34)*100 -> 35.294117647058826 | E298: =(C298/34)*100 -> 35.294117647058826 | F298: 4 | G298: =(F298/44)*100 -> 9.0909090909090917 | H298: =(F298/49)*100 -> 8.1632653061224492 | I298: 15 | J298: =(I298/52)*100 -> 28.846153846153843 | K298: =(I298/57)*100 -> 26.315789473684209 | L298: 15 | M298: =(L298/45)*100 -> 33.333333333333329 | N298: =(L298/45)*100 -> 33.333333333333329 | O298: =(C298+F298+L298+I298) -> 46 | P298: =(O298/175)*100 -> 26.285714285714285 | Q298: =(O298/185)*100 -> 24.864864864864867
B299: To a small extent | C299: 6 | D299: =(C299/34)*100 -> 17.647058823529413 | E299: =(C299/34)*100 -> 17.647058823529413 | F299: 3 | G299: =(F299/44)*100 -> 6.8181818181818175 | H299: =(F299/49)*100 -> 6.1224489795918364 | I299: 2 | J299: =(I299/52)*100 -> 3.8461538461538463 | K299: =(I299/57)*100 -> 3.5087719298245612 | L299: 4 | M299: =(L299/45)*100 -> 8.8888888888888893 | N299: =(L299/45)*100 -> 8.8888888888888893 | O299: =(C299+F299+L299+I299) -> 15 | P299: =(O299/175)*100 -> 8.5714285714285712 | Q299: =(O299/185)*100 -> 8.1081081081081088
B300: Not at all | C300: 0 | D300: =(C300/34)*100 -> 0.0 | E300: =(C300/34)*100 -> 0.0 | F300: 0 | G300: =(F300/44)*100 -> 0.0 | H300: =(F300/49)*100 -> 0.0 | I300: 4 | J300: =(I300/52)*100 -> 7.6923076923076925 | K300: =(I300/57)*100 -> 7.0175438596491224 | L300: 0 | M300: =(L300/45)*100 -> 0.0 | N300: =(L300/45)*100 -> 0.0 | O300: =(C300+F300+L300+I300) -> 4 | P300: =(O300/175)*100 -> 2.2857142857142856 | Q300: =(O300/185)*100 -> 2.1621621621621623
B301: Total | C301: =SUM(C297:C300) -> 34 | D301: =(C301/34)*100 -> 100.0 | E301: =(C301/34)*100 -> 100.0 | F301: =SUM(F297:F300) -> 44 | G301: =(F301/44)*100 -> 100.0 | H301: =(F301/49)*100 -> 89.795918367346943 | I301: =SUM(I297:I300) -> 52 | J301: =(I301/52)*100 -> 100.0 | K301: =(I301/57)*100 -> 91.228070175438589 | L301: =SUM(L297:L300) -> 45 | M301: =(L301/45)*100 -> 100.0 | N301: =(L301/45)*100 -> 100.0 | O301: =(C301+F301+L301+I301) -> 175 | P301: =(O301/175)*100 -> 100.0 | Q301: =(O301/185)*100 -> 94.594594594594597
B302: f. Making something
B303: To a great extent | C303: 9 | D303: =(C303/34)*100 -> 26.47058823529412 | E303: =(C303/34)*100 -> 26.47058823529412 | F303: 13 | G303: =(F303/40)*100 -> 32.5 | H303: =(F303/49)*100 -> 26.530612244897959 | I303: 14 | J303: =(I303/51)*100 -> 27.450980392156865 | K303: =(I303/57)*100 -> 24.561403508771928 | L303: 16 | M303: =(L303/45)*100 -> 35.555555555555557 | N303: =(L303/45)*100 -> 35.555555555555557 | O303: =(C303+F303+L303+I303) -> 52 | P303: =(O303/170)*100 -> 30.588235294117649 | Q303: =(O303/185)*100 -> 28.108108108108109
B304: To a moderate extent | C304: 8 | D304: =(C304/34)*100 -> 23.52941176470588 | E304: =(C304/34)*100 -> 23.52941176470588 | F304: 11 | G304: =(F304/40)*100 -> 27.5 | H304: =(F304/49)*100 -> 22.448979591836736 | I304: 18 | J304: =(I304/51)*100 -> 35.294117647058826 | K304: =(I304/57)*100 -> 31.578947368421051 | L304: 12 | M304: =(L304/45)*100 -> 26.666666666666668 | N304: =(L304/45)*100 -> 26.666666666666668 | O304: =(C304+F304+L304+I304) -> 49 | P304: =(O304/170)*100 -> 28.823529411764703 | Q304: =(O304/185)*100 -> 26.486486486486488
B305: To a small extent | C305: 10 | D305: =(C305/34)*100 -> 29.411764705882355 | E305: =(C305/34)*100 -> 29.411764705882355 | F305: 5 | G305: =(F305/40)*100 -> 12.5 | H305: =(F305/49)*100 -> 10.204081632653061 | I305: 11 | J305: =(I305/51)*100 -> 21.568627450980394 | K305: =(I305/57)*100 -> 19.298245614035086 | L305: 8 | M305: =(L305/45)*100 -> 17.777777777777779 | N305: =(L305/45)*100 -> 17.777777777777779 | O305: =(C305+F305+L305+I305) -> 34 | P305: =(O305/170)*100 -> 20.0 | Q305: =(O305/185)*100 -> 18.378378378378379
B306: Not at all | C306: 7 | D306: =(C306/34)*100 -> 20.588235294117645 | E306: =(C306/34)*100 -> 20.588235294117645 | F306: 11 | G306: =(F306/40)*100 -> 27.5 | H306: =(F306/49)*100 -> 22.448979591836736 | I306: 8 | J306: =(I306/51)*100 -> 15.686274509803921 | K306: =(I306/57)*100 -> 14.035087719298245 | L306: 9 | M306: =(L306/45)*100 -> 20.0 | N306: =(L306/45)*100 -> 20.0 | O306: =(C306+F306+L306+I306) -> 35 | P306: =(O306/170)*100 -> 20.588235294117645 | Q306: =(O306/185)*100 -> 18.918918918918919
B307: Total | C307: 34 | D307: =(C307/34)*100 -> 100.0 | E307: =(C307/34)*100 -> 100.0 | F307: =SUM(F303:F306) -> 40 | G307: =(F307/40)*100 -> 100.0 | H307: =(F307/49)*100 -> 81.632653061224488 | I307: =SUM(I303:I306) -> 51 | J307: =(I307/51)*100 -> 100.0 | K307: =(I307/57)*100 -> 89.473684210526315 | L307: =SUM(L303:L306) -> 45 | M307: =(L307/45)*100 -> 100.0 | N307: =(L307/45)*100 -> 100.0 | O307: =(C307+F307+L307+I307) -> 170 | P307: =(O307/170)*100 -> 100.0 | Q307: =(O307/185)*100 -> 91.891891891891902
B308: g. Problem-solving
B309: To a great extent | C309: 14 | D309: =(C309/33)*100 -> 42.424242424242422 | E309: =(C309/34)*100 -> 41.17647058823529 | F309: 19 | G309: =(F309/41)*100 -> 46.341463414634148 | H309: =(F309/49)*100 -> 38.775510204081634 | I309: 18 | J309: =(I309/51)*100 -> 35.294117647058826 | K309: =(I309/57)*100 -> 31.578947368421051 | L309: 21 | M309: =(L309/45)*100 -> 46.666666666666664 | N309: =(L309/45)*100 -> 46.666666666666664 | O309: =(C309+F309+L309+I309) -> 72 | P309: =(O309/170)*100 -> 42.352941176470587 | Q309: =(O309/185)*100 -> 38.918918918918919
B310: To a moderate extent | C310: 14 | D310: =(C310/33)*100 -> 42.424242424242422 | E310: =(C310/34)*100 -> 41.17647058823529 | F310: 16 | G310: =(F310/41)*100 -> 39.024390243902438 | H310: =(F310/49)*100 -> 32.653061224489797 | I310: 22 | J310: =(I310/51)*100 -> 43.137254901960787 | K310: =(I310/57)*100 -> 38.596491228070171 | L310: 19 | M310: =(L310/45)*100 -> 42.222222222222221 | N310: =(L310/45)*100 -> 42.222222222222221 | O310: =(C310+F310+L310+I310) -> 71 | P310: =(O310/170)*100 -> 41.764705882352942 | Q310: =(O310/185)*100 -> 38.378378378378379
B311: To a small extent | C311: 5 | D311: =(C311/33)*100 -> 15.151515151515152 | E311: =(C311/34)*100 -> 14.705882352941178 | F311: 3 | G311: =(F311/41)*100 -> 7.3170731707317067 | H311: =(F311/49)*100 -> 6.1224489795918364 | I311: 10 | J311: =(I311/51)*100 -> 19.607843137254903 | K311: =(I311/57)*100 -> 17.543859649122805 | L311: 4 | M311: =(L311/45)*100 -> 8.8888888888888893 | N311: =(L311/45)*100 -> 8.8888888888888893 | O311: =(C311+F311+L311+I311) -> 22 | P311: =(O311/170)*100 -> 12.941176470588237 | Q311: =(O311/185)*100 -> 11.891891891891893
B312: Not at all | C312: 0 | D312: =(C312/33)*100 -> 0.0 | E312: =(C312/34)*100 -> 0.0 | F312: 3 | G312: =(F312/41)*100 -> 7.3170731707317067 | H312: =(F312/49)*100 -> 6.1224489795918364 | I312: 1 | J312: =(I312/51)*100 -> 1.9607843137254901 | K312: =(I312/57)*100 -> 1.7543859649122806 | L312: 1 | M312: =(L312/45)*100 -> 2.2222222222222223 | N312: =(L312/45)*100 -> 2.2222222222222223 | O312: =(C312+F312+L312+I312) -> 5 | P312: =(O312/170)*100 -> 2.9411764705882351 | Q312: =(O312/185)*100 -> 2.7027027027027026
B313: Total | C313: =SUM(C309:C312) -> 33 | D313: =(C313/33)*100 -> 100.0 | E313: =(C313/34)*100 -> 97.058823529411768 | F313: =SUM(F309:F312) -> 41 | G313: =(F313/41)*100 -> 100.0 | H313: =(F313/49)*100 -> 83.673469387755105 | I313: =SUM(I309:I312) -> 51 | J313: =(I313/51)*100 -> 100.0 | K313: =(I313/57)*100 -> 89.473684210526315 | L313: 45 | M313: =(L313/45)*100 -> 100.0 | N313: =(L313/45)*100 -> 100.0 | O313: =(C313+F313+L313+I313) -> 170 | P313: =(O313/170)*100 -> 100.0 | Q313: =(O313/185)*100 -> 91.891891891891902
B314: h. Test-taking
B315: To a great extent | C315: 0 | D315: =(C315/33)*100 -> 0.0 | E315: =(C315/34)*100 -> 0.0 | F315: 2 | G315: =(F315/39)*100 -> 5.1282051282051277 | H315: =(F315/49)*100 -> 4.0816326530612246 | I315: 0 | J315: =(I315/51)*100 -> 0.0 | K315: =(I315/57)*100 -> 0.0 | L315: 2 | M315: =(L315/42)*100 -> 4.7619047619047619 | N315: =(L315/45)*100 -> 4.4444444444444446 | O315: =(C315+F315+L315+I315) -> 4 | P315: =(O315/165)*100 -> 2.4242424242424243 | Q315: =(O315/185)*100 -> 2.1621621621621623
B316: To a moderate extent | C316: 3 | D316: =(C316/33)*100 -> 9.0909090909090917 | E316: =(C316/34)*100 -> 8.8235294117647065 | F316: 7 | G316: =(F316/39)*100 -> 17.948717948717949 | H316: =(F316/49)*100 -> 14.285714285714285 | I316: 4 | J316: =(I316/51)*100 -> 7.8431372549019605 | K316: =(I316/57)*100 -> 7.0175438596491224 | L316: 11 | M316: =(L316/42)*100 -> 26.190476190476193 | N316: =(L316/45)*100 -> 24.444444444444443 | O316: =(C316+F316+L316+I316) -> 25 | P316: =(O316/165)*100 -> 15.151515151515152 | Q316: =(O316/185)*100 -> 13.513513513513514
B317: To a small extent | C317: 17 | D317: =(C317/33)*100 -> 51.515151515151516 | E317: =(C317/34)*100 -> 50.0 | F317: 24 | G317: =(F317/39)*100 -> 61.53846153846154 | H317: =(F317/49)*100 -> 48.979591836734691 | I317: 16 | J317: =(I317/51)*100 -> 31.372549019607842 | K317: =(I317/57)*100 -> 28.07017543859649 | L317: 10 | M317: =(L317/42)*100 -> 23.809523809523807 | N317: =(L317/45)*100 -> 22.222222222222221 | O317: =(C317+F317+L317+I317) -> 67 | P317: =(O317/165)*100 -> 40.606060606060609 | Q317: =(O317/185)*100 -> 36.216216216216218
B318: Not at all | C318: 13 | D318: =(C318/33)*100 -> 39.393939393939391 | E318: =(C318/34)*100 -> 38.235294117647058 | F318: 6 | G318: =(F318/39)*100 -> 15.384615384615385 | H318: =(F318/49)*100 -> 12.244897959183673 | I318: 31 | J318: =(I318/51)*100 -> 60.784313725490193 | K318: =(I318/57)*100 -> 54.385964912280706 | L318: 19 | M318: =(L318/42)*100 -> 45.238095238095241 | N318: =(L318/45)*100 -> 42.222222222222221 | O318: =(C318+F318+L318+I318) -> 69 | P318: =(O318/165)*100 -> 41.818181818181813 | Q318: =(O318/185)*100 -> 37.297297297297298
B319: Total | C319: =SUM(C315:C318) -> 33 | D319: =(C319/33)*100 -> 100.0 | E319: =(C319/34)*100 -> 97.058823529411768 | F319: =SUM(F315:F318) -> 39 | G319: =(F319/39)*100 -> 100.0 | H319: =(F319/49)*100 -> 79.591836734693871 | I319: =SUM(I315:I318) -> 51 | J319: =(I319/51)*100 -> 100.0 | K319: =(I319/57)*100 -> 89.473684210526315 | L319: =SUM(L315:L318) -> 42 | M319: =(L319/42)*100 -> 100.0 | N319: =(L319/45)*100 -> 93.333333333333329 | O319: =(C319+F319+L319+I319) -> 165 | P319: =(O319/165)*100 -> 100.0 | Q319: =(O319/185)*100 -> 89.189189189189193
B320: I. Laboratory work
B321: To a great extent | C321: 3 | D321: =(C321/34)*100 -> 8.8235294117647065 | E321: =(C321/34)*100 -> 8.8235294117647065 | F321: 4 | G321: =(F321/40)*100 -> 10.0 | H321: =(F321/49)*100 -> 8.1632653061224492 | I321: 8 | J321: =(I321/48)*100 -> 16.666666666666664 | K321: =(I321/57)*100 -> 14.035087719298245 | L321: 5 | M321: =(L321/43)*100 -> 11.627906976744185 | N321: =(L321/45)*100 -> 11.111111111111111 | O321: =(C321+F321+L321+I321) -> 20 | P321: =(O321/165)*100 -> 12.121212121212121 | Q321: =(O321/185)*100 -> 10.810810810810811
B322: To a moderate extent | C322: 8 | D322: =(C322/34)*100 -> 23.52941176470588 | E322: =(C322/34)*100 -> 23.52941176470588 | F322: 6 | G322: =(F322/40)*100 -> 15.0 | H322: =(F322/49)*100 -> 12.244897959183673 | I322: 3 | J322: =(I322/48)*100 -> 6.25 | K322: =(I322/57)*100 -> 5.2631578947368416 | L322: 5 | M322: =(L322/43)*100 -> 11.627906976744185 | N322: =(L322/45)*100 -> 11.111111111111111 | O322: =(C322+F322+L322+I322) -> 22 | P322: =(O322/165)*100 -> 13.333333333333334 | Q322: =(O322/185)*100 -> 11.891891891891893
B323: To a small extent | C323: 5 | D323: =(C323/34)*100 -> 14.705882352941178 | E323: =(C323/34)*100 -> 14.705882352941178 | F323: 2 | G323: =(F323/40)*100 -> 5.0 | H323: =(F323/49)*100 -> 4.0816326530612246 | I323: 6 | J323: =(I323/48)*100 -> 12.5 | K323: =(I323/57)*100 -> 10.526315789473683 | L323: 4 | M323: =(L323/43)*100 -> 9.3023255813953494 | N323: =(L323/45)*100 -> 8.8888888888888893 | O323: =(C323+F323+L323+I323) -> 17 | P323: =(O323/165)*100 -> 10.303030303030303 | Q323: =(O323/185)*100 -> 9.1891891891891895
B324: Not at all | C324: 18 | D324: =(C324/34)*100 -> 52.941176470588239 | E324: =(C324/34)*100 -> 52.941176470588239 | F324: 28 | G324: =(F324/40)*100 -> 70.0 | H324: =(F324/49)*100 -> 57.142857142857139 | I324: 31 | J324: =(I324/48)*100 -> 64.583333333333343 | K324: =(I324/57)*100 -> 54.385964912280706 | L324: 29 | M324: =(L324/43)*100 -> 67.441860465116278 | N324: =(L324/45)*100 -> 64.444444444444443 | O324: =(C324+F324+L324+I324) -> 106 | P324: =(O324/165)*100 -> 64.242424242424249 | Q324: =(O324/185)*100 -> 57.297297297297298
B325: Total | C325: =SUM(C321:C324) -> 34 | D325: =(C325/34)*100 -> 100.0 | E325: =(C325/34)*100 -> 100.0 | F325: =SUM(F321:F324) -> 40 | G325: =(F325/40)*100 -> 100.0 | H325: =(F325/49)*100 -> 81.632653061224488 | I325: =SUM(I321:I324) -> 48 | J325: =(I325/48)*100 -> 100.0 | K325: =(I325/57)*100 -> 84.210526315789465 | L325: =SUM(L321:L324) -> 43 | M325: =(L325/43)*100 -> 100.0 | N325: =(L325/45)*100 -> 95.555555555555557 | O325: =(C325+F325+L325+I325) -> 165 | P325: =(O325/165)*100 -> 100.0 | Q325: =(O325/185)*100 -> 89.189189189189193
B326: J. Other
B327: To a great extent | C327: 2 | D327: =(C327/4)*100 -> 50.0 | E327: =(C327/34)*100 -> 5.8823529411764701 | F327: 2 | G327: =(F327/3)*100 -> 66.666666666666657 | H327: =(F327/49)*100 -> 4.0816326530612246 | I327: 7 | J327: =(I327/9)*100 -> 77.777777777777786 | K327: =(I327/57)*100 -> 12.280701754385964 | L327: 4 | M327: =(L327/5)*100 -> 80.0 | N327: =(L327/45)*100 -> 8.8888888888888893 | O327: =(C327+F327+L327+I327) -> 15 | P327: =(O327/21)*100 -> 71.428571428571431 | Q327: =(O327/185)*100 -> 8.1081081081081088
B328: To a moderate extent | C328: 2 | D328: =(C328/4)*100 -> 50.0 | E328: =(C328/34)*100 -> 5.8823529411764701 | F328: 1 | G328: =(F328/3)*100 -> 33.333333333333329 | H328: =(F328/49)*100 -> 2.0408163265306123 | I328: 2 | J328: =(I328/9)*100 -> 22.222222222222221 | K328: =(I328/57)*100 -> 3.5087719298245612 | L328: 1 | M328: =(L328/5)*100 -> 20.0 | N328: =(L328/45)*100 -> 2.2222222222222223 | O328: =(C328+F328+L328+I328) -> 6 | P328: =(O328/21)*100 -> 28.571428571428569 | Q328: =(O328/185)*100 -> 3.2432432432432434
B329: To a small extent | C329: 0 | D329: =(C329/4)*100 -> 0.0 | E329: =(C329/34)*100 -> 0.0 | F329: 0 | G329: =(F329/3)*100 -> 0.0 | H329: =(F329/49)*100 -> 0.0 | I329: 0 | J329: =(I329/9)*100 -> 0.0 | K329: =(I329/57)*100 -> 0.0 | L329: 0 | M329: =(L329/5)*100 -> 0.0 | N329: =(L329/45)*100 -> 0.0 | O329: =(C329+F329+L329+I329) -> 0 | P329: =(O329/21)*100 -> 0.0 | Q329: =(O329/185)*100 -> 0.0
B330: Not at all | C330: 0 | D330: =(C330/4)*100 -> 0.0 | E330: =(C330/34)*100 -> 0.0 | F330: 0 | G330: =(F330/3)*100 -> 0.0 | H330: =(F330/49)*100 -> 0.0 | I330: 0 | J330: =(I330/9)*100 -> 0.0 | K330: =(I330/57)*100 -> 0.0 | L330: 0 | M330: =(L330/5)*100 -> 0.0 | N330: =(L330/45)*100 -> 0.0 | O330: =(C330+F330+L330+I330) -> 0 | P330: =(O330/21)*100 -> 0.0 | Q330: =(O330/185)*100 -> 0.0
B331: Total | C331: =SUM(C327:C330) -> 4 | D331: =(C331/4)*100 -> 100.0 | E331: =(C331/34)*100 -> 11.76470588235294 | F331: =SUM(F327:F330) -> 3 | G331: =(F331/3)*100 -> 100.0 | H331: =(F331/49)*100 -> 6.1224489795918364 | I331: =SUM(I327:I330) -> 9 | J331: =(I331/9)*100 -> 100.0 | K331: =(I331/57)*100 -> 15.789473684210526 | L331: =SUM(L327:L330) -> 5 | M331: =(L331/5)*100 -> 100.0 | N331: =(L331/45)*100 -> 11.111111111111111 | O331: =(C331+F331+L331+I331) -> 21 | P331: =(O331/21)*100 -> 100.0 | Q331: =(O331/185)*100 -> 11.351351351351353
A333: 18 | B333: Extent of the unit teaching students' competencies | C333: FRQ | D333: % T2 | E333: % T1 | F333: FRQ | G333: % T2 | H333: % T1 | I333: FRQ | J333: % T2 | K333: % T1 | L333: FRQ | M333: % T2 | N333: % T1 | O333: FRQ | P333: % T2 | Q333: % T1
B334: a. Reading
B335: To a great extent | C335: 19 | D335: =(C335/34)*100 -> 55.882352941176471 | E335: =(C335/34)*100 -> 55.882352941176471 | F335: 28 | G335: =(F335/46)*100 -> 60.869565217391312 | H335: =(F335/49)*100 -> 57.142857142857139 | I335: 25 | J335: =(I335/50)*100 -> 50.0 | K335: =(I335/57)*100 -> 43.859649122807014 | L335: 21 | M335: =(L335/45)*100 -> 46.666666666666664 | N335: =(L335/45)*100 -> 46.666666666666664 | O335: =(C335+F335+L335+I335) -> 93 | P335: =(O335/175)*100 -> 53.142857142857146 | Q335: =(O335/185)*100 -> 50.270270270270267
B336: To a moderate extent | C336: 6 | D336: =(C336/34)*100 -> 17.647058823529413 | E336: =(C336/34)*100 -> 17.647058823529413 | F336: 15 | G336: =(F336/46)*100 -> 32.608695652173914 | H336: =(F336/49)*100 -> 30.612244897959183 | I336: 15 | J336: =(I336/50)*100 -> 30.0 | K336: =(I336/57)*100 -> 26.315789473684209 | L336: 15 | M336: =(L336/45)*100 -> 33.333333333333329 | N336: =(L336/45)*100 -> 33.333333333333329 | O336: =(C336+F336+L336+I336) -> 51 | P336: =(O336/175)*100 -> 29.142857142857142 | Q336: =(O336/185)*100 -> 27.567567567567568
B337: To a small extent | C337: 9 | D337: =(C337/34)*100 -> 26.47058823529412 | E337: =(C337/34)*100 -> 26.47058823529412 | F337: 2 | G337: =(F337/46)*100 -> 4.3478260869565215 | H337: =(F337/49)*100 -> 4.0816326530612246 | I337: 7 | J337: =(I337/50)*100 -> 14.0 | K337: =(I337/57)*100 -> 12.280701754385964 | L337: 7 | M337: =(L337/45)*100 -> 15.555555555555555 | N337: =(L337/45)*100 -> 15.555555555555555 | O337: =(C337+F337+L337+I337) -> 25 | P337: =(O337/175)*100 -> 14.285714285714285 | Q337: =(O337/185)*100 -> 13.513513513513514
B338: Not at all | C338: 0 | D338: =(C338/34)*100 -> 0.0 | E338: =(C338/34)*100 -> 0.0 | F338: 1 | G338: =(F338/46)*100 -> 2.1739130434782608 | H338: =(F338/49)*100 -> 2.0408163265306123 | I338: 3 | J338: =(I338/50)*100 -> 6.0 | K338: =(I338/57)*100 -> 5.2631578947368416 | L338: 2 | M338: =(L338/45)*100 -> 4.4444444444444446 | N338: =(L338/45)*100 -> 4.4444444444444446 | O338: =(C338+F338+L338+I338) -> 6 | P338: =(O338/175)*100 -> 3.4285714285714288 | Q338: =(O338/185)*100 -> 3.2432432432432434
B339: Total | C339: =SUM(C335:C338) -> 34 | D339: =(C339/34)*100 -> 100.0 | E339: =(C339/34)*100 -> 100.0 | F339: =SUM(F335:F338) -> 46 | G339: =(F339/46)*100 -> 100.0 | H339: =(F339/49)*100 -> 93.877551020408163 | I339: =SUM(I335:I338) -> 50 | J339: =(I339/50)*100 -> 100.0 | K339: =(I339/57)*100 -> 87.719298245614027 | L339: =SUM(L335:L338) -> 45 | M339: =(L339/45)*100 -> 100.0 | N339: =(L339/45)*100 -> 100.0 | O339: =(C339+F339+L339+I339) -> 175 | P339: =(O339/175)*100 -> 100.0 | Q339: =(O339/185)*100 -> 94.594594594594597
B340: b. Writing
B341: To a great extent | C341: 15 | D341: =(C341/34)*100 -> 44.117647058823529 | E341: =(C341/34)*100 -> 44.117647058823529 | F341: 22 | G341: =(F341/45)*100 -> 48.888888888888886 | H341: =(F341/49)*100 -> 44.897959183673471 | I341: 26 | J341: =(I341/50)*100 -> 52.0 | K341: =(I341/57)*100 -> 45.614035087719294 | L341: 25 | M341: =(L341/45)*100 -> 55.555555555555557 | N341: =(L341/45)*100 -> 55.555555555555557 | O341: =(C341+F341+L341+I341) -> 88 | P341: =(O341/174)*100 -> 50.574712643678168 | Q341: =(O341/185)*100 -> 47.567567567567572
B342: To a moderate extent | C342: 10 | D342: =(C342/34)*100 -> 29.411764705882355 | E342: =(C342/34)*100 -> 29.411764705882355 | F342: 17 | G342: =(F342/45)*100 -> 37.777777777777779 | H342: =(F342/49)*100 -> 34.693877551020407 | I342: 15 | J342: =(I342/50)*100 -> 30.0 | K342: =(I342/57)*100 -> 26.315789473684209 | L342: 12 | M342: =(L342/45)*100 -> 26.666666666666668 | N342: =(L342/45)*100 -> 26.666666666666668 | O342: =(C342+F342+L342+I342) -> 54 | P342: =(O342/174)*100 -> 31.03448275862069 | Q342: =(O342/185)*100 -> 29.189189189189189
B343: To a small extent | C343: 8 | D343: =(C343/34)*100 -> 23.52941176470588 | E343: =(C343/34)*100 -> 23.52941176470588 | F343: 5 | G343: =(F343/45)*100 -> 11.111111111111111 | H343: =(F343/49)*100 -> 10.204081632653061 | I343: 6 | J343: =(I343/50)*100 -> 12.0 | K343: =(I343/57)*100 -> 10.526315789473683 | L343: 6 | M343: =(L343/45)*100 -> 13.333333333333334 | N343: =(L343/45)*100 -> 13.333333333333334 | O343: =(C343+F343+L343+I343) -> 25 | P343: =(O343/174)*100 -> 14.367816091954023 | Q343: =(O343/185)*100 -> 13.513513513513514
B344: Not at all | C344: 1 | D344: =(C344/34)*100 -> 2.9411764705882351 | E344: =(C344/34)*100 -> 2.9411764705882351 | F344: 1 | G344: =(F344/45)*100 -> 2.2222222222222223 | H344: =(F344/49)*100 -> 2.0408163265306123 | I344: 3 | J344: =(I344/50)*100 -> 6.0 | K344: =(I344/57)*100 -> 5.2631578947368416 | L344: 2 | M344: =(L344/45)*100 -> 4.4444444444444446 | N344: =(L344/45)*100 -> 4.4444444444444446 | O344: =(C344+F344+L344+I344) -> 7 | P344: =(O344/174)*100 -> 4.0229885057471266 | Q344: =(O344/185)*100 -> 3.7837837837837842
B345: Total | C345: =SUM(C341:C344) -> 34 | D345: =(C345/34)*100 -> 100.0 | E345: =(C345/34)*100 -> 100.0 | F345: =SUM(F341:F344) -> 45 | G345: =(F345/45)*100 -> 100.0 | H345: =(F345/49)*100 -> 91.83673469387756 | I345: =SUM(I341:I344) -> 50 | J345: =(I345/50)*100 -> 100.0 | K345: =(I345/57)*100 -> 87.719298245614027 | L345: =SUM(L341:L344) -> 45 | M345: =(L345/45)*100 -> 100.0 | N345: =(L345/45)*100 -> 100.0 | O345: =(C345+F345+L345+I345) -> 174 | P345: =(O345/174)*100 -> 100.0 | Q345: =(O345/185)*100 -> 94.054054054054063
B346: c. Speaking and listening
B347: To a great extent | C347: 21 | D347: =(C347/34)*100 -> 61.764705882352942 | E347: =(C347/34)*100 -> 61.764705882352942 | F347: 28 | G347: =(F347/45)*100 -> 62.222222222222221 | H347: =(F347/49)*100 -> 57.142857142857139 | I347: 31 | J347: =(I347/51)*100 -> 60.784313725490193 | K347: =(I347/57)*100 -> 54.385964912280706 | L347: 26 | M347: =(L347/45)*100 -> 57.777777777777771 | N347: =(L347/45)*100 -> 57.777777777777771 | O347: =(C347+F347+L347+I347) -> 106 | P347: =(O347/175)*100 -> 60.571428571428577 | Q347: =(O347/185)*100 -> 57.297297297297298
B348: To a moderate extent | C348: 8 | D348: =(C348/34)*100 -> 23.52941176470588 | E348: =(C348/34)*100 -> 23.52941176470588 | F348: 13 | G348: =(F348/45)*100 -> 28.888888888888886 | H348: =(F348/49)*100 -> 26.530612244897959 | I348: 12 | J348: =(I348/51)*100 -> 23.52941176470588 | K348: =(I348/57)*100 -> 21.052631578947366 | L348: 14 | M348: =(L348/45)*100 -> 31.111111111111111 | N348: =(L348/45)*100 -> 31.111111111111111 | O348: =(C348+F348+L348+I348) -> 47 | P348: =(O348/175)*100 -> 26.857142857142858 | Q348: =(O348/185)*100 -> 25.405405405405407
B349: To a small extent | C349: 5 | D349: =(C349/34)*100 -> 14.705882352941178 | E349: =(C349/34)*100 -> 14.705882352941178 | F349: 4 | G349: =(F349/45)*100 -> 8.8888888888888893 | H349: =(F349/49)*100 -> 8.1632653061224492 | I349: 6 | J349: =(I349/51)*100 -> 11.76470588235294 | K349: =(I349/57)*100 -> 10.526315789473683 | L349: 3 | M349: =(L349/45)*100 -> 6.666666666666667 | N349: =(L349/45)*100 -> 6.666666666666667 | O349: =(C349+F349+L349+I349) -> 18 | P349: =(O349/175)*100 -> 10.285714285714285 | Q349: =(O349/185)*100 -> 9.7297297297297298
B350: Not at all | C350: 0 | D350: =(C350/34)*100 -> 0.0 | E350: =(C350/34)*100 -> 0.0 | F350: 0 | G350: =(F350/45)*100 -> 0.0 | H350: =(F350/49)*100 -> 0.0 | I350: 2 | J350: =(I350/51)*100 -> 3.9215686274509802 | K350: =(I350/57)*100 -> 3.5087719298245612 | L350: 2 | M350: =(L350/45)*100 -> 4.4444444444444446 | N350: =(L350/45)*100 -> 4.4444444444444446 | O350: =(C350+F350+L350+I350) -> 4 | P350: =(O350/175)*100 -> 2.2857142857142856 | Q350: =(O350/185)*100 -> 2.1621621621621623
B351: Total | C351: =SUM(C347:C350) -> 34 | D351: =(C351/34)*100 -> 100.0 | E351: =(C351/34)*100 -> 100.0 | F351: =SUM(F347:F350) -> 45 | G351: =(F351/45)*100 -> 100.0 | H351: =(F351/49)*100 -> 91.83673469387756 | I351: =SUM(I347:I350) -> 51 | J351: =(I351/51)*100 -> 100.0 | K351: =(I351/57)*100 -> 89.473684210526315 | L351: =SUM(L347:L350) -> 45 | M351: =(L351/45)*100 -> 100.0 | N351: =(L351/45)*100 -> 100.0 | O351: =(C351+F351+L351+I351) -> 175 | P351: =(O351/175)*100 -> 100.0 | Q351: =(O351/185)*100 -> 94.594594594594597
B352: d. Mathematics
B353: To a great extent | C353: 2 | D353: =(C353/33)*100 -> 6.0606060606060606 | E353: =(C353/34)*100 -> 5.8823529411764701 | F353: 5 | G353: =(F353/39)*100 -> 12.820512820512819 | H353: =(F353/49)*100 -> 10.204081632653061 | I353: 3 | J353: =(I353/47)*100 -> 6.3829787234042552 | K353: =(I353/57)*100 -> 5.2631578947368416 | L353: 4 | M353: =(L353/45)*100 -> 8.8888888888888893 | N353: =(L353/45)*100 -> 8.8888888888888893 | O353: =(C353+F353+L353+I353) -> 14 | P353: =(O353/164)*100 -> 8.536585365853659 | Q353: =(O353/185)*100 -> 7.5675675675675684
B354: To a moderate extent | C354: 4 | D354: =(C354/33)*100 -> 12.121212121212121 | E354: =(C354/34)*100 -> 11.76470588235294 | F354: 1 | G354: =(F354/39)*100 -> 2.5641025641025639 | H354: =(F354/49)*100 -> 2.0408163265306123 | I354: 7 | J354: =(I354/47)*100 -> 14.893617021276595 | K354: =(I354/57)*100 -> 12.280701754385964 | L354: 6 | M354: =(L354/45)*100 -> 13.333333333333334 | N354: =(L354/45)*100 -> 13.333333333333334 | O354: =(C354+F354+L354+I354) -> 18 | P354: =(O354/164)*100 -> 10.975609756097562 | Q354: =(O354/185)*100 -> 9.7297297297297298
B355: To a small extent | C355: 14 | D355: =(C355/33)*100 -> 42.424242424242422 | E355: =(C355/34)*100 -> 41.17647058823529 | F355: 6 | G355: =(F355/39)*100 -> 15.384615384615385 | H355: =(F355/49)*100 -> 12.244897959183673 | I355: 22 | J355: =(I355/47)*100 -> 46.808510638297875 | K355: =(I355/57)*100 -> 38.596491228070171 | L355: 14 | M355: =(L355/45)*100 -> 31.111111111111111 | N355: =(L355/45)*100 -> 31.111111111111111 | O355: =(C355+F355+L355+I355) -> 56 | P355: =(O355/164)*100 -> 34.146341463414636 | Q355: =(O355/185)*100 -> 30.270270270270274
B356: Not at all | C356: 13 | D356: =(C356/33)*100 -> 39.393939393939391 | E356: =(C356/34)*100 -> 38.235294117647058 | F356: 27 | G356: =(F356/39)*100 -> 69.230769230769226 | H356: =(F356/49)*100 -> 55.102040816326522 | I356: 15 | J356: =(I356/47)*100 -> 31.914893617021278 | K356: =(I356/57)*100 -> 26.315789473684209 | L356: 21 | M356: =(L356/45)*100 -> 46.666666666666664 | N356: =(L356/45)*100 -> 46.666666666666664 | O356: =(C356+F356+L356+I356) -> 76 | P356: =(O356/164)*100 -> 46.341463414634148 | Q356: =(O356/185)*100 -> 41.081081081081081
B357: Total | C357: =SUM(C353:C356) -> 33 | D357: =(C357/33)*100 -> 100.0 | E357: =(C357/34)*100 -> 97.058823529411768 | F357: =SUM(F353:F356) -> 39 | G357: =(F357/39)*100 -> 100.0 | H357: =(F357/49)*100 -> 79.591836734693871 | I357: =SUM(I353:I356) -> 47 | J357: =(I357/47)*100 -> 100.0 | K357: =(I357/57)*100 -> 82.456140350877192 | L357: =SUM(L353:L356) -> 45 | M357: =(L357/45)*100 -> 100.0 | N357: =(L357/45)*100 -> 100.0 | O357: =(C357+F357+L357+I357) -> 164 | P357: =(O357/164)*100 -> 100.0 | Q357: =(O357/185)*100 -> 88.64864864864866
B358: e. Reasoning
B359: To a great extent | C359: 15 | D359: =(C359/34)*100 -> 44.117647058823529 | E359: =(C359/34)*100 -> 44.117647058823529 | F359: 24 | G359: =(F359/43)*100 -> 55.813953488372093 | H359: =(F359/49)*100 -> 48.979591836734691 | I359: 28 | J359: =(I359/49)*100 -> 57.142857142857139 | K359: =(I359/57)*100 -> 49.122807017543856 | L359: 22 | M359: =(L359/45)*100 -> 48.888888888888886 | N359: =(L359/45)*100 -> 48.888888888888886 | O359: =(C359+F359+L359+I359) -> 89 | P359: =(O359/171)*100 -> 52.046783625730995 | Q359: =(O359/185)*100 -> 48.108108108108112
B360: To a moderate extent | C360: 14 | D360: =(C360/34)*100 -> 41.17647058823529 | E360: =(C360/34)*100 -> 41.17647058823529 | F360: 16 | G360: =(F360/43)*100 -> 37.209302325581397 | H360: =(F360/49)*100 -> 32.653061224489797 | I360: 14 | J360: =(I360/49)*100 -> 28.571428571428569 | K360: =(I360/57)*100 -> 24.561403508771928 | L360: 18 | M360: =(L360/45)*100 -> 40.0 | N360: =(L360/45)*100 -> 40.0 | O360: =(C360+F360+L360+I360) -> 62 | P360: =(O360/171)*100 -> 36.257309941520468 | Q360: =(O360/185)*100 -> 33.513513513513516
B361: To a small extent | C361: 5 | D361: =(C361/34)*100 -> 14.705882352941178 | E361: =(C361/34)*100 -> 14.705882352941178 | F361: 3 | G361: =(F361/43)*100 -> 6.9767441860465116 | H361: =(F361/49)*100 -> 6.1224489795918364 | I361: 6 | J361: =(I361/49)*100 -> 12.244897959183673 | K361: =(I361/57)*100 -> 10.526315789473683 | L361: 4 | M361: =(L361/45)*100 -> 8.8888888888888893 | N361: =(L361/45)*100 -> 8.8888888888888893 | O361: =(C361+F361+L361+I361) -> 18 | P361: =(O361/171)*100 -> 10.526315789473683 | Q361: =(O361/185)*100 -> 9.7297297297297298
B362: Not at all | C362: 0 | D362: =(C362/34)*100 -> 0.0 | E362: =(C362/34)*100 -> 0.0 | F362: 0 | G362: =(F362/43)*100 -> 0.0 | H362: =(F362/49)*100 -> 0.0 | I362: 1 | J362: =(I362/49)*100 -> 2.0408163265306123 | K362: =(I362/57)*100 -> 1.7543859649122806 | L362: 1 | M362: =(L362/45)*100 -> 2.2222222222222223 | N362: =(L362/45)*100 -> 2.2222222222222223 | O362: =(C362+F362+L362+I362) -> 2 | P362: =(O362/171)*100 -> 1.1695906432748537 | Q362: =(O362/185)*100 -> 1.0810810810810811
B363: Total | C363: =SUM(C359:C362) -> 34 | D363: =(C363/34)*100 -> 100.0 | E363: =(C363/34)*100 -> 100.0 | F363: =SUM(F359:F362) -> 43 | G363: =(F363/43)*100 -> 100.0 | H363: =(F363/49)*100 -> 87.755102040816325 | I363: =SUM(I359:I362) -> 49 | J363: =(I363/49)*100 -> 100.0 | K363: =(I363/57)*100 -> 85.964912280701753 | L363: =SUM(L359:L362) -> 45 | M363: =(L363/45)*100 -> 100.0 | N363: =(L363/45)*100 -> 100.0 | O363: =(C363+F363+L363+I363) -> 171 | P363: =(O363/171)*100 -> 100.0 | Q363: =(O363/185)*100 -> 92.432432432432435
B364: f. Computer competency
B365: To a great extent | C365: 5 | D365: =(C365/32)*100 -> 15.625 | E365: =(C365/34)*100 -> 14.705882352941178 | F365: 3 | G365: =(F365/40)*100 -> 7.5 | H365: =(F365/49)*100 -> 6.1224489795918364 | I365: 11 | J365: =(I365/49)*100 -> 22.448979591836736 | K365: =(I365/57)*100 -> 19.298245614035086 | L365: 8 | M365: =(L365/45)*100 -> 17.777777777777779 | N365: =(L365/45)*100 -> 17.777777777777779 | O365: =(C365+F365+L365+I365) -> 27 | P365: =(O365/166)*100 -> 16.265060240963855 | Q365: =(O365/185)*100 -> 14.594594594594595
B366: To a moderate extent | C366: 9 | D366: =(C366/32)*100 -> 28.125 | E366: =(C366/34)*100 -> 26.47058823529412 | F366: 9 | G366: =(F366/40)*100 -> 22.5 | H366: =(F366/49)*100 -> 18.367346938775512 | I366: 15 | J366: =(I366/49)*100 -> 30.612244897959183 | K366: =(I366/57)*100 -> 26.315789473684209 | L366: 11 | M366: =(L366/45)*100 -> 24.444444444444443 | N366: =(L366/45)*100 -> 24.444444444444443 | O366: =(C366+F366+L366+I366) -> 44 | P366: =(O366/166)*100 -> 26.506024096385545 | Q366: =(O366/185)*100 -> 23.783783783783786
B367: To a small extent | C367: 10 | D367: =(C367/32)*100 -> 31.25 | E367: =(C367/34)*100 -> 29.411764705882355 | F367: 9 | G367: =(F367/40)*100 -> 22.5 | H367: =(F367/49)*100 -> 18.367346938775512 | I367: 14 | J367: =(I367/49)*100 -> 28.571428571428569 | K367: =(I367/57)*100 -> 24.561403508771928 | L367: 9 | M367: =(L367/45)*100 -> 20.0 | N367: =(L367/45)*100 -> 20.0 | O367: =(C367+F367+L367+I367) -> 42 | P367: =(O367/166)*100 -> 25.301204819277107 | Q367: =(O367/185)*100 -> 22.702702702702705
B368: Not at all | C368: 8 | D368: =(C368/32)*100 -> 25.0 | E368: =(C368/34)*100 -> 23.52941176470588 | F368: 19 | G368: =(F368/40)*100 -> 47.5 | H368: =(F368/49)*100 -> 38.775510204081634 | I368: 9 | J368: =(I368/49)*100 -> 18.367346938775512 | K368: =(I368/57)*100 -> 15.789473684210526 | L368: 17 | M368: =(L368/45)*100 -> 37.777777777777779 | N368: =(L368/45)*100 -> 37.777777777777779 | O368: =(C368+F368+L368+I368) -> 53 | P368: =(O368/166)*100 -> 31.92771084337349 | Q368: =(O368/185)*100 -> 28.648648648648649
B369: Total | C369: =SUM(C365:C368) -> 32 | D369: =(C369/32)*100 -> 100.0 | E369: =(C369/34)*100 -> 94.117647058823522 | F369: =SUM(F365:F368) -> 40 | G369: =(F369/40)*100 -> 100.0 | H369: =(F369/49)*100 -> 81.632653061224488 | I369: =SUM(I365:I368) -> 49 | J369: =(I369/49)*100 -> 100.0 | K369: =(I369/57)*100 -> 85.964912280701753 | L369: =SUM(L365:L368) -> 45 | M369: =(L369/45)*100 -> 100.0 | N369: =(L369/45)*100 -> 100.0 | O369: =(C369+F369+L369+I369) -> 166 | P369: =(O369/166)*100 -> 100.0 | Q369: =(O369/185)*100 -> 89.72972972972974
B370: g. Other
B371: To a great extent | C371: 3 | D371: =(C371/3)*100 -> 100.0 | E371: =(C371/34)*100 -> 8.8235294117647065 | F371: 1 | G371: =(F371/4)*100 -> 25.0 | H371: =(F371/49)*100 -> 2.0408163265306123 | I371: 2 | J371: =(I371/3)*100 -> 66.666666666666657 | K371: =(I371/57)*100 -> 3.5087719298245612 | L371: 6 | M371: =(L371/6)*100 -> 100.0 | N371: =(L371/45)*100 -> 13.333333333333334 | O371: =(C371+F371+L371+I371) -> 12 | P371: =(O371/16)*100 -> 75.0 | Q371: =(O371/185)*100 -> 6.4864864864864868
B372: To a moderate extent | C372: 0 | D372: =(C372/3)*100 -> 0.0 | E372: =(C372/34)*100 -> 0.0 | F372: 2 | G372: =(F372/4)*100 -> 50.0 | H372: =(F372/49)*100 -> 4.0816326530612246 | I372: 1 | J372: =(I372/3)*100 -> 33.333333333333329 | K372: =(I372/57)*100 -> 1.7543859649122806 | L372: 0 | M372: =(L372/6)*100 -> 0.0 | N372: =(L372/45)*100 -> 0.0 | O372: =(C372+F372+L372+I372) -> 3 | P372: =(O372/16)*100 -> 18.75 | Q372: =(O372/185)*100 -> 1.6216216216216217
B373: To a small extent | C373: 0 | D373: =(C373/3)*100 -> 0.0 | E373: =(C373/34)*100 -> 0.0 | F373: 1 | G373: =(F373/4)*100 -> 25.0 | H373: =(F373/49)*100 -> 2.0408163265306123 | I373: 0 | J373: =(I373/3)*100 -> 0.0 | K373: =(I373/57)*100 -> 0.0 | L373: 0 | M373: =(L373/6)*100 -> 0.0 | N373: =(L373/45)*100 -> 0.0 | O373: =(C373+F373+L373+I373) -> 1 | P373: =(O373/16)*100 -> 6.25 | Q373: =(O373/185)*100 -> 0.54054054054054057
B374: Not at all | C374: 0 | D374: =(C374/3)*100 -> 0.0 | E374: =(C374/34)*100 -> 0.0 | F374: 0 | G374: =(F374/4)*100 -> 0.0 | H374: =(F374/49)*100 -> 0.0 | I374: 0 | J374: =(I374/3)*100 -> 0.0 | K374: =(I374/57)*100 -> 0.0 | L374: 0 | M374: =(L374/6)*100 -> 0.0 | N374: =(L374/45)*100 -> 0.0 | O374: =(C374+F374+L374+I374) -> 0 | P374: =(O374/16)*100 -> 0.0 | Q374: =(O374/185)*100 -> 0.0
B375: Total | C375: =SUM(C371:C374) -> 3 | D375: =(C375/3)*100 -> 100.0 | E375: =(C375/34)*100 -> 8.8235294117647065 | F375: =SUM(F371:F374) -> 4 | G375: =(F375/4)*100 -> 100.0 | H375: =(F375/49)*100 -> 8.1632653061224492 | I375: =SUM(I371:I374) -> 3 | J375: =(I375/3)*100 -> 100.0 | K375: =(I375/57)*100 -> 5.2631578947368416 | L375: =SUM(L371:L374) -> 6 | M375: =(L375/6)*100 -> 100.0 | N375: =(L375/45)*100 -> 13.333333333333334 | O375: =(C375+F375+L375+I375) -> 16 | P375: =(O375/16)*100 -> 100.0 | Q375: =(O375/185)*100 -> 8.6486486486486491
A377: 19 | B377: Extent of the unit teaching students' skills | C377: FRQ | D377: % T2 | E377: % T1 | F377: FRQ | G377: % T2 | H377: % T1 | I377: FRQ | J377: % T2 | K377: % T1 | L377: FRQ | M377: % T2 | N377: % T1 | O377: FRQ | P377: % T2 | Q377: % T1
B378: a. Setting goals | K378: =(I378/57)*100 -> 0.0
B379: To a great extent | C379: 7 | D379: =(C379/33)*100 -> 21.212121212121211 | E379: =(C379/34)*100 -> 20.588235294117645 | F379: 15 | G379: =(F379/42)*100 -> 35.714285714285715 | H379: =(F379/49)*100 -> 30.612244897959183 | I379: 18 | J379: =(I379/49)*100 -> 36.734693877551024 | K379: =(I379/57)*100 -> 31.578947368421051 | L379: 19 | M379: =(L379/45)*100 -> 42.222222222222221 | N379: =(L379/45)*100 -> 42.222222222222221 | O379: =(C379+F379+L379+I379) -> 59 | P379: =(O379/169)*100 -> 34.911242603550299 | Q379: =(O379/185)*100 -> 31.891891891891895
B380: To a moderate extent | C380: 10 | D380: =(C380/33)*100 -> 30.303030303030305 | E380: =(C380/34)*100 -> 29.411764705882355 | F380: 12 | G380: =(F380/42)*100 -> 28.571428571428569 | H380: =(F380/49)*100 -> 24.489795918367346 | I380: 16 | J380: =(I380/49)*100 -> 32.653061224489797 | K380: =(I380/57)*100 -> 28.07017543859649 | L380: 10 | M380: =(L380/45)*100 -> 22.222222222222221 | N380: =(L380/45)*100 -> 22.222222222222221 | O380: =(C380+F380+L380+I380) -> 48 | P380: =(O380/169)*100 -> 28.402366863905325 | Q380: =(O380/185)*100 -> 25.945945945945947
B381: To a small extent | C381: 14 | D381: =(C381/33)*100 -> 42.424242424242422 | E381: =(C381/34)*100 -> 41.17647058823529 | F381: 10 | G381: =(F381/42)*100 -> 23.809523809523807 | H381: =(F381/49)*100 -> 20.408163265306122 | I381: 9 | J381: =(I381/49)*100 -> 18.367346938775512 | K381: =(I381/57)*100 -> 15.789473684210526 | L381: 11 | M381: =(L381/45)*100 -> 24.444444444444443 | N381: =(L381/45)*100 -> 24.444444444444443 | O381: =(C381+F381+L381+I381) -> 44 | P381: =(O381/169)*100 -> 26.035502958579883 | Q381: =(O381/185)*100 -> 23.783783783783786
B382: Not at all | C382: 2 | D382: =(C382/33)*100 -> 6.0606060606060606 | E382: =(C382/34)*100 -> 5.8823529411764701 | F382: 5 | G382: =(F382/42)*100 -> 11.904761904761903 | H382: =(F382/49)*100 -> 10.204081632653061 | I382: 6 | J382: =(I382/49)*100 -> 12.244897959183673 | K382: =(I382/57)*100 -> 10.526315789473683 | L382: 5 | M382: =(L382/45)*100 -> 11.111111111111111 | N382: =(L382/45)*100 -> 11.111111111111111 | O382: =(C382+F382+L382+I382) -> 18 | P382: =(O382/169)*100 -> 10.650887573964498 | Q382: =(O382/185)*100 -> 9.7297297297297298
B383: Total | C383: =SUM(C379:C382) -> 33 | D383: =(C383/33)*100 -> 100.0 | E383: =(C383/34)*100 -> 97.058823529411768 | F383: =SUM(F379:F382) -> 42 | G383: =(F383/42)*100 -> 100.0 | H383: =(F383/49)*100 -> 85.714285714285708 | I383: =SUM(I379:I382) -> 49 | J383: =(I383/49)*100 -> 100.0 | K383: =(I383/57)*100 -> 85.964912280701753 | L383: =SUM(L379:L382) -> 45 | M383: =(L383/45)*100 -> 100.0 | N383: =(L383/45)*100 -> 100.0 | O383: =(C383+F383+L383+I383) -> 169 | P383: =(O383/169)*100 -> 100.0 | Q383: =(O383/185)*100 -> 91.351351351351354
B384: b. Using resources
B385: To a great extent | C385: 22 | D385: =(C385/33)*100 -> 66.666666666666657 | E385: =(C385/34)*100 -> 64.705882352941174 | F385: 28 | G385: =(F385/45)*100 -> 62.222222222222221 | H385: =(F385/49)*100 -> 57.142857142857139 | I385: 33 | J385: =(I385/49)*100 -> 67.346938775510196 | K385: =(I385/57)*100 -> 57.894736842105267 | L385: 26 | M385: =(L385/45)*100 -> 57.777777777777771 | N385: =(L385/45)*100 -> 57.777777777777771 | O385: =(C385+F385+L385+I385) -> 109 | P385: =(O385/172)*100 -> 63.372093023255815 | Q385: =(O385/185)*100 -> 58.918918918918919
B386: To a moderate extent | C386: 9 | D386: =(C386/33)*100 -> 27.27272727272727 | E386: =(C386/34)*100 -> 26.47058823529412 | F386: 12 | G386: =(F386/45)*100 -> 26.666666666666668 | H386: =(F386/49)*100 -> 24.489795918367346 | I386: 8 | J386: =(I386/49)*100 -> 16.326530612244898 | K386: =(I386/57)*100 -> 14.035087719298245 | L386: 12 | M386: =(L386/45)*100 -> 26.666666666666668 | N386: =(L386/45)*100 -> 26.666666666666668 | O386: =(C386+F386+L386+I386) -> 41 | P386: =(O386/172)*100 -> 23.837209302325583 | Q386: =(O386/185)*100 -> 22.162162162162165
B387: To a small extent | C387: 2 | D387: =(C387/33)*100 -> 6.0606060606060606 | E387: =(C387/34)*100 -> 5.8823529411764701 | F387: 4 | G387: =(F387/45)*100 -> 8.8888888888888893 | H387: =(F387/49)*100 -> 8.1632653061224492 | I387: 8 | J387: =(I387/49)*100 -> 16.326530612244898 | K387: =(I387/57)*100 -> 14.035087719298245 | L387: 4 | M387: =(L387/45)*100 -> 8.8888888888888893 | N387: =(L387/45)*100 -> 8.8888888888888893 | O387: =(C387+F387+L387+I387) -> 18 | P387: =(O387/172)*100 -> 10.465116279069768 | Q387: =(O387/185)*100 -> 9.7297297297297298
B388: Not at all | C388: 0 | D388: =(C388/33)*100 -> 0.0 | E388: =(C388/34)*100 -> 0.0 | F388: 1 | G388: =(F388/45)*100 -> 2.2222222222222223 | H388: =(F388/49)*100 -> 2.0408163265306123 | I388: 0 | J388: =(I388/49)*100 -> 0.0 | K388: =(I388/57)*100 -> 0.0 | L388: 3 | M388: =(L388/45)*100 -> 6.666666666666667 | N388: =(L388/45)*100 -> 6.666666666666667 | O388: =(C388+F388+L388+I388) -> 4 | P388: =(O388/172)*100 -> 2.3255813953488373 | Q388: =(O388/185)*100 -> 2.1621621621621623
B389: Total | C389: =SUM(C385:C388) -> 33 | D389: =(C389/33)*100 -> 100.0 | E389: =(C389/34)*100 -> 97.058823529411768 | F389: =SUM(F385:F388) -> 45 | G389: =(F389/45)*100 -> 100.0 | H389: =(F389/49)*100 -> 91.83673469387756 | I389: =SUM(I385:I388) -> 49 | J389: =(I389/49)*100 -> 100.0 | K389: =(I389/57)*100 -> 85.964912280701753 | L389: =SUM(L385:L388) -> 45 | M389: =(L389/45)*100 -> 100.0 | N389: =(L389/45)*100 -> 100.0 | O389: =(C389+F389+L389+I389) -> 172 | P389: =(O389/172)*100 -> 100.0 | Q389: =(O389/185)*100 -> 92.972972972972983
B390: c. Developing vocabularies
B391: To a great extent | C391: 18 | D391: =(C391/33)*100 -> 54.54545454545454 | E391: =(C391/34)*100 -> 52.941176470588239 | F391: 30 | G391: =(F391/45)*100 -> 66.666666666666657 | H391: =(F391/49)*100 -> 61.224489795918366 | I391: 23 | J391: =(I391/47)*100 -> 48.936170212765958 | K391: =(I391/57)*100 -> 40.350877192982452 | L391: 20 | M391: =(L391/45)*100 -> 44.444444444444443 | N391: =(L391/45)*100 -> 44.444444444444443 | O391: =(C391+F391+L391+I391) -> 91 | P391: =(O391/170)*100 -> 53.529411764705884 | Q391: =(O391/185)*100 -> 49.189189189189193
B392: To a moderate extent | C392: 11 | D392: =(C392/33)*100 -> 33.333333333333329 | E392: =(C392/34)*100 -> 32.352941176470587 | F392: 11 | G392: =(F392/45)*100 -> 24.444444444444443 | H392: =(F392/49)*100 -> 22.448979591836736 | I392: 20 | J392: =(I392/47)*100 -> 42.553191489361701 | K392: =(I392/57)*100 -> 35.087719298245609 | L392: 17 | M392: =(L392/45)*100 -> 37.777777777777779 | N392: =(L392/45)*100 -> 37.777777777777779 | O392: =(C392+F392+L392+I392) -> 59 | P392: =(O392/170)*100 -> 34.705882352941174 | Q392: =(O392/185)*100 -> 31.891891891891895
B393: To a small extent | C393: 4 | D393: =(C393/33)*100 -> 12.121212121212121 | E393: =(C393/34)*100 -> 11.76470588235294 | F393: 4 | G393: =(F393/45)*100 -> 8.8888888888888893 | H393: =(F393/49)*100 -> 8.1632653061224492 | I393: 3 | J393: =(I393/47)*100 -> 6.3829787234042552 | K393: =(I393/57)*100 -> 5.2631578947368416 | L393: 7 | M393: =(L393/45)*100 -> 15.555555555555555 | N393: =(L393/45)*100 -> 15.555555555555555 | O393: =(C393+F393+L393+I393) -> 18 | P393: =(O393/170)*100 -> 10.588235294117647 | Q393: =(O393/185)*100 -> 9.7297297297297298
B394: Not at all | C394: 0 | D394: =(C394/33)*100 -> 0.0 | E394: =(C394/34)*100 -> 0.0 | F394: 0 | G394: =(F394/45)*100 -> 0.0 | H394: =(F394/49)*100 -> 0.0 | I394: 1 | J394: =(I394/47)*100 -> 2.1276595744680851 | K394: =(I394/57)*100 -> 1.7543859649122806 | L394: 1 | M394: =(L394/45)*100 -> 2.2222222222222223 | N394: =(L394/45)*100 -> 2.2222222222222223 | O394: =(C394+F394+L394+I394) -> 2 | P394: =(O394/170)*100 -> 1.1764705882352942 | Q394: =(O394/185)*100 -> 1.0810810810810811
B395: Total | C395: =SUM(C391:C394) -> 33 | D395: =(C395/33)*100 -> 100.0 | E395: =(C395/34)*100 -> 97.058823529411768 | F395: =SUM(F391:F394) -> 45 | G395: =(F395/45)*100 -> 100.0 | H395: =(F395/49)*100 -> 91.83673469387756 | I395: =SUM(I391:I394) -> 47 | J395: =(I395/47)*100 -> 100.0 | K395: =(I395/57)*100 -> 82.456140350877192 | L395: =SUM(L391:L394) -> 45 | M395: =(L395/45)*100 -> 100.0 | N395: =(L395/45)*100 -> 100.0 | O395: =(C395+F395+L395+I395) -> 170 | P395: =(O395/170)*100 -> 100.0 | Q395: =(O395/185)*100 -> 91.891891891891902
B396: d. Preparing for exam
B397: To a great extent | C397: 1 | D397: =(C397/33)*100 -> 3.0303030303030303 | E397: =(C397/34)*100 -> 2.9411764705882351 | F397: 6 | G397: =(F397/42)*100 -> 14.285714285714285 | H397: =(F397/49)*100 -> 12.244897959183673 | I397: 1 | J397: =(I397/48)*100 -> 2.083333333333333 | K397: =(I397/57)*100 -> 1.7543859649122806 | L397: 2 | M397: =(L397/44)*100 -> 4.5454545454545459 | N397: =(L397/45)*100 -> 4.4444444444444446 | O397: =(C397+F397+L397+I397) -> 10 | P397: =(O397/167)*100 -> 5.9880239520958085 | Q397: =(O397/185)*100 -> 5.4054054054054053
B398: To a moderate extent | C398: 3 | D398: =(C398/33)*100 -> 9.0909090909090917 | E398: =(C398/34)*100 -> 8.8235294117647065 | F398: 9 | G398: =(F398/42)*100 -> 21.428571428571427 | H398: =(F398/49)*100 -> 18.367346938775512 | I398: 4 | J398: =(I398/48)*100 -> 8.3333333333333321 | K398: =(I398/57)*100 -> 7.0175438596491224 | L398: 7 | M398: =(L398/44)*100 -> 15.909090909090908 | N398: =(L398/45)*100 -> 15.555555555555555 | O398: =(C398+F398+L398+I398) -> 23 | P398: =(O398/167)*100 -> 13.77245508982036 | Q398: =(O398/185)*100 -> 12.432432432432433
B399: To a small extent | C399: 15 | D399: =(C399/33)*100 -> 45.454545454545453 | E399: =(C399/34)*100 -> 44.117647058823529 | F399: 18 | G399: =(F399/42)*100 -> 42.857142857142854 | H399: =(F399/49)*100 -> 36.734693877551024 | I399: 17 | J399: =(I399/48)*100 -> 35.416666666666671 | K399: =(I399/57)*100 -> 29.82456140350877 | L399: 22 | M399: =(L399/44)*100 -> 50.0 | N399: =(L399/45)*100 -> 48.888888888888886 | O399: =(C399+F399+L399+I399) -> 72 | P399: =(O399/167)*100 -> 43.113772455089823 | Q399: =(O399/185)*100 -> 38.918918918918919
B400: Not at all | C400: 14 | D400: =(C400/33)*100 -> 42.424242424242422 | E400: =(C400/34)*100 -> 41.17647058823529 | F400: 9 | G400: =(F400/42)*100 -> 21.428571428571427 | H400: =(F400/49)*100 -> 18.367346938775512 | I400: 26 | J400: =(I400/48)*100 -> 54.166666666666664 | K400: =(I400/57)*100 -> 45.614035087719294 | L400: 13 | M400: =(L400/44)*100 -> 29.545454545454547 | N400: =(L400/45)*100 -> 28.888888888888886 | O400: =(C400+F400+L400+I400) -> 62 | P400: =(O400/167)*100 -> 37.125748502994007 | Q400: =(O400/185)*100 -> 33.513513513513516
B401: Total | C401: =SUM(C397:C400) -> 33 | D401: =(C401/33)*100 -> 100.0 | E401: =(C401/34)*100 -> 97.058823529411768 | F401: =SUM(F397:F400) -> 42 | G401: =(F401/42)*100 -> 100.0 | H401: =(F401/49)*100 -> 85.714285714285708 | I401: =SUM(I397:I400) -> 48 | J401: =(I401/48)*100 -> 100.0 | K401: =(I401/57)*100 -> 84.210526315789465 | L401: =SUM(L397:L400) -> 44 | M401: =(L401/44)*100 -> 100.0 | N401: =(L401/45)*100 -> 97.777777777777771 | O401: =(C401+F401+L401+I401) -> 167 | P401: =(O401/167)*100 -> 100.0 | Q401: =(O401/185)*100 -> 90.270270270270274
B402: e. Following instructions
B403: To a great extent | C403: 19 | D403: =(C403/33)*100 -> 57.575757575757578 | E403: =(C403/34)*100 -> 55.882352941176471 | F403: 25 | G403: =(F403/43)*100 -> 58.139534883720934 | H403: =(F403/49)*100 -> 51.020408163265309 | I403: 22 | J403: =(I403/48)*100 -> 45.833333333333329 | K403: =(I403/57)*100 -> 38.596491228070171 | L403: 18 | M403: =(L403/45)*100 -> 40.0 | N403: =(L403/45)*100 -> 40.0 | O403: =(C403+F403+L403+I403) -> 84 | P403: =(O403/169)*100 -> 49.704142011834321 | Q403: =(O403/185)*100 -> 45.405405405405411
B404: To a moderate extent | C404: 11 | D404: =(C404/33)*100 -> 33.333333333333329 | E404: =(C404/34)*100 -> 32.352941176470587 | F404: 13 | G404: =(F404/43)*100 -> 30.232558139534881 | H404: =(F404/49)*100 -> 26.530612244897959 | I404: 17 | J404: =(I404/48)*100 -> 35.416666666666671 | K404: =(I404/57)*100 -> 29.82456140350877 | L404: 18 | M404: =(L404/45)*100 -> 40.0 | N404: =(L404/45)*100 -> 40.0 | O404: =(C404+F404+L404+I404) -> 59 | P404: =(O404/169)*100 -> 34.911242603550299 | Q404: =(O404/185)*100 -> 31.891891891891895
B405: To a small extent | C405: 2 | D405: =(C405/33)*100 -> 6.0606060606060606 | E405: =(C405/34)*100 -> 5.8823529411764701 | F405: 5 | G405: =(F405/43)*100 -> 11.627906976744185 | H405: =(F405/49)*100 -> 10.204081632653061 | I405: 6 | J405: =(I405/48)*100 -> 12.5 | K405: =(I405/57)*100 -> 10.526315789473683 | L405: 8 | M405: =(L405/45)*100 -> 17.777777777777779 | N405: =(L405/45)*100 -> 17.777777777777779 | O405: =(C405+F405+L405+I405) -> 21 | P405: =(O405/169)*100 -> 12.42603550295858 | Q405: =(O405/185)*100 -> 11.351351351351353
B406: Not at all | C406: 1 | D406: =(C406/33)*100 -> 3.0303030303030303 | E406: =(C406/34)*100 -> 2.9411764705882351 | F406: 0 | G406: =(F406/43)*100 -> 0.0 | H406: =(F406/49)*100 -> 0.0 | I406: 3 | J406: =(I406/48)*100 -> 6.25 | K406: =(I406/57)*100 -> 5.2631578947368416 | L406: 1 | M406: =(L406/45)*100 -> 2.2222222222222223 | N406: =(L406/45)*100 -> 2.2222222222222223 | O406: =(C406+F406+L406+I406) -> 5 | P406: =(O406/169)*100 -> 2.9585798816568047 | Q406: =(O406/185)*100 -> 2.7027027027027026
B407: Total | C407: =SUM(C403:C406) -> 33 | D407: =(C407/33)*100 -> 100.0 | E407: =(C407/34)*100 -> 97.058823529411768 | F407: =SUM(F403:F406) -> 43 | G407: =(F407/43)*100 -> 100.0 | H407: =(F407/49)*100 -> 87.755102040816325 | I407: =SUM(I403:I406) -> 48 | J407: =(I407/48)*100 -> 100.0 | K407: =(I407/57)*100 -> 84.210526315789465 | L407: =SUM(L403:L406) -> 45 | M407: =(L407/45)*100 -> 100.0 | N407: =(L407/45)*100 -> 100.0 | O407: =(C407+F407+L407+I407) -> 169 | P407: =(O407/169)*100 -> 100.0 | Q407: =(O407/185)*100 -> 91.351351351351354
B408: f. Accepting criticism
B409: To a great extent | C409: 3 | D409: =(C409/33)*100 -> 9.0909090909090917 | E409: =(C409/34)*100 -> 8.8235294117647065 | F409: 18 | G409: =(F409/44)*100 -> 40.909090909090914 | H409: =(F409/49)*100 -> 36.734693877551024 | I409: 11 | J409: =(I409/49)*100 -> 22.448979591836736 | K409: =(I409/57)*100 -> 19.298245614035086 | L409: 6 | M409: =(L409/45)*100 -> 13.333333333333334 | N409: =(L409/45)*100 -> 13.333333333333334 | O409: =(C409+F409+L409+I409) -> 38 | P409: =(O409/171)*100 -> 22.222222222222221 | Q409: =(O409/185)*100 -> 20.54054054054054
B410: To a moderate extent | C410: 7 | D410: =(C410/33)*100 -> 21.212121212121211 | E410: =(C410/34)*100 -> 20.588235294117645 | F410: 14 | G410: =(F410/44)*100 -> 31.818181818181817 | H410: =(F410/49)*100 -> 28.571428571428569 | I410: 17 | J410: =(I410/49)*100 -> 34.693877551020407 | K410: =(I410/57)*100 -> 29.82456140350877 | L410: 19 | M410: =(L410/45)*100 -> 42.222222222222221 | N410: =(L410/45)*100 -> 42.222222222222221 | O410: =(C410+F410+L410+I410) -> 57 | P410: =(O410/171)*100 -> 33.333333333333329 | Q410: =(O410/185)*100 -> 30.810810810810814
B411: To a small extent | C411: 16 | D411: =(C411/33)*100 -> 48.484848484848484 | E411: =(C411/34)*100 -> 47.058823529411761 | F411: 10 | G411: =(F411/44)*100 -> 22.727272727272727 | H411: =(F411/49)*100 -> 20.408163265306122 | I411: 12 | J411: =(I411/49)*100 -> 24.489795918367346 | K411: =(I411/57)*100 -> 21.052631578947366 | L411: 15 | M411: =(L411/45)*100 -> 33.333333333333329 | N411: =(L411/45)*100 -> 33.333333333333329 | O411: =(C411+F411+L411+I411) -> 53 | P411: =(O411/171)*100 -> 30.994152046783626 | Q411: =(O411/185)*100 -> 28.648648648648649
B412: Not at all | C412: 7 | D412: =(C412/33)*100 -> 21.212121212121211 | E412: =(C412/34)*100 -> 20.588235294117645 | F412: 2 | G412: =(F412/44)*100 -> 4.5454545454545459 | H412: =(F412/49)*100 -> 4.0816326530612246 | I412: 9 | J412: =(I412/49)*100 -> 18.367346938775512 | K412: =(I412/57)*100 -> 15.789473684210526 | L412: 5 | M412: =(L412/45)*100 -> 11.111111111111111 | N412: =(L412/45)*100 -> 11.111111111111111 | O412: =(C412+F412+L412+I412) -> 23 | P412: =(O412/171)*100 -> 13.450292397660817 | Q412: =(O412/185)*100 -> 12.432432432432433
B413: Total | C413: =SUM(C409:C412) -> 33 | D413: =(C413/33)*100 -> 100.0 | E413: =(C413/34)*100 -> 97.058823529411768 | F413: =SUM(F409:F412) -> 44 | G413: =(F413/44)*100 -> 100.0 | H413: =(F413/49)*100 -> 89.795918367346943 | I413: =SUM(I409:I412) -> 49 | J413: =(I413/49)*100 -> 100.0 | K413: =(I413/57)*100 -> 85.964912280701753 | L413: =SUM(L409:L412) -> 45 | M413: =(L413/45)*100 -> 100.0 | N413: =(L413/45)*100 -> 100.0 | O413: =(C413+F413+L413+I413) -> 171 | P413: =(O413/171)*100 -> 100.0 | Q413: =(O413/185)*100 -> 92.432432432432435
B414: g. Other
B415: To a great extent | C415: 4 | D415: =(C415/4)*100 -> 100.0 | E415: =(C415/34)*100 -> 11.76470588235294 | F415: 3 | G415: =(F415/4)*100 -> 75.0 | H415: =(F415/49)*100 -> 6.1224489795918364 | I415: 4 | J415: =(I415/4)*100 -> 100.0 | K415: =(I415/57)*100 -> 7.0175438596491224 | L415: 0 | M415: 0.0 | N415: 0.0 | O415: =(C415+F415+L415+I415) -> 11 | P415: =(O415/12)*100 -> 91.666666666666657 | Q415: =(O415/185)*100 -> 5.9459459459459465
B416: To a moderate extent | C416: 0 | D416: =(C416/4)*100 -> 0.0 | E416: =(C416/34)*100 -> 0.0 | F416: 1 | G416: =(F416/4)*100 -> 25.0 | H416: =(F416/49)*100 -> 2.0408163265306123 | I416: 0 | J416: =(I416/4)*100 -> 0.0 | K416: =(I416/57)*100 -> 0.0 | L416: 0 | M416: 0.0 | N416: 0.0 | O416: =(C416+F416+L416+I416) -> 1 | P416: =(O416/12)*100 -> 8.3333333333333321 | Q416: =(O416/185)*100 -> 0.54054054054054057
B417: To a small extent | C417: 0 | D417: =(C417/4)*100 -> 0.0 | E417: =(C417/34)*100 -> 0.0 | F417: 0 | G417: =(F417/4)*100 -> 0.0 | H417: =(F417/49)*100 -> 0.0 | I417: 0 | J417: =(I417/4)*100 -> 0.0 | K417: =(I417/57)*100 -> 0.0 | L417: 0 | M417: 0.0 | N417: 0.0 | O417: =(C417+F417+L417+I417) -> 0 | P417: =(O417/12)*100 -> 0.0 | Q417: =(O417/185)*100 -> 0.0
B418: Not at all | C418: 0 | D418: =(C418/4)*100 -> 0.0 | E418: =(C418/34)*100 -> 0.0 | F418: 0 | G418: =(F418/4)*100 -> 0.0 | H418: =(F418/49)*100 -> 0.0 | I418: 0 | J418: =(I418/4)*100 -> 0.0 | K418: =(I418/57)*100 -> 0.0 | L418: 0 | M418: 0.0 | N418: 0.0 | O418: =(C418+F418+L418+I418) -> 0 | P418: =(O418/12)*100 -> 0.0 | Q418: =(O418/185)*100 -> 0.0
B419: Total | C419: =SUM(C415:C418) -> 4 | D419: =(C419/4)*100 -> 100.0 | E419: =(C419/34)*100 -> 11.76470588235294 | F419: =SUM(F415:F418) -> 4 | G419: =(F419/4)*100 -> 100.0 | H419: =(F419/49)*100 -> 8.1632653061224492 | I419: =SUM(I415:I418) -> 4 | J419: =(I419/4)*100 -> 100.0 | K419: =(I419/57)*100 -> 7.0175438596491224 | L419: 0 | M419: 0.0 | N419: 0.0 | O419: =(C419+F419+L419+I419) -> 12 | P419: =(O419/12)*100 -> 100.0 | Q419: =(O419/185)*100 -> 6.4864864864864868
A421: 20 | B421: Number of COURSES using at least one unit prepared at FTI | C421: FRQ | D421: % T2 | E421: % T1 | F421: FRQ | G421: % T2 | H421: % T1 | I421: FRQ | J421: % T2 | K421: % T1 | L421: FRQ | M421: % T2 | N421: % T1 | O421: FRQ | P421: % T2 | Q421: % T1
B422: 1 course | C422: 16 | D422: =(C422/28)*100 -> 57.142857142857139 | E422: =(C422/34)*100 -> 47.058823529411761 | F422: 21 | G422: =(F422/40)*100 -> 52.5 | H422: =(F422/49)*100 -> 42.857142857142854 | I422: 30 | J422: =(I422/46)*100 -> 65.217391304347828 | K422: =(I422/57)*100 -> 52.631578947368418 | L422: 24 | M422: =(L422/41)*100 -> 58.536585365853654 | N422: =(L422/45)*100 -> 53.333333333333336 | O422: =(C422+F422+L422+I422) -> 91 | P422: =(O422/155)*100 -> 58.709677419354833 | Q422: =(O422/185)*100 -> 49.189189189189193
B423: 2 courses | C423: 6 | D423: =(C423/28)*100 -> 21.428571428571427 | E423: =(C423/34)*100 -> 17.647058823529413 | F423: 10 | G423: =(F423/40)*100 -> 25.0 | H423: =(F423/49)*100 -> 20.408163265306122 | I423: 12 | J423: =(I423/46)*100 -> 26.086956521739129 | K423: =(I423/57)*100 -> 21.052631578947366 | L423: 10 | M423: =(L423/41)*100 -> 24.390243902439025 | N423: =(L423/45)*100 -> 22.222222222222221 | O423: =(C423+F423+L423+I423) -> 38 | P423: =(O423/155)*100 -> 24.516129032258064 | Q423: =(O423/185)*100 -> 20.54054054054054
B424: 3 courses | C424: 3 | D424: =(C424/28)*100 -> 10.714285714285714 | E424: =(C424/34)*100 -> 8.8235294117647065 | F424: 3 | G424: =(F424/40)*100 -> 7.5 | H424: =(F424/49)*100 -> 6.1224489795918364 | I424: 3 | J424: =(I424/46)*100 -> 6.5217391304347823 | K424: =(I424/57)*100 -> 5.2631578947368416 | L424: 3 | M424: =(L424/41)*100 -> 7.3170731707317067 | N424: =(L424/45)*100 -> 6.666666666666667 | O424: =(C424+F424+L424+I424) -> 12 | P424: =(O424/155)*100 -> 7.741935483870968 | Q424: =(O424/185)*100 -> 6.4864864864864868
B425: 4 courses | C425: 1 | D425: =(C425/28)*100 -> 3.5714285714285712 | E425: =(C425/34)*100 -> 2.9411764705882351 | F425: 5 | G425: =(F425/40)*100 -> 12.5 | H425: =(F425/49)*100 -> 10.204081632653061 | I425: 1 | J425: =(I425/46)*100 -> 2.1739130434782608 | K425: =(I425/57)*100 -> 1.7543859649122806 | L425: 1 | M425: =(L425/41)*100 -> 2.4390243902439024 | N425: =(L425/45)*100 -> 2.2222222222222223 | O425: =(C425+F425+L425+I425) -> 8 | P425: =(O425/155)*100 -> 5.161290322580645 | Q425: =(O425/185)*100 -> 4.3243243243243246
B426: 5 courses | C426: 2 | D426: =(C426/28)*100 -> 7.1428571428571423 | E426: =(C426/34)*100 -> 5.8823529411764701 | F426: 1 | G426: =(F426/40)*100 -> 2.5 | H426: =(F426/49)*100 -> 2.0408163265306123 | I426: 0 | J426: =(I426/46)*100 -> 0.0 | K426: =(I426/57)*100 -> 0.0 | L426: 3 | M426: =(L426/41)*100 -> 7.3170731707317067 | N426: =(L426/45)*100 -> 6.666666666666667 | O426: =(C426+F426+L426+I426) -> 6 | P426: =(O426/155)*100 -> 3.870967741935484 | Q426: =(O426/185)*100 -> 3.2432432432432434
B427: Total | C427: =SUM(C422:C426) -> 28 | D427: =(C427/28)*100 -> 100.0 | E427: =(C427/34)*100 -> 82.35294117647058 | F427: =SUM(F422:F426) -> 40 | G427: =(F427/40)*100 -> 100.0 | H427: =(F427/49)*100 -> 81.632653061224488 | I427: =SUM(I422:I426) -> 46 | J427: =(I427/46)*100 -> 100.0 | K427: =(I427/57)*100 -> 80.701754385964904 | L427: =SUM(L422:L426) -> 41 | M427: =(L427/41)*100 -> 100.0 | N427: =(L427/45)*100 -> 91.111111111111114 | O427: =(C427+F427+L427+I427) -> 155 | P427: =(O427/155)*100 -> 100.0 | Q427: =(O427/185)*100 -> 83.78378378378379
A429: 21 | B429: LENGTH of each course using the unit | C429: FRQ | D429: % T2 | E429: % T1 | F429: FRQ | G429: % T2 | H429: % T1 | I429: FRQ | J429: % T2 | K429: % T1 | L429: FRQ | M429: % T2 | N429: % T1 | O429: FRQ | P429: % T2 | Q429: % T1
B430: Year-long | C430: 21 | D430: =(C430/28)*100 -> 75.0 | E430: =(C430/34)*100 -> 61.764705882352942 | F430: 17 | G430: =(F430/42)*100 -> 40.476190476190474 | H430: =(F430/49)*100 -> 34.693877551020407 | I430: 22 | J430: =(I430/47)*100 -> 46.808510638297875 | K430: =(I430/57)*100 -> 38.596491228070171 | L430: 32 | M430: =(L430/42)*100 -> 76.19047619047619 | N430: =(L430/45)*100 -> 71.111111111111114 | O430: =(C430+F430+L430+I430) -> 92 | P430: =(O430/159)*100 -> 57.861635220125784 | Q430: =(O430/185)*100 -> 49.729729729729733
B431: Half-year | C431: 3 | D431: =(C431/28)*100 -> 10.714285714285714 | E431: =(C431/34)*100 -> 8.8235294117647065 | F431: 10 | G431: =(F431/42)*100 -> 23.809523809523807 | H431: =(F431/49)*100 -> 20.408163265306122 | I431: 12 | J431: =(I431/47)*100 -> 25.531914893617021 | K431: =(I431/57)*100 -> 21.052631578947366 | L431: 6 | M431: =(L431/42)*100 -> 14.285714285714285 | N431: =(L431/45)*100 -> 13.333333333333334 | O431: =(C431+F431+L431+I431) -> 31 | P431: =(O431/159)*100 -> 19.49685534591195 | Q431: =(O431/185)*100 -> 16.756756756756758
B432: Marking period | C432: 2 | D432: =(C432/28)*100 -> 7.1428571428571423 | E432: =(C432/34)*100 -> 5.8823529411764701 | F432: 9 | G432: =(F432/42)*100 -> 21.428571428571427 | H432: =(F432/49)*100 -> 18.367346938775512 | I432: 6 | J432: =(I432/47)*100 -> 12.76595744680851 | K432: =(I432/57)*100 -> 10.526315789473683 | L432: 2 | M432: =(L432/42)*100 -> 4.7619047619047619 | N432: =(L432/45)*100 -> 4.4444444444444446 | O432: =(C432+F432+L432+I432) -> 19 | P432: =(O432/159)*100 -> 11.949685534591195 | Q432: =(O432/185)*100 -> 10.27027027027027
B433: Other | C433: 2 | D433: =(C433/28)*100 -> 7.1428571428571423 | E433: =(C433/34)*100 -> 5.8823529411764701 | F433: 6 | G433: =(F433/42)*100 -> 14.285714285714285 | H433: =(F433/49)*100 -> 12.244897959183673 | I433: 7 | J433: =(I433/47)*100 -> 14.893617021276595 | K433: =(I433/57)*100 -> 12.280701754385964 | L433: 2 | M433: =(L433/42)*100 -> 4.7619047619047619 | N433: =(L433/45)*100 -> 4.4444444444444446 | O433: =(C433+F433+L433+I433) -> 17 | P433: =(O433/159)*100 -> 10.691823899371069 | Q433: =(O433/185)*100 -> 9.1891891891891895
B434: Total | C434: =SUM(C430:C433) -> 28 | D434: =(C434/28)*100 -> 100.0 | E434: =(C434/34)*100 -> 82.35294117647058 | F434: =SUM(F430:F433) -> 42 | G434: =(F434/42)*100 -> 100.0 | H434: =(F434/49)*100 -> 85.714285714285708 | I434: =SUM(I430:I433) -> 47 | J434: =(I434/47)*100 -> 100.0 | K434: =(I434/57)*100 -> 82.456140350877192 | L434: =SUM(L430:L433) -> 42 | M434: =(L434/42)*100 -> 100.0 | N434: =(L434/45)*100 -> 93.333333333333329 | O434: =(C434+F434+L434+I434) -> 159 | P434: =(O434/159)*100 -> 100.0 | Q434: =(O434/185)*100 -> 85.945945945945951
A436: 22 | B436: Number of CLASSES teaching the courses | C436: FRQ | D436: % T2 | E436: % T1 | F436: FRQ | G436: % T2 | H436: % T1 | I436: FRQ | J436: % T2 | K436: % T1 | L436: FRQ | M436: % T2 | N436: % T1 | O436: FRQ | P436: % T2 | Q436: % T1
B437: 1 class | C437: 6 | D437: =(C437/28)*100 -> 21.428571428571427 | E437: =(C437/34)*100 -> 17.647058823529413 | F437: 3 | G437: =(F437/39)*100 -> 7.6923076923076925 | H437: =(F437/49)*100 -> 6.1224489795918364 | I437: 9 | J437: =(I437/44)*100 -> 20.454545454545457 | K437: =(I437/57)*100 -> 15.789473684210526 | L437: 17 | M437: =(L437/41)*100 -> 41.463414634146339 | N437: =(L437/45)*100 -> 37.777777777777779 | O437: =(C437+F437+L437+I437) -> 35 | P437: =(O437/152)*100 -> 23.026315789473685 | Q437: =(O437/185)*100 -> 18.918918918918919
B438: 2 classes | C438: 6 | D438: =(C438/28)*100 -> 21.428571428571427 | E438: =(C438/34)*100 -> 17.647058823529413 | F438: 7 | G438: =(F438/39)*100 -> 17.948717948717949 | H438: =(F438/49)*100 -> 14.285714285714285 | I438: 8 | J438: =(I438/44)*100 -> 18.181818181818183 | K438: =(I438/57)*100 -> 14.035087719298245 | L438: 8 | M438: =(L438/41)*100 -> 19.512195121951219 | N438: =(L438/45)*100 -> 17.777777777777779 | O438: =(C438+F438+L438+I438) -> 29 | P438: =(O438/152)*100 -> 19.078947368421055 | Q438: =(O438/185)*100 -> 15.675675675675677
B439: 3 classes | C439: 8 | D439: =(C439/28)*100 -> 28.571428571428569 | E439: =(C439/34)*100 -> 23.52941176470588 | F439: 11 | G439: =(F439/39)*100 -> 28.205128205128204 | H439: =(F439/49)*100 -> 22.448979591836736 | I439: 10 | J439: =(I439/44)*100 -> 22.727272727272727 | K439: =(I439/57)*100 -> 17.543859649122805 | L439: 2 | M439: =(L439/41)*100 -> 4.8780487804878048 | N439: =(L439/45)*100 -> 4.4444444444444446 | O439: =(C439+F439+L439+I439) -> 31 | P439: =(O439/152)*100 -> 20.394736842105264 | Q439: =(O439/185)*100 -> 16.756756756756758
B440: 4 classes | C440: 4 | D440: =(C440/28)*100 -> 14.285714285714285 | E440: =(C440/34)*100 -> 11.76470588235294 | F440: 10 | G440: =(F440/39)*100 -> 25.641025641025639 | H440: =(F440/49)*100 -> 20.408163265306122 | I440: 8 | J440: =(I440/44)*100 -> 18.181818181818183 | K440: =(I440/57)*100 -> 14.035087719298245 | L440: 5 | M440: =(L440/41)*100 -> 12.195121951219512 | N440: =(L440/45)*100 -> 11.111111111111111 | O440: =(C440+F440+L440+I440) -> 27 | P440: =(O440/152)*100 -> 17.763157894736842 | Q440: =(O440/185)*100 -> 14.594594594594595
B441: 5 classes | C441: 4 | D441: =(C441/28)*100 -> 14.285714285714285 | E441: =(C441/34)*100 -> 11.76470588235294 | F441: 8 | G441: =(F441/39)*100 -> 20.512820512820511 | H441: =(F441/49)*100 -> 16.326530612244898 | I441: 9 | J441: =(I441/44)*100 -> 20.454545454545457 | K441: =(I441/57)*100 -> 15.789473684210526 | L441: 9 | M441: =(L441/41)*100 -> 21.951219512195124 | N441: =(L441/45)*100 -> 20.0 | O441: =(C441+F441+L441+I441) -> 30 | P441: =(O441/152)*100 -> 19.736842105263158 | Q441: =(O441/185)*100 -> 16.216216216216218
B442: Total | C442: =SUM(C437:C441) -> 28 | D442: =(C442/28)*100 -> 100.0 | E442: =(C442/34)*100 -> 82.35294117647058 | F442: =SUM(F437:F441) -> 39 | G442: =(F442/39)*100 -> 100.0 | H442: =(F442/49)*100 -> 79.591836734693871 | I442: =SUM(I437:I441) -> 44 | J442: =(I442/44)*100 -> 100.0 | K442: =(I442/57)*100 -> 77.192982456140342 | L442: =SUM(L437:L441) -> 41 | M442: =(L442/41)*100 -> 100.0 | N442: =(L442/45)*100 -> 91.111111111111114 | O442: =(C442+F442+L442+I442) -> 152 | P442: =(O442/152)*100 -> 100.0 | Q442: =(O442/185)*100 -> 82.162162162162161
A444: 23 | B444: DAILY CLASS PERIODS in each of the courses | C444: FRQ | D444: % T2 | E444: % T1 | F444: FRQ | G444: % T2 | H444: % T1 | I444: FRQ | J444: % T2 | K444: % T1 | L444: FRQ | M444: % T2 | N444: % T1 | O444: FRQ | P444: % T2 | Q444: % T1
B445: Fewer than 5 minutes | C445: 13 | D445: =(C445/26)*100 -> 50.0 | E445: =(C445/34)*100 -> 38.235294117647058 | F445: 19 | G445: =(F445/37)*100 -> 51.351351351351347 | H445: =(F445/49)*100 -> 38.775510204081634 | I445: 17 | J445: =(I445/45)*100 -> 37.777777777777779 | K445: =(I445/57)*100 -> 29.82456140350877 | L445: 18 | M445: =(L445/40)*100 -> 45.0 | N445: =(L445/45)*100 -> 40.0 | O445: =(C445+F445+L445+I445) -> 67 | P445: =(O445/148)*100 -> 45.270270270270267 | Q445: =(O445/185)*100 -> 36.216216216216218
B446: 5-10 | C446: 6 | D446: =(C446/26)*100 -> 23.076923076923077 | E446: =(C446/34)*100 -> 17.647058823529413 | F446: 7 | G446: =(F446/37)*100 -> 18.918918918918919 | H446: =(F446/49)*100 -> 14.285714285714285 | I446: 13 | J446: =(I446/45)*100 -> 28.888888888888886 | K446: =(I446/57)*100 -> 22.807017543859647 | L446: 12 | M446: =(L446/40)*100 -> 30.0 | N446: =(L446/45)*100 -> 26.666666666666668 | O446: =(C446+F446+L446+I446) -> 38 | P446: =(O446/148)*100 -> 25.675675675675674 | Q446: =(O446/185)*100 -> 20.54054054054054
B447: 11-20 | C447: 3 | D447: =(C447/26)*100 -> 11.538461538461538 | E447: =(C447/34)*100 -> 8.8235294117647065 | F447: 8 | G447: =(F447/37)*100 -> 21.621621621621621 | H447: =(F447/49)*100 -> 16.326530612244898 | I447: 9 | J447: =(I447/45)*100 -> 20.0 | K447: =(I447/57)*100 -> 15.789473684210526 | L447: 3 | M447: =(L447/40)*100 -> 7.5 | N447: =(L447/45)*100 -> 6.666666666666667 | O447: =(C447+F447+L447+I447) -> 23 | P447: =(O447/148)*100 -> 15.54054054054054 | Q447: =(O447/185)*100 -> 12.432432432432433
B448: 21-30 | C448: 2 | D448: =(C448/26)*100 -> 7.6923076923076925 | E448: =(C448/34)*100 -> 5.8823529411764701 | F448: 3 | G448: =(F448/37)*100 -> 8.1081081081081088 | H448: =(F448/49)*100 -> 6.1224489795918364 | I448: 3 | J448: =(I448/45)*100 -> 6.666666666666667 | K448: =(I448/57)*100 -> 5.2631578947368416 | L448: 4 | M448: =(L448/40)*100 -> 10.0 | N448: =(L448/45)*100 -> 8.8888888888888893 | O448: =(C448+F448+L448+I448) -> 12 | P448: =(O448/148)*100 -> 8.1081081081081088 | Q448: =(O448/185)*100 -> 6.4864864864864868
B449: 31-40 | C449: 1 | D449: =(C449/26)*100 -> 3.8461538461538463 | E449: =(C449/34)*100 -> 2.9411764705882351 | F449: 0 | G449: =(F449/37)*100 -> 0.0 | H449: =(F449/49)*100 -> 0.0 | I449: 1 | J449: =(I449/45)*100 -> 2.2222222222222223 | K449: =(I449/57)*100 -> 1.7543859649122806 | L449: 1 | M449: =(L449/40)*100 -> 2.5 | N449: =(L449/45)*100 -> 2.2222222222222223 | O449: =(C449+F449+L449+I449) -> 3 | P449: =(O449/148)*100 -> 2.0270270270270272 | Q449: =(O449/185)*100 -> 1.6216216216216217
B450: More than 40 minutes | C450: 1 | D450: =(C450/26)*100 -> 3.8461538461538463 | E450: =(C450/34)*100 -> 2.9411764705882351 | F450: 0 | G450: =(F450/37)*100 -> 0.0 | H450: =(F450/49)*100 -> 0.0 | I450: 2 | J450: =(I450/45)*100 -> 4.4444444444444446 | K450: =(I450/57)*100 -> 3.5087719298245612 | L450: 2 | M450: =(L450/40)*100 -> 5.0 | N450: =(L450/45)*100 -> 4.4444444444444446 | O450: =(C450+F450+L450+I450) -> 5 | P450: =(O450/148)*100 -> 3.3783783783783785 | Q450: =(O450/185)*100 -> 2.7027027027027026
B451: Total | C451: =SUM(C445:C450) -> 26 | D451: =(C451/26)*100 -> 100.0 | E451: =(C451/34)*100 -> 76.470588235294116 | F451: =SUM(F445:F450) -> 37 | G451: =(F451/37)*100 -> 100.0 | H451: =(F451/49)*100 -> 75.510204081632651 | I451: =SUM(I445:I450) -> 45 | J451: =(I451/45)*100 -> 100.0 | K451: =(I451/57)*100 -> 78.94736842105263 | L451: =SUM(L445:L450) -> 40 | M451: =(L451/40)*100 -> 100.0 | N451: =(L451/45)*100 -> 88.888888888888886 | O451: =(C451+F451+L451+I451) -> 148 | P451: =(O451/148)*100 -> 100.0 | Q451: =(O451/185)*100 -> 80.0
A453: 24 | B453: Class level using the unit(s) of FTI (multiple choice) | C453: FRQ | D453: % T2 | E453: % T1 | F453: FRQ | G453: % T2 | H453: % T1 | I453: FRQ | J453: % T2 | K453: % T1 | L453: FRQ | M453: % T2 | N453: % T1 | O453: FRQ | P453: % T2 | Q453: % T1
B454: Advanced classes | C454: 14 | D454: =(C454/42)*100 -> 33.333333333333329 | E454: =(C454/34)*100 -> 41.17647058823529 | F454: 22 | G454: =(F454/62)*100 -> 35.483870967741936 | H454: =(F454/49)*100 -> 44.897959183673471 | I454: 21 | J454: =(I454/63)*100 -> 33.333333333333329 | K454: =(I454/57)*100 -> 36.84210526315789 | L454: 11 | M454: =(L454/58)*100 -> 18.96551724137931 | N454: =(L454/45)*100 -> 24.444444444444443 | O454: =(C454+F454+L454+I454) -> 68 | P454: =(O454/225)*100 -> 30.222222222222221 | Q454: =(O454/185)*100 -> 36.756756756756758
B455: Average classes | C455: 17 | D455: =(C455/42)*100 -> 40.476190476190474 | E455: =(C455/34)*100 -> 50.0 | F455: 27 | G455: =(F455/62)*100 -> 43.548387096774192 | H455: =(F455/49)*100 -> 55.102040816326522 | I455: 32 | J455: =(I455/63)*100 -> 50.793650793650791 | K455: =(I455/57)*100 -> 56.140350877192979 | L455: 30 | M455: =(L455/58)*100 -> 51.724137931034484 | N455: =(L455/45)*100 -> 66.666666666666657 | O455: =(C455+F455+L455+I455) -> 106 | P455: =(O455/225)*100 -> 47.111111111111107 | Q455: =(O455/185)*100 -> 57.297297297297298
B456: Remedial classes | C456: 11 | D456: =(C456/42)*100 -> 26.190476190476193 | E456: =(C456/34)*100 -> 32.352941176470587 | F456: 13 | G456: =(F456/62)*100 -> 20.967741935483872 | H456: =(F456/49)*100 -> 26.530612244897959 | I456: 10 | J456: =(I456/63)*100 -> 15.873015873015872 | K456: =(I456/57)*100 -> 17.543859649122805 | L456: 17 | M456: =(L456/58)*100 -> 29.310344827586203 | N456: =(L456/45)*100 -> 37.777777777777779 | O456: =(C456+F456+L456+I456) -> 51 | P456: =(O456/225)*100 -> 22.666666666666664 | Q456: =(O456/185)*100 -> 27.567567567567568
B457: Total | C457: =SUM(C454:C456) -> 42 | D457: =(C457/42)*100 -> 100.0 | E457: =(C457/34)*100 -> 123.52941176470588 | F457: =SUM(F454:F456) -> 62 | G457: =(F457/62)*100 -> 100.0 | H457: =(F457/49)*100 -> 126.53061224489797 | I457: =SUM(I454:I456) -> 63 | J457: =(I457/63)*100 -> 100.0 | K457: =(I457/57)*100 -> 110.5263157894737 | L457: =SUM(L454:L456) -> 58 | M457: =(L457/58)*100 -> 100.0 | N457: =(L457/45)*100 -> 128.88888888888889 | O457: =(C457+F457+L457+I457) -> 225 | P457: =(O457/225)*100 -> 100.0 | Q457: =(O457/185)*100 -> 121.62162162162163
A459: 25 | B459: Class level the unit(s) designed for (multiple choice) | C459: FRQ | D459: % T2 | E459: % T1 | F459: FRQ | G459: % T2 | H459: % T1 | I459: FRQ | J459: % T2 | K459: % T1 | L459: FRQ | M459: % T2 | N459: % T1 | O459: FRQ | P459: % T2 | Q459: % T1
B460: Advanced classes | C460: 17 | D460: =(C460/57)*100 -> 29.82456140350877 | E460: =(C460/34)*100 -> 50.0 | F460: 23 | G460: =(F460/78)*100 -> 29.487179487179489 | H460: =(F460/49)*100 -> 46.938775510204081 | I460: 26 | J460: =(I460/83)*100 -> 31.325301204819279 | K460: =(I460/57)*100 -> 45.614035087719294 | L460: 16 | M460: =(L460/72)*100 -> 22.222222222222221 | N460: =(L460/45)*100 -> 35.555555555555557 | O460: =(C460+F460+L460+I460) -> 82 | P460: =(O460/290)*100 -> 28.27586206896552 | Q460: =(O460/185)*100 -> 44.32432432432433
B461: Average classes | C461: 20 | D461: =(C461/57)*100 -> 35.087719298245609 | E461: =(C461/34)*100 -> 58.82352941176471 | F461: 32 | G461: =(F461/78)*100 -> 41.025641025641022 | H461: =(F461/49)*100 -> 65.306122448979593 | I461: 41 | J461: =(I461/83)*100 -> 49.397590361445779 | K461: =(I461/57)*100 -> 71.929824561403507 | L461: 33 | M461: =(L461/72)*100 -> 45.833333333333329 | N461: =(L461/45)*100 -> 73.333333333333329 | O461: =(C461+F461+L461+I461) -> 126 | P461: =(O461/290)*100 -> 43.448275862068961 | Q461: =(O461/185)*100 -> 68.108108108108112
B462: Remedial classes | C462: 20 | D462: =(C462/57)*100 -> 35.087719298245609 | E462: =(C462/34)*100 -> 58.82352941176471 | F462: 23 | G462: =(F462/78)*100 -> 29.487179487179489 | H462: =(F462/49)*100 -> 46.938775510204081 | I462: 16 | J462: =(I462/83)*100 -> 19.277108433734941 | K462: =(I462/57)*100 -> 28.07017543859649 | L462: 23 | M462: =(L462/72)*100 -> 31.944444444444443 | N462: =(L462/45)*100 -> 51.111111111111107 | O462: =(C462+F462+L462+I462) -> 82 | P462: =(O462/290)*100 -> 28.27586206896552 | Q462: =(O462/185)*100 -> 44.32432432432433
B463: Total | C463: =SUM(C460:C462) -> 57 | D463: =(C463/57)*100 -> 100.0 | E463: =(C463/34)*100 -> 167.64705882352942 | F463: =SUM(F460:F462) -> 78 | G463: =(F463/78)*100 -> 100.0 | H463: =(F463/49)*100 -> 159.18367346938774 | I463: =SUM(I460:I462) -> 83 | J463: =(I463/83)*100 -> 100.0 | K463: =(I463/57)*100 -> 145.61403508771932 | L463: =SUM(L460:L462) -> 72 | M463: =(L463/72)*100 -> 100.0 | N463: =(L463/45)*100 -> 160.0 | O463: =(C463+F463+L463+I463) -> 290 | P463: =(O463/290)*100 -> 100.0 | Q463: =(O463/185)*100 -> 156.75675675675674
A465: 26 | B465: Successfulness of class using the unit(s) (multiple choice) | C465: FRQ | D465: % T2 | E465: % T1 | F465: FRQ | G465: % T2 | H465: % T1 | I465: FRQ | J465: % T2 | K465: % T1 | L465: FRQ | M465: % T2 | N465: % T1 | O465: FRQ | P465: % T2 | Q465: % T1
B466: Advanced classes | C466: 16 | D466: =(C466/51)*100 -> 31.372549019607842 | E466: =(C466/34)*100 -> 47.058823529411761 | F466: 23 | G466: =(F466/68)*100 -> 33.82352941176471 | H466: =(F466/49)*100 -> 46.938775510204081 | I466: 28 | J466: =(I466/77)*100 -> 36.363636363636367 | K466: =(I466/57)*100 -> 49.122807017543856 | L466: 18 | M466: =(L466/74)*100 -> 24.324324324324326 | N466: =(L466/45)*100 -> 40.0 | O466: =(C466+F466+L466+I466) -> 85 | P466: =(O466/270)*100 -> 31.481481481481481 | Q466: =(O466/185)*100 -> 45.945945945945951
B467: Average classes | C467: 19 | D467: =(C467/51)*100 -> 37.254901960784316 | E467: =(C467/34)*100 -> 55.882352941176471 | F467: 28 | G467: =(F467/68)*100 -> 41.17647058823529 | H467: =(F467/49)*100 -> 57.142857142857139 | I467: 35 | J467: =(I467/77)*100 -> 45.454545454545453 | K467: =(I467/57)*100 -> 61.403508771929829 | L467: 32 | M467: =(L467/74)*100 -> 43.243243243243242 | N467: =(L467/45)*100 -> 71.111111111111114 | O467: =(C467+F467+L467+I467) -> 114 | P467: =(O467/270)*100 -> 42.222222222222221 | Q467: =(O467/185)*100 -> 61.621621621621628
B468: Remedial classes | C468: 16 | D468: =(C468/51)*100 -> 31.372549019607842 | E468: =(C468/34)*100 -> 47.058823529411761 | F468: 17 | G468: =(F468/68)*100 -> 25.0 | H468: =(F468/49)*100 -> 34.693877551020407 | I468: 14 | J468: =(I468/77)*100 -> 18.181818181818183 | K468: =(I468/57)*100 -> 24.561403508771928 | L468: 24 | M468: =(L468/74)*100 -> 32.432432432432435 | N468: =(L468/45)*100 -> 53.333333333333336 | O468: =(C468+F468+L468+I468) -> 71 | P468: =(O468/270)*100 -> 26.296296296296294 | Q468: =(O468/185)*100 -> 38.378378378378379
B469: Total | C469: =SUM(C466:C468) -> 51 | D469: =(C469/51)*100 -> 100.0 | E469: =(C469/34)*100 -> 150.0 | F469: =SUM(F466:F468) -> 68 | G469: =(F469/68)*100 -> 100.0 | H469: =(F469/49)*100 -> 138.77551020408163 | I469: =SUM(I466:I468) -> 77 | J469: =(I469/77)*100 -> 100.0 | K469: =(I469/57)*100 -> 135.08771929824562 | L469: =SUM(L466:L468) -> 74 | M469: =(L469/74)*100 -> 100.0 | N469: =(L469/45)*100 -> 164.44444444444443 | O469: =(C469+F469+L469+I469) -> 270 | P469: =(O469/270)*100 -> 100.0 | Q469: =(O469/185)*100 -> 145.94594594594594
A471: 27 | B471: Way of use the unit(s) (multiple choice) | C471: FRQ | D471: % T2 | E471: % T1 | F471: FRQ | G471: % T2 | H471: % T1 | I471: FRQ | J471: % T2 | K471: % T1 | L471: FRQ | M471: % T2 | N471: % T1 | O471: FRQ | P471: % T2 | Q471: % T1
B472: As primary resource | C472: 20 | D472: =(C472/53)*100 -> 37.735849056603776 | E472: =(C472/34)*100 -> 58.82352941176471 | F472: 18 | G472: =(F472/68)*100 -> 26.47058823529412 | H472: =(F472/49)*100 -> 36.734693877551024 | I472: 25 | J472: =(I472/80)*100 -> 31.25 | K472: =(I472/57)*100 -> 43.859649122807014 | L472: 19 | M472: =(L472/71)*100 -> 26.760563380281688 | N472: =(L472/45)*100 -> 42.222222222222221 | O472: =(C472+F472+L472+I472) -> 82 | P472: =(O472/272)*100 -> 30.147058823529409 | Q472: =(O472/185)*100 -> 44.32432432432433
B473: To introduce new topic | C473: 8 | D473: =(C473/53)*100 -> 15.09433962264151 | E473: =(C473/34)*100 -> 23.52941176470588 | F473: 17 | G473: =(F473/68)*100 -> 25.0 | H473: =(F473/49)*100 -> 34.693877551020407 | I473: 16 | J473: =(I473/80)*100 -> 20.0 | K473: =(I473/57)*100 -> 28.07017543859649 | L473: 16 | M473: =(L473/71)*100 -> 22.535211267605636 | N473: =(L473/45)*100 -> 35.555555555555557 | O473: =(C473+F473+L473+I473) -> 57 | P473: =(O473/272)*100 -> 20.955882352941178 | Q473: =(O473/185)*100 -> 30.810810810810814
B474: To expand on textbook topic | C474: 13 | D474: =(C474/53)*100 -> 24.528301886792452 | E474: =(C474/34)*100 -> 38.235294117647058 | F474: 15 | G474: =(F474/68)*100 -> 22.058823529411764 | H474: =(F474/49)*100 -> 30.612244897959183 | I474: 25 | J474: =(I474/80)*100 -> 31.25 | K474: =(I474/57)*100 -> 43.859649122807014 | L474: 18 | M474: =(L474/71)*100 -> 25.352112676056336 | N474: =(L474/45)*100 -> 40.0 | O474: =(C474+F474+L474+I474) -> 71 | P474: =(O474/272)*100 -> 26.102941176470591 | Q474: =(O474/185)*100 -> 38.378378378378379
B475: Better substitute for other | C475: 10 | D475: =(C475/53)*100 -> 18.867924528301888 | E475: =(C475/34)*100 -> 29.411764705882355 | F475: 13 | G475: =(F475/68)*100 -> 19.117647058823529 | H475: =(F475/49)*100 -> 26.530612244897959 | I475: 9 | J475: =(I475/80)*100 -> 11.25 | K475: =(I475/57)*100 -> 15.789473684210526 | L475: 15 | M475: =(L475/71)*100 -> 21.12676056338028 | N475: =(L475/45)*100 -> 33.333333333333329 | O475: =(C475+F475+L475+I475) -> 47 | P475: =(O475/272)*100 -> 17.27941176470588 | Q475: =(O475/185)*100 -> 25.405405405405407
A476: 175 | B476: Other | C476: 2 | D476: =(C476/53)*100 -> 3.7735849056603774 | E476: =(C476/34)*100 -> 5.8823529411764701 | F476: 5 | G476: =(F476/68)*100 -> 7.3529411764705888 | H476: =(F476/49)*100 -> 10.204081632653061 | I476: 5 | J476: =(I476/80)*100 -> 6.25 | K476: =(I476/57)*100 -> 8.7719298245614024 | L476: 3 | M476: =(L476/71)*100 -> 4.225352112676056 | N476: =(L476/45)*100 -> 6.666666666666667 | O476: =(C476+F476+L476+I476) -> 15 | P476: =(O476/272)*100 -> 5.5147058823529411 | Q476: =(O476/185)*100 -> 8.1081081081081088
B477: Total | C477: =SUM(C472:C476) -> 53 | D477: =(C477/53)*100 -> 100.0 | E477: =(C477/34)*100 -> 155.88235294117646 | F477: =SUM(F472:F476) -> 68 | G477: =(F477/68)*100 -> 100.0 | H477: =(F477/49)*100 -> 138.77551020408163 | I477: =SUM(I472:I476) -> 80 | J477: =(I477/80)*100 -> 100.0 | K477: =(I477/57)*100 -> 140.35087719298244 | L477: =SUM(L472:L476) -> 71 | M477: =(L477/71)*100 -> 100.0 | N477: =(L477/45)*100 -> 157.77777777777777 | O477: =(C477+F477+L477+I477) -> 272 | P477: =(O477/272)*100 -> 100.0 | Q477: =(O477/185)*100 -> 147.02702702702703
A479: 28 | B479: ADAPTABILITY of the unit(s) to grade levels | C479: FRQ | D479: % T2 | E479: % T1 | F479: FRQ | G479: % T2 | H479: % T1 | I479: FRQ | J479: % T2 | K479: % T1 | L479: FRQ | M479: % T2 | N479: % T1 | O479: FRQ | P479: % T2 | Q479: % T1
B480: No | C480: 2 | D480: =(C480/32)*100 -> 6.25 | E480: =(C480/34)*100 -> 5.8823529411764701 | F480: 2 | G480: =(F480/44)*100 -> 4.5454545454545459 | H480: =(F480/49)*100 -> 4.0816326530612246 | I480: 2 | J480: =(I480/51)*100 -> 3.9215686274509802 | K480: =(I480/57)*100 -> 3.5087719298245612 | L480: 4 | M480: =(L480/43)*100 -> 9.3023255813953494 | N480: =(L480/45)*100 -> 8.8888888888888893 | O480: =(C480+F480+L480+I480) -> 10 | P480: =(O480/170)*100 -> 5.8823529411764701 | Q480: =(O480/185)*100 -> 5.4054054054054053
B481: Yes | C481: 21 | D481: =(C481/32)*100 -> 65.625 | E481: =(C481/34)*100 -> 61.764705882352942 | F481: 37 | G481: =(F481/44)*100 -> 84.090909090909093 | H481: =(F481/49)*100 -> 75.510204081632651 | I481: 29 | J481: =(I481/51)*100 -> 56.862745098039213 | K481: =(I481/57)*100 -> 50.877192982456144 | L481: 28 | M481: =(L481/43)*100 -> 65.116279069767444 | N481: =(L481/45)*100 -> 62.222222222222221 | O481: =(C481+F481+L481+I481) -> 115 | P481: =(O481/170)*100 -> 67.64705882352942 | Q481: =(O481/185)*100 -> 62.162162162162161
B482: N/A | C482: 9 | D482: =(C482/32)*100 -> 28.125 | E482: =(C482/34)*100 -> 26.47058823529412 | F482: 5 | G482: =(F482/44)*100 -> 11.363636363636363 | H482: =(F482/49)*100 -> 10.204081632653061 | I482: 20 | J482: =(I482/51)*100 -> 39.215686274509807 | K482: =(I482/57)*100 -> 35.087719298245609 | L482: 11 | M482: =(L482/43)*100 -> 25.581395348837212 | N482: =(L482/45)*100 -> 24.444444444444443 | O482: =(C482+F482+L482+I482) -> 45 | P482: =(O482/170)*100 -> 26.47058823529412 | Q482: =(O482/185)*100 -> 24.324324324324326
B483: Total | C483: =SUM(C480:C482) -> 32 | D483: =(C483/32)*100 -> 100.0 | E483: =(C483/34)*100 -> 94.117647058823522 | F483: =SUM(F480:F482) -> 44 | G483: =(F483/44)*100 -> 100.0 | H483: =(F483/49)*100 -> 89.795918367346943 | I483: =SUM(I480:I482) -> 51 | J483: =(I483/51)*100 -> 100.0 | K483: =(I483/57)*100 -> 89.473684210526315 | L483: =SUM(L480:L482) -> 43 | M483: =(L483/43)*100 -> 100.0 | N483: =(L483/45)*100 -> 95.555555555555557 | O483: =(C483+F483+L483+I483) -> 170 | P483: =(O483/170)*100 -> 100.0 | Q483: =(O483/185)*100 -> 91.891891891891902
A485: 29 | B485: ENJOYMENT degree of teaching the unit(s) compared to others | C485: FRQ | D485: % T2 | E485: % T1 | F485: FRQ | G485: % T2 | H485: % T1 | I485: FRQ | J485: % T2 | K485: % T1 | L485: FRQ | M485: % T2 | N485: % T1 | O485: FRQ | P485: % T2 | Q485: % T1
B486: Less enjoyable to teach | C486: 1 | D486: =(C486/29)*100 -> 3.4482758620689653 | E486: =(C486/34)*100 -> 2.9411764705882351 | F486: 0 | G486: =(F486/44)*100 -> 0.0 | H486: =(F486/49)*100 -> 0.0 | I486: 2 | J486: =(I486/50)*100 -> 4.0 | K486: =(I486/57)*100 -> 3.5087719298245612 | L486: 1 | M486: =(L486/42)*100 -> 2.3809523809523809 | N486: =(L486/45)*100 -> 2.2222222222222223 | O486: =(C486+F486+L486+I486) -> 4 | P486: =(O486/165)*100 -> 2.4242424242424243 | Q486: =(O486/185)*100 -> 2.1621621621621623
B487: Equally enjoyable to teach | C487: 8 | D487: =(C487/29)*100 -> 27.586206896551722 | E487: =(C487/34)*100 -> 23.52941176470588 | F487: 15 | G487: =(F487/44)*100 -> 34.090909090909086 | H487: =(F487/49)*100 -> 30.612244897959183 | I487: 21 | J487: =(I487/50)*100 -> 42.0 | K487: =(I487/57)*100 -> 36.84210526315789 | L487: 18 | M487: =(L487/42)*100 -> 42.857142857142854 | N487: =(L487/45)*100 -> 40.0 | O487: =(C487+F487+L487+I487) -> 62 | P487: =(O487/165)*100 -> 37.575757575757571 | Q487: =(O487/185)*100 -> 33.513513513513516
B488: More enjoyable to teach | C488: 20 | D488: =(C488/29)*100 -> 68.965517241379317 | E488: =(C488/34)*100 -> 58.82352941176471 | F488: 29 | G488: =(F488/44)*100 -> 65.909090909090907 | H488: =(F488/49)*100 -> 59.183673469387756 | I488: 27 | J488: =(I488/50)*100 -> 54.0 | K488: =(I488/57)*100 -> 47.368421052631575 | L488: 23 | M488: =(L488/42)*100 -> 54.761904761904766 | N488: =(L488/45)*100 -> 51.111111111111107 | O488: =(C488+F488+L488+I488) -> 99 | P488: =(O488/165)*100 -> 60.0 | Q488: =(O488/185)*100 -> 53.513513513513509
B489: Total | C489: =SUM(C486:C488) -> 29 | D489: =(C489/29)*100 -> 100.0 | E489: =(C489/34)*100 -> 85.294117647058826 | F489: =SUM(F486:F488) -> 44 | G489: =(F489/44)*100 -> 100.0 | H489: =(F489/49)*100 -> 89.795918367346943 | I489: =SUM(I486:I488) -> 50 | J489: =(I489/50)*100 -> 100.0 | K489: =(I489/57)*100 -> 87.719298245614027 | L489: =SUM(L486:L488) -> 42 | M489: =(L489/42)*100 -> 100.0 | N489: =(L489/45)*100 -> 93.333333333333329 | O489: =(C489+F489+L489+I489) -> 165 | P489: =(O489/165)*100 -> 100.0 | Q489: =(O489/185)*100 -> 89.189189189189193
A491: 30 | B491: Overall evaluation of the unit(s) compared to others | C491: FRQ | D491: % T2 | E491: % T1 | F491: FRQ | G491: % T2 | H491: % T1 | I491: FRQ | J491: % T2 | K491: % T1 | L491: FRQ | M491: % T2 | N491: % T1 | O491: FRQ | P491: % T2 | Q491: % T1
B492: Inferior | C492: 0 | D492: =(C492/33)*100 -> 0.0 | E492: =(C492/34)*100 -> 0.0 | F492: 1 | G492: =(F492/47)*100 -> 2.1276595744680851 | H492: =(F492/49)*100 -> 2.0408163265306123 | I492: 1 | J492: =(I492/51)*100 -> 1.9607843137254901 | K492: =(I492/57)*100 -> 1.7543859649122806 | L492: 1 | M492: =(L492/45)*100 -> 2.2222222222222223 | N492: =(L492/45)*100 -> 2.2222222222222223 | O492: =(C492+F492+L492+I492) -> 3 | P492: =(O492/176)*100 -> 1.7045454545454544 | Q492: =(O492/185)*100 -> 1.6216216216216217
B493: About equal | C493: 7 | D493: =(C493/33)*100 -> 21.212121212121211 | E493: =(C493/34)*100 -> 20.588235294117645 | F493: 15 | G493: =(F493/47)*100 -> 31.914893617021278 | H493: =(F493/49)*100 -> 30.612244897959183 | I493: 27 | J493: =(I493/51)*100 -> 52.941176470588239 | K493: =(I493/57)*100 -> 47.368421052631575 | L493: 19 | M493: =(L493/45)*100 -> 42.222222222222221 | N493: =(L493/45)*100 -> 42.222222222222221 | O493: =(C493+F493+L493+I493) -> 68 | P493: =(O493/176)*100 -> 38.636363636363633 | Q493: =(O493/185)*100 -> 36.756756756756758
B494: Superior | C494: 26 | D494: =(C494/33)*100 -> 78.787878787878782 | E494: =(C494/34)*100 -> 76.470588235294116 | F494: 31 | G494: =(F494/47)*100 -> 65.957446808510639 | H494: =(F494/49)*100 -> 63.265306122448983 | I494: 23 | J494: =(I494/51)*100 -> 45.098039215686278 | K494: =(I494/57)*100 -> 40.350877192982452 | L494: 25 | M494: =(L494/45)*100 -> 55.555555555555557 | N494: =(L494/45)*100 -> 55.555555555555557 | O494: =(C494+F494+L494+I494) -> 105 | P494: =(O494/176)*100 -> 59.659090909090907 | Q494: =(O494/185)*100 -> 56.756756756756758
B495: Total | C495: =SUM(C492:C494) -> 33 | D495: =(C495/33)*100 -> 100.0 | E495: =(C495/34)*100 -> 97.058823529411768 | F495: =SUM(F492:F494) -> 47 | G495: =(F495/47)*100 -> 100.0 | H495: =(F495/49)*100 -> 95.918367346938766 | I495: =SUM(I492:I494) -> 51 | J495: =(I495/51)*100 -> 100.0 | K495: =(I495/57)*100 -> 89.473684210526315 | L495: =SUM(L492:L494) -> 45 | M495: =(L495/45)*100 -> 100.0 | N495: =(L495/45)*100 -> 100.0 | O495: =(C495+F495+L495+I495) -> 176 | P495: =(O495/176)*100 -> 100.0 | Q495: =(O495/185)*100 -> 95.135135135135144
A497: 31 | B497: STUDENT RESPONSE to the unit(s) compared to others | C497: FRQ | D497: % T2 | E497: % T1 | F497: FRQ | G497: % T2 | H497: % T1 | I497: FRQ | J497: % T2 | K497: % T1 | L497: FRQ | M497: % T2 | N497: % T1 | O497: FRQ | P497: % T2 | Q497: % T1
B498: a. Student attention
B499: Higher | C499: 17 | D499: =(C499/30)*100 -> 56.666666666666664 | E499: =(C499/34)*100 -> 50.0 | F499: 36 | G499: =(F499/42)*100 -> 85.714285714285708 | H499: =(F499/49)*100 -> 73.469387755102048 | I499: 25 | J499: =(I499/49)*100 -> 51.020408163265309 | K499: =(I499/57)*100 -> 43.859649122807014 | L499: 23 | M499: =(L499/45)*100 -> 51.111111111111107 | N499: =(L499/45)*100 -> 51.111111111111107 | O499: =(C499+F499+L499+I499) -> 101 | P499: =(O499/166)*100 -> 60.843373493975903 | Q499: =(O499/185)*100 -> 54.594594594594589
B500: Same | C500: 13 | D500: =(C500/30)*100 -> 43.333333333333336 | E500: =(C500/34)*100 -> 38.235294117647058 | F500: 6 | G500: =(F500/42)*100 -> 14.285714285714285 | H500: =(F500/49)*100 -> 12.244897959183673 | I500: 24 | J500: =(I500/49)*100 -> 48.979591836734691 | K500: =(I500/57)*100 -> 42.105263157894733 | L500: 22 | M500: =(L500/45)*100 -> 48.888888888888886 | N500: =(L500/45)*100 -> 48.888888888888886 | O500: =(C500+F500+L500+I500) -> 65 | P500: =(O500/166)*100 -> 39.156626506024097 | Q500: =(O500/185)*100 -> 35.135135135135137
B501: Lower | C501: 0 | D501: =(C501/30)*100 -> 0.0 | E501: =(C501/34)*100 -> 0.0 | F501: 0 | G501: =(F501/42)*100 -> 0.0 | H501: =(F501/49)*100 -> 0.0 | I501: 0 | J501: =(I501/49)*100 -> 0.0 | K501: =(I501/57)*100 -> 0.0 | L501: 0 | M501: =(L501/45)*100 -> 0.0 | N501: =(L501/45)*100 -> 0.0 | O501: =(C501+F501+L501+I501) -> 0 | P501: =(O501/166)*100 -> 0.0 | Q501: =(O501/185)*100 -> 0.0
B502: Total | C502: =SUM(C499:C501) -> 30 | D502: =(C502/30)*100 -> 100.0 | E502: =(C502/34)*100 -> 88.235294117647058 | F502: =SUM(F499:F501) -> 42 | G502: =(F502/42)*100 -> 100.0 | H502: =(F502/49)*100 -> 85.714285714285708 | I502: =SUM(I499:I501) -> 49 | J502: =(I502/49)*100 -> 100.0 | K502: =(I502/57)*100 -> 85.964912280701753 | L502: =SUM(L499:L501) -> 45 | M502: =(L502/45)*100 -> 100.0 | N502: =(L502/45)*100 -> 100.0 | O502: =(C502+F502+L502+I502) -> 166 | P502: =(O502/166)*100 -> 100.0 | Q502: =(O502/185)*100 -> 89.72972972972974
B503: b. Student interest
B504: Higher | C504: 22 | D504: =(C504/31)*100 -> 70.967741935483872 | E504: =(C504/34)*100 -> 64.705882352941174 | F504: 30 | G504: =(F504/39)*100 -> 76.923076923076934 | H504: =(F504/49)*100 -> 61.224489795918366 | I504: 29 | J504: =(I504/49)*100 -> 59.183673469387756 | K504: =(I504/57)*100 -> 50.877192982456144 | L504: 25 | M504: =(L504/45)*100 -> 55.555555555555557 | N504: =(L504/45)*100 -> 55.555555555555557 | O504: =(C504+F504+L504+I504) -> 106 | P504: =(O504/164)*100 -> 64.634146341463421 | Q504: =(O504/185)*100 -> 57.297297297297298
B505: Same | C505: 9 | D505: =(C505/31)*100 -> 29.032258064516132 | E505: =(C505/34)*100 -> 26.47058823529412 | F505: 9 | G505: =(F505/39)*100 -> 23.076923076923077 | H505: =(F505/49)*100 -> 18.367346938775512 | I505: 20 | J505: =(I505/49)*100 -> 40.816326530612244 | K505: =(I505/57)*100 -> 35.087719298245609 | L505: 20 | M505: =(L505/45)*100 -> 44.444444444444443 | N505: =(L505/45)*100 -> 44.444444444444443 | O505: =(C505+F505+L505+I505) -> 58 | P505: =(O505/164)*100 -> 35.365853658536587 | Q505: =(O505/185)*100 -> 31.351351351351354
B506: Lower | C506: 0 | D506: =(C506/31)*100 -> 0.0 | E506: =(C506/34)*100 -> 0.0 | F506: 0 | G506: =(F506/39)*100 -> 0.0 | H506: =(F506/49)*100 -> 0.0 | I506: 0 | J506: =(I506/49)*100 -> 0.0 | K506: =(I506/57)*100 -> 0.0 | L506: 0 | M506: =(L506/45)*100 -> 0.0 | N506: =(L506/45)*100 -> 0.0 | O506: =(C506+F506+L506+I506) -> 0 | P506: =(O506/164)*100 -> 0.0 | Q506: =(O506/185)*100 -> 0.0
B507: Total | C507: =SUM(C504:C506) -> 31 | D507: =(C507/31)*100 -> 100.0 | E507: =(C507/34)*100 -> 91.17647058823529 | F507: =SUM(F504:F506) -> 39 | G507: =(F507/39)*100 -> 100.0 | H507: =(F507/49)*100 -> 79.591836734693871 | I507: =SUM(I504:I505) -> 49 | J507: =(I507/49)*100 -> 100.0 | K507: =(I507/57)*100 -> 85.964912280701753 | L507: =SUM(L504:L506) -> 45 | M507: =(L507/45)*100 -> 100.0 | N507: =(L507/45)*100 -> 100.0 | O507: =(C507+F507+L507+I507) -> 164 | P507: =(O507/164)*100 -> 100.0 | Q507: =(O507/185)*100 -> 88.64864864864866
B508: c. Student motivation
B509: Higher | C509: 19 | D509: =(C509/31)*100 -> 61.29032258064516 | E509: =(C509/34)*100 -> 55.882352941176471 | F509: 28 | G509: =(F509/41)*100 -> 68.292682926829272 | H509: =(F509/49)*100 -> 57.142857142857139 | I509: 26 | J509: =(I509/49)*100 -> 53.061224489795919 | K509: =(I509/57)*100 -> 45.614035087719294 | L509: 23 | M509: =(L509/45)*100 -> 51.111111111111107 | N509: =(L509/45)*100 -> 51.111111111111107 | O509: =(C509+F509+L509+I509) -> 96 | P509: =(O509/166)*100 -> 57.831325301204814 | Q509: =(O509/185)*100 -> 51.891891891891895
B510: Same | C510: 12 | D510: =(C510/31)*100 -> 38.70967741935484 | E510: =(C510/34)*100 -> 35.294117647058826 | F510: 13 | G510: =(F510/41)*100 -> 31.707317073170731 | H510: =(F510/49)*100 -> 26.530612244897959 | I510: 23 | J510: =(I510/49)*100 -> 46.938775510204081 | K510: =(I510/57)*100 -> 40.350877192982452 | L510: 22 | M510: =(L510/45)*100 -> 48.888888888888886 | N510: =(L510/45)*100 -> 48.888888888888886 | O510: =(C510+F510+L510+I510) -> 70 | P510: =(O510/166)*100 -> 42.168674698795186 | Q510: =(O510/185)*100 -> 37.837837837837839
B511: Lower | C511: 0 | D511: =(C511/31)*100 -> 0.0 | E511: =(C511/34)*100 -> 0.0 | F511: 0 | G511: =(F511/41)*100 -> 0.0 | H511: =(F511/49)*100 -> 0.0 | I511: 0 | J511: =(I511/49)*100 -> 0.0 | K511: =(I511/57)*100 -> 0.0 | L511: 0 | M511: =(L511/45)*100 -> 0.0 | N511: =(L511/45)*100 -> 0.0 | O511: =(C511+F511+L511+I511) -> 0 | P511: =(O511/166)*100 -> 0.0 | Q511: =(O511/185)*100 -> 0.0
B512: Total | C512: =SUM(C509:C511) -> 31 | D512: =(C512/31)*100 -> 100.0 | E512: =(C512/34)*100 -> 91.17647058823529 | F512: =SUM(F509:F511) -> 41 | G512: =(F512/41)*100 -> 100.0 | H512: =(F512/49)*100 -> 83.673469387755105 | I512: =SUM(I509:I511) -> 49 | J512: =(I512/49)*100 -> 100.0 | K512: =(I512/57)*100 -> 85.964912280701753 | L512: =SUM(L509:L511) -> 45 | M512: =(L512/45)*100 -> 100.0 | N512: =(L512/45)*100 -> 100.0 | O512: =(C512+F512+L512+I512) -> 166 | P512: =(O512/166)*100 -> 100.0 | Q512: =(O512/185)*100 -> 89.72972972972974
B513: d. Student mastery
B514: Higher | C514: 17 | D514: =(C514/31)*100 -> 54.838709677419352 | E514: =(C514/34)*100 -> 50.0 | F514: 27 | G514: =(F514/39)*100 -> 69.230769230769226 | H514: =(F514/49)*100 -> 55.102040816326522 | I514: 16 | J514: =(I514/49)*100 -> 32.653061224489797 | K514: =(I514/57)*100 -> 28.07017543859649 | L514: 16 | M514: =(L514/45)*100 -> 35.555555555555557 | N514: =(L514/45)*100 -> 35.555555555555557 | O514: =(C514+F514+L514+I514) -> 76 | P514: =(O514/164)*100 -> 46.341463414634148 | Q514: =(O514/185)*100 -> 41.081081081081081
B515: Same | C515: 14 | D515: =(C515/31)*100 -> 45.161290322580641 | E515: =(C515/34)*100 -> 41.17647058823529 | F515: 12 | G515: =(F515/39)*100 -> 30.76923076923077 | H515: =(F515/49)*100 -> 24.489795918367346 | I515: 33 | J515: =(I515/49)*100 -> 67.346938775510196 | K515: =(I515/57)*100 -> 57.894736842105267 | L515: 29 | M515: =(L515/45)*100 -> 64.444444444444443 | N515: =(L515/45)*100 -> 64.444444444444443 | O515: =(C515+F515+L515+I515) -> 88 | P515: =(O515/164)*100 -> 53.658536585365859 | Q515: =(O515/185)*100 -> 47.567567567567572
B516: Lower | C516: 0 | D516: =(C516/31)*100 -> 0.0 | E516: =(C516/34)*100 -> 0.0 | F516: 0 | G516: =(F516/39)*100 -> 0.0 | H516: =(F516/49)*100 -> 0.0 | I516: 0 | J516: =(I516/49)*100 -> 0.0 | K516: =(I516/57)*100 -> 0.0 | L516: 0 | M516: =(L516/45)*100 -> 0.0 | N516: =(L516/45)*100 -> 0.0 | O516: =(C516+F516+L516+I516) -> 0 | P516: =(O516/164)*100 -> 0.0 | Q516: =(O516/185)*100 -> 0.0
B517: Total | C517: =SUM(C514:C516) -> 31 | D517: =(C517/31)*100 -> 100.0 | E517: =(C517/34)*100 -> 91.17647058823529 | F517: =SUM(F514:F516) -> 39 | G517: =(F517/39)*100 -> 100.0 | H517: =(F517/49)*100 -> 79.591836734693871 | I517: =SUM(I514:I516) -> 49 | J517: =(I517/49)*100 -> 100.0 | K517: =(I517/57)*100 -> 85.964912280701753 | L517: =SUM(L514:L516) -> 45 | M517: =(L517/45)*100 -> 100.0 | N517: =(L517/45)*100 -> 100.0 | O517: =(C517+F517+L517+I517) -> 164 | P517: =(O517/164)*100 -> 100.0 | Q517: =(O517/185)*100 -> 88.64864864864866
A519: 32 | B519: Agreement on the use of the curriculum unit(s) | C519: FRQ | D519: % T2 | E519: % T1 | F519: FRQ | G519: % T2 | H519: % T1 | I519: FRQ | J519: % T2 | K519: % T1 | L519: FRQ | M519: % T2 | N519: % T1 | O519: FRQ | P519: % T2 | Q519: % T1
B520: a. Students mastery
B521: Strongly agree | C521: 8 | D521: =(C521/31)*100 -> 25.806451612903224 | E521: =(C521/34)*100 -> 23.52941176470588 | F521: 20 | G521: =(F521/43)*100 -> 46.511627906976742 | H521: =(F521/49)*100 -> 40.816326530612244 | I521: 9 | J521: =(I521/49)*100 -> 18.367346938775512 | K521: =(I521/57)*100 -> 15.789473684210526 | L521: 9 | M521: =(L521/44)*100 -> 20.454545454545457 | N521: =(L521/45)*100 -> 20.0 | O521: =(C521+F521+L521+I521) -> 46 | P521: =(O521/167)*100 -> 27.54491017964072 | Q521: =(O521/185)*100 -> 24.864864864864867
B522: Agree | C522: 19 | D522: =(C522/31)*100 -> 61.29032258064516 | E522: =(C522/34)*100 -> 55.882352941176471 | F522: 18 | G522: =(F522/43)*100 -> 41.860465116279073 | H522: =(F522/49)*100 -> 36.734693877551024 | I522: 19 | J522: =(I522/49)*100 -> 38.775510204081634 | K522: =(I522/57)*100 -> 33.333333333333329 | L522: 24 | M522: =(L522/44)*100 -> 54.54545454545454 | N522: =(L522/45)*100 -> 53.333333333333336 | O522: =(C522+F522+L522+I522) -> 80 | P522: =(O522/167)*100 -> 47.904191616766468 | Q522: =(O522/185)*100 -> 43.243243243243242
B523: Neither agree nor disagree | C523: 3 | D523: =(C523/31)*100 -> 9.67741935483871 | E523: =(C523/34)*100 -> 8.8235294117647065 | F523: 4 | G523: =(F523/43)*100 -> 9.3023255813953494 | H523: =(F523/49)*100 -> 8.1632653061224492 | I523: 21 | J523: =(I523/49)*100 -> 42.857142857142854 | K523: =(I523/57)*100 -> 36.84210526315789 | L523: 9 | M523: =(L523/44)*100 -> 20.454545454545457 | N523: =(L523/45)*100 -> 20.0 | O523: =(C523+F523+L523+I523) -> 37 | P523: =(O523/167)*100 -> 22.155688622754489 | Q523: =(O523/185)*100 -> 20.0
B524: Disagree | C524: 1 | D524: =(C524/31)*100 -> 3.225806451612903 | E524: =(C524/34)*100 -> 2.9411764705882351 | F524: 1 | G524: =(F524/43)*100 -> 2.3255813953488373 | H524: =(F524/49)*100 -> 2.0408163265306123 | I524: 0 | J524: =(I524/49)*100 -> 0.0 | K524: =(I524/57)*100 -> 0.0 | L524: 2 | M524: =(L524/44)*100 -> 4.5454545454545459 | N524: =(L524/45)*100 -> 4.4444444444444446 | O524: =(C524+F524+L524+I524) -> 4 | P524: =(O524/167)*100 -> 2.3952095808383236 | Q524: =(O524/185)*100 -> 2.1621621621621623
B525: Strongly disagree | C525: 0 | D525: =(C525/31)*100 -> 0.0 | E525: =(C525/34)*100 -> 0.0 | F525: 0 | G525: =(F525/43)*100 -> 0.0 | H525: =(F525/49)*100 -> 0.0 | I525: 0 | J525: =(I525/49)*100 -> 0.0 | K525: =(I525/57)*100 -> 0.0 | L525: 0 | M525: =(L525/44)*100 -> 0.0 | N525: =(L525/45)*100 -> 0.0 | O525: =(C525+F525+L525+I525) -> 0 | P525: =(O525/167)*100 -> 0.0 | Q525: =(O525/185)*100 -> 0.0
B526: Total | C526: =SUM(C521:C525) -> 31 | D526: =(C526/31)*100 -> 100.0 | E526: =(C526/34)*100 -> 91.17647058823529 | F526: =SUM(F521:F525) -> 43 | G526: =(F526/43)*100 -> 100.0 | H526: =(F526/49)*100 -> 87.755102040816325 | I526: =SUM(I521:I525) -> 49 | J526: =(I526/49)*100 -> 100.0 | K526: =(I526/57)*100 -> 85.964912280701753 | L526: =SUM(L521:L525) -> 44 | M526: =(L526/44)*100 -> 100.0 | N526: =(L526/45)*100 -> 97.777777777777771 | O526: =(C526+F526+L526+I526) -> 167 | P526: =(O526/167)*100 -> 100.0 | Q526: =(O526/185)*100 -> 90.270270270270274
B527: b. Students interest
B528: Strongly agree | C528: 16 | D528: =(C528/31)*100 -> 51.612903225806448 | E528: =(C528/34)*100 -> 47.058823529411761 | F528: 18 | G528: =(F528/43)*100 -> 41.860465116279073 | H528: =(F528/49)*100 -> 36.734693877551024 | I528: 13 | J528: =(I528/49)*100 -> 26.530612244897959 | K528: =(I528/57)*100 -> 22.807017543859647 | L528: 11 | M528: =(L528/45)*100 -> 24.444444444444443 | N528: =(L528/45)*100 -> 24.444444444444443 | O528: =(C528+F528+L528+I528) -> 58 | P528: =(O528/168)*100 -> 34.523809523809526 | Q528: =(O528/185)*100 -> 31.351351351351354
B529: Agree | C529: 11 | D529: =(C529/31)*100 -> 35.483870967741936 | E529: =(C529/34)*100 -> 32.352941176470587 | F529: 22 | G529: =(F529/43)*100 -> 51.162790697674424 | H529: =(F529/49)*100 -> 44.897959183673471 | I529: 19 | J529: =(I529/49)*100 -> 38.775510204081634 | K529: =(I529/57)*100 -> 33.333333333333329 | L529: 25 | M529: =(L529/45)*100 -> 55.555555555555557 | N529: =(L529/45)*100 -> 55.555555555555557 | O529: =(C529+F529+L529+I529) -> 77 | P529: =(O529/168)*100 -> 45.833333333333329 | Q529: =(O529/185)*100 -> 41.621621621621621
B530: Neither agree nor disagree | C530: 3 | D530: =(C530/31)*100 -> 9.67741935483871 | E530: =(C530/34)*100 -> 8.8235294117647065 | F530: 3 | G530: =(F530/43)*100 -> 6.9767441860465116 | H530: =(F530/49)*100 -> 6.1224489795918364 | I530: 16 | J530: =(I530/49)*100 -> 32.653061224489797 | K530: =(I530/57)*100 -> 28.07017543859649 | L530: 8 | M530: =(L530/45)*100 -> 17.777777777777779 | N530: =(L530/45)*100 -> 17.777777777777779 | O530: =(C530+F530+L530+I530) -> 30 | P530: =(O530/168)*100 -> 17.857142857142858 | Q530: =(O530/185)*100 -> 16.216216216216218
B531: Disagree | C531: 1 | D531: =(C531/31)*100 -> 3.225806451612903 | E531: =(C531/34)*100 -> 2.9411764705882351 | F531: 0 | G531: =(F531/43)*100 -> 0.0 | H531: =(F531/49)*100 -> 0.0 | I531: 1 | J531: =(I531/49)*100 -> 2.0408163265306123 | K531: =(I531/57)*100 -> 1.7543859649122806 | L531: 1 | M531: =(L531/45)*100 -> 2.2222222222222223 | N531: =(L531/45)*100 -> 2.2222222222222223 | O531: =(C531+F531+L531+I531) -> 3 | P531: =(O531/168)*100 -> 1.7857142857142856 | Q531: =(O531/185)*100 -> 1.6216216216216217
B532: Strongly disagree | C532: 0 | D532: =(C532/31)*100 -> 0.0 | E532: =(C532/34)*100 -> 0.0 | F532: 0 | G532: =(F532/43)*100 -> 0.0 | H532: =(F532/49)*100 -> 0.0 | I532: 0 | J532: =(I532/49)*100 -> 0.0 | K532: =(I532/57)*100 -> 0.0 | L532: 0 | M532: =(L532/45)*100 -> 0.0 | N532: =(L532/45)*100 -> 0.0 | O532: =(C532+F532+L532+I532) -> 0 | P532: =(O532/168)*100 -> 0.0 | Q532: =(O532/185)*100 -> 0.0
B533: Total | C533: =SUM(C528:C532) -> 31 | D533: =(C533/31)*100 -> 100.0 | E533: =(C533/34)*100 -> 91.17647058823529 | F533: =SUM(F528:F532) -> 43 | G533: =(F533/43)*100 -> 100.0 | H533: =(F533/49)*100 -> 87.755102040816325 | I533: =SUM(I528:I532) -> 49 | J533: =(I533/49)*100 -> 100.0 | K533: =(I533/57)*100 -> 85.964912280701753 | L533: =SUM(L528:L532) -> 45 | M533: =(L533/45)*100 -> 100.0 | N533: =(L533/45)*100 -> 100.0 | O533: =(C533+F533+L533+I533) -> 168 | P533: =(O533/168)*100 -> 100.0 | Q533: =(O533/185)*100 -> 90.810810810810821
B534: c. Students positive view
B535: Strongly agree | C535: 10 | D535: =(C535/31)*100 -> 32.258064516129032 | E535: =(C535/34)*100 -> 29.411764705882355 | F535: 19 | G535: =(F535/44)*100 -> 43.18181818181818 | H535: =(F535/49)*100 -> 38.775510204081634 | I535: 11 | J535: =(I535/49)*100 -> 22.448979591836736 | K535: =(I535/57)*100 -> 19.298245614035086 | L535: 9 | M535: =(L535/44)*100 -> 20.454545454545457 | N535: =(L535/45)*100 -> 20.0 | O535: =(C535+F535+L535+I535) -> 49 | P535: =(O535/168)*100 -> 29.166666666666668 | Q535: =(O535/185)*100 -> 26.486486486486488
B536: Agree | C536: 15 | D536: =(C536/31)*100 -> 48.387096774193552 | E536: =(C536/34)*100 -> 44.117647058823529 | F536: 19 | G536: =(F536/44)*100 -> 43.18181818181818 | H536: =(F536/49)*100 -> 38.775510204081634 | I536: 23 | J536: =(I536/49)*100 -> 46.938775510204081 | K536: =(I536/57)*100 -> 40.350877192982452 | L536: 23 | M536: =(L536/44)*100 -> 52.272727272727273 | N536: =(L536/45)*100 -> 51.111111111111107 | O536: =(C536+F536+L536+I536) -> 80 | P536: =(O536/168)*100 -> 47.619047619047613 | Q536: =(O536/185)*100 -> 43.243243243243242
B537: Neither agree nor disagree | C537: 5 | D537: =(C537/31)*100 -> 16.129032258064516 | E537: =(C537/34)*100 -> 14.705882352941178 | F537: 6 | G537: =(F537/44)*100 -> 13.636363636363635 | H537: =(F537/49)*100 -> 12.244897959183673 | I537: 13 | J537: =(I537/49)*100 -> 26.530612244897959 | K537: =(I537/57)*100 -> 22.807017543859647 | L537: 11 | M537: =(L537/44)*100 -> 25.0 | N537: =(L537/45)*100 -> 24.444444444444443 | O537: =(C537+F537+L537+I537) -> 35 | P537: =(O537/168)*100 -> 20.833333333333336 | Q537: =(O537/185)*100 -> 18.918918918918919
B538: Disagree | C538: 1 | D538: =(C538/31)*100 -> 3.225806451612903 | E538: =(C538/34)*100 -> 2.9411764705882351 | F538: 0 | G538: =(F538/44)*100 -> 0.0 | H538: =(F538/49)*100 -> 0.0 | I538: 2 | J538: =(I538/49)*100 -> 4.0816326530612246 | K538: =(I538/57)*100 -> 3.5087719298245612 | L538: 1 | M538: =(L538/44)*100 -> 2.2727272727272729 | N538: =(L538/45)*100 -> 2.2222222222222223 | O538: =(C538+F538+L538+I538) -> 4 | P538: =(O538/168)*100 -> 2.3809523809523809 | Q538: =(O538/185)*100 -> 2.1621621621621623
B539: Strongly disagree | C539: 0 | D539: =(C539/31)*100 -> 0.0 | E539: =(C539/34)*100 -> 0.0 | F539: 0 | G539: =(F539/44)*100 -> 0.0 | H539: =(F539/49)*100 -> 0.0 | I539: 0 | J539: =(I539/49)*100 -> 0.0 | K539: =(I539/57)*100 -> 0.0 | L539: 0 | M539: =(L539/44)*100 -> 0.0 | N539: =(L539/45)*100 -> 0.0 | O539: =(C539+F539+L539+I539) -> 0 | P539: =(O539/168)*100 -> 0.0 | Q539: =(O539/185)*100 -> 0.0
B540: Total | C540: =SUM(C535:C539) -> 31 | D540: =(C540/31)*100 -> 100.0 | E540: =(C540/34)*100 -> 91.17647058823529 | F540: =SUM(F535:F539) -> 44 | G540: =(F540/44)*100 -> 100.0 | H540: =(F540/49)*100 -> 89.795918367346943 | I540: =SUM(I535:I539) -> 49 | J540: =(I540/49)*100 -> 100.0 | K540: =(I540/57)*100 -> 85.964912280701753 | L540: =SUM(L535:L539) -> 44 | M540: =(L540/44)*100 -> 100.0 | N540: =(L540/45)*100 -> 97.777777777777771 | O540: =(C540+F540+L540+I540) -> 168 | P540: =(O540/168)*100 -> 100.0 | Q540: =(O540/185)*100 -> 90.810810810810821
B541: d. Caring about them
B542: Strongly agree | C542: 10 | D542: =(C542/31)*100 -> 32.258064516129032 | E542: =(C542/34)*100 -> 29.411764705882355 | F542: 17 | G542: =(F542/44)*100 -> 38.636363636363633 | H542: =(F542/49)*100 -> 34.693877551020407 | I542: 8 | J542: =(I542/49)*100 -> 16.326530612244898 | K542: =(I542/57)*100 -> 14.035087719298245 | L542: 7 | M542: =(L542/45)*100 -> 15.555555555555555 | N542: =(L542/45)*100 -> 15.555555555555555 | O542: =(C542+F542+L542+I542) -> 42 | P542: =(O542/169)*100 -> 24.852071005917161 | Q542: =(O542/185)*100 -> 22.702702702702705
B543: Agree | C543: 9 | D543: =(C543/31)*100 -> 29.032258064516132 | E543: =(C543/34)*100 -> 26.47058823529412 | F543: 13 | G543: =(F543/44)*100 -> 29.545454545454547 | H543: =(F543/49)*100 -> 26.530612244897959 | I543: 9 | J543: =(I543/49)*100 -> 18.367346938775512 | K543: =(I543/57)*100 -> 15.789473684210526 | L543: 21 | M543: =(L543/45)*100 -> 46.666666666666664 | N543: =(L543/45)*100 -> 46.666666666666664 | O543: =(C543+F543+L543+I543) -> 52 | P543: =(O543/169)*100 -> 30.76923076923077 | Q543: =(O543/185)*100 -> 28.108108108108109
B544: Neither agree nor disagree | C544: 10 | D544: =(C544/31)*100 -> 32.258064516129032 | E544: =(C544/34)*100 -> 29.411764705882355 | F544: 14 | G544: =(F544/44)*100 -> 31.818181818181817 | H544: =(F544/49)*100 -> 28.571428571428569 | I544: 30 | J544: =(I544/49)*100 -> 61.224489795918366 | K544: =(I544/57)*100 -> 52.631578947368418 | L544: 14 | M544: =(L544/45)*100 -> 31.111111111111111 | N544: =(L544/45)*100 -> 31.111111111111111 | O544: =(C544+F544+L544+I544) -> 68 | P544: =(O544/169)*100 -> 40.236686390532547 | Q544: =(O544/185)*100 -> 36.756756756756758
B545: Disagree | C545: 1 | D545: =(C545/31)*100 -> 3.225806451612903 | E545: =(C545/34)*100 -> 2.9411764705882351 | F545: 0 | G545: =(F545/44)*100 -> 0.0 | H545: =(F545/49)*100 -> 0.0 | I545: 1 | J545: =(I545/49)*100 -> 2.0408163265306123 | K545: =(I545/57)*100 -> 1.7543859649122806 | L545: 3 | M545: =(L545/45)*100 -> 6.666666666666667 | N545: =(L545/45)*100 -> 6.666666666666667 | O545: =(C545+F545+L545+I545) -> 5 | P545: =(O545/169)*100 -> 2.9585798816568047 | Q545: =(O545/185)*100 -> 2.7027027027027026
B546: Strongly disagree | C546: 1 | D546: =(C546/31)*100 -> 3.225806451612903 | E546: =(C546/34)*100 -> 2.9411764705882351 | F546: 0 | G546: =(F546/44)*100 -> 0.0 | H546: =(F546/49)*100 -> 0.0 | I546: 1 | J546: =(I546/49)*100 -> 2.0408163265306123 | K546: =(I546/57)*100 -> 1.7543859649122806 | L546: 0 | M546: =(L546/45)*100 -> 0.0 | N546: =(L546/45)*100 -> 0.0 | O546: =(C546+F546+L546+I546) -> 2 | P546: =(O546/169)*100 -> 1.1834319526627219 | Q546: =(O546/185)*100 -> 1.0810810810810811
B547: Total | C547: =SUM(C542:C546) -> 31 | D547: =(C547/31)*100 -> 100.0 | E547: =(C547/34)*100 -> 91.17647058823529 | F547: =SUM(F542:F546) -> 44 | G547: =(F547/44)*100 -> 100.0 | H547: =(F547/49)*100 -> 89.795918367346943 | I547: =SUM(I542:I546) -> 49 | J547: =(I547/49)*100 -> 100.0 | K547: =(I547/57)*100 -> 85.964912280701753 | L547: 45 | M547: =(L547/45)*100 -> 100.0 | N547: =(L547/45)*100 -> 100.0 | O547: =(C547+F547+L547+I547) -> 169 | P547: =(O547/169)*100 -> 100.0 | Q547: =(O547/185)*100 -> 91.351351351351354
B548: e. Continuous learning
B549: Strongly agree | C549: 19 | D549: =(C549/32)*100 -> 59.375 | E549: =(C549/34)*100 -> 55.882352941176471 | F549: 23 | G549: =(F549/43)*100 -> 53.488372093023251 | H549: =(F549/49)*100 -> 46.938775510204081 | I549: 18 | J549: =(I549/49)*100 -> 36.734693877551024 | K549: =(I549/57)*100 -> 31.578947368421051 | L549: 21 | M549: =(L549/45)*100 -> 46.666666666666664 | N549: =(L549/45)*100 -> 46.666666666666664 | O549: =(C549+F549+L549+I549) -> 81 | P549: =(O549/169)*100 -> 47.928994082840234 | Q549: =(O549/185)*100 -> 43.78378378378379
B550: Agree | C550: 11 | D550: =(C550/32)*100 -> 34.375 | E550: =(C550/34)*100 -> 32.352941176470587 | F550: 17 | G550: =(F550/43)*100 -> 39.534883720930232 | H550: =(F550/49)*100 -> 34.693877551020407 | I550: 21 | J550: =(I550/49)*100 -> 42.857142857142854 | K550: =(I550/57)*100 -> 36.84210526315789 | L550: 22 | M550: =(L550/45)*100 -> 48.888888888888886 | N550: =(L550/45)*100 -> 48.888888888888886 | O550: =(C550+F550+L550+I550) -> 71 | P550: =(O550/169)*100 -> 42.011834319526628 | Q550: =(O550/185)*100 -> 38.378378378378379
B551: Neither agree nor disagree | C551: 1 | D551: =(C551/32)*100 -> 3.125 | E551: =(C551/34)*100 -> 2.9411764705882351 | F551: 3 | G551: =(F551/43)*100 -> 6.9767441860465116 | H551: =(F551/49)*100 -> 6.1224489795918364 | I551: 10 | J551: =(I551/49)*100 -> 20.408163265306122 | K551: =(I551/57)*100 -> 17.543859649122805 | L551: 2 | M551: =(L551/45)*100 -> 4.4444444444444446 | N551: =(L551/45)*100 -> 4.4444444444444446 | O551: =(C551+F551+L551+I551) -> 16 | P551: =(O551/169)*100 -> 9.4674556213017755 | Q551: =(O551/185)*100 -> 8.6486486486486491
B552: Disagree | C552: 1 | D552: =(C552/32)*100 -> 3.125 | E552: =(C552/34)*100 -> 2.9411764705882351 | F552: 0 | G552: =(F552/43)*100 -> 0.0 | H552: =(F552/49)*100 -> 0.0 | I552: 0 | J552: =(I552/49)*100 -> 0.0 | K552: =(I552/57)*100 -> 0.0 | L552: 0 | M552: =(L552/45)*100 -> 0.0 | N552: =(L552/45)*100 -> 0.0 | O552: =(C552+F552+L552+I552) -> 1 | P552: =(O552/169)*100 -> 0.59171597633136097 | Q552: =(O552/185)*100 -> 0.54054054054054057
B553: Strongly disagree | C553: 0 | D553: =(C553/32)*100 -> 0.0 | E553: =(C553/34)*100 -> 0.0 | F553: 0 | G553: =(F553/43)*100 -> 0.0 | H553: =(F553/49)*100 -> 0.0 | I553: 0 | J553: =(I553/49)*100 -> 0.0 | K553: =(I553/57)*100 -> 0.0 | L553: 0 | M553: =(L553/45)*100 -> 0.0 | N553: =(L553/45)*100 -> 0.0 | O553: =(C553+F553+L553+I553) -> 0 | P553: =(O553/169)*100 -> 0.0 | Q553: =(O553/185)*100 -> 0.0
B554: Total | C554: =SUM(C549:C553) -> 32 | D554: =(C554/32)*100 -> 100.0 | E554: =(C554/34)*100 -> 94.117647058823522 | F554: =SUM(F549:F553) -> 43 | G554: =(F554/43)*100 -> 100.0 | H554: =(F554/49)*100 -> 87.755102040816325 | I554: =SUM(I549:I553) -> 49 | J554: =(I554/49)*100 -> 100.0 | K554: =(I554/57)*100 -> 85.964912280701753 | L554: =SUM(L549:L553) -> 45 | M554: =(L554/45)*100 -> 100.0 | N554: =(L554/45)*100 -> 100.0 | O554: =(C554+F554+L554+I554) -> 169 | P554: =(O554/169)*100 -> 100.0 | Q554: =(O554/185)*100 -> 91.351351351351354
B555: f. Questions and discussion
B556: Strongly agree | C556: 19 | D556: =(C556/32)*100 -> 59.375 | E556: =(C556/34)*100 -> 55.882352941176471 | F556: 24 | G556: =(F556/43)*100 -> 55.813953488372093 | H556: =(F556/49)*100 -> 48.979591836734691 | I556: 17 | J556: =(I556/49)*100 -> 34.693877551020407 | K556: =(I556/57)*100 -> 29.82456140350877 | L556: 17 | M556: =(L556/44)*100 -> 38.636363636363633 | N556: =(L556/45)*100 -> 37.777777777777779 | O556: =(C556+F556+L556+I556) -> 77 | P556: =(O556/168)*100 -> 45.833333333333329 | Q556: =(O556/185)*100 -> 41.621621621621621
B557: Agree | C557: 10 | D557: =(C557/32)*100 -> 31.25 | E557: =(C557/34)*100 -> 29.411764705882355 | F557: 14 | G557: =(F557/43)*100 -> 32.558139534883722 | H557: =(F557/49)*100 -> 28.571428571428569 | I557: 24 | J557: =(I557/49)*100 -> 48.979591836734691 | K557: =(I557/57)*100 -> 42.105263157894733 | L557: 17 | M557: =(L557/44)*100 -> 38.636363636363633 | N557: =(L557/45)*100 -> 37.777777777777779 | O557: =(C557+F557+L557+I557) -> 65 | P557: =(O557/168)*100 -> 38.69047619047619 | Q557: =(O557/185)*100 -> 35.135135135135137
B558: Neither agree nor disagree | C558: 2 | D558: =(C558/32)*100 -> 6.25 | E558: =(C558/34)*100 -> 5.8823529411764701 | F558: 4 | G558: =(F558/43)*100 -> 9.3023255813953494 | H558: =(F558/49)*100 -> 8.1632653061224492 | I558: 6 | J558: =(I558/49)*100 -> 12.244897959183673 | K558: =(I558/57)*100 -> 10.526315789473683 | L558: 8 | M558: =(L558/44)*100 -> 18.181818181818183 | N558: =(L558/45)*100 -> 17.777777777777779 | O558: =(C558+F558+L558+I558) -> 20 | P558: =(O558/168)*100 -> 11.904761904761903 | Q558: =(O558/185)*100 -> 10.810810810810811
B559: Disagree | C559: 1 | D559: =(C559/32)*100 -> 3.125 | E559: =(C559/34)*100 -> 2.9411764705882351 | F559: 1 | G559: =(F559/43)*100 -> 2.3255813953488373 | H559: =(F559/49)*100 -> 2.0408163265306123 | I559: 2 | J559: =(I559/49)*100 -> 4.0816326530612246 | K559: =(I559/57)*100 -> 3.5087719298245612 | L559: 2 | M559: =(L559/44)*100 -> 4.5454545454545459 | N559: =(L559/45)*100 -> 4.4444444444444446 | O559: =(C559+F559+L559+I559) -> 6 | P559: =(O559/168)*100 -> 3.5714285714285712 | Q559: =(O559/185)*100 -> 3.2432432432432434
B560: Strongly disagree | C560: 0 | D560: =(C560/32)*100 -> 0.0 | E560: =(C560/34)*100 -> 0.0 | F560: 0 | G560: =(F560/43)*100 -> 0.0 | H560: =(F560/49)*100 -> 0.0 | I560: 0 | J560: =(I560/49)*100 -> 0.0 | K560: =(I560/57)*100 -> 0.0 | L560: 0 | M560: =(L560/44)*100 -> 0.0 | N560: =(L560/45)*100 -> 0.0 | O560: =(C560+F560+L560+I560) -> 0 | P560: =(O560/168)*100 -> 0.0 | Q560: =(O560/185)*100 -> 0.0
B561: Total | C561: =SUM(C556:C560) -> 32 | D561: =(C561/32)*100 -> 100.0 | E561: =(C561/34)*100 -> 94.117647058823522 | F561: =SUM(F556:F560) -> 43 | G561: =(F561/43)*100 -> 100.0 | H561: =(F561/49)*100 -> 87.755102040816325 | I561: =SUM(I556:I560) -> 49 | J561: =(I561/49)*100 -> 100.0 | K561: =(I561/57)*100 -> 85.964912280701753 | L561: =SUM(L556:L560) -> 44 | M561: =(L561/44)*100 -> 100.0 | N561: =(L561/45)*100 -> 97.777777777777771 | O561: =(C561+F561+L561+I561) -> 168 | P561: =(O561/168)*100 -> 100.0 | Q561: =(O561/185)*100 -> 90.810810810810821
A563: 33 | B563: Reason NEVER able to use a particular curriculum unit | C563: FRQ | D563: % T2 | E563: % T1 | F563: FRQ | G563: % T2 | H563: % T1 | I563: FRQ | J563: % T2 | K563: % T1 | L563: FRQ | M563: % T2 | N563: % T1 | O563: FRQ | P563: % T2 | Q563: % T1
B564: Courses not assigned | C564: 3 | D564: =(C564/24)*100 -> 12.5 | E564: =(C564/34)*100 -> 8.8235294117647065 | F564: 0 | G564: =(F564/27)*100 -> 0.0 | H564: =(F564/49)*100 -> 0.0 | I564: 3 | J564: =(I564/33)*100 -> 9.0909090909090917 | K564: =(I564/57)*100 -> 5.2631578947368416 | L564: 1 | M564: =(L564/26)*100 -> 3.8461538461538463 | N564: =(L564/43)*100 -> 2.3255813953488373 | O564: =(C564+F564+L564+I564) -> 7 | P564: =(O564/110)*100 -> 6.3636363636363633 | Q564: =(O564/185)*100 -> 3.7837837837837842
B565: Poor students' preparation | C565: 1 | D565: =(C565/24)*100 -> 4.1666666666666661 | E565: =(C565/34)*100 -> 2.9411764705882351 | F565: 0 | G565: =(F565/27)*100 -> 0.0 | H565: =(F565/49)*100 -> 0.0 | I565: 0 | J565: =(I565/33)*100 -> 0.0 | K565: =(I565/57)*100 -> 0.0 | L565: 0 | M565: =(L565/26)*100 -> 0.0 | N565: =(L565/43)*100 -> 0.0 | O565: =(C565+F565+L565+I565) -> 1 | P565: =(O565/110)*100 -> 0.90909090909090906 | Q565: =(O565/185)*100 -> 0.54054054054054057
B566: Inflexibility of curriculum | C566: 2 | D566: =(C566/24)*100 -> 8.3333333333333321 | E566: =(C566/34)*100 -> 5.8823529411764701 | F566: 4 | G566: =(F566/27)*100 -> 14.814814814814813 | H566: =(F566/49)*100 -> 8.1632653061224492 | I566: 2 | J566: =(I566/33)*100 -> 6.0606060606060606 | K566: =(I566/57)*100 -> 3.5087719298245612 | L566: 1 | M566: =(L566/26)*100 -> 3.8461538461538463 | N566: =(L566/43)*100 -> 2.3255813953488373 | O566: =(C566+F566+L566+I566) -> 9 | P566: =(O566/110)*100 -> 8.1818181818181817 | Q566: =(O566/185)*100 -> 4.8648648648648649
B567: Change of school curriculum | C567: 0 | D567: =(C567/24)*100 -> 0.0 | E567: =(C567/34)*100 -> 0.0 | F567: 0 | G567: =(F567/27)*100 -> 0.0 | H567: =(F567/49)*100 -> 0.0 | I567: 1 | J567: =(I567/33)*100 -> 3.0303030303030303 | K567: =(I567/57)*100 -> 1.7543859649122806 | L567: 0 | M567: =(L567/26)*100 -> 0.0 | N567: =(L567/43)*100 -> 0.0 | O567: =(C567+F567+L567+I567) -> 1 | P567: =(O567/110)*100 -> 0.90909090909090906 | Q567: =(O567/185)*100 -> 0.54054054054054057
B568: School administrators | C568: 0 | D568: =(C568/24)*100 -> 0.0 | E568: =(C568/34)*100 -> 0.0 | F568: 0 | G568: =(F568/27)*100 -> 0.0 | H568: =(F568/49)*100 -> 0.0 | I568: 0 | J568: =(I568/33)*100 -> 0.0 | K568: =(I568/57)*100 -> 0.0 | L568: 0 | M568: =(L568/26)*100 -> 0.0 | N568: =(L568/43)*100 -> 0.0 | O568: =(C568+F568+L568+I568) -> 0 | P568: =(O568/110)*100 -> 0.0 | Q568: =(O568/185)*100 -> 0.0
B569: Other. | C569: 4 | D569: =(C569/24)*100 -> 16.666666666666664 | E569: =(C569/34)*100 -> 11.76470588235294 | F569: 2 | G569: =(F569/27)*100 -> 7.4074074074074066 | H569: =(F569/49)*100 -> 4.0816326530612246 | I569: 4 | J569: =(I569/33)*100 -> 12.121212121212121 | K569: =(I569/57)*100 -> 7.0175438596491224 | L569: 0 | M569: =(L569/26)*100 -> 0.0 | N569: =(L569/43)*100 -> 0.0 | O569: =(C569+F569+L569+I569) -> 10 | P569: =(O569/110)*100 -> 9.0909090909090917 | Q569: =(O569/185)*100 -> 5.4054054054054053
B570: N/A | C570: 14 | D570: =(C570/24)*100 -> 58.333333333333336 | E570: =(C570/34)*100 -> 41.17647058823529 | F570: 21 | G570: =(F570/27)*100 -> 77.777777777777786 | H570: =(F570/49)*100 -> 42.857142857142854 | I570: 23 | J570: =(I570/33)*100 -> 69.696969696969703 | K570: =(I570/57)*100 -> 40.350877192982452 | L570: 24 | M570: =(L570/26)*100 -> 92.307692307692307 | N570: =(L570/43)*100 -> 55.813953488372093 | O570: =(C570+F570+L570+I570) -> 82 | P570: =(O570/110)*100 -> 74.545454545454547 | Q570: =(O570/185)*100 -> 44.32432432432433
B571: Total | C571: =SUM(C564:C570) -> 24 | D571: =(C571/24)*100 -> 100.0 | E571: =(C571/34)*100 -> 70.588235294117652 | F571: =SUM(F564:F570) -> 27 | G571: =(F571/27)*100 -> 100.0 | H571: =(F571/49)*100 -> 55.102040816326522 | I571: =SUM(I564:I570) -> 33 | J571: =(I571/33)*100 -> 100.0 | K571: =(I571/57)*100 -> 57.894736842105267 | L571: =SUM(L564:L570) -> 26 | M571: =(L571/26)*100 -> 100.0 | N571: =(L571/43)*100 -> 60.465116279069761 | O571: =(C571+F571+L571+I571) -> 110 | P571: =(O571/110)*100 -> 100.0 | Q571: =(O571/185)*100 -> 59.45945945945946
A573: 34 | B573: Reason of NO LONGER USING a unit prepared in previous years | C573: FRQ | D573: % T2 | E573: % T1 | F573: FRQ | G573: % T2 | H573: % T1 | I573: FRQ | J573: % T2 | K573: % T1 | L573: FRQ | M573: % T2 | N573: % T1 | O573: FRQ | P573: % T2 | Q573: % T1
B574: No longer teaching | C574: 8 | D574: =(C574/15)*100 -> 53.333333333333336 | E574: =(C574/34)*100 -> 23.52941176470588 | F574: 3 | G574: =(F574/14)*100 -> 21.428571428571427 | H574: =(F574/49)*100 -> 6.1224489795918364 | I574: 6 | J574: =(I574/17)*100 -> 35.294117647058826 | K574: =(I574/57)*100 -> 10.526315789473683 | L574: 5 | M574: =(L574/13)*100 -> 38.461538461538467 | N574: =(L574/45)*100 -> 11.111111111111111 | O574: =(C574+F574+L574+I574) -> 22 | P574: =(O574/59)*100 -> 37.288135593220339 | Q574: =(O574/185)*100 -> 11.891891891891893
B575: The content now dated | C575: 0 | D575: =(C575/15)*100 -> 0.0 | E575: =(C575/34)*100 -> 0.0 | F575: 0 | G575: =(F575/14)*100 -> 0.0 | H575: =(F575/49)*100 -> 0.0 | I575: 0 | J575: =(I575/17)*100 -> 0.0 | K575: =(I575/57)*100 -> 0.0 | L575: 0 | M575: =(L575/13)*100 -> 0.0 | N575: =(L575/45)*100 -> 0.0 | O575: =(C575+F575+L575+I575) -> 0 | P575: =(O575/59)*100 -> 0.0 | Q575: =(O575/185)*100 -> 0.0
B576: Previous unit unsuccessful | C576: 0 | D576: =(C576/15)*100 -> 0.0 | E576: =(C576/34)*100 -> 0.0 | F576: 0 | G576: =(F576/14)*100 -> 0.0 | H576: =(F576/49)*100 -> 0.0 | I576: 1 | J576: =(I576/17)*100 -> 5.8823529411764701 | K576: =(I576/57)*100 -> 1.7543859649122806 | L576: 0 | M576: =(L576/13)*100 -> 0.0 | N576: =(L576/45)*100 -> 0.0 | O576: =(C576+F576+L576+I576) -> 1 | P576: =(O576/59)*100 -> 1.6949152542372881 | Q576: =(O576/185)*100 -> 0.54054054054054057
B577: No longer enough time | C577: 1 | D577: =(C577/15)*100 -> 6.666666666666667 | E577: =(C577/34)*100 -> 2.9411764705882351 | F577: 4 | G577: =(F577/14)*100 -> 28.571428571428569 | H577: =(F577/49)*100 -> 8.1632653061224492 | I577: 2 | J577: =(I577/17)*100 -> 11.76470588235294 | K577: =(I577/57)*100 -> 3.5087719298245612 | L577: 2 | M577: =(L577/13)*100 -> 15.384615384615385 | N577: =(L577/45)*100 -> 4.4444444444444446 | O577: =(C577+F577+L577+I577) -> 9 | P577: =(O577/59)*100 -> 15.254237288135593 | Q577: =(O577/185)*100 -> 4.8648648648648649
B578: Curriculum changed | C578: 2 | D578: =(C578/15)*100 -> 13.333333333333334 | E578: =(C578/34)*100 -> 5.8823529411764701 | F578: 1 | G578: =(F578/14)*100 -> 7.1428571428571423 | H578: =(F578/49)*100 -> 2.0408163265306123 | I578: 2 | J578: =(I578/17)*100 -> 11.76470588235294 | K578: =(I578/57)*100 -> 3.5087719298245612 | L578: 1 | M578: =(L578/13)*100 -> 7.6923076923076925 | N578: =(L578/45)*100 -> 2.2222222222222223 | O578: =(C578+F578+L578+I578) -> 6 | P578: =(O578/59)*100 -> 10.16949152542373 | Q578: =(O578/185)*100 -> 3.2432432432432434
B579: Different students level | C579: 1 | D579: =(C579/15)*100 -> 6.666666666666667 | E579: =(C579/34)*100 -> 2.9411764705882351 | F579: 2 | G579: =(F579/14)*100 -> 14.285714285714285 | H579: =(F579/49)*100 -> 4.0816326530612246 | I579: 2 | J579: =(I579/17)*100 -> 11.76470588235294 | K579: =(I579/57)*100 -> 3.5087719298245612 | L579: 1 | M579: =(L579/13)*100 -> 7.6923076923076925 | N579: =(L579/45)*100 -> 2.2222222222222223 | O579: =(C579+F579+L579+I579) -> 6 | P579: =(O579/59)*100 -> 10.16949152542373 | Q579: =(O579/185)*100 -> 3.2432432432432434
B580: Class materials not available | C580: 1 | D580: =(C580/15)*100 -> 6.666666666666667 | E580: =(C580/34)*100 -> 2.9411764705882351 | F580: 0 | G580: =(F580/14)*100 -> 0.0 | H580: =(F580/49)*100 -> 0.0 | I580: 0 | J580: =(I580/17)*100 -> 0.0 | K580: =(I580/57)*100 -> 0.0 | L580: 0 | M580: =(L580/13)*100 -> 0.0 | N580: =(L580/45)*100 -> 0.0 | O580: =(C580+F580+L580+I580) -> 1 | P580: =(O580/59)*100 -> 1.6949152542372881 | Q580: =(O580/185)*100 -> 0.54054054054054057
B581: School administrator | C581: 0 | D581: =(C581/15)*100 -> 0.0 | E581: =(C581/34)*100 -> 0.0 | F581: 0 | G581: =(F581/14)*100 -> 0.0 | H581: =(F581/49)*100 -> 0.0 | I581: 0 | J581: =(I581/17)*100 -> 0.0 | K581: =(I581/57)*100 -> 0.0 | L581: 0 | M581: =(L581/13)*100 -> 0.0 | N581: =(L581/45)*100 -> 0.0 | O581: =(C581+F581+L581+I581) -> 0 | P581: =(O581/59)*100 -> 0.0 | Q581: =(O581/185)*100 -> 0.0
B582: No longer interest | C582: 0 | D582: =(C582/15)*100 -> 0.0 | E582: =(C582/34)*100 -> 0.0 | F582: 0 | G582: =(F582/14)*100 -> 0.0 | H582: =(F582/49)*100 -> 0.0 | I582: 0 | J582: =(I582/17)*100 -> 0.0 | K582: =(I582/57)*100 -> 0.0 | L582: 0 | M582: =(L582/13)*100 -> 0.0 | N582: =(L582/45)*100 -> 0.0 | O582: =(C582+F582+L582+I582) -> 0 | P582: =(O582/59)*100 -> 0.0 | Q582: =(O582/185)*100 -> 0.0
B583: Tired of teaching the unit | C583: 0 | D583: =(C583/15)*100 -> 0.0 | E583: =(C583/34)*100 -> 0.0 | F583: 0 | G583: =(F583/14)*100 -> 0.0 | H583: =(F583/49)*100 -> 0.0 | I583: 0 | J583: =(I583/17)*100 -> 0.0 | K583: =(I583/57)*100 -> 0.0 | L583: 1 | M583: =(L583/13)*100 -> 7.6923076923076925 | N583: =(L583/45)*100 -> 2.2222222222222223 | O583: =(C583+F583+L583+I583) -> 1 | P583: =(O583/59)*100 -> 1.6949152542372881 | Q583: =(O583/185)*100 -> 0.54054054054054057
B584: Replaced with other Ins. unit | C584: 0 | D584: =(C584/15)*100 -> 0.0 | E584: =(C584/34)*100 -> 0.0 | F584: 0 | G584: =(F584/14)*100 -> 0.0 | H584: =(F584/49)*100 -> 0.0 | I584: 1 | J584: =(I584/17)*100 -> 5.8823529411764701 | K584: =(I584/57)*100 -> 1.7543859649122806 | L584: 1 | M584: =(L584/13)*100 -> 7.6923076923076925 | N584: =(L584/45)*100 -> 2.2222222222222223 | O584: =(C584+F584+L584+I584) -> 2 | P584: =(O584/59)*100 -> 3.3898305084745761 | Q584: =(O584/185)*100 -> 1.0810810810810811
B585: Other | C585: 2 | D585: =(C585/15)*100 -> 13.333333333333334 | E585: =(C585/34)*100 -> 5.8823529411764701 | F585: 4 | G585: =(F585/14)*100 -> 28.571428571428569 | H585: =(F585/49)*100 -> 8.1632653061224492 | I585: 3 | J585: =(I585/17)*100 -> 17.647058823529413 | K585: =(I585/57)*100 -> 5.2631578947368416 | L585: 2 | M585: =(L585/13)*100 -> 15.384615384615385 | N585: =(L585/45)*100 -> 4.4444444444444446 | O585: =(C585+F585+L585+I585) -> 11 | P585: =(O585/59)*100 -> 18.64406779661017 | Q585: =(O585/185)*100 -> 5.9459459459459465
B586: Total | C586: =SUM(C574:C585) -> 15 | D586: =(C586/15)*100 -> 100.0 | E586: =(C586/34)*100 -> 44.117647058823529 | F586: =SUM(F574:F585) -> 14 | G586: =(F586/14)*100 -> 100.0 | H586: =(F586/49)*100 -> 28.571428571428569 | I586: =SUM(I574:I585) -> 17 | J586: =(I586/17)*100 -> 100.0 | K586: =(I586/57)*100 -> 29.82456140350877 | L586: =SUM(L574:L585) -> 13 | M586: =(L586/13)*100 -> 100.0 | N586: =(L586/45)*100 -> 28.888888888888886 | O586: =(C586+F586+L586+I586) -> 59 | P586: =(O586/59)*100 -> 100.0 | Q586: =(O586/185)*100 -> 31.891891891891895
A588: 35 | B588: Overall number of used FTI curriculum units prepared by yourself or other Fellow | C588: FRQ | D588: AVG | E588: STD | F588: FRQ | G588: AVG | H588: STD | I588: FRQ | J588: AVG | K588: STD | L588: FRQ | M588: AVG | N588: STD | O588: FRQ | P588: AVG | Q588: STD
C589: 33 | D589: 1.9393939 | E589: 1.0879852999999999 | F589: 47 | G589: 1.6808510999999999 | H589: 1.3368747000000001 | I589: 51 | J589: 1.4134614999999999 | K589: 0.93263890000000005 | L589: 45 | M589: 1.7777778 | N589: 1.3123346 | O589: =(C589+F589+L589+I589) -> 176 | P589: 1.6846591 | Q589: 1.1801902
D590: RNG | E590: 0-4 | G590: RNG | H590: 0-7 | J590: RNG | K590: 0-4 | M590: RNG | N590: 0-8 | P590: RNG | Q590: 0-8
C591: 31 | D591: 2.0645161000000001 | E591: 0.99784709999999999 | F591: 45 | G591: 1.7555556000000001 | H591: 1.3169447000000001 | I591: 47 | J591: 1.5638297999999999 | K591: 0.85093949999999996 | L591: 44 | M591: 1.8181818000000001 | N591: 1.2988854999999999 | O591: =(C591+F591+L591+I591) -> 167 | P591: 1.7754490999999999 | Q591: 1.1428913999999999
D592: RNG | E592: 1-4 | G592: RNG | H592: 1-7 | J592: RNG | K592: 1-4 | M592: RNG | N592: 1-8 | P592: RNG | Q592: 1-8
A594: 36 | B594: Number of FTI curriculum units prepared during the CURRENT YEAR | C594: FRQ | D594: AVG | E594: STD | F594: FRQ | G594: AVG | H594: STD | I594: FRQ | J594: AVG | K594: STD | L594: FRQ | M594: AVG | N594: STD | O594: FRQ | P594: AVG | Q594: STD
C595: 34 | D595: 1.0588234999999999 | E595: 0.69374590000000003 | F595: 46 | G595: 1.7391304000000001 | H595: 3.2140993999999998 | I595: 50 | J595: 0.94117649999999997 | K595: 0.67562610000000001 | L595: 45 | M595: 1.2666667 | N595: 1.2684994999999999 | O595: =(C595+F595+L595+I595) -> 175 | P595: 1.2571429000000001 | Q595: 1.8436417
D596: RNG | E596: 0-3 | G596: RNG | H596: 0-21 | J596: RNG | K596: 0-3 | M596: RNG | N596: 0-8 | P596: RNG | Q596: 0-21
C597: 28 | D597: 1.2857143 | E597: 0.53452250000000001 | F597: 35 | G597: 2.2857143 | H597: 3.5194537000000001 | I597: 40 | J597: 1.20 | K597: 0.51639780000000002 | L597: 36 | M597: 1.5833333000000001 | N597: 1.2276575000000001 | O597: =(C597+F597+L597+I597) -> 139 | P597: 1.5899281000000001 | Q597: 1.9367272
D598: RNG | E598: 1-3 | G598: RNG | H598: 1-21 | J598: RNG | K598: 1-3 | M598: RNG | N598: 1-8 | P598: RNG | Q598: 1-21
B600: UNIT USE STATISTICS: FOUR AREAS
C602: ALBUQUERQUE (n=16) | F602: HOUSTON (n=17) | I602: PITTSBURGH (n=15) | L602: UCI-SA (n=10) | O602: ALL (n=58)
A604: 37 | B604: Way to get information about the unit(s) by Fellow Institute (multiple choice) | C604: FRQ | D604: % T2 | E604: % T1 | F604: FRQ | G604: % T2 | H604: % T1 | I604: FRQ | J604: % T2 | K604: % T1 | L604: FRQ | M604: % T2 | N604: % T1 | O604: FRQ | P604: % T2 | Q604: % T1
B605: Institute Seminar Coordinator | C605: 4 | D605: =(C605/24)*100 -> 16.666666666666664 | E605: =(C605/16)*100 -> 25.0 | F605: 2 | G605: =(F605/26)*100 -> 7.6923076923076925 | H605: =(F605/17)*100 -> 11.76470588235294 | I605: 2 | J605: =(I605/19)*100 -> 10.526315789473683 | K605: =(I605/15)*100 -> 13.333333333333334 | L605: 3 | M605: =(L605/17)*100 -> 17.647058823529413 | N605: =(L605/10)*100 -> 30.0 | O605: =(C605+F605+L605+I605) -> 11 | P605: =(O605/86)*100 -> 12.790697674418606 | Q605: =(O605/58)*100 -> 18.96551724137931
B606: School Representative | C606: 4 | D606: =(C606/24)*100 -> 16.666666666666664 | E606: =(C606/16)*100 -> 25.0 | F606: 2 | G606: =(F606/26)*100 -> 7.6923076923076925 | H606: =(F606/17)*100 -> 11.76470588235294 | I606: 7 | J606: =(I606/19)*100 -> 36.84210526315789 | K606: =(I606/15)*100 -> 46.666666666666664 | L606: 2 | M606: =(L606/17)*100 -> 11.76470588235294 | N606: =(L606/10)*100 -> 20.0 | O606: =(C606+F606+L606+I606) -> 15 | P606: =(O606/86)*100 -> 17.441860465116278 | Q606: =(O606/58)*100 -> 25.862068965517242
B607: Teacher written the unit | C607: 6 | D607: =(C607/24)*100 -> 25.0 | E607: =(C607/16)*100 -> 37.5 | F607: 3 | G607: =(F607/26)*100 -> 11.538461538461538 | H607: =(F607/17)*100 -> 17.647058823529413 | I607: 3 | J607: =(I607/19)*100 -> 15.789473684210526 | K607: =(I607/15)*100 -> 20.0 | L607: 5 | M607: =(L607/17)*100 -> 29.411764705882355 | N607: =(L607/10)*100 -> 50.0 | O607: =(C607+F607+L607+I607) -> 17 | P607: =(O607/86)*100 -> 19.767441860465116 | Q607: =(O607/58)*100 -> 29.310344827586203
B608: Teacher attended Ins. Seminar | C608: 3 | D608: =(C608/24)*100 -> 12.5 | E608: =(C608/16)*100 -> 18.75 | F608: 3 | G608: =(F608/26)*100 -> 11.538461538461538 | H608: =(F608/17)*100 -> 17.647058823529413 | I608: 3 | J608: =(I608/19)*100 -> 15.789473684210526 | K608: =(I608/15)*100 -> 20.0 | L608: 3 | M608: =(L608/17)*100 -> 17.647058823529413 | N608: =(L608/10)*100 -> 30.0 | O608: =(C608+F608+L608+I608) -> 12 | P608: =(O608/86)*100 -> 13.953488372093023 | Q608: =(O608/58)*100 -> 20.689655172413794
B609: Another teacher used the unit | C609: 0 | D609: =(C609/24)*100 -> 0.0 | E609: =(C609/16)*100 -> 0.0 | F609: 0 | G609: =(F609/26)*100 -> 0.0 | H609: =(F609/17)*100 -> 0.0 | I609: 0 | J609: =(I609/19)*100 -> 0.0 | K609: =(I609/15)*100 -> 0.0 | L609: 0 | M609: =(L609/17)*100 -> 0.0 | N609: =(L609/10)*100 -> 0.0 | O609: =(C609+F609+L609+I609) -> 0 | P609: =(O609/86)*100 -> 0.0 | Q609: =(O609/58)*100 -> 0.0
B610: Librarian | C610: 1 | D610: =(C610/24)*100 -> 4.1666666666666661 | E610: =(C610/16)*100 -> 6.25 | F610: 2 | G610: =(F610/26)*100 -> 7.6923076923076925 | H610: =(F610/17)*100 -> 11.76470588235294 | I610: 1 | J610: =(I610/19)*100 -> 5.2631578947368416 | K610: =(I610/15)*100 -> 6.666666666666667 | L610: 0 | M610: =(L610/17)*100 -> 0.0 | N610: =(L610/10)*100 -> 0.0 | O610: =(C610+F610+L610+I610) -> 4 | P610: =(O610/86)*100 -> 4.6511627906976747 | Q610: =(O610/58)*100 -> 6.8965517241379306
B611: Supervisor | C611: 0 | D611: =(C611/24)*100 -> 0.0 | E611: =(C611/16)*100 -> 0.0 | F611: 0 | G611: =(F611/26)*100 -> 0.0 | H611: =(F611/17)*100 -> 0.0 | I611: 0 | J611: =(I611/19)*100 -> 0.0 | K611: =(I611/15)*100 -> 0.0 | L611: 0 | M611: =(L611/17)*100 -> 0.0 | N611: =(L611/10)*100 -> 0.0 | O611: =(C611+F611+L611+I611) -> 0 | P611: =(O611/86)*100 -> 0.0 | Q611: =(O611/58)*100 -> 0.0
B612: Department chairperson | C612: 0 | D612: =(C612/24)*100 -> 0.0 | E612: =(C612/16)*100 -> 0.0 | F612: 0 | G612: =(F612/26)*100 -> 0.0 | H612: =(F612/17)*100 -> 0.0 | I612: 0 | J612: =(I612/19)*100 -> 0.0 | K612: =(I612/15)*100 -> 0.0 | L612: 0 | M612: =(L612/17)*100 -> 0.0 | N612: =(L612/10)*100 -> 0.0 | O612: =(C612+F612+L612+I612) -> 0 | P612: =(O612/86)*100 -> 0.0 | Q612: =(O612/58)*100 -> 0.0
B613: Principal | C613: 0 | D613: =(C613/24)*100 -> 0.0 | E613: =(C613/16)*100 -> 0.0 | F613: 1 | G613: =(F613/26)*100 -> 3.8461538461538463 | H613: =(F613/17)*100 -> 5.8823529411764701 | I613: 0 | J613: =(I613/19)*100 -> 0.0 | K613: =(I613/15)*100 -> 0.0 | L613: 0 | M613: =(L613/17)*100 -> 0.0 | N613: =(L613/10)*100 -> 0.0 | O613: =(C613+F613+L613+I613) -> 1 | P613: =(O613/86)*100 -> 1.1627906976744187 | Q613: =(O613/58)*100 -> 1.7241379310344827
B614: Institute website | C614: 3 | D614: =(C614/24)*100 -> 12.5 | E614: =(C614/16)*100 -> 18.75 | F614: 3 | G614: =(F614/26)*100 -> 11.538461538461538 | H614: =(F614/17)*100 -> 17.647058823529413 | I614: 2 | J614: =(I614/19)*100 -> 10.526315789473683 | K614: =(I614/15)*100 -> 13.333333333333334 | L614: 0 | M614: =(L614/17)*100 -> 0.0 | N614: =(L614/10)*100 -> 0.0 | O614: =(C614+F614+L614+I614) -> 8 | P614: =(O614/86)*100 -> 9.3023255813953494 | Q614: =(O614/58)*100 -> 13.793103448275861
B615: Index to Curriculum Units | C615: 0 | D615: =(C615/24)*100 -> 0.0 | E615: =(C615/16)*100 -> 0.0 | F615: 3 | G615: =(F615/26)*100 -> 11.538461538461538 | H615: =(F615/17)*100 -> 17.647058823529413 | I615: 0 | J615: =(I615/19)*100 -> 0.0 | K615: =(I615/15)*100 -> 0.0 | L615: 2 | M615: =(L615/17)*100 -> 11.76470588235294 | N615: =(L615/10)*100 -> 20.0 | O615: =(C615+F615+L615+I615) -> 5 | P615: =(O615/86)*100 -> 5.8139534883720927 | Q615: =(O615/58)*100 -> 8.6206896551724146
B616: Guide to Curriculum Units | C616: 2 | D616: =(C616/24)*100 -> 8.3333333333333321 | E616: =(C616/16)*100 -> 12.5 | F616: 4 | G616: =(F616/26)*100 -> 15.384615384615385 | H616: =(F616/17)*100 -> 23.52941176470588 | I616: 0 | J616: =(I616/19)*100 -> 0.0 | K616: =(I616/15)*100 -> 0.0 | L616: 1 | M616: =(L616/17)*100 -> 5.8823529411764701 | N616: =(L616/10)*100 -> 10.0 | O616: =(C616+F616+L616+I616) -> 7 | P616: =(O616/86)*100 -> 8.1395348837209305 | Q616: =(O616/58)*100 -> 12.068965517241379
B617: Workshop presentation | C617: 0 | D617: =(C617/24)*100 -> 0.0 | E617: =(C617/16)*100 -> 0.0 | F617: 0 | G617: =(F617/26)*100 -> 0.0 | H617: =(F617/17)*100 -> 0.0 | I617: 0 | J617: =(I617/19)*100 -> 0.0 | K617: =(I617/15)*100 -> 0.0 | L617: 1 | M617: =(L617/17)*100 -> 5.8823529411764701 | N617: =(L617/10)*100 -> 10.0 | O617: =(C617+F617+L617+I617) -> 1 | P617: =(O617/86)*100 -> 1.1627906976744187 | Q617: =(O617/58)*100 -> 1.7241379310344827
B618: Other | C618: 1 | D618: =(C618/24)*100 -> 4.1666666666666661 | E618: =(C618/16)*100 -> 6.25 | F618: 3 | G618: =(F618/26)*100 -> 11.538461538461538 | H618: =(F618/17)*100 -> 17.647058823529413 | I618: 1 | J618: =(I618/19)*100 -> 5.2631578947368416 | K618: =(I618/15)*100 -> 6.666666666666667 | L618: 0 | M618: =(L618/17)*100 -> 0.0 | N618: =(L618/10)*100 -> 0.0 | O618: =(C618+F618+L618+I618) -> 5 | P618: =(O618/86)*100 -> 5.8139534883720927 | Q618: =(O618/58)*100 -> 8.6206896551724146
B619: Total | C619: =SUM(C605:C618) -> 24 | D619: =(C619/24)*100 -> 100.0 | E619: =(C619/16)*100 -> 150.0 | F619: =SUM(F605:F618) -> 26 | G619: =(F619/26)*100 -> 100.0 | H619: =(F619/17)*100 -> 152.94117647058823 | I619: =SUM(I605:I618) -> 19 | J619: =(I619/19)*100 -> 100.0 | K619: =(I619/15)*100 -> 126.66666666666666 | L619: =SUM(L605:L618) -> 17 | M619: =(L619/17)*100 -> 100.0 | N619: =(L619/10)*100 -> 170.0 | O619: =(C619+F619+L619+I619) -> 86 | P619: =(O619/86)*100 -> 100.0 | Q619: =(O619/58)*100 -> 148.27586206896552
A621: 38 | B621: Reason of using the unit(s) by other Fellows (multiple choice) | C621: FRQ | D621: % T2 | E621: % T1 | F621: FRQ | G621: % T2 | H621: % T1 | I621: FRQ | J621: % T2 | K621: % T1 | L621: FRQ | M621: % T2 | N621: % T1 | O621: FRQ | P621: % T2 | Q621: % T1
B622: Fellow of TI | C622: 9 | D622: =(C622/19)*100 -> 47.368421052631575 | E622: =(C622/16)*100 -> 56.25 | F622: 12 | G622: =(F622/20)*100 -> 60.0 | H622: =(F622/17)*100 -> 70.588235294117652 | I622: 5 | J622: =(I622/14)*100 -> 35.714285714285715 | K622: =(I622/15)*100 -> 33.333333333333329 | L622: 4 | M622: =(L622/15)*100 -> 26.666666666666668 | N622: =(L622/10)*100 -> 40.0 | O622: =(C622+F622+L622+I622) -> 30 | P622: =(O622/68)*100 -> 44.117647058823529 | Q622: =(O622/58)*100 -> 51.724137931034484
B623: By teacher of the unit | C623: 2 | D623: =(C623/19)*100 -> 10.526315789473683 | E623: =(C623/16)*100 -> 12.5 | F623: 2 | G623: =(F623/20)*100 -> 10.0 | H623: =(F623/17)*100 -> 11.76470588235294 | I623: 5 | J623: =(I623/14)*100 -> 35.714285714285715 | K623: =(I623/15)*100 -> 33.333333333333329 | L623: 5 | M623: =(L623/15)*100 -> 33.333333333333329 | N623: =(L623/10)*100 -> 50.0 | O623: =(C623+F623+L623+I623) -> 14 | P623: =(O623/68)*100 -> 20.588235294117645 | Q623: =(O623/58)*100 -> 24.137931034482758
B624: By other teacher | C624: 1 | D624: =(C624/19)*100 -> 5.2631578947368416 | E624: =(C624/16)*100 -> 6.25 | F624: 2 | G624: =(F624/20)*100 -> 10.0 | H624: =(F624/17)*100 -> 11.76470588235294 | I624: 0 | J624: =(I624/14)*100 -> 0.0 | K624: =(I624/15)*100 -> 0.0 | L624: 0 | M624: =(L624/15)*100 -> 0.0 | N624: =(L624/10)*100 -> 0.0 | O624: =(C624+F624+L624+I624) -> 3 | P624: =(O624/68)*100 -> 4.4117647058823533 | Q624: =(O624/58)*100 -> 5.1724137931034484
B625: By Inst. Seminar Coordinator | C625: 0 | D625: =(C625/19)*100 -> 0.0 | E625: =(C625/16)*100 -> 0.0 | F625: 0 | G625: =(F625/20)*100 -> 0.0 | H625: =(F625/17)*100 -> 0.0 | I625: 0 | J625: =(I625/14)*100 -> 0.0 | K625: =(I625/15)*100 -> 0.0 | L625: 1 | M625: =(L625/15)*100 -> 6.666666666666667 | N625: =(L625/10)*100 -> 10.0 | O625: =(C625+F625+L625+I625) -> 1 | P625: =(O625/68)*100 -> 1.4705882352941175 | Q625: =(O625/58)*100 -> 1.7241379310344827
B626: By subject area supervisor | C626: 0 | D626: =(C626/19)*100 -> 0.0 | E626: =(C626/16)*100 -> 0.0 | F626: 1 | G626: =(F626/20)*100 -> 5.0 | H626: =(F626/17)*100 -> 5.8823529411764701 | I626: 0 | J626: =(I626/14)*100 -> 0.0 | K626: =(I626/15)*100 -> 0.0 | L626: 0 | M626: =(L626/15)*100 -> 0.0 | N626: =(L626/10)*100 -> 0.0 | O626: =(C626+F626+L626+I626) -> 1 | P626: =(O626/68)*100 -> 1.4705882352941175 | Q626: =(O626/58)*100 -> 1.7241379310344827
B627: By department chairperson | C627: 0 | D627: =(C627/19)*100 -> 0.0 | E627: =(C627/16)*100 -> 0.0 | F627: 0 | G627: =(F627/20)*100 -> 0.0 | H627: =(F627/17)*100 -> 0.0 | I627: 0 | J627: =(I627/14)*100 -> 0.0 | K627: =(I627/15)*100 -> 0.0 | L627: 0 | M627: =(L627/15)*100 -> 0.0 | N627: =(L627/10)*100 -> 0.0 | O627: =(C627+F627+L627+I627) -> 0 | P627: =(O627/68)*100 -> 0.0 | Q627: =(O627/58)*100 -> 0.0
B628: By school superintendent | C628: 0 | D628: =(C628/19)*100 -> 0.0 | E628: =(C628/16)*100 -> 0.0 | F628: 0 | G628: =(F628/20)*100 -> 0.0 | H628: =(F628/17)*100 -> 0.0 | I628: 0 | J628: =(I628/14)*100 -> 0.0 | K628: =(I628/15)*100 -> 0.0 | L628: 0 | M628: =(L628/15)*100 -> 0.0 | N628: =(L628/10)*100 -> 0.0 | O628: =(C628+F628+L628+I628) -> 0 | P628: =(O628/68)*100 -> 0.0 | Q628: =(O628/58)*100 -> 0.0
B629: In-service TI session | C629: 0 | D629: =(C629/19)*100 -> 0.0 | E629: =(C629/16)*100 -> 0.0 | F629: 0 | G629: =(F629/20)*100 -> 0.0 | H629: =(F629/17)*100 -> 0.0 | I629: 0 | J629: =(I629/14)*100 -> 0.0 | K629: =(I629/15)*100 -> 0.0 | L629: 1 | M629: =(L629/15)*100 -> 6.666666666666667 | N629: =(L629/10)*100 -> 10.0 | O629: =(C629+F629+L629+I629) -> 1 | P629: =(O629/68)*100 -> 1.4705882352941175 | Q629: =(O629/58)*100 -> 1.7241379310344827
B630: Reading the units | C630: 6 | D630: =(C630/19)*100 -> 31.578947368421051 | E630: =(C630/16)*100 -> 37.5 | F630: 2 | G630: =(F630/20)*100 -> 10.0 | H630: =(F630/17)*100 -> 11.76470588235294 | I630: 4 | J630: =(I630/14)*100 -> 28.571428571428569 | K630: =(I630/15)*100 -> 26.666666666666668 | L630: 4 | M630: =(L630/15)*100 -> 26.666666666666668 | N630: =(L630/10)*100 -> 40.0 | O630: =(C630+F630+L630+I630) -> 16 | P630: =(O630/68)*100 -> 23.52941176470588 | Q630: =(O630/58)*100 -> 27.586206896551722
B631: Other | C631: 1 | D631: =(C631/19)*100 -> 5.2631578947368416 | E631: =(C631/16)*100 -> 6.25 | F631: 1 | G631: =(F631/20)*100 -> 5.0 | H631: =(F631/17)*100 -> 5.8823529411764701 | I631: 0 | J631: =(I631/14)*100 -> 0.0 | K631: =(I631/15)*100 -> 0.0 | L631: 0 | M631: =(L631/15)*100 -> 0.0 | N631: =(L631/10)*100 -> 0.0 | O631: =(C631+F631+L631+I631) -> 2 | P631: =(O631/68)*100 -> 2.9411764705882351 | Q631: =(O631/58)*100 -> 3.4482758620689653
B632: Total | C632: =SUM(C622:C631) -> 19 | D632: =(C632/19)*100 -> 100.0 | E632: =(C632/16)*100 -> 118.75 | F632: =SUM(F622:F631) -> 20 | G632: =(F632/20)*100 -> 100.0 | H632: =(F632/17)*100 -> 117.64705882352942 | I632: =SUM(I622:I631) -> 14 | J632: =(I632/14)*100 -> 100.0 | K632: =(I632/15)*100 -> 93.333333333333329 | L632: =SUM(L622:L631) -> 15 | M632: =(L632/15)*100 -> 100.0 | N632: =(L632/10)*100 -> 150.0 | O632: =(C632+F632+L632+I632) -> 68 | P632: =(O632/68)*100 -> 100.0 | Q632: =(O632/58)*100 -> 117.24137931034481
A634: 39 | B634: Place obtained the copy of the unit(s) (multiple choice) | C634: FRQ | D634: % T2 | E634: % T1 | F634: FRQ | G634: % T2 | H634: % T1 | I634: FRQ | J634: % T2 | K634: % T1 | L634: FRQ | M634: % T2 | N634: % T1 | O634: FRQ | P634: % T2 | Q634: % T1
B635: Inst. Seminar Coordinator | C635: 2 | D635: =(C635/21)*100 -> 9.5238095238095237 | E635: =(C635/16)*100 -> 12.5 | F635: 2 | G635: =(F635/20)*100 -> 10.0 | H635: =(F635/17)*100 -> 11.76470588235294 | I635: 2 | J635: =(I635/15)*100 -> 13.333333333333334 | K635: =(I635/15)*100 -> 13.333333333333334 | L635: 7 | M635: =(L635/14)*100 -> 50.0 | N635: =(L635/10)*100 -> 70.0 | O635: =(C635+F635+L635+I635) -> 13 | P635: =(O635/70)*100 -> 18.571428571428573 | Q635: =(O635/58)*100 -> 22.413793103448278
B636: School representative | C636: 2 | D636: =(C636/21)*100 -> 9.5238095238095237 | E636: =(C636/16)*100 -> 12.5 | F636: 1 | G636: =(F636/20)*100 -> 5.0 | H636: =(F636/17)*100 -> 5.8823529411764701 | I636: 3 | J636: =(I636/15)*100 -> 20.0 | K636: =(I636/15)*100 -> 20.0 | L636: 2 | M636: =(L636/14)*100 -> 14.285714285714285 | N636: =(L636/10)*100 -> 20.0 | O636: =(C636+F636+L636+I636) -> 8 | P636: =(O636/70)*100 -> 11.428571428571429 | Q636: =(O636/58)*100 -> 13.793103448275861
B637: Teacher written the unit | C637: 4 | D637: =(C637/21)*100 -> 19.047619047619047 | E637: =(C637/16)*100 -> 25.0 | F637: 1 | G637: =(F637/20)*100 -> 5.0 | H637: =(F637/17)*100 -> 5.8823529411764701 | I637: 3 | J637: =(I637/15)*100 -> 20.0 | K637: =(I637/15)*100 -> 20.0 | L637: 1 | M637: =(L637/14)*100 -> 7.1428571428571423 | N637: =(L637/10)*100 -> 10.0 | O637: =(C637+F637+L637+I637) -> 9 | P637: =(O637/70)*100 -> 12.857142857142856 | Q637: =(O637/58)*100 -> 15.517241379310345
B638: Teacher attended Seminar | C638: 1 | D638: =(C638/21)*100 -> 4.7619047619047619 | E638: =(C638/16)*100 -> 6.25 | F638: 2 | G638: =(F638/20)*100 -> 10.0 | H638: =(F638/17)*100 -> 11.76470588235294 | I638: 0 | J638: =(I638/15)*100 -> 0.0 | K638: =(I638/15)*100 -> 0.0 | L638: 0 | M638: =(L638/14)*100 -> 0.0 | N638: =(L638/10)*100 -> 0.0 | O638: =(C638+F638+L638+I638) -> 3 | P638: =(O638/70)*100 -> 4.2857142857142856 | Q638: =(O638/58)*100 -> 5.1724137931034484
B639: Librarian | C639: 3 | D639: =(C639/21)*100 -> 14.285714285714285 | E639: =(C639/16)*100 -> 18.75 | F639: 1 | G639: =(F639/20)*100 -> 5.0 | H639: =(F639/17)*100 -> 5.8823529411764701 | I639: 1 | J639: =(I639/15)*100 -> 6.666666666666667 | K639: =(I639/15)*100 -> 6.666666666666667 | L639: 0 | M639: =(L639/14)*100 -> 0.0 | N639: =(L639/10)*100 -> 0.0 | O639: =(C639+F639+L639+I639) -> 5 | P639: =(O639/70)*100 -> 7.1428571428571423 | Q639: =(O639/58)*100 -> 8.6206896551724146
B640: Supervisor | C640: 0 | D640: =(C640/21)*100 -> 0.0 | E640: =(C640/16)*100 -> 0.0 | F640: 0 | G640: =(F640/20)*100 -> 0.0 | H640: =(F640/17)*100 -> 0.0 | I640: 0 | J640: =(I640/15)*100 -> 0.0 | K640: =(I640/15)*100 -> 0.0 | L640: 0 | M640: =(L640/14)*100 -> 0.0 | N640: =(L640/10)*100 -> 0.0 | O640: =(C640+F640+L640+I640) -> 0 | P640: =(O640/70)*100 -> 0.0 | Q640: =(O640/58)*100 -> 0.0
B641: Department chairperson | C641: 0 | D641: =(C641/21)*100 -> 0.0 | E641: =(C641/16)*100 -> 0.0 | F641: 0 | G641: =(F641/20)*100 -> 0.0 | H641: =(F641/17)*100 -> 0.0 | I641: 0 | J641: =(I641/15)*100 -> 0.0 | K641: =(I641/15)*100 -> 0.0 | L641: 0 | M641: =(L641/14)*100 -> 0.0 | N641: =(L641/10)*100 -> 0.0 | O641: =(C641+F641+L641+I641) -> 0 | P641: =(O641/70)*100 -> 0.0 | Q641: =(O641/58)*100 -> 0.0
B642: Principal | C642: 0 | D642: =(C642/21)*100 -> 0.0 | E642: =(C642/16)*100 -> 0.0 | F642: 0 | G642: =(F642/20)*100 -> 0.0 | H642: =(F642/17)*100 -> 0.0 | I642: 0 | J642: =(I642/15)*100 -> 0.0 | K642: =(I642/15)*100 -> 0.0 | L642: 0 | M642: =(L642/14)*100 -> 0.0 | N642: =(L642/10)*100 -> 0.0 | O642: =(C642+F642+L642+I642) -> 0 | P642: =(O642/70)*100 -> 0.0 | Q642: =(O642/58)*100 -> 0.0
B643: School library | C643: 1 | D643: =(C643/21)*100 -> 4.7619047619047619 | E643: =(C643/16)*100 -> 6.25 | F643: 4 | G643: =(F643/20)*100 -> 20.0 | H643: =(F643/17)*100 -> 23.52941176470588 | I643: 2 | J643: =(I643/15)*100 -> 13.333333333333334 | K643: =(I643/15)*100 -> 13.333333333333334 | L643: 0 | M643: =(L643/14)*100 -> 0.0 | N643: =(L643/10)*100 -> 0.0 | O643: =(C643+F643+L643+I643) -> 7 | P643: =(O643/70)*100 -> 10.0 | Q643: =(O643/58)*100 -> 12.068965517241379
B644: Institute office | C644: 1 | D644: =(C644/21)*100 -> 4.7619047619047619 | E644: =(C644/16)*100 -> 6.25 | F644: 0 | G644: =(F644/20)*100 -> 0.0 | H644: =(F644/17)*100 -> 0.0 | I644: 0 | J644: =(I644/15)*100 -> 0.0 | K644: =(I644/15)*100 -> 0.0 | L644: 2 | M644: =(L644/14)*100 -> 14.285714285714285 | N644: =(L644/10)*100 -> 20.0 | O644: =(C644+F644+L644+I644) -> 3 | P644: =(O644/70)*100 -> 4.2857142857142856 | Q644: =(O644/58)*100 -> 5.1724137931034484
B645: Institute website | C645: 5 | D645: =(C645/21)*100 -> 23.809523809523807 | E645: =(C645/16)*100 -> 31.25 | F645: 7 | G645: =(F645/20)*100 -> 35.0 | H645: =(F645/17)*100 -> 41.17647058823529 | I645: 3 | J645: =(I645/15)*100 -> 20.0 | K645: =(I645/15)*100 -> 20.0 | L645: 1 | M645: =(L645/14)*100 -> 7.1428571428571423 | N645: =(L645/10)*100 -> 10.0 | O645: =(C645+F645+L645+I645) -> 16 | P645: =(O645/70)*100 -> 22.857142857142858 | Q645: =(O645/58)*100 -> 27.586206896551722
B646: Other | C646: 2 | D646: =(C646/21)*100 -> 9.5238095238095237 | E646: =(C646/16)*100 -> 12.5 | F646: 2 | G646: =(F646/20)*100 -> 10.0 | H646: =(F646/17)*100 -> 11.76470588235294 | I646: 1 | J646: =(I646/15)*100 -> 6.666666666666667 | K646: =(I646/15)*100 -> 6.666666666666667 | L646: 1 | M646: =(L646/14)*100 -> 7.1428571428571423 | N646: =(L646/10)*100 -> 10.0 | O646: =(C646+F646+L646+I646) -> 6 | P646: =(O646/70)*100 -> 8.5714285714285712 | Q646: =(O646/58)*100 -> 10.344827586206897
B647: Total | C647: =SUM(C635:C646) -> 21 | D647: =(C647/21)*100 -> 100.0 | E647: =(C647/16)*100 -> 131.25 | F647: =SUM(F635:F646) -> 20 | G647: =(F647/20)*100 -> 100.0 | H647: =(F647/17)*100 -> 117.64705882352942 | I647: =SUM(I635:I646) -> 15 | J647: =(I647/15)*100 -> 100.0 | K647: =(I647/15)*100 -> 100.0 | L647: =SUM(L635:L646) -> 14 | M647: =(L647/14)*100 -> 100.0 | N647: =(L647/10)*100 -> 140.0 | O647: =(C647+F647+L647+I647) -> 70 | P647: =(O647/70)*100 -> 100.0 | Q647: =(O647/58)*100 -> 120.68965517241379
A649: 40 | B649: Usefulness of the units prepared by other Fellows | C649: FRQ | D649: % T2 | E649: % T1 | F649: FRQ | G649: % T2 | H649: % T1 | I649: FRQ | J649: % T2 | K649: % T1 | L649: FRQ | M649: % T2 | N649: % T1 | O649: FRQ | P649: % T2 | Q649: % T1
B650: a. Objectives
B651: Very useful | C651: 9 | D651: =(C651/15)*100 -> 60.0 | E651: =(C651/16)*100 -> 56.25 | F651: 9 | G651: =(F651/16)*100 -> 56.25 | H651: =(F651/17)*100 -> 52.941176470588239 | I651: 4 | J651: =(I651/14)*100 -> 28.571428571428569 | K651: =(I651/15)*100 -> 26.666666666666668 | L651: 6 | M651: =(L651/9)*100 -> 66.666666666666657 | N651: =(L651/10)*100 -> 60.0 | O651: =(C651+F651+L651+I651) -> 28 | P651: =(O651/54)*100 -> 51.851851851851848 | Q651: =(O651/58)*100 -> 48.275862068965516
B652: Somewhat useful | C652: 5 | D652: =(C652/15)*100 -> 33.333333333333329 | E652: =(C652/16)*100 -> 31.25 | F652: 6 | G652: =(F652/16)*100 -> 37.5 | H652: =(F652/17)*100 -> 35.294117647058826 | I652: 9 | J652: =(I652/14)*100 -> 64.285714285714292 | K652: =(I652/15)*100 -> 60.0 | L652: 3 | M652: =(L652/9)*100 -> 33.333333333333329 | N652: =(L652/10)*100 -> 30.0 | O652: =(C652+F652+L652+I652) -> 23 | P652: =(O652/54)*100 -> 42.592592592592595 | Q652: =(O652/58)*100 -> 39.655172413793103
B653: Not at all useful | C653: 1 | D653: =(C653/15)*100 -> 6.666666666666667 | E653: =(C653/16)*100 -> 6.25 | F653: 0 | G653: =(F653/16)*100 -> 0.0 | H653: =(F653/17)*100 -> 0.0 | I653: 0 | J653: =(I653/14)*100 -> 0.0 | K653: =(I653/15)*100 -> 0.0 | L653: 0 | M653: =(L653/9)*100 -> 0.0 | N653: =(L653/10)*100 -> 0.0 | O653: =(C653+F653+L653+I653) -> 1 | P653: =(O653/54)*100 -> 1.8518518518518516 | Q653: =(O653/58)*100 -> 1.7241379310344827
B654: Did not use | C654: 0 | D654: =(C654/15)*100 -> 0.0 | E654: =(C654/16)*100 -> 0.0 | F654: 1 | G654: =(F654/16)*100 -> 6.25 | H654: =(F654/17)*100 -> 5.8823529411764701 | I654: 1 | J654: =(I654/14)*100 -> 7.1428571428571423 | K654: =(I654/15)*100 -> 6.666666666666667 | L654: 0 | M654: =(L654/9)*100 -> 0.0 | N654: =(L654/10)*100 -> 0.0 | O654: =(C654+F654+L654+I654) -> 2 | P654: =(O654/54)*100 -> 3.7037037037037033 | Q654: =(O654/58)*100 -> 3.4482758620689653
B655: Total | C655: =SUM(C651:C654) -> 15 | D655: =(C655/15)*100 -> 100.0 | E655: =(C655/16)*100 -> 93.75 | F655: =SUM(F651:F654) -> 16 | G655: =(F655/16)*100 -> 100.0 | H655: =(F655/17)*100 -> 94.117647058823522 | I655: =SUM(I651:I654) -> 14 | J655: =(I655/14)*100 -> 100.0 | K655: =(I655/15)*100 -> 93.333333333333329 | L655: =SUM(L651:L654) -> 9 | M655: =(L655/9)*100 -> 100.0 | N655: =(L655/10)*100 -> 90.0 | O655: =(C655+F655+L655+I655) -> 54 | P655: =(O655/54)*100 -> 100.0 | Q655: =(O655/58)*100 -> 93.103448275862064
B656: b. Teaching strategies
B657: Very useful | C657: 6 | D657: =(C657/15)*100 -> 40.0 | E657: =(C657/16)*100 -> 37.5 | F657: 10 | G657: =(F657/16)*100 -> 62.5 | H657: =(F657/17)*100 -> 58.82352941176471 | I657: 5 | J657: =(I657/14)*100 -> 35.714285714285715 | K657: =(I657/15)*100 -> 33.333333333333329 | L657: 5 | M657: =(L657/8)*100 -> 62.5 | N657: =(L657/10)*100 -> 50.0 | O657: =(C657+F657+L657+I657) -> 26 | P657: =(O657/53)*100 -> 49.056603773584904 | Q657: =(O657/58)*100 -> 44.827586206896555
B658: Somewhat useful | C658: 9 | D658: =(C658/15)*100 -> 60.0 | E658: =(C658/16)*100 -> 56.25 | F658: 6 | G658: =(F658/16)*100 -> 37.5 | H658: =(F658/17)*100 -> 35.294117647058826 | I658: 8 | J658: =(I658/14)*100 -> 57.142857142857139 | K658: =(I658/15)*100 -> 53.333333333333336 | L658: 3 | M658: =(L658/8)*100 -> 37.5 | N658: =(L658/10)*100 -> 30.0 | O658: =(C658+F658+L658+I658) -> 26 | P658: =(O658/53)*100 -> 49.056603773584904 | Q658: =(O658/58)*100 -> 44.827586206896555
B659: Not at all useful | C659: 0 | D659: =(C659/15)*100 -> 0.0 | E659: =(C659/16)*100 -> 0.0 | F659: 0 | G659: =(F659/16)*100 -> 0.0 | H659: =(F659/17)*100 -> 0.0 | I659: 0 | J659: =(I659/14)*100 -> 0.0 | K659: =(I659/15)*100 -> 0.0 | L659: 0 | M659: =(L659/8)*100 -> 0.0 | N659: =(L659/10)*100 -> 0.0 | O659: =(C659+F659+L659+I659) -> 0 | P659: =(O659/53)*100 -> 0.0 | Q659: =(O659/58)*100 -> 0.0
B660: Did not use | C660: 0 | D660: =(C660/15)*100 -> 0.0 | E660: =(C660/16)*100 -> 0.0 | F660: 0 | G660: =(F660/16)*100 -> 0.0 | H660: =(F660/17)*100 -> 0.0 | I660: 1 | J660: =(I660/14)*100 -> 7.1428571428571423 | K660: =(I660/15)*100 -> 6.666666666666667 | L660: 0 | M660: =(L660/8)*100 -> 0.0 | N660: =(L660/10)*100 -> 0.0 | O660: =(C660+F660+L660+I660) -> 1 | P660: =(O660/53)*100 -> 1.8867924528301887 | Q660: =(O660/58)*100 -> 1.7241379310344827
B661: Total | C661: =SUM(C657:C660) -> 15 | D661: =(C661/15)*100 -> 100.0 | E661: =(C661/16)*100 -> 93.75 | F661: =SUM(F657:F660) -> 16 | G661: =(F661/16)*100 -> 100.0 | H661: =(F661/17)*100 -> 94.117647058823522 | I661: =SUM(I657:I660) -> 14 | J661: =(I661/14)*100 -> 100.0 | K661: =(I661/15)*100 -> 93.333333333333329 | L661: =SUM(L657:L660) -> 8 | M661: =(L661/8)*100 -> 100.0 | N661: =(L661/10)*100 -> 80.0 | O661: =(C661+F661+L661+I661) -> 53 | P661: =(O661/53)*100 -> 100.0 | Q661: =(O661/58)*100 -> 91.379310344827587
B662: c. Sample lessons/activities
B663: Very useful | C663: 11 | D663: =(C663/16)*100 -> 68.75 | E663: =(C663/16)*100 -> 68.75 | F663: 11 | G663: =(F663/16)*100 -> 68.75 | H663: =(F663/17)*100 -> 64.705882352941174 | I663: 6 | J663: =(I663/14)*100 -> 42.857142857142854 | K663: =(I663/15)*100 -> 40.0 | L663: 7 | M663: =(L663/9)*100 -> 77.777777777777786 | N663: =(L663/10)*100 -> 70.0 | O663: =(C663+F663+L663+I663) -> 35 | P663: =(O663/55)*100 -> 63.636363636363633 | Q663: =(O663/58)*100 -> 60.344827586206897
B664: Somewhat useful | C664: 5 | D664: =(C664/16)*100 -> 31.25 | E664: =(C664/16)*100 -> 31.25 | F664: 5 | G664: =(F664/16)*100 -> 31.25 | H664: =(F664/17)*100 -> 29.411764705882355 | I664: 7 | J664: =(I664/14)*100 -> 50.0 | K664: =(I664/15)*100 -> 46.666666666666664 | L664: 2 | M664: =(L664/9)*100 -> 22.222222222222221 | N664: =(L664/10)*100 -> 20.0 | O664: =(C664+F664+L664+I664) -> 19 | P664: =(O664/55)*100 -> 34.545454545454547 | Q664: =(O664/58)*100 -> 32.758620689655174
B665: Not at all useful | C665: 0 | D665: =(C665/16)*100 -> 0.0 | E665: =(C665/16)*100 -> 0.0 | F665: 0 | G665: =(F665/16)*100 -> 0.0 | H665: =(F665/17)*100 -> 0.0 | I665: 0 | J665: =(I665/14)*100 -> 0.0 | K665: =(I665/15)*100 -> 0.0 | L665: 0 | M665: =(L665/9)*100 -> 0.0 | N665: =(L665/10)*100 -> 0.0 | O665: =(C665+F665+L665+I665) -> 0 | P665: =(O665/55)*100 -> 0.0 | Q665: =(O665/58)*100 -> 0.0
B666: Did not use | C666: 0 | D666: =(C666/16)*100 -> 0.0 | E666: =(C666/16)*100 -> 0.0 | F666: 0 | G666: =(F666/16)*100 -> 0.0 | H666: =(F666/17)*100 -> 0.0 | I666: 1 | J666: =(I666/14)*100 -> 7.1428571428571423 | K666: =(I666/15)*100 -> 6.666666666666667 | L666: 0 | M666: =(L666/9)*100 -> 0.0 | N666: =(L666/10)*100 -> 0.0 | O666: =(C666+F666+L666+I666) -> 1 | P666: =(O666/55)*100 -> 1.8181818181818181 | Q666: =(O666/58)*100 -> 1.7241379310344827
B667: Total | C667: =SUM(C663:C666) -> 16 | D667: =(C667/16)*100 -> 100.0 | E667: =(C667/16)*100 -> 100.0 | F667: =SUM(F663:F666) -> 16 | G667: =(F667/16)*100 -> 100.0 | H667: =(F667/17)*100 -> 94.117647058823522 | I667: =SUM(I663:I666) -> 14 | J667: =(I667/14)*100 -> 100.0 | K667: =(I667/15)*100 -> 93.333333333333329 | L667: =SUM(L663:L666) -> 9 | M667: =(L667/9)*100 -> 100.0 | N667: =(L667/10)*100 -> 90.0 | O667: =(C667+F667+L667+I667) -> 55 | P667: =(O667/55)*100 -> 100.0 | Q667: =(O667/58)*100 -> 94.827586206896555
B668: d. Resource list for teachers
B669: Very useful | C669: 9 | D669: =(C669/16)*100 -> 56.25 | E669: =(C669/16)*100 -> 56.25 | F669: 6 | G669: =(F669/15)*100 -> 40.0 | H669: =(F669/17)*100 -> 35.294117647058826 | I669: 10 | J669: =(I669/14)*100 -> 71.428571428571431 | K669: =(I669/15)*100 -> 66.666666666666657 | L669: 9 | M669: =(L669/10)*100 -> 90.0 | N669: =(L669/10)*100 -> 90.0 | O669: =(C669+F669+L669+I669) -> 34 | P669: =(O669/55)*100 -> 61.818181818181813 | Q669: =(O669/58)*100 -> 58.620689655172406
B670: Somewhat useful | C670: 5 | D670: =(C670/16)*100 -> 31.25 | E670: =(C670/16)*100 -> 31.25 | F670: 7 | G670: =(F670/15)*100 -> 46.666666666666664 | H670: =(F670/17)*100 -> 41.17647058823529 | I670: 2 | J670: =(I670/14)*100 -> 14.285714285714285 | K670: =(I670/15)*100 -> 13.333333333333334 | L670: 1 | M670: =(L670/10)*100 -> 10.0 | N670: =(L670/10)*100 -> 10.0 | O670: =(C670+F670+L670+I670) -> 15 | P670: =(O670/55)*100 -> 27.27272727272727 | Q670: =(O670/58)*100 -> 25.862068965517242
B671: Not at all useful | C671: 1 | D671: =(C671/16)*100 -> 6.25 | E671: =(C671/16)*100 -> 6.25 | F671: 0 | G671: =(F671/15)*100 -> 0.0 | H671: =(F671/17)*100 -> 0.0 | I671: 1 | J671: =(I671/14)*100 -> 7.1428571428571423 | K671: =(I671/15)*100 -> 6.666666666666667 | L671: 0 | M671: =(L671/10)*100 -> 0.0 | N671: =(L671/10)*100 -> 0.0 | O671: =(C671+F671+L671+I671) -> 2 | P671: =(O671/55)*100 -> 3.6363636363636362 | Q671: =(O671/58)*100 -> 3.4482758620689653
B672: Did not use | C672: 1 | D672: =(C672/16)*100 -> 6.25 | E672: =(C672/16)*100 -> 6.25 | F672: 2 | G672: =(F672/15)*100 -> 13.333333333333334 | H672: =(F672/17)*100 -> 11.76470588235294 | I672: 1 | J672: =(I672/14)*100 -> 7.1428571428571423 | K672: =(I672/15)*100 -> 6.666666666666667 | L672: 0 | M672: =(L672/10)*100 -> 0.0 | N672: =(L672/10)*100 -> 0.0 | O672: =(C672+F672+L672+I672) -> 4 | P672: =(O672/55)*100 -> 7.2727272727272725 | Q672: =(O672/58)*100 -> 6.8965517241379306
B673: Total | C673: =SUM(C669:C672) -> 16 | D673: =(C673/16)*100 -> 100.0 | E673: =(C673/16)*100 -> 100.0 | F673: =SUM(F669:F672) -> 15 | G673: =(F673/15)*100 -> 100.0 | H673: =(F673/17)*100 -> 88.235294117647058 | I673: =SUM(I669:I672) -> 14 | J673: =(I673/14)*100 -> 100.0 | K673: =(I673/15)*100 -> 93.333333333333329 | L673: =SUM(L669:L672) -> 10 | M673: =(L673/10)*100 -> 100.0 | N673: =(L673/10)*100 -> 100.0 | O673: =(C673+F673+L673+I673) -> 55 | P673: =(O673/55)*100 -> 100.0 | Q673: =(O673/58)*100 -> 94.827586206896555
B674: e. Resource list for students
B675: Very useful | C675: 7 | D675: =(C675/16)*100 -> 43.75 | E675: =(C675/16)*100 -> 43.75 | F675: 7 | G675: =(F675/15)*100 -> 46.666666666666664 | H675: =(F675/17)*100 -> 41.17647058823529 | I675: 8 | J675: =(I675/14)*100 -> 57.142857142857139 | K675: =(I675/15)*100 -> 53.333333333333336 | L675: 7 | M675: =(L675/9)*100 -> 77.777777777777786 | N675: =(L675/10)*100 -> 70.0 | O675: =(C675+F675+L675+I675) -> 29 | P675: =(O675/54)*100 -> 53.703703703703709 | Q675: =(O675/58)*100 -> 50.0
B676: Somewhat useful | C676: 8 | D676: =(C676/16)*100 -> 50.0 | E676: =(C676/16)*100 -> 50.0 | F676: 6 | G676: =(F676/15)*100 -> 40.0 | H676: =(F676/17)*100 -> 35.294117647058826 | I676: 4 | J676: =(I676/14)*100 -> 28.571428571428569 | K676: =(I676/15)*100 -> 26.666666666666668 | L676: 2 | M676: =(L676/9)*100 -> 22.222222222222221 | N676: =(L676/10)*100 -> 20.0 | O676: =(C676+F676+L676+I676) -> 20 | P676: =(O676/54)*100 -> 37.037037037037038 | Q676: =(O676/58)*100 -> 34.482758620689658
B677: Not at all useful | C677: 0 | D677: =(C677/16)*100 -> 0.0 | E677: =(C677/16)*100 -> 0.0 | F677: 0 | G677: =(F677/15)*100 -> 0.0 | H677: =(F677/17)*100 -> 0.0 | I677: 1 | J677: =(I677/14)*100 -> 7.1428571428571423 | K677: =(I677/15)*100 -> 6.666666666666667 | L677: 0 | M677: =(L677/9)*100 -> 0.0 | N677: =(L677/10)*100 -> 0.0 | O677: =(C677+F677+L677+I677) -> 1 | P677: =(O677/54)*100 -> 1.8518518518518516 | Q677: =(O677/58)*100 -> 1.7241379310344827
B678: Did not use | C678: 1 | D678: =(C678/16)*100 -> 6.25 | E678: =(C678/16)*100 -> 6.25 | F678: 2 | G678: =(F678/15)*100 -> 13.333333333333334 | H678: =(F678/17)*100 -> 11.76470588235294 | I678: 1 | J678: =(I678/14)*100 -> 7.1428571428571423 | K678: =(I678/15)*100 -> 6.666666666666667 | L678: 0 | M678: =(L678/9)*100 -> 0.0 | N678: =(L678/10)*100 -> 0.0 | O678: =(C678+F678+L678+I678) -> 4 | P678: =(O678/54)*100 -> 7.4074074074074066 | Q678: =(O678/58)*100 -> 6.8965517241379306
B679: Total | C679: =SUM(C675:C678) -> 16 | D679: =(C679/16)*100 -> 100.0 | E679: =(C679/16)*100 -> 100.0 | F679: =SUM(F675:F678) -> 15 | G679: =(F679/15)*100 -> 100.0 | H679: =(F679/17)*100 -> 88.235294117647058 | I679: =SUM(I675:I678) -> 14 | J679: =(I679/14)*100 -> 100.0 | K679: =(I679/15)*100 -> 93.333333333333329 | L679: =SUM(L675:L678) -> 9 | M679: =(L679/9)*100 -> 100.0 | N679: =(L679/10)*100 -> 90.0 | O679: =(C679+F679+L679+I679) -> 54 | P679: =(O679/54)*100 -> 100.0 | Q679: =(O679/58)*100 -> 93.103448275862064
B680: f. Classroom materials
B681: Very useful | C681: 3 | D681: =(C681/15)*100 -> 20.0 | E681: =(C681/16)*100 -> 18.75 | F681: 6 | G681: =(F681/15)*100 -> 40.0 | H681: =(F681/17)*100 -> 35.294117647058826 | I681: 3 | J681: =(I681/14)*100 -> 21.428571428571427 | K681: =(I681/15)*100 -> 20.0 | L681: 4 | M681: =(L681/8)*100 -> 50.0 | N681: =(L681/10)*100 -> 40.0 | O681: =(C681+F681+L681+I681) -> 16 | P681: =(O681/52)*100 -> 30.76923076923077 | Q681: =(O681/58)*100 -> 27.586206896551722
B682: Somewhat useful | C682: 5 | D682: =(C682/15)*100 -> 33.333333333333329 | E682: =(C682/16)*100 -> 31.25 | F682: 7 | G682: =(F682/15)*100 -> 46.666666666666664 | H682: =(F682/17)*100 -> 41.17647058823529 | I682: 8 | J682: =(I682/14)*100 -> 57.142857142857139 | K682: =(I682/15)*100 -> 53.333333333333336 | L682: 3 | M682: =(L682/8)*100 -> 37.5 | N682: =(L682/10)*100 -> 30.0 | O682: =(C682+F682+L682+I682) -> 23 | P682: =(O682/52)*100 -> 44.230769230769226 | Q682: =(O682/58)*100 -> 39.655172413793103
B683: Not at all useful | C683: 2 | D683: =(C683/15)*100 -> 13.333333333333334 | E683: =(C683/16)*100 -> 12.5 | F683: 0 | G683: =(F683/15)*100 -> 0.0 | H683: =(F683/17)*100 -> 0.0 | I683: 1 | J683: =(I683/14)*100 -> 7.1428571428571423 | K683: =(I683/15)*100 -> 6.666666666666667 | L683: 1 | M683: =(L683/8)*100 -> 12.5 | N683: =(L683/10)*100 -> 10.0 | O683: =(C683+F683+L683+I683) -> 4 | P683: =(O683/52)*100 -> 7.6923076923076925 | Q683: =(O683/58)*100 -> 6.8965517241379306
B684: Did not use | C684: 5 | D684: =(C684/15)*100 -> 33.333333333333329 | E684: =(C684/16)*100 -> 31.25 | F684: 2 | G684: =(F684/15)*100 -> 13.333333333333334 | H684: =(F684/17)*100 -> 11.76470588235294 | I684: 2 | J684: =(I684/14)*100 -> 14.285714285714285 | K684: =(I684/15)*100 -> 13.333333333333334 | L684: 0 | M684: =(L684/8)*100 -> 0.0 | N684: =(L684/10)*100 -> 0.0 | O684: =(C684+F684+L684+I684) -> 9 | P684: =(O684/52)*100 -> 17.307692307692307 | Q684: =(O684/58)*100 -> 15.517241379310345
B685: Total | C685: =SUM(C681:C684) -> 15 | D685: =(C685/15)*100 -> 100.0 | E685: =(C685/16)*100 -> 93.75 | F685: =SUM(F681:F684) -> 15 | G685: =(F685/15)*100 -> 100.0 | H685: =(F685/17)*100 -> 88.235294117647058 | I685: =SUM(I681:I684) -> 14 | J685: =(I685/14)*100 -> 100.0 | K685: =(I685/15)*100 -> 93.333333333333329 | L685: =SUM(L681:L684) -> 8 | M685: =(L685/8)*100 -> 100.0 | N685: =(L685/10)*100 -> 80.0 | O685: =(C685+F685+L685+I685) -> 52 | P685: =(O685/52)*100 -> 100.0 | Q685: =(O685/58)*100 -> 89.65517241379311
B686: g. Entire unit
B687: Very useful | C687: 9 | D687: =(C687/16)*100 -> 56.25 | E687: =(C687/16)*100 -> 56.25 | F687: 9 | G687: =(F687/16)*100 -> 56.25 | H687: =(F687/17)*100 -> 52.941176470588239 | I687: 4 | J687: =(I687/14)*100 -> 28.571428571428569 | K687: =(I687/15)*100 -> 26.666666666666668 | L687: 5 | M687: =(L687/8)*100 -> 62.5 | N687: =(L687/10)*100 -> 50.0 | O687: =(C687+F687+L687+I687) -> 27 | P687: =(O687/54)*100 -> 50.0 | Q687: =(O687/58)*100 -> 46.551724137931032
B688: Somewhat useful | C688: 7 | D688: =(C688/16)*100 -> 43.75 | E688: =(C688/16)*100 -> 43.75 | F688: 7 | G688: =(F688/16)*100 -> 43.75 | H688: =(F688/17)*100 -> 41.17647058823529 | I688: 9 | J688: =(I688/14)*100 -> 64.285714285714292 | K688: =(I688/15)*100 -> 60.0 | L688: 3 | M688: =(L688/8)*100 -> 37.5 | N688: =(L688/10)*100 -> 30.0 | O688: =(C688+F688+L688+I688) -> 26 | P688: =(O688/54)*100 -> 48.148148148148145 | Q688: =(O688/58)*100 -> 44.827586206896555
B689: Not at all useful | C689: 0 | D689: =(C689/16)*100 -> 0.0 | E689: =(C689/16)*100 -> 0.0 | F689: 0 | G689: =(F689/16)*100 -> 0.0 | H689: =(F689/17)*100 -> 0.0 | I689: 0 | J689: =(I689/14)*100 -> 0.0 | K689: =(I689/15)*100 -> 0.0 | L689: 0 | M689: =(L689/8)*100 -> 0.0 | N689: =(L689/10)*100 -> 0.0 | O689: =(C689+F689+L689+I689) -> 0 | P689: =(O689/54)*100 -> 0.0 | Q689: =(O689/58)*100 -> 0.0
B690: Did not use | C690: 0 | D690: =(C690/16)*100 -> 0.0 | E690: =(C690/16)*100 -> 0.0 | F690: 0 | G690: =(F690/16)*100 -> 0.0 | H690: =(F690/17)*100 -> 0.0 | I690: 1 | J690: =(I690/14)*100 -> 7.1428571428571423 | K690: =(I690/15)*100 -> 6.666666666666667 | L690: 0 | M690: =(L690/8)*100 -> 0.0 | N690: =(L690/10)*100 -> 0.0 | O690: =(C690+F690+L690+I690) -> 1 | P690: =(O690/54)*100 -> 1.8518518518518516 | Q690: =(O690/58)*100 -> 1.7241379310344827
B691: Total | C691: =SUM(C687:C690) -> 16 | D691: =(C691/16)*100 -> 100.0 | E691: =(C691/16)*100 -> 100.0 | F691: =SUM(F687:F690) -> 16 | G691: =(F691/16)*100 -> 100.0 | H691: =(F691/17)*100 -> 94.117647058823522 | I691: =SUM(I687:I690) -> 14 | J691: =(I691/14)*100 -> 100.0 | K691: =(I691/15)*100 -> 93.333333333333329 | L691: =SUM(L687:L690) -> 8 | M691: =(L691/8)*100 -> 100.0 | N691: =(L691/10)*100 -> 80.0 | O691: =(C691+F691+L691+I691) -> 54 | P691: =(O691/54)*100 -> 100.0 | Q691: =(O691/58)*100 -> 93.103448275862064
A693: 41 | B693: Way of use the curriculum unit(s) (multiple choice) | C693: FRQ | D693: % T2 | E693: % T1 | F693: FRQ | G693: % T2 | H693: % T1 | I693: FRQ | J693: % T2 | K693: % T1 | L693: FRQ | M693: % T2 | N693: % T1 | O693: FRQ | P693: % T2 | Q693: % T1
B694: As primary resource | C694: 7 | D694: =(C694/20)*100 -> 35.0 | E694: =(C694/16)*100 -> 43.75 | F694: 5 | G694: =(F694/17)*100 -> 29.411764705882355 | H694: =(F694/17)*100 -> 29.411764705882355 | I694: 4 | J694: =(I694/14)*100 -> 28.571428571428569 | K694: =(I694/15)*100 -> 26.666666666666668 | L694: 2 | M694: =(L694/20)*100 -> 10.0 | N694: =(L694/10)*100 -> 20.0 | O694: =(C694+F694+L694+I694) -> 18 | P694: =(O694/71)*100 -> 25.352112676056336 | Q694: =(O694/58)*100 -> 31.03448275862069
B695: To introduce new topic | C695: 2 | D695: =(C695/20)*100 -> 10.0 | E695: =(C695/16)*100 -> 12.5 | F695: 0 | G695: =(F695/17)*100 -> 0.0 | H695: =(F695/17)*100 -> 0.0 | I695: 4 | J695: =(I695/14)*100 -> 28.571428571428569 | K695: =(I695/15)*100 -> 26.666666666666668 | L695: 7 | M695: =(L695/20)*100 -> 35.0 | N695: =(L695/10)*100 -> 70.0 | O695: =(C695+F695+L695+I695) -> 13 | P695: =(O695/71)*100 -> 18.30985915492958 | Q695: =(O695/58)*100 -> 22.413793103448278
B696: To expand on textbook topic | C696: 6 | D696: =(C696/20)*100 -> 30.0 | E696: =(C696/16)*100 -> 37.5 | F696: 7 | G696: =(F696/17)*100 -> 41.17647058823529 | H696: =(F696/17)*100 -> 41.17647058823529 | I696: 4 | J696: =(I696/14)*100 -> 28.571428571428569 | K696: =(I696/15)*100 -> 26.666666666666668 | L696: 7 | M696: =(L696/20)*100 -> 35.0 | N696: =(L696/10)*100 -> 70.0 | O696: =(C696+F696+L696+I696) -> 24 | P696: =(O696/71)*100 -> 33.802816901408448 | Q696: =(O696/58)*100 -> 41.379310344827587
B697: Better substitute for other | C697: 4 | D697: =(C697/20)*100 -> 20.0 | E697: =(C697/16)*100 -> 25.0 | F697: 4 | G697: =(F697/17)*100 -> 23.52941176470588 | H697: =(F697/17)*100 -> 23.52941176470588 | I697: 0 | J697: =(I697/14)*100 -> 0.0 | K697: =(I697/15)*100 -> 0.0 | L697: 3 | M697: =(L697/20)*100 -> 15.0 | N697: =(L697/10)*100 -> 30.0 | O697: =(C697+F697+L697+I697) -> 11 | P697: =(O697/71)*100 -> 15.492957746478872 | Q697: =(O697/58)*100 -> 18.96551724137931
B698: Other | C698: 1 | D698: =(C698/20)*100 -> 5.0 | E698: =(C698/16)*100 -> 6.25 | F698: 1 | G698: =(F698/17)*100 -> 5.8823529411764701 | H698: =(F698/17)*100 -> 5.8823529411764701 | I698: 2 | J698: =(I698/14)*100 -> 14.285714285714285 | K698: =(I698/15)*100 -> 13.333333333333334 | L698: 1 | M698: =(L698/20)*100 -> 5.0 | N698: =(L698/10)*100 -> 10.0 | O698: =(C698+F698+L698+I698) -> 5 | P698: =(O698/71)*100 -> 7.042253521126761 | Q698: =(O698/58)*100 -> 8.6206896551724146
B699: Total | C699: =SUM(C694:C698) -> 20 | D699: =(C699/20)*100 -> 100.0 | E699: =(C699/16)*100 -> 125.0 | F699: =SUM(F694:F698) -> 17 | G699: =(F699/17)*100 -> 100.0 | H699: =(F699/17)*100 -> 100.0 | I699: =SUM(I694:I698) -> 14 | J699: =(I699/14)*100 -> 100.0 | K699: =(I699/15)*100 -> 93.333333333333329 | L699: =SUM(L694:L698) -> 20 | M699: =(L699/20)*100 -> 100.0 | N699: =(L699/10)*100 -> 200.0 | O699: =(C699+F699+L699+I699) -> 71 | P699: =(O699/71)*100 -> 100.0 | Q699: =(O699/58)*100 -> 122.41379310344827
A701: 42 | B701: Class level used the units by Fellows (multiple choice) | C701: FRQ | D701: % T2 | E701: % T1 | F701: FRQ | G701: % T2 | H701: % T1 | I701: FRQ | J701: % T2 | K701: % T1 | L701: FRQ | M701: % T2 | N701: % T1 | O701: FRQ | P701: % T2 | Q701: % T1
B702: Advanced classes. | C702: 6 | D702: =(C702/24)*100 -> 25.0 | E702: =(C702/16)*100 -> 37.5 | F702: 8 | G702: =(F702/25)*100 -> 32.0 | H702: =(F702/17)*100 -> 47.058823529411761 | I702: 5 | J702: =(I702/14)*100 -> 35.714285714285715 | K702: =(I702/15)*100 -> 33.333333333333329 | L702: 3 | M702: =(L702/18)*100 -> 16.666666666666664 | N702: =(L702/10)*100 -> 30.0 | O702: =(C702+F702+L702+I702) -> 22 | P702: =(O702/81)*100 -> 27.160493827160494 | Q702: =(O702/58)*100 -> 37.931034482758619
B703: Average classes. | C703: 10 | D703: =(C703/24)*100 -> 41.666666666666671 | E703: =(C703/16)*100 -> 62.5 | F703: 11 | G703: =(F703/25)*100 -> 44.0 | H703: =(F703/17)*100 -> 64.705882352941174 | I703: 7 | J703: =(I703/14)*100 -> 50.0 | K703: =(I703/15)*100 -> 46.666666666666664 | L703: 8 | M703: =(L703/18)*100 -> 44.444444444444443 | N703: =(L703/10)*100 -> 80.0 | O703: =(C703+F703+L703+I703) -> 36 | P703: =(O703/81)*100 -> 44.444444444444443 | Q703: =(O703/58)*100 -> 62.068965517241381
B704: Remedial classes. | C704: 8 | D704: =(C704/24)*100 -> 33.333333333333329 | E704: =(C704/16)*100 -> 50.0 | F704: 6 | G704: =(F704/25)*100 -> 24.0 | H704: =(F704/17)*100 -> 35.294117647058826 | I704: 2 | J704: =(I704/14)*100 -> 14.285714285714285 | K704: =(I704/15)*100 -> 13.333333333333334 | L704: 7 | M704: =(L704/18)*100 -> 38.888888888888893 | N704: =(L704/10)*100 -> 70.0 | O704: =(C704+F704+L704+I704) -> 23 | P704: =(O704/81)*100 -> 28.39506172839506 | Q704: =(O704/58)*100 -> 39.655172413793103
B705: Total | C705: =SUM(C702:C704) -> 24 | D705: =(C705/24)*100 -> 100.0 | E705: =(C705/16)*100 -> 150.0 | F705: =SUM(F702:F704) -> 25 | G705: =(F705/25)*100 -> 100.0 | H705: =(F705/17)*100 -> 147.05882352941177 | I705: =SUM(I702:I704) -> 14 | J705: =(I705/14)*100 -> 100.0 | K705: =(I705/15)*100 -> 93.333333333333329 | L705: =SUM(L702:L704) -> 18 | M705: =(L705/18)*100 -> 100.0 | N705: =(L705/10)*100 -> 180.0 | O705: =(C705+F705+L705+I705) -> 81 | P705: =(O705/81)*100 -> 100.0 | Q705: =(O705/58)*100 -> 139.65517241379311
A707: 43 | B707: Units successful class level (multiple choice) | C707: FRQ | D707: % T2 | E707: % T1 | F707: FRQ | G707: % T2 | H707: % T1 | I707: FRQ | J707: % T2 | K707: % T1 | L707: FRQ | M707: % T2 | N707: % T1 | O707: FRQ | P707: % T2 | Q707: % T1
B708: Most advanced students. | C708: 7 | D708: =(C708/26)*100 -> 26.923076923076923 | E708: =(C708/16)*100 -> 43.75 | F708: 8 | G708: =(F708/20)*100 -> 40.0 | H708: =(F708/17)*100 -> 47.058823529411761 | I708: 8 | J708: =(I708/20)*100 -> 40.0 | K708: =(I708/15)*100 -> 53.333333333333336 | L708: 4 | M708: =(L708/16)*100 -> 25.0 | N708: =(L708/10)*100 -> 40.0 | O708: =(C708+F708+L708+I708) -> 27 | P708: =(O708/82)*100 -> 32.926829268292686 | Q708: =(O708/58)*100 -> 46.551724137931032
B709: Average students. | C709: 9 | D709: =(C709/26)*100 -> 34.615384615384613 | E709: =(C709/16)*100 -> 56.25 | F709: 8 | G709: =(F709/20)*100 -> 40.0 | H709: =(F709/17)*100 -> 47.058823529411761 | I709: 9 | J709: =(I709/20)*100 -> 45.0 | K709: =(I709/15)*100 -> 60.0 | L709: 8 | M709: =(L709/16)*100 -> 50.0 | N709: =(L709/10)*100 -> 80.0 | O709: =(C709+F709+L709+I709) -> 34 | P709: =(O709/82)*100 -> 41.463414634146339 | Q709: =(O709/58)*100 -> 58.620689655172406
B710: Least advanced students. | C710: 10 | D710: =(C710/26)*100 -> 38.461538461538467 | E710: =(C710/16)*100 -> 62.5 | F710: 4 | G710: =(F710/20)*100 -> 20.0 | H710: =(F710/17)*100 -> 23.52941176470588 | I710: 3 | J710: =(I710/20)*100 -> 15.0 | K710: =(I710/15)*100 -> 20.0 | L710: 4 | M710: =(L710/16)*100 -> 25.0 | N710: =(L710/10)*100 -> 40.0 | O710: =(C710+F710+L710+I710) -> 21 | P710: =(O710/82)*100 -> 25.609756097560975 | Q710: =(O710/58)*100 -> 36.206896551724135
B711: Total | C711: =SUM(C708:C710) -> 26 | D711: =(C711/26)*100 -> 100.0 | E711: =(C711/16)*100 -> 162.5 | F711: =SUM(F708:F710) -> 20 | G711: =(F711/20)*100 -> 100.0 | H711: =(F711/17)*100 -> 117.64705882352942 | I711: =SUM(I708:I710) -> 20 | J711: =(I711/20)*100 -> 100.0 | K711: =(I711/15)*100 -> 133.33333333333331 | L711: =SUM(L708:L710) -> 16 | M711: =(L711/16)*100 -> 100.0 | N711: =(L711/10)*100 -> 160.0 | O711: =(C711+F711+L711+I711) -> 82 | P711: =(O711/82)*100 -> 100.0 | Q711: =(O711/58)*100 -> 141.37931034482759
A713: 44 | B713: Seeking help or advice in using unit (multiple choice) | C713: FRQ | D713: % T2 | E713: % T1 | F713: FRQ | G713: % T2 | H713: % T1 | I713: FRQ | J713: % T2 | K713: % T1 | L713: FRQ | M713: % T2 | N713: % T1 | O713: FRQ | P713: % T2 | Q713: % T1
B714: No one. | C714: 11 | D714: =(C714/18)*100 -> 61.111111111111114 | E714: =(C714/16)*100 -> 68.75 | F714: 11 | G714: =(F714/19)*100 -> 57.894736842105267 | H714: =(F714/17)*100 -> 64.705882352941174 | I714: 8 | J714: =(I714/14)*100 -> 57.142857142857139 | K714: =(I714/15)*100 -> 53.333333333333336 | L714: 6 | M714: =(L714/12)*100 -> 50.0 | N714: =(L714/10)*100 -> 60.0 | O714: =(C714+F714+L714+I714) -> 36 | P714: =(O714/63)*100 -> 57.142857142857139 | Q714: =(O714/58)*100 -> 62.068965517241381
B715: Teacher written the unit | C715: 4 | D715: =(C715/18)*100 -> 22.222222222222221 | E715: =(C715/16)*100 -> 25.0 | F715: 4 | G715: =(F715/19)*100 -> 21.052631578947366 | H715: =(F715/17)*100 -> 23.52941176470588 | I715: 3 | J715: =(I715/14)*100 -> 21.428571428571427 | K715: =(I715/15)*100 -> 20.0 | L715: 3 | M715: =(L715/12)*100 -> 25.0 | N715: =(L715/10)*100 -> 30.0 | O715: =(C715+F715+L715+I715) -> 14 | P715: =(O715/63)*100 -> 22.222222222222221 | Q715: =(O715/58)*100 -> 24.137931034482758
B716: Other teacher | C716: 1 | D716: =(C716/18)*100 -> 5.5555555555555554 | E716: =(C716/16)*100 -> 6.25 | F716: 1 | G716: =(F716/19)*100 -> 5.2631578947368416 | H716: =(F716/17)*100 -> 5.8823529411764701 | I716: 1 | J716: =(I716/14)*100 -> 7.1428571428571423 | K716: =(I716/15)*100 -> 6.666666666666667 | L716: 0 | M716: =(L716/12)*100 -> 0.0 | N716: =(L716/10)*100 -> 0.0 | O716: =(C716+F716+L716+I716) -> 3 | P716: =(O716/63)*100 -> 4.7619047619047619 | Q716: =(O716/58)*100 -> 5.1724137931034484
B717: Institute seminar coordinator | C717: 1 | D717: =(C717/18)*100 -> 5.5555555555555554 | E717: =(C717/16)*100 -> 6.25 | F717: 1 | G717: =(F717/19)*100 -> 5.2631578947368416 | H717: =(F717/17)*100 -> 5.8823529411764701 | I717: 0 | J717: =(I717/14)*100 -> 0.0 | K717: =(I717/15)*100 -> 0.0 | L717: 0 | M717: =(L717/12)*100 -> 0.0 | N717: =(L717/10)*100 -> 0.0 | O717: =(C717+F717+L717+I717) -> 2 | P717: =(O717/63)*100 -> 3.1746031746031744 | Q717: =(O717/58)*100 -> 3.4482758620689653
B718: Subject area supervisor | C718: 1 | D718: =(C718/18)*100 -> 5.5555555555555554 | E718: =(C718/16)*100 -> 6.25 | F718: 0 | G718: =(F718/19)*100 -> 0.0 | H718: =(F718/17)*100 -> 0.0 | I718: 0 | J718: =(I718/14)*100 -> 0.0 | K718: =(I718/15)*100 -> 0.0 | L718: 0 | M718: =(L718/12)*100 -> 0.0 | N718: =(L718/10)*100 -> 0.0 | O718: =(C718+F718+L718+I718) -> 1 | P718: =(O718/63)*100 -> 1.5873015873015872 | Q718: =(O718/58)*100 -> 1.7241379310344827
B719: Department chairperson | C719: 0 | D719: =(C719/18)*100 -> 0.0 | E719: =(C719/16)*100 -> 0.0 | F719: 1 | G719: =(F719/19)*100 -> 5.2631578947368416 | H719: =(F719/17)*100 -> 5.8823529411764701 | I719: 1 | J719: =(I719/14)*100 -> 7.1428571428571423 | K719: =(I719/15)*100 -> 6.666666666666667 | L719: 1 | M719: =(L719/12)*100 -> 8.3333333333333321 | N719: =(L719/10)*100 -> 10.0 | O719: =(C719+F719+L719+I719) -> 3 | P719: =(O719/63)*100 -> 4.7619047619047619 | Q719: =(O719/58)*100 -> 5.1724137931034484
B720: Other | C720: 0 | D720: =(C720/18)*100 -> 0.0 | E720: =(C720/16)*100 -> 0.0 | F720: 1 | G720: =(F720/19)*100 -> 5.2631578947368416 | H720: =(F720/17)*100 -> 5.8823529411764701 | I720: 1 | J720: =(I720/14)*100 -> 7.1428571428571423 | K720: =(I720/15)*100 -> 6.666666666666667 | L720: 2 | M720: =(L720/12)*100 -> 16.666666666666664 | N720: =(L720/10)*100 -> 20.0 | O720: =(C720+F720+L720+I720) -> 4 | P720: =(O720/63)*100 -> 6.3492063492063489 | Q720: =(O720/58)*100 -> 6.8965517241379306
B721: Total | C721: =SUM(C714:C720) -> 18 | D721: =(C721/18)*100 -> 100.0 | E721: =(C721/16)*100 -> 112.5 | F721: =SUM(F714:F720) -> 19 | G721: =(F721/19)*100 -> 100.0 | H721: =(F721/17)*100 -> 111.76470588235294 | I721: =SUM(I714:I720) -> 14 | J721: =(I721/14)*100 -> 100.0 | K721: =(I721/15)*100 -> 93.333333333333329 | L721: =SUM(L714:L720) -> 12 | M721: =(L721/12)*100 -> 100.0 | N721: =(L721/10)*100 -> 120.0 | O721: =(C721+F721+L721+I721) -> 63 | P721: =(O721/63)*100 -> 100.0 | Q721: =(O721/58)*100 -> 108.62068965517241
A723: 45 | B723: Unit preparedness of SUFFICIENT BACKGROUND INFORMATION on topic | C723: FRQ | D723: % T2 | E723: % T1 | F723: FRQ | G723: % T2 | H723: % T1 | I723: FRQ | J723: % T2 | K723: % T1 | L723: FRQ | M723: % T2 | N723: % T1 | O723: FRQ | P723: % T2 | Q723: % T1
B724: No | C724: 0 | D724: =(C724/16)*100 -> 0.0 | E724: =(C724/16)*100 -> 0.0 | F724: 1 | G724: =(F724/16)*100 -> 6.25 | H724: =(F724/17)*100 -> 5.8823529411764701 | I724: 2 | J724: =(I724/13)*100 -> 15.384615384615385 | K724: =(I724/15)*100 -> 13.333333333333334 | L724: 1 | M724: =(L724/10)*100 -> 10.0 | N724: =(L724/10)*100 -> 10.0 | O724: =(C724+F724+L724+I724) -> 4 | P724: =(O724/55)*100 -> 7.2727272727272725 | Q724: =(O724/58)*100 -> 6.8965517241379306
B725: Yes | C725: 16 | D725: =(C725/16)*100 -> 100.0 | E725: =(C725/16)*100 -> 100.0 | F725: 15 | G725: =(F725/16)*100 -> 93.75 | H725: =(F725/17)*100 -> 88.235294117647058 | I725: 11 | J725: =(I725/13)*100 -> 84.615384615384613 | K725: =(I725/15)*100 -> 73.333333333333329 | L725: 9 | M725: =(L725/10)*100 -> 90.0 | N725: =(L725/10)*100 -> 90.0 | O725: =(C725+F725+L725+I725) -> 51 | P725: =(O725/55)*100 -> 92.72727272727272 | Q725: =(O725/58)*100 -> 87.931034482758619
B726: Total | C726: =SUM(C724:C725) -> 16 | D726: =(C726/16)*100 -> 100.0 | E726: =(C726/16)*100 -> 100.0 | F726: =SUM(F724:F725) -> 16 | G726: =(F726/16)*100 -> 100.0 | H726: =(F726/17)*100 -> 94.117647058823522 | I726: =SUM(I724:I725) -> 13 | J726: =(I726/13)*100 -> 100.0 | K726: =(I726/15)*100 -> 86.666666666666671 | L726: =SUM(L724:L725) -> 10 | M726: =(L726/10)*100 -> 100.0 | N726: =(L726/10)*100 -> 100.0 | O726: =(C726+F726+L726+I726) -> 55 | P726: =(O726/55)*100 -> 100.0 | Q726: =(O726/58)*100 -> 94.827586206896555
A728: 46 | B728: Units prompting ADDITIONAL READING before teaching | C728: FRQ | D728: % T2 | E728: % T1 | F728: FRQ | G728: % T2 | H728: % T1 | I728: FRQ | J728: % T2 | K728: % T1 | L728: FRQ | M728: % T2 | N728: % T1 | O728: FRQ | P728: % T2 | Q728: % T1
B729: No | C729: 6 | D729: =(C729/16)*100 -> 37.5 | E729: =(C729/16)*100 -> 37.5 | F729: 4 | G729: =(F729/17)*100 -> 23.52941176470588 | H729: =(F729/17)*100 -> 23.52941176470588 | I729: 3 | J729: =(I729/14)*100 -> 21.428571428571427 | K729: =(I729/15)*100 -> 20.0 | L729: 3 | M729: =(L729/9)*100 -> 33.333333333333329 | N729: =(L729/10)*100 -> 30.0 | O729: =(C729+F729+L729+I729) -> 16 | P729: =(O729/56)*100 -> 28.571428571428569 | Q729: =(O729/58)*100 -> 27.586206896551722
B730: Yes | C730: 10 | D730: =(C730/16)*100 -> 62.5 | E730: =(C730/16)*100 -> 62.5 | F730: 13 | G730: =(F730/17)*100 -> 76.470588235294116 | H730: =(F730/17)*100 -> 76.470588235294116 | I730: 11 | J730: =(I730/14)*100 -> 78.571428571428569 | K730: =(I730/15)*100 -> 73.333333333333329 | L730: 6 | M730: =(L730/9)*100 -> 66.666666666666657 | N730: =(L730/10)*100 -> 60.0 | O730: =(C730+F730+L730+I730) -> 40 | P730: =(O730/56)*100 -> 71.428571428571431 | Q730: =(O730/58)*100 -> 68.965517241379317
B731: Total | C731: =SUM(C729:C730) -> 16 | D731: =(C731/16)*100 -> 100.0 | E731: =(C731/16)*100 -> 100.0 | F731: =SUM(F729:F730) -> 17 | G731: =(F731/17)*100 -> 100.0 | H731: =(F731/17)*100 -> 100.0 | I731: =SUM(I729:I730) -> 14 | J731: =(I731/14)*100 -> 100.0 | K731: =(I731/15)*100 -> 93.333333333333329 | L731: =SUM(L729:L730) -> 9 | M731: =(L731/9)*100 -> 100.0 | N731: =(L731/10)*100 -> 90.0 | O731: =(C731+F731+L731+I731) -> 56 | P731: =(O731/56)*100 -> 100.0 | Q731: =(O731/58)*100 -> 96.551724137931032
A733: 47 | B733: Appropriateness of reading level of the SAMPLE LESSONS of the units | C733: FRQ | D733: % T2 | E733: % T1 | F733: FRQ | G733: % T2 | H733: % T1 | I733: FRQ | J733: % T2 | K733: % T1 | L733: FRQ | M733: % T2 | N733: % T1 | O733: FRQ | P733: % T2 | Q733: % T1
B734: Yes | C734: 14 | D734: =(C734/16)*100 -> 87.5 | E734: =(C734/16)*100 -> 87.5 | F734: 17 | G734: =(F734/17)*100 -> 100.0 | H734: =(F734/17)*100 -> 100.0 | I734: 13 | J734: =(I734/14)*100 -> 92.857142857142861 | K734: =(I734/15)*100 -> 86.666666666666671 | L734: 9 | M734: =(L734/9)*100 -> 100.0 | N734: =(L734/10)*100 -> 90.0 | O734: =(C734+F734+L734+I734) -> 53 | P734: =(O734/56)*100 -> 94.642857142857139 | Q734: =(O734/58)*100 -> 91.379310344827587
B735: No, too high | C735: 2 | D735: =(C735/16)*100 -> 12.5 | E735: =(C735/16)*100 -> 12.5 | F735: 0 | G735: =(F735/17)*100 -> 0.0 | H735: =(F735/17)*100 -> 0.0 | I735: 0 | J735: =(I735/14)*100 -> 0.0 | K735: =(I735/15)*100 -> 0.0 | L735: 0 | M735: =(L735/9)*100 -> 0.0 | N735: =(L735/10)*100 -> 0.0 | O735: =(C735+F735+L735+I735) -> 2 | P735: =(O735/56)*100 -> 3.5714285714285712 | Q735: =(O735/58)*100 -> 3.4482758620689653
B736: No, too low | C736: 0 | D736: =(C736/16)*100 -> 0.0 | E736: =(C736/16)*100 -> 0.0 | F736: 0 | G736: =(F736/17)*100 -> 0.0 | H736: =(F736/17)*100 -> 0.0 | I736: 1 | J736: =(I736/14)*100 -> 7.1428571428571423 | K736: =(I736/15)*100 -> 6.666666666666667 | L736: 0 | M736: =(L736/9)*100 -> 0.0 | N736: =(L736/10)*100 -> 0.0 | O736: =(C736+F736+L736+I736) -> 1 | P736: =(O736/56)*100 -> 1.7857142857142856 | Q736: =(O736/58)*100 -> 1.7241379310344827
B737: Total | C737: =SUM(C734:C736) -> 16 | D737: =(C737/16)*100 -> 100.0 | E737: =(C737/16)*100 -> 100.0 | F737: =SUM(F734:F736) -> 17 | G737: =(F737/17)*100 -> 100.0 | H737: =(F737/17)*100 -> 100.0 | I737: =SUM(I734:I736) -> 14 | J737: =(I737/14)*100 -> 100.0 | K737: =(I737/15)*100 -> 93.333333333333329 | L737: =SUM(L734:L736) -> 9 | M737: =(L737/9)*100 -> 100.0 | N737: =(L737/10)*100 -> 90.0 | O737: =(C737+F737+L737+I737) -> 56 | P737: =(O737/56)*100 -> 100.0 | Q737: =(O737/58)*100 -> 96.551724137931032
A739: 48 | B739: ADAPTABILITY of the units to other grade levels | C739: FRQ | D739: % T2 | E739: % T1 | F739: FRQ | G739: % T2 | H739: % T1 | I739: FRQ | J739: % T2 | K739: % T1 | L739: FRQ | M739: % T2 | N739: % T1 | O739: FRQ | P739: % T2 | Q739: % T1
B740: No | C740: 0 | D740: =(C740/16)*100 -> 0.0 | E740: =(C740/16)*100 -> 0.0 | F740: 0 | G740: =(F740/17)*100 -> 0.0 | H740: =(F740/17)*100 -> 0.0 | I740: 0 | J740: =(I740/14)*100 -> 0.0 | K740: =(I740/15)*100 -> 0.0 | L740: 1 | M740: =(L740/9)*100 -> 11.111111111111111 | N740: =(L740/10)*100 -> 10.0 | O740: =(C740+F740+L740+I740) -> 1 | P740: =(O740/56)*100 -> 1.7857142857142856 | Q740: =(O740/58)*100 -> 1.7241379310344827
B741: Yes | C741: 13 | D741: =(C741/16)*100 -> 81.25 | E741: =(C741/16)*100 -> 81.25 | F741: 15 | G741: =(F741/17)*100 -> 88.235294117647058 | H741: =(F741/17)*100 -> 88.235294117647058 | I741: 12 | J741: =(I741/14)*100 -> 85.714285714285708 | K741: =(I741/15)*100 -> 80.0 | L741: 8 | M741: =(L741/9)*100 -> 88.888888888888886 | N741: =(L741/10)*100 -> 80.0 | O741: =(C741+F741+L741+I741) -> 48 | P741: =(O741/56)*100 -> 85.714285714285708 | Q741: =(O741/58)*100 -> 82.758620689655174
B742: N/A, only used intended level | C742: 3 | D742: =(C742/16)*100 -> 18.75 | E742: =(C742/16)*100 -> 18.75 | F742: 2 | G742: =(F742/17)*100 -> 11.76470588235294 | H742: =(F742/17)*100 -> 11.76470588235294 | I742: 2 | J742: =(I742/14)*100 -> 14.285714285714285 | K742: =(I742/15)*100 -> 13.333333333333334 | L742: 0 | M742: =(L742/9)*100 -> 0.0 | N742: =(L742/10)*100 -> 0.0 | O742: =(C742+F742+L742+I742) -> 7 | P742: =(O742/56)*100 -> 12.5 | Q742: =(O742/58)*100 -> 12.068965517241379
B743: Total | C743: =SUM(C740:C742) -> 16 | D743: =(C743/16)*100 -> 100.0 | E743: =(C743/16)*100 -> 100.0 | F743: =SUM(F740:F742) -> 17 | G743: =(F743/17)*100 -> 100.0 | H743: =(F743/17)*100 -> 100.0 | I743: =SUM(I740:I742) -> 14 | J743: =(I743/14)*100 -> 100.0 | K743: =(I743/15)*100 -> 93.333333333333329 | L743: =SUM(L740:L742) -> 9 | M743: =(L743/9)*100 -> 100.0 | N743: =(L743/10)*100 -> 90.0 | O743: =(C743+F743+L743+I743) -> 56 | P743: =(O743/56)*100 -> 100.0 | Q743: =(O743/58)*100 -> 96.551724137931032
A745: 49 | B745: PREPARATION TIME compared to commercial curriculum materials | C745: FRQ | D745: % T2 | E745: % T1 | F745: FRQ | G745: % T2 | H745: % T1 | I745: FRQ | J745: % T2 | K745: % T1 | L745: FRQ | M745: % T2 | N745: % T1 | O745: FRQ | P745: % T2 | Q745: % T1
B746: More preparation time | C746: 6 | D746: =(C746/15)*100 -> 40.0 | E746: =(C746/16)*100 -> 37.5 | F746: 2 | G746: =(F746/16)*100 -> 12.5 | H746: =(F746/17)*100 -> 11.76470588235294 | I746: 3 | J746: =(I746/15)*100 -> 20.0 | K746: =(I746/15)*100 -> 20.0 | L746: 1 | M746: =(L746/9)*100 -> 11.111111111111111 | N746: =(L746/10)*100 -> 10.0 | O746: =(C746+F746+L746+I746) -> 12 | P746: =(O746/55)*100 -> 21.818181818181817 | Q746: =(O746/58)*100 -> 20.689655172413794
B747: About the same amount | C747: 7 | D747: =(C747/15)*100 -> 46.666666666666664 | E747: =(C747/16)*100 -> 43.75 | F747: 9 | G747: =(F747/16)*100 -> 56.25 | H747: =(F747/17)*100 -> 52.941176470588239 | I747: 9 | J747: =(I747/15)*100 -> 60.0 | K747: =(I747/15)*100 -> 60.0 | L747: 6 | M747: =(L747/9)*100 -> 66.666666666666657 | N747: =(L747/10)*100 -> 60.0 | O747: =(C747+F747+L747+I747) -> 31 | P747: =(O747/55)*100 -> 56.36363636363636 | Q747: =(O747/58)*100 -> 53.448275862068961
B748: Less preparation time | C748: 2 | D748: =(C748/15)*100 -> 13.333333333333334 | E748: =(C748/16)*100 -> 12.5 | F748: 5 | G748: =(F748/16)*100 -> 31.25 | H748: =(F748/17)*100 -> 29.411764705882355 | I748: 3 | J748: =(I748/15)*100 -> 20.0 | K748: =(I748/15)*100 -> 20.0 | L748: 2 | M748: =(L748/9)*100 -> 22.222222222222221 | N748: =(L748/10)*100 -> 20.0 | O748: =(C748+F748+L748+I748) -> 12 | P748: =(O748/55)*100 -> 21.818181818181817 | Q748: =(O748/58)*100 -> 20.689655172413794
B749: Total | C749: =SUM(C746:C748) -> 15 | D749: =(C749/15)*100 -> 100.0 | E749: =(C749/16)*100 -> 93.75 | F749: =SUM(F746:F748) -> 16 | G749: =(F749/16)*100 -> 100.0 | H749: =(F749/17)*100 -> 94.117647058823522 | I749: =SUM(I746:I748) -> 15 | J749: =(I749/15)*100 -> 100.0 | K749: =(I749/15)*100 -> 100.0 | L749: =SUM(L746:L748) -> 9 | M749: =(L749/9)*100 -> 100.0 | N749: =(L749/10)*100 -> 90.0 | O749: =(C749+F749+L749+I749) -> 55 | P749: =(O749/55)*100 -> 100.0 | Q749: =(O749/58)*100 -> 94.827586206896555
A751: 50 | B751: Evaluation of the units by FTI compared with commercial curriculum materials | C751: FRQ | D751: % T2 | E751: % T1 | F751: FRQ | G751: % T2 | H751: % T1 | I751: FRQ | J751: % T2 | K751: % T1 | L751: FRQ | M751: % T2 | N751: % T1 | O751: FRQ | P751: % T2 | Q751: % T1
B752: a. Objectives
B753: Unfavorably | C753: 0 | D753: =(C753/16)*100 -> 0.0 | E753: =(C753/16)*100 -> 0.0 | F753: 0 | G753: =(F753/17)*100 -> 0.0 | H753: =(F753/17)*100 -> 0.0 | I753: 1 | J753: =(I753/15)*100 -> 6.666666666666667 | K753: =(I753/15)*100 -> 6.666666666666667 | L753: 0 | M753: =(L753/8)*100 -> 0.0 | N753: =(L753/10)*100 -> 0.0 | O753: =(C753+F753+L753+I753) -> 1 | P753: =(O753/56)*100 -> 1.7857142857142856 | Q753: =(O753/58)*100 -> 1.7241379310344827
B754: No difference | C754: 2 | D754: =(C754/16)*100 -> 12.5 | E754: =(C754/16)*100 -> 12.5 | F754: 4 | G754: =(F754/17)*100 -> 23.52941176470588 | H754: =(F754/17)*100 -> 23.52941176470588 | I754: 5 | J754: =(I754/15)*100 -> 33.333333333333329 | K754: =(I754/15)*100 -> 33.333333333333329 | L754: 2 | M754: =(L754/8)*100 -> 25.0 | N754: =(L754/10)*100 -> 20.0 | O754: =(C754+F754+L754+I754) -> 13 | P754: =(O754/56)*100 -> 23.214285714285715 | Q754: =(O754/58)*100 -> 22.413793103448278
B755: Favorably | C755: 14 | D755: =(C755/16)*100 -> 87.5 | E755: =(C755/16)*100 -> 87.5 | F755: 13 | G755: =(F755/17)*100 -> 76.470588235294116 | H755: =(F755/17)*100 -> 76.470588235294116 | I755: 9 | J755: =(I755/15)*100 -> 60.0 | K755: =(I755/15)*100 -> 60.0 | L755: 6 | M755: =(L755/8)*100 -> 75.0 | N755: =(L755/10)*100 -> 60.0 | O755: =(C755+F755+L755+I755) -> 42 | P755: =(O755/56)*100 -> 75.0 | Q755: =(O755/58)*100 -> 72.41379310344827
B756: Total | C756: =SUM(C753:C755) -> 16 | D756: =(C756/16)*100 -> 100.0 | E756: =(C756/16)*100 -> 100.0 | F756: =SUM(F753:F755) -> 17 | G756: =(F756/17)*100 -> 100.0 | H756: =(F756/17)*100 -> 100.0 | I756: =SUM(I753:I755) -> 15 | J756: =(I756/15)*100 -> 100.0 | K756: =(I756/15)*100 -> 100.0 | L756: =SUM(L753:L755) -> 8 | M756: =(L756/8)*100 -> 100.0 | N756: =(L756/10)*100 -> 80.0 | O756: =(C756+F756+L756+I756) -> 56 | P756: =(O756/56)*100 -> 100.0 | Q756: =(O756/58)*100 -> 96.551724137931032
B757: b. Teaching strategies
B758: Unfavorably | C758: 0 | D758: =(C758/16)*100 -> 0.0 | E758: =(C758/16)*100 -> 0.0 | F758: 0 | G758: =(F758/17)*100 -> 0.0 | H758: =(F758/17)*100 -> 0.0 | I758: 0 | J758: =(I758/15)*100 -> 0.0 | K758: =(I758/15)*100 -> 0.0 | L758: 0 | M758: =(L758/9)*100 -> 0.0 | N758: =(L758/10)*100 -> 0.0 | O758: =(C758+F758+L758+I758) -> 0 | P758: =(O758/57)*100 -> 0.0 | Q758: =(O758/58)*100 -> 0.0
B759: No difference | C759: 3 | D759: =(C759/16)*100 -> 18.75 | E759: =(C759/16)*100 -> 18.75 | F759: 2 | G759: =(F759/17)*100 -> 11.76470588235294 | H759: =(F759/17)*100 -> 11.76470588235294 | I759: 7 | J759: =(I759/15)*100 -> 46.666666666666664 | K759: =(I759/15)*100 -> 46.666666666666664 | L759: 1 | M759: =(L759/9)*100 -> 11.111111111111111 | N759: =(L759/10)*100 -> 10.0 | O759: =(C759+F759+L759+I759) -> 13 | P759: =(O759/57)*100 -> 22.807017543859647 | Q759: =(O759/58)*100 -> 22.413793103448278
B760: Favorably | C760: 13 | D760: =(C760/16)*100 -> 81.25 | E760: =(C760/16)*100 -> 81.25 | F760: 15 | G760: =(F760/17)*100 -> 88.235294117647058 | H760: =(F760/17)*100 -> 88.235294117647058 | I760: 8 | J760: =(I760/15)*100 -> 53.333333333333336 | K760: =(I760/15)*100 -> 53.333333333333336 | L760: 8 | M760: =(L760/9)*100 -> 88.888888888888886 | N760: =(L760/10)*100 -> 80.0 | O760: =(C760+F760+L760+I760) -> 44 | P760: =(O760/57)*100 -> 77.192982456140342 | Q760: =(O760/58)*100 -> 75.862068965517238
B761: Total | C761: =SUM(C758:C760) -> 16 | D761: =(C761/16)*100 -> 100.0 | E761: =(C761/16)*100 -> 100.0 | F761: 17 | G761: =(F761/17)*100 -> 100.0 | H761: =(F761/17)*100 -> 100.0 | I761: =SUM(I758:I760) -> 15 | J761: =(I761/15)*100 -> 100.0 | K761: =(I761/15)*100 -> 100.0 | L761: =SUM(L758:L760) -> 9 | M761: =(L761/9)*100 -> 100.0 | N761: =(L761/10)*100 -> 90.0 | O761: =(C761+F761+L761+I761) -> 57 | P761: =(O761/57)*100 -> 100.0 | Q761: =(O761/58)*100 -> 98.275862068965509
B762: c. Sample lessons/activities
B763: Unfavorably | C763: 2 | D763: =(C763/16)*100 -> 12.5 | E763: =(C763/16)*100 -> 12.5 | F763: 0 | G763: =(F763/17)*100 -> 0.0 | H763: =(F763/17)*100 -> 0.0 | I763: 1 | J763: =(I763/15)*100 -> 6.666666666666667 | K763: =(I763/15)*100 -> 6.666666666666667 | L763: 0 | M763: =(L763/9)*100 -> 0.0 | N763: =(L763/10)*100 -> 0.0 | O763: =(C763+F763+L763+I763) -> 3 | P763: =(O763/57)*100 -> 5.2631578947368416 | Q763: =(O763/58)*100 -> 5.1724137931034484
B764: No difference | C764: 1 | D764: =(C764/16)*100 -> 6.25 | E764: =(C764/16)*100 -> 6.25 | F764: 2 | G764: =(F764/17)*100 -> 11.76470588235294 | H764: =(F764/17)*100 -> 11.76470588235294 | I764: 6 | J764: =(I764/15)*100 -> 40.0 | K764: =(I764/15)*100 -> 40.0 | L764: 0 | M764: =(L764/9)*100 -> 0.0 | N764: =(L764/10)*100 -> 0.0 | O764: =(C764+F764+L764+I764) -> 9 | P764: =(O764/57)*100 -> 15.789473684210526 | Q764: =(O764/58)*100 -> 15.517241379310345
B765: Favorably | C765: 13 | D765: =(C765/16)*100 -> 81.25 | E765: =(C765/16)*100 -> 81.25 | F765: 15 | G765: =(F765/17)*100 -> 88.235294117647058 | H765: =(F765/17)*100 -> 88.235294117647058 | I765: 8 | J765: =(I765/15)*100 -> 53.333333333333336 | K765: =(I765/15)*100 -> 53.333333333333336 | L765: 9 | M765: =(L765/9)*100 -> 100.0 | N765: =(L765/10)*100 -> 90.0 | O765: =(C765+F765+L765+I765) -> 45 | P765: =(O765/57)*100 -> 78.94736842105263 | Q765: =(O765/58)*100 -> 77.58620689655173
B766: Total | C766: =SUM(C763:C765) -> 16 | D766: =(C766/16)*100 -> 100.0 | E766: =(C766/16)*100 -> 100.0 | F766: =SUM(F763:F765) -> 17 | G766: =(F766/17)*100 -> 100.0 | H766: =(F766/17)*100 -> 100.0 | I766: =SUM(I763:I765) -> 15 | J766: =(I766/15)*100 -> 100.0 | K766: =(I766/15)*100 -> 100.0 | L766: =SUM(L763:L765) -> 9 | M766: =(L766/9)*100 -> 100.0 | N766: =(L766/10)*100 -> 90.0 | O766: =(C766+F766+L766+I766) -> 57 | P766: =(O766/57)*100 -> 100.0 | Q766: =(O766/58)*100 -> 98.275862068965509
B767: d. Resource list for teachers
B768: Unfavorably | C768: 1 | D768: =(C768/17)*100 -> 5.8823529411764701 | E768: =(C768/16)*100 -> 6.25 | F768: 0 | G768: =(F768/16)*100 -> 0.0 | H768: =(F768/17)*100 -> 0.0 | I768: 0 | J768: =(I768/15)*100 -> 0.0 | K768: =(I768/15)*100 -> 0.0 | L768: 0 | M768: =(L768/9)*100 -> 0.0 | N768: =(L768/10)*100 -> 0.0 | O768: =(C768+F768+L768+I768) -> 1 | P768: =(O768/56)*100 -> 1.7857142857142856 | Q768: =(O768/58)*100 -> 1.7241379310344827
B769: No difference | C769: 3 | D769: =(C769/17)*100 -> 17.647058823529413 | E769: =(C769/16)*100 -> 18.75 | F769: 4 | G769: =(F769/16)*100 -> 25.0 | H769: =(F769/17)*100 -> 23.52941176470588 | I769: 6 | J769: =(I769/15)*100 -> 40.0 | K769: =(I769/15)*100 -> 40.0 | L769: 0 | M769: =(L769/9)*100 -> 0.0 | N769: =(L769/10)*100 -> 0.0 | O769: =(C769+F769+L769+I769) -> 13 | P769: =(O769/56)*100 -> 23.214285714285715 | Q769: =(O769/58)*100 -> 22.413793103448278
B770: Favorably | C770: 12 | D770: =(C770/17)*100 -> 70.588235294117652 | E770: =(C770/16)*100 -> 75.0 | F770: 12 | G770: =(F770/16)*100 -> 75.0 | H770: =(F770/17)*100 -> 70.588235294117652 | I770: 9 | J770: =(I770/15)*100 -> 60.0 | K770: =(I770/15)*100 -> 60.0 | L770: 9 | M770: =(L770/9)*100 -> 100.0 | N770: =(L770/10)*100 -> 90.0 | O770: =(C770+F770+L770+I770) -> 42 | P770: =(O770/56)*100 -> 75.0 | Q770: =(O770/58)*100 -> 72.41379310344827
B771: Total | C771: 16 | D771: =(C771/17)*100 -> 94.117647058823522 | E771: =(C771/16)*100 -> 100.0 | F771: =SUM(F768:F770) -> 16 | G771: =(F771/16)*100 -> 100.0 | H771: =(F771/17)*100 -> 94.117647058823522 | I771: =SUM(I768:I770) -> 15 | J771: =(I771/15)*100 -> 100.0 | K771: =(I771/15)*100 -> 100.0 | L771: =SUM(L768:L770) -> 9 | M771: =(L771/9)*100 -> 100.0 | N771: =(L771/10)*100 -> 90.0 | O771: =(C771+F771+L771+I771) -> 56 | P771: =(O771/56)*100 -> 100.0 | Q771: =(O771/58)*100 -> 96.551724137931032
B772: e. Resource list for students
B773: Unfavorably | C773: 0 | D773: =(C773/15)*100 -> 0.0 | E773: =(C773/16)*100 -> 0.0 | F773: 0 | G773: =(F773/15)*100 -> 0.0 | H773: =(F773/17)*100 -> 0.0 | I773: 1 | J773: =(I773/15)*100 -> 6.666666666666667 | K773: =(I773/15)*100 -> 6.666666666666667 | L773: 0 | M773: =(L773/9)*100 -> 0.0 | N773: =(L773/10)*100 -> 0.0 | O773: =(C773+F773+L773+I773) -> 1 | P773: =(O773/54)*100 -> 1.8518518518518516 | Q773: =(O773/58)*100 -> 1.7241379310344827
B774: No difference | C774: 5 | D774: =(C774/15)*100 -> 33.333333333333329 | E774: =(C774/16)*100 -> 31.25 | F774: 4 | G774: =(F774/15)*100 -> 26.666666666666668 | H774: =(F774/17)*100 -> 23.52941176470588 | I774: 5 | J774: =(I774/15)*100 -> 33.333333333333329 | K774: =(I774/15)*100 -> 33.333333333333329 | L774: 0 | M774: =(L774/9)*100 -> 0.0 | N774: =(L774/10)*100 -> 0.0 | O774: =(C774+F774+L774+I774) -> 14 | P774: =(O774/54)*100 -> 25.925925925925924 | Q774: =(O774/58)*100 -> 24.137931034482758
B775: Favorably | C775: 10 | D775: =(C775/15)*100 -> 66.666666666666657 | E775: =(C775/16)*100 -> 62.5 | F775: 11 | G775: =(F775/15)*100 -> 73.333333333333329 | H775: =(F775/17)*100 -> 64.705882352941174 | I775: 9 | J775: =(I775/15)*100 -> 60.0 | K775: =(I775/15)*100 -> 60.0 | L775: 9 | M775: =(L775/9)*100 -> 100.0 | N775: =(L775/10)*100 -> 90.0 | O775: =(C775+F775+L775+I775) -> 39 | P775: =(O775/54)*100 -> 72.222222222222214 | Q775: =(O775/58)*100 -> 67.241379310344826
B776: Total | C776: =SUM(C773:C775) -> 15 | D776: =(C776/15)*100 -> 100.0 | E776: =(C776/16)*100 -> 93.75 | F776: =SUM(F773:F775) -> 15 | G776: =(F776/15)*100 -> 100.0 | H776: =(F776/17)*100 -> 88.235294117647058 | I776: =SUM(I773:I775) -> 15 | J776: =(I776/15)*100 -> 100.0 | K776: =(I776/15)*100 -> 100.0 | L776: =SUM(L773:L775) -> 9 | M776: =(L776/9)*100 -> 100.0 | N776: =(L776/10)*100 -> 90.0 | O776: =(C776+F776+L776+I776) -> 54 | P776: =(O776/54)*100 -> 100.0 | Q776: =(O776/58)*100 -> 93.103448275862064
A778: 51 | B778: STUDENT RESPONSE to units by FTI compared with commercial curriculum materials | C778: FRQ | D778: % T2 | E778: % T1 | F778: FRQ | G778: % T2 | H778: % T1 | I778: FRQ | J778: % T2 | K778: % T1 | L778: FRQ | M778: % T2 | N778: % T1 | O778: FRQ | P778: % T2 | Q778: % T1
B779: a. Student attention
B780: Higher | C780: 9 | D780: =(C780/15)*100 -> 60.0 | E780: =(C780/16)*100 -> 56.25 | F780: 11 | G780: =(F780/17)*100 -> 64.705882352941174 | H780: =(F780/17)*100 -> 64.705882352941174 | I780: 5 | J780: =(I780/14)*100 -> 35.714285714285715 | K780: =(I780/15)*100 -> 33.333333333333329 | L780: 5 | M780: =(L780/9)*100 -> 55.555555555555557 | N780: =(L780/10)*100 -> 50.0 | O780: =(C780+F780+L780+I780) -> 30 | P780: =(O780/55)*100 -> 54.54545454545454 | Q780: =(O780/58)*100 -> 51.724137931034484
B781: About the same | C781: 6 | D781: =(C781/15)*100 -> 40.0 | E781: =(C781/16)*100 -> 37.5 | F781: 6 | G781: =(F781/17)*100 -> 35.294117647058826 | H781: =(F781/17)*100 -> 35.294117647058826 | I781: 9 | J781: =(I781/14)*100 -> 64.285714285714292 | K781: =(I781/15)*100 -> 60.0 | L781: 4 | M781: =(L781/9)*100 -> 44.444444444444443 | N781: =(L781/10)*100 -> 40.0 | O781: =(C781+F781+L781+I781) -> 25 | P781: =(O781/55)*100 -> 45.454545454545453 | Q781: =(O781/58)*100 -> 43.103448275862064
B782: Lower | C782: 0 | D782: =(C782/15)*100 -> 0.0 | E782: =(C782/16)*100 -> 0.0 | F782: 0 | G782: =(F782/17)*100 -> 0.0 | H782: =(F782/17)*100 -> 0.0 | I782: 0 | J782: =(I782/14)*100 -> 0.0 | K782: =(I782/15)*100 -> 0.0 | L782: 0 | M782: =(L782/9)*100 -> 0.0 | N782: =(L782/10)*100 -> 0.0 | O782: =(C782+F782+L782+I782) -> 0 | P782: =(O782/55)*100 -> 0.0 | Q782: =(O782/58)*100 -> 0.0
B783: Total | C783: =SUM(C780:C782) -> 15 | D783: =(C783/15)*100 -> 100.0 | E783: =(C783/16)*100 -> 93.75 | F783: =SUM(F780:F782) -> 17 | G783: =(F783/17)*100 -> 100.0 | H783: =(F783/17)*100 -> 100.0 | I783: =SUM(I780:I782) -> 14 | J783: =(I783/14)*100 -> 100.0 | K783: =(I783/15)*100 -> 93.333333333333329 | L783: =SUM(L780:L782) -> 9 | M783: =(L783/9)*100 -> 100.0 | N783: =(L783/10)*100 -> 90.0 | O783: =(C783+F783+L783+I783) -> 55 | P783: =(O783/55)*100 -> 100.0 | Q783: =(O783/58)*100 -> 94.827586206896555
B784: b. Student interest
B785: Higher | C785: 11 | D785: =(C785/15)*100 -> 73.333333333333329 | E785: =(C785/16)*100 -> 68.75 | F785: 7 | G785: =(F785/16)*100 -> 43.75 | H785: =(F785/17)*100 -> 41.17647058823529 | I785: 6 | J785: =(I785/14)*100 -> 42.857142857142854 | K785: =(I785/15)*100 -> 40.0 | L785: 5 | M785: =(L785/9)*100 -> 55.555555555555557 | N785: =(L785/10)*100 -> 50.0 | O785: =(C785+F785+L785+I785) -> 29 | P785: =(O785/54)*100 -> 53.703703703703709 | Q785: =(O785/58)*100 -> 50.0
B786: About the same | C786: 4 | D786: =(C786/15)*100 -> 26.666666666666668 | E786: =(C786/16)*100 -> 25.0 | F786: 9 | G786: =(F786/16)*100 -> 56.25 | H786: =(F786/17)*100 -> 52.941176470588239 | I786: 7 | J786: =(I786/14)*100 -> 50.0 | K786: =(I786/15)*100 -> 46.666666666666664 | L786: 4 | M786: =(L786/9)*100 -> 44.444444444444443 | N786: =(L786/10)*100 -> 40.0 | O786: =(C786+F786+L786+I786) -> 24 | P786: =(O786/54)*100 -> 44.444444444444443 | Q786: =(O786/58)*100 -> 41.379310344827587
B787: Lower | C787: 0 | D787: =(C787/15)*100 -> 0.0 | E787: =(C787/16)*100 -> 0.0 | F787: 0 | G787: =(F787/16)*100 -> 0.0 | H787: =(F787/17)*100 -> 0.0 | I787: 1 | J787: =(I787/14)*100 -> 7.1428571428571423 | K787: =(I787/15)*100 -> 6.666666666666667 | L787: 0 | M787: =(L787/9)*100 -> 0.0 | N787: =(L787/10)*100 -> 0.0 | O787: =(C787+F787+L787+I787) -> 1 | P787: =(O787/54)*100 -> 1.8518518518518516 | Q787: =(O787/58)*100 -> 1.7241379310344827
B788: Total | C788: =SUM(C785:C787) -> 15 | D788: =(C788/15)*100 -> 100.0 | E788: =(C788/16)*100 -> 93.75 | F788: =SUM(F785:F787) -> 16 | G788: =(F788/16)*100 -> 100.0 | H788: =(F788/17)*100 -> 94.117647058823522 | I788: =SUM(I785:I787) -> 14 | J788: =(I788/14)*100 -> 100.0 | K788: =(I788/15)*100 -> 93.333333333333329 | L788: =SUM(L785:L787) -> 9 | M788: =(L788/9)*100 -> 100.0 | N788: =(L788/10)*100 -> 90.0 | O788: =(C788+F788+L788+I788) -> 54 | P788: =(O788/54)*100 -> 100.0 | Q788: =(O788/58)*100 -> 93.103448275862064
B789: c. Student motivation
B790: Higher | C790: 9 | D790: =(C790/15)*100 -> 60.0 | E790: =(C790/16)*100 -> 56.25 | F790: 9 | G790: =(F790/17)*100 -> 52.941176470588239 | H790: =(F790/17)*100 -> 52.941176470588239 | I790: 6 | J790: =(I790/14)*100 -> 42.857142857142854 | K790: =(I790/15)*100 -> 40.0 | L790: 5 | M790: =(L790/9)*100 -> 55.555555555555557 | N790: =(L790/10)*100 -> 50.0 | O790: =(C790+F790+L790+I790) -> 29 | P790: =(O790/55)*100 -> 52.72727272727272 | Q790: =(O790/58)*100 -> 50.0
B791: About the same | C791: 6 | D791: =(C791/15)*100 -> 40.0 | E791: =(C791/16)*100 -> 37.5 | F791: 8 | G791: =(F791/17)*100 -> 47.058823529411761 | H791: =(F791/17)*100 -> 47.058823529411761 | I791: 7 | J791: =(I791/14)*100 -> 50.0 | K791: =(I791/15)*100 -> 46.666666666666664 | L791: 4 | M791: =(L791/9)*100 -> 44.444444444444443 | N791: =(L791/10)*100 -> 40.0 | O791: =(C791+F791+L791+I791) -> 25 | P791: =(O791/55)*100 -> 45.454545454545453 | Q791: =(O791/58)*100 -> 43.103448275862064
B792: Lower | C792: 0 | D792: =(C792/15)*100 -> 0.0 | E792: =(C792/16)*100 -> 0.0 | F792: 0 | G792: =(F792/17)*100 -> 0.0 | H792: =(F792/17)*100 -> 0.0 | I792: 1 | J792: =(I792/14)*100 -> 7.1428571428571423 | K792: =(I792/15)*100 -> 6.666666666666667 | L792: 0 | M792: =(L792/9)*100 -> 0.0 | N792: =(L792/10)*100 -> 0.0 | O792: =(C792+F792+L792+I792) -> 1 | P792: =(O792/55)*100 -> 1.8181818181818181 | Q792: =(O792/58)*100 -> 1.7241379310344827
B793: Total | C793: =SUM(C790:C792) -> 15 | D793: =(C793/15)*100 -> 100.0 | E793: =(C793/16)*100 -> 93.75 | F793: =SUM(F790:F792) -> 17 | G793: =(F793/17)*100 -> 100.0 | H793: =(F793/17)*100 -> 100.0 | I793: =SUM(I790:I792) -> 14 | J793: =(I793/14)*100 -> 100.0 | K793: =(I793/15)*100 -> 93.333333333333329 | L793: =SUM(L790:L792) -> 9 | M793: =(L793/9)*100 -> 100.0 | N793: =(L793/10)*100 -> 90.0 | O793: =(C793+F793+L793+I793) -> 55 | P793: =(O793/55)*100 -> 100.0 | Q793: =(O793/58)*100 -> 94.827586206896555
B794: d. Student mastery | Q794: =(O794/58)*100 -> 0.0
B795: Higher | C795: 7 | D795: =(C795/14)*100 -> 50.0 | E795: =(C795/16)*100 -> 43.75 | F795: 10 | G795: =(F795/16)*100 -> 62.5 | H795: =(F795/17)*100 -> 58.82352941176471 | I795: 2 | J795: =(I795/13)*100 -> 15.384615384615385 | K795: =(I795/15)*100 -> 13.333333333333334 | L795: 5 | M795: =(L795/9)*100 -> 55.555555555555557 | N795: =(L795/10)*100 -> 50.0 | O795: =(C795+F795+L795+I795) -> 24 | P795: =(O795/52)*100 -> 46.153846153846153 | Q795: =(O795/58)*100 -> 41.379310344827587
B796: About the same | C796: 7 | D796: =(C796/14)*100 -> 50.0 | E796: =(C796/16)*100 -> 43.75 | F796: 6 | G796: =(F796/16)*100 -> 37.5 | H796: =(F796/17)*100 -> 35.294117647058826 | I796: 11 | J796: =(I796/13)*100 -> 84.615384615384613 | K796: =(I796/15)*100 -> 73.333333333333329 | L796: 4 | M796: =(L796/9)*100 -> 44.444444444444443 | N796: =(L796/10)*100 -> 40.0 | O796: =(C796+F796+L796+I796) -> 28 | P796: =(O796/52)*100 -> 53.846153846153847 | Q796: =(O796/58)*100 -> 48.275862068965516
B797: Lower | C797: 0 | D797: =(C797/14)*100 -> 0.0 | E797: =(C797/16)*100 -> 0.0 | F797: 0 | G797: =(F797/16)*100 -> 0.0 | H797: =(F797/17)*100 -> 0.0 | I797: 0 | J797: =(I797/13)*100 -> 0.0 | K797: =(I797/15)*100 -> 0.0 | L797: 0 | M797: =(L797/9)*100 -> 0.0 | N797: =(L797/10)*100 -> 0.0 | O797: =(C797+F797+L797+I797) -> 0 | P797: =(O797/52)*100 -> 0.0 | Q797: =(O797/58)*100 -> 0.0
B798: Total | C798: =SUM(C795:C797) -> 14 | D798: =(C798/14)*100 -> 100.0 | E798: =(C798/16)*100 -> 87.5 | F798: =SUM(F795:F797) -> 16 | G798: =(F798/16)*100 -> 100.0 | H798: =(F798/17)*100 -> 94.117647058823522 | I798: =SUM(I795:I797) -> 13 | J798: =(I798/13)*100 -> 100.0 | K798: =(I798/15)*100 -> 86.666666666666671 | L798: =SUM(L795:L797) -> 9 | M798: =(L798/9)*100 -> 100.0 | N798: =(L798/10)*100 -> 90.0 | O798: =(C798+F798+L798+I798) -> 52 | P798: =(O798/52)*100 -> 100.0 | Q798: =(O798/58)*100 -> 89.65517241379311
A800: 52 | B800: ENJOYMENT of teaching compared with commercial curriculum materials | C800: FRQ | D800: % T2 | E800: % T1 | F800: FRQ | G800: % T2 | H800: % T1 | I800: FRQ | J800: % T2 | K800: % T1 | L800: FRQ | M800: % T2 | N800: % T1 | O800: FRQ | P800: % T2 | Q800: % T1
B801: Less enjoyable to teach | C801: 0 | D801: =(C801/16)*100 -> 0.0 | E801: =(C801/16)*100 -> 0.0 | F801: 0 | G801: =(F801/17)*100 -> 0.0 | H801: =(F801/17)*100 -> 0.0 | I801: 1 | J801: =(I801/13)*100 -> 7.6923076923076925 | K801: =(I801/15)*100 -> 6.666666666666667 | L801: 0 | M801: =(L801/9)*100 -> 0.0 | N801: =(L801/10)*100 -> 0.0 | O801: =(C801+F801+L801+I801) -> 1 | P801: =(O801/55)*100 -> 1.8181818181818181 | Q801: =(O801/58)*100 -> 1.7241379310344827
B802: Equally enjoyable to teach | C802: 3 | D802: =(C802/16)*100 -> 18.75 | E802: =(C802/16)*100 -> 18.75 | F802: 7 | G802: =(F802/17)*100 -> 41.17647058823529 | H802: =(F802/17)*100 -> 41.17647058823529 | I802: 6 | J802: =(I802/13)*100 -> 46.153846153846153 | K802: =(I802/15)*100 -> 40.0 | L802: 4 | M802: =(L802/9)*100 -> 44.444444444444443 | N802: =(L802/10)*100 -> 40.0 | O802: =(C802+F802+L802+I802) -> 20 | P802: =(O802/55)*100 -> 36.363636363636367 | Q802: =(O802/58)*100 -> 34.482758620689658
B803: More enjoyable to teach | C803: 13 | D803: =(C803/16)*100 -> 81.25 | E803: =(C803/16)*100 -> 81.25 | F803: 10 | G803: =(F803/17)*100 -> 58.82352941176471 | H803: =(F803/17)*100 -> 58.82352941176471 | I803: 6 | J803: =(I803/13)*100 -> 46.153846153846153 | K803: =(I803/15)*100 -> 40.0 | L803: 5 | M803: =(L803/9)*100 -> 55.555555555555557 | N803: =(L803/10)*100 -> 50.0 | O803: =(C803+F803+L803+I803) -> 34 | P803: =(O803/55)*100 -> 61.818181818181813 | Q803: =(O803/58)*100 -> 58.620689655172406
B804: Total | C804: =SUM(C801:C803) -> 16 | D804: =(C804/16)*100 -> 100.0 | E804: =(C804/16)*100 -> 100.0 | F804: =SUM(F801:F803) -> 17 | G804: =(F804/17)*100 -> 100.0 | H804: =(F804/17)*100 -> 100.0 | I804: =SUM(I801:I803) -> 13 | J804: =(I804/13)*100 -> 100.0 | K804: =(I804/15)*100 -> 86.666666666666671 | L804: =SUM(L801:L803) -> 9 | M804: =(L804/9)*100 -> 100.0 | N804: =(L804/10)*100 -> 90.0 | O804: =(C804+F804+L804+I804) -> 55 | P804: =(O804/55)*100 -> 100.0 | Q804: =(O804/58)*100 -> 94.827586206896555
A806: 53 | B806: Overall evaluation compared with commercial curriculum materials | C806: FRQ | D806: % T2 | E806: % T1 | F806: FRQ | G806: % T2 | H806: % T1 | I806: FRQ | J806: % T2 | K806: % T1 | L806: FRQ | M806: % T2 | N806: % T1 | O806: FRQ | P806: % T2 | Q806: % T1
B807: Inferior | C807: 1 | D807: =(C807/16)*100 -> 6.25 | E807: =(C807/16)*100 -> 6.25 | F807: 0 | G807: =(F807/17)*100 -> 0.0 | H807: =(F807/17)*100 -> 0.0 | I807: 0 | J807: =(I807/15)*100 -> 0.0 | K807: =(I807/15)*100 -> 0.0 | L807: 0 | M807: =(L807/9)*100 -> 0.0 | N807: =(L807/10)*100 -> 0.0 | O807: =(C807+F807+L807+I807) -> 1 | P807: =(O807/57)*100 -> 1.7543859649122806 | Q807: =(O807/58)*100 -> 1.7241379310344827
B808: About equal | C808: 3 | D808: =(C808/16)*100 -> 18.75 | E808: =(C808/16)*100 -> 18.75 | F808: 10 | G808: =(F808/17)*100 -> 58.82352941176471 | H808: =(F808/17)*100 -> 58.82352941176471 | I808: 5 | J808: =(I808/15)*100 -> 33.333333333333329 | K808: =(I808/15)*100 -> 33.333333333333329 | L808: 3 | M808: =(L808/9)*100 -> 33.333333333333329 | N808: =(L808/10)*100 -> 30.0 | O808: =(C808+F808+L808+I808) -> 21 | P808: =(O808/57)*100 -> 36.84210526315789 | Q808: =(O808/58)*100 -> 36.206896551724135
B809: Supeior | C809: 12 | D809: =(C809/16)*100 -> 75.0 | E809: =(C809/16)*100 -> 75.0 | F809: 7 | G809: =(F809/17)*100 -> 41.17647058823529 | H809: =(F809/17)*100 -> 41.17647058823529 | I809: 10 | J809: =(I809/15)*100 -> 66.666666666666657 | K809: =(I809/15)*100 -> 66.666666666666657 | L809: 6 | M809: =(L809/9)*100 -> 66.666666666666657 | N809: =(L809/10)*100 -> 60.0 | O809: =(C809+F809+L809+I809) -> 35 | P809: =(O809/57)*100 -> 61.403508771929829 | Q809: =(O809/58)*100 -> 60.344827586206897
B810: Total | C810: =SUM(C807:C809) -> 16 | D810: =(C810/16)*100 -> 100.0 | E810: =(C810/16)*100 -> 100.0 | F810: =SUM(F807:F809) -> 17 | G810: =(F810/17)*100 -> 100.0 | H810: =(F810/17)*100 -> 100.0 | I810: =SUM(I807:I809) -> 15 | J810: =(I810/15)*100 -> 100.0 | K810: =(I810/15)*100 -> 100.0 | L810: =SUM(L807:L809) -> 9 | M810: =(L810/9)*100 -> 100.0 | N810: =(L810/10)*100 -> 90.0 | O810: =(C810+F810+L810+I810) -> 57 | P810: =(O810/57)*100 -> 100.0 | Q810: =(O810/58)*100 -> 98.275862068965509
A812: 54 | B812: Suggestions and ideas of FTI curriculum units (multiple choice) | C812: FRQ | D812: % T2 | E812: % T1 | F812: FRQ | G812: % T2 | H812: % T1 | I812: FRQ | J812: % T2 | K812: % T1 | L812: FRQ | M812: % T2 | N812: % T1 | O812: FRQ | P812: % T2 | Q812: % T1
B813: More objectives | C813: 0 | D813: =(C813/26)*100 -> 0.0 | E813: =(C813/16)*100 -> 0.0 | F813: 3 | G813: =(F813/31)*100 -> 9.67741935483871 | H813: =(F813/17)*100 -> 17.647058823529413 | I813: 1 | J813: =(I813/21)*100 -> 4.7619047619047619 | K813: =(I813/15)*100 -> 6.666666666666667 | L813: 1 | M813: =(L813/12)*100 -> 8.3333333333333321 | N813: =(L813/10)*100 -> 10.0 | O813: =(C813+F813+L813+I813) -> 5 | P813: =(O813/90)*100 -> 5.5555555555555554 | Q813: =(O813/58)*100 -> 8.6206896551724146
B814: More teaching strategies | C814: 6 | D814: =(C814/26)*100 -> 23.076923076923077 | E814: =(C814/16)*100 -> 37.5 | F814: 7 | G814: =(F814/31)*100 -> 22.58064516129032 | H814: =(F814/17)*100 -> 41.17647058823529 | I814: 1 | J814: =(I814/21)*100 -> 4.7619047619047619 | K814: =(I814/15)*100 -> 6.666666666666667 | L814: 1 | M814: =(L814/12)*100 -> 8.3333333333333321 | N814: =(L814/10)*100 -> 10.0 | O814: =(C814+F814+L814+I814) -> 15 | P814: =(O814/90)*100 -> 16.666666666666664 | Q814: =(O814/58)*100 -> 25.862068965517242
B815: More sample lessons/activ. | C815: 9 | D815: =(C815/26)*100 -> 34.615384615384613 | E815: =(C815/16)*100 -> 56.25 | F815: 6 | G815: =(F815/31)*100 -> 19.35483870967742 | H815: =(F815/17)*100 -> 35.294117647058826 | I815: 6 | J815: =(I815/21)*100 -> 28.571428571428569 | K815: =(I815/15)*100 -> 40.0 | L815: 4 | M815: =(L815/12)*100 -> 33.333333333333329 | N815: =(L815/10)*100 -> 40.0 | O815: =(C815+F815+L815+I815) -> 25 | P815: =(O815/90)*100 -> 27.777777777777779 | Q815: =(O815/58)*100 -> 43.103448275862064
B816: More resources for student | C816: 2 | D816: =(C816/26)*100 -> 7.6923076923076925 | E816: =(C816/16)*100 -> 12.5 | F816: 5 | G816: =(F816/31)*100 -> 16.129032258064516 | H816: =(F816/17)*100 -> 29.411764705882355 | I816: 4 | J816: =(I816/21)*100 -> 19.047619047619047 | K816: =(I816/15)*100 -> 26.666666666666668 | L816: 2 | M816: =(L816/12)*100 -> 16.666666666666664 | N816: =(L816/10)*100 -> 20.0 | O816: =(C816+F816+L816+I816) -> 13 | P816: =(O816/90)*100 -> 14.444444444444443 | Q816: =(O816/58)*100 -> 22.413793103448278
B817: More classroom materials | C817: 4 | D817: =(C817/26)*100 -> 15.384615384615385 | E817: =(C817/16)*100 -> 25.0 | F817: 7 | G817: =(F817/31)*100 -> 22.58064516129032 | H817: =(F817/17)*100 -> 41.17647058823529 | I817: 2 | J817: =(I817/21)*100 -> 9.5238095238095237 | K817: =(I817/15)*100 -> 13.333333333333334 | L817: 1 | M817: =(L817/12)*100 -> 8.3333333333333321 | N817: =(L817/10)*100 -> 10.0 | O817: =(C817+F817+L817+I817) -> 14 | P817: =(O817/90)*100 -> 15.555555555555555 | Q817: =(O817/58)*100 -> 24.137931034482758
B818: Satisfied with present units | C818: 5 | D818: =(C818/26)*100 -> 19.230769230769234 | E818: =(C818/16)*100 -> 31.25 | F818: 3 | G818: =(F818/31)*100 -> 9.67741935483871 | H818: =(F818/17)*100 -> 17.647058823529413 | I818: 7 | J818: =(I818/21)*100 -> 33.333333333333329 | K818: =(I818/15)*100 -> 46.666666666666664 | L818: 3 | M818: =(L818/12)*100 -> 25.0 | N818: =(L818/10)*100 -> 30.0 | O818: =(C818+F818+L818+I818) -> 18 | P818: =(O818/90)*100 -> 20.0 | Q818: =(O818/58)*100 -> 31.03448275862069
B819: Total | C819: =SUM(C813:C818) -> 26 | D819: =(C819/26)*100 -> 100.0 | E819: =(C819/16)*100 -> 162.5 | F819: =SUM(F813:F818) -> 31 | G819: =(F819/31)*100 -> 100.0 | H819: =(F819/17)*100 -> 182.35294117647058 | I819: =SUM(I813:I818) -> 21 | J819: =(I819/21)*100 -> 100.0 | K819: =(I819/15)*100 -> 140.0 | L819: =SUM(L813:L818) -> 12 | M819: =(L819/12)*100 -> 100.0 | N819: =(L819/10)*100 -> 120.0 | O819: =(C819+F819+L819+I819) -> 90 | P819: =(O819/90)*100 -> 100.0 | Q819: =(O819/58)*100 -> 155.17241379310346
A821: 55 | B821: The reason of no more use of UNIT | C821: FRQ | D821: % T2 | E821: % T1 | F821: FRQ | G821: % T2 | H821: % T1 | I821: FRQ | J821: % T2 | K821: % T1 | L821: FRQ | M821: % T2 | N821: % T1 | O821: FRQ | P821: % T2 | Q821: % T1
B822: No longer teaching | C822: 6 | D822: =(C822/8)*100 -> 75.0 | E822: =(C822/16)*100 -> 37.5 | F822: 2 | G822: =(F822/6)*100 -> 33.333333333333329 | H822: =(F822/17)*100 -> 11.76470588235294 | I822: 6 | J822: =(I822/12)*100 -> 50.0 | K822: =(I822/15)*100 -> 40.0 | L822: 1 | M822: =(L822/2)*100 -> 50.0 | N822: =(L822/10)*100 -> 10.0 | O822: =(C822+F822+L822+I822) -> 15 | P822: =(O822/28)*100 -> 53.571428571428569 | Q822: =(O822/58)*100 -> 25.862068965517242
B823: The content now dated | C823: 0 | D823: =(C823/8)*100 -> 0.0 | E823: =(C823/16)*100 -> 0.0 | F823: 0 | G823: =(F823/6)*100 -> 0.0 | H823: =(F823/17)*100 -> 0.0 | I823: 0 | J823: =(I823/12)*100 -> 0.0 | K823: =(I823/15)*100 -> 0.0 | L823: 0 | M823: =(L823/2)*100 -> 0.0 | N823: =(L823/10)*100 -> 0.0 | O823: =(C823+F823+L823+I823) -> 0 | P823: =(O823/28)*100 -> 0.0 | Q823: =(O823/58)*100 -> 0.0
B824: Previous unit unsuccessful | C824: 0 | D824: =(C824/8)*100 -> 0.0 | E824: =(C824/16)*100 -> 0.0 | F824: 0 | G824: =(F824/6)*100 -> 0.0 | H824: =(F824/17)*100 -> 0.0 | I824: 0 | J824: =(I824/12)*100 -> 0.0 | K824: =(I824/15)*100 -> 0.0 | L824: 0 | M824: =(L824/2)*100 -> 0.0 | N824: =(L824/10)*100 -> 0.0 | O824: =(C824+F824+L824+I824) -> 0 | P824: =(O824/28)*100 -> 0.0 | Q824: =(O824/58)*100 -> 0.0
B825: No longer enough time | C825: 0 | D825: =(C825/8)*100 -> 0.0 | E825: =(C825/16)*100 -> 0.0 | F825: 1 | G825: =(F825/6)*100 -> 16.666666666666664 | H825: =(F825/17)*100 -> 5.8823529411764701 | I825: 3 | J825: =(I825/12)*100 -> 25.0 | K825: =(I825/15)*100 -> 20.0 | L825: 1 | M825: =(L825/2)*100 -> 50.0 | N825: =(L825/10)*100 -> 10.0 | O825: =(C825+F825+L825+I825) -> 5 | P825: =(O825/28)*100 -> 17.857142857142858 | Q825: =(O825/58)*100 -> 8.6206896551724146
B826: Curriculum changed | C826: 0 | D826: =(C826/8)*100 -> 0.0 | E826: =(C826/16)*100 -> 0.0 | F826: 2 | G826: =(F826/6)*100 -> 33.333333333333329 | H826: =(F826/17)*100 -> 11.76470588235294 | I826: 1 | J826: =(I826/12)*100 -> 8.3333333333333321 | K826: =(I826/15)*100 -> 6.666666666666667 | L826: 0 | M826: =(L826/2)*100 -> 0.0 | N826: =(L826/10)*100 -> 0.0 | O826: =(C826+F826+L826+I826) -> 3 | P826: =(O826/28)*100 -> 10.714285714285714 | Q826: =(O826/58)*100 -> 5.1724137931034484
B827: Different students level | C827: 2 | D827: =(C827/8)*100 -> 25.0 | E827: =(C827/16)*100 -> 12.5 | F827: 0 | G827: =(F827/6)*100 -> 0.0 | H827: =(F827/17)*100 -> 0.0 | I827: 0 | J827: =(I827/12)*100 -> 0.0 | K827: =(I827/15)*100 -> 0.0 | L827: 0 | M827: =(L827/2)*100 -> 0.0 | N827: =(L827/10)*100 -> 0.0 | O827: =(C827+F827+L827+I827) -> 2 | P827: =(O827/28)*100 -> 7.1428571428571423 | Q827: =(O827/58)*100 -> 3.4482758620689653
B828: Class materials no available | C828: 0 | D828: =(C828/8)*100 -> 0.0 | E828: =(C828/16)*100 -> 0.0 | F828: 0 | G828: =(F828/6)*100 -> 0.0 | H828: =(F828/17)*100 -> 0.0 | I828: 0 | J828: =(I828/12)*100 -> 0.0 | K828: =(I828/15)*100 -> 0.0 | L828: 0 | M828: =(L828/2)*100 -> 0.0 | N828: =(L828/10)*100 -> 0.0 | O828: =(C828+F828+L828+I828) -> 0 | P828: =(O828/28)*100 -> 0.0 | Q828: =(O828/58)*100 -> 0.0
B829: School administrator | C829: 0 | D829: =(C829/8)*100 -> 0.0 | E829: =(C829/16)*100 -> 0.0 | F829: 0 | G829: =(F829/6)*100 -> 0.0 | H829: =(F829/17)*100 -> 0.0 | I829: 0 | J829: =(I829/12)*100 -> 0.0 | K829: =(I829/15)*100 -> 0.0 | L829: 0 | M829: =(L829/2)*100 -> 0.0 | N829: =(L829/10)*100 -> 0.0 | O829: =(C829+F829+L829+I829) -> 0 | P829: =(O829/28)*100 -> 0.0 | Q829: =(O829/58)*100 -> 0.0
B830: No longer interest | C830: 0 | D830: =(C830/8)*100 -> 0.0 | E830: =(C830/16)*100 -> 0.0 | F830: 0 | G830: =(F830/6)*100 -> 0.0 | H830: =(F830/17)*100 -> 0.0 | I830: 0 | J830: =(I830/12)*100 -> 0.0 | K830: =(I830/15)*100 -> 0.0 | L830: 0 | M830: =(L830/2)*100 -> 0.0 | N830: =(L830/10)*100 -> 0.0 | O830: =(C830+F830+L830+I830) -> 0 | P830: =(O830/28)*100 -> 0.0 | Q830: =(O830/58)*100 -> 0.0
B831: Tired of teaching the unit | C831: 0 | D831: =(C831/8)*100 -> 0.0 | E831: =(C831/16)*100 -> 0.0 | F831: 0 | G831: =(F831/6)*100 -> 0.0 | H831: =(F831/17)*100 -> 0.0 | I831: 0 | J831: =(I831/12)*100 -> 0.0 | K831: =(I831/15)*100 -> 0.0 | L831: 0 | M831: =(L831/2)*100 -> 0.0 | N831: =(L831/10)*100 -> 0.0 | O831: =(C831+F831+L831+I831) -> 0 | P831: =(O831/28)*100 -> 0.0 | Q831: =(O831/58)*100 -> 0.0
B832: Replaced with another unit | C832: 0 | D832: =(C832/8)*100 -> 0.0 | E832: =(C832/16)*100 -> 0.0 | F832: 0 | G832: =(F832/6)*100 -> 0.0 | H832: =(F832/17)*100 -> 0.0 | I832: 0 | J832: =(I832/12)*100 -> 0.0 | K832: =(I832/15)*100 -> 0.0 | L832: 0 | M832: =(L832/2)*100 -> 0.0 | N832: =(L832/10)*100 -> 0.0 | O832: =(C832+F832+L832+I832) -> 0 | P832: =(O832/28)*100 -> 0.0 | Q832: =(O832/58)*100 -> 0.0
B833: Replaced with other material | C833: 0 | D833: =(C833/8)*100 -> 0.0 | E833: =(C833/16)*100 -> 0.0 | F833: 0 | G833: =(F833/6)*100 -> 0.0 | H833: =(F833/17)*100 -> 0.0 | I833: 0 | J833: =(I833/12)*100 -> 0.0 | K833: =(I833/15)*100 -> 0.0 | L833: 0 | M833: =(L833/2)*100 -> 0.0 | N833: =(L833/10)*100 -> 0.0 | O833: =(C833+F833+L833+I833) -> 0 | P833: =(O833/28)*100 -> 0.0 | Q833: =(O833/58)*100 -> 0.0
B834: Other | C834: 0 | D834: =(C834/8)*100 -> 0.0 | E834: =(C834/16)*100 -> 0.0 | F834: 1 | G834: =(F834/6)*100 -> 16.666666666666664 | H834: =(F834/17)*100 -> 5.8823529411764701 | I834: 2 | J834: =(I834/12)*100 -> 16.666666666666664 | K834: =(I834/15)*100 -> 13.333333333333334 | L834: 0 | M834: =(L834/2)*100 -> 0.0 | N834: =(L834/10)*100 -> 0.0 | O834: =(C834+F834+L834+I834) -> 3 | P834: =(O834/28)*100 -> 10.714285714285714 | Q834: =(O834/58)*100 -> 5.1724137931034484
B835: Total | C835: =SUM(C822:C834) -> 8 | D835: =(C835/8)*100 -> 100.0 | E835: =(C835/16)*100 -> 50.0 | F835: =SUM(F822:F834) -> 6 | G835: =(F835/6)*100 -> 100.0 | H835: =(F835/17)*100 -> 35.294117647058826 | I835: =SUM(I822:I834) -> 12 | J835: =(I835/12)*100 -> 100.0 | K835: =(I835/15)*100 -> 80.0 | L835: =SUM(L822:L834) -> 2 | M835: =(L835/2)*100 -> 100.0 | N835: =(L835/10)*100 -> 20.0 | O835: =(C835+F835+L835+I835) -> 28 | P835: =(O835/28)*100 -> 100.0 | Q835: =(O835/58)*100 -> 48.275862068965516